authors,title,venue,year
n_bruno_n_koudas_d_srivastava,holistic twig joins optimal xml pattern matching,sigmod_conference,2002.0
,workshop on workflow management in scientific and engineering applications report,,1997.0
n_polyzotis_m_garofalakis,statistical synopses for graphstructured xml databases,sigmod_conference,2002.0
l_seligman,industry perspectives,sigmod_record,1997.0
a_gupta_v_harinarayan_a_rajaraman,virtual database technology,sigmod_record,1997.0
k_chang_s_hwang,minimal probing supporting expensive predicates for topk queries,sigmod_conference,2002.0
,chairs message,,1997.0
j_yang_w_wang_p_yu_j_han,mining long sequential patterns in a noisy environment,sigmod_conference,2002.0
d_barbar_m_sullivan,quasicubes exploiting approximations in multidimensional databases,sigmod_record,1997.0
y_choi_c_chung,selectivity estimation for spatiotemporal queries to moving objects,sigmod_conference,2002.0
g_clement_c_larouche_d_gouin_p_morin_h_kucera,ogdi toward interoperability among geospatial databases,sigmod_record,1997.0
m_garofalakis_p_gibbons,wavelet synopses with error guarantees,sigmod_conference,2002.0
v_josifovski_p_schwarz_l_haas_e_lin,garlic a new flavor of federated query processing for db2,sigmod_conference,2002.0
,report on dart 96 databases active and realtime concepts meet practice,,1997.0
k_kanth_s_ravada_d_abugov,quadtree and rtree indexes in oracle spatial a comparison using gis data,sigmod_conference,2002.0
m_fernandez_d_florescu_a_levy_d_suciu,a query language for a website management system,sigmod_record,1997.0
t_hadzilacos_n_tryfona,an extended entityrelationship model for geographic applications,sigmod_record,1997.0
a_szalay_j_gray_a_thakar_p_kunszt_t_malik_j_raddick_c_stoughton_j_vandenberg,the sdss skyserver public access to the sloan digital sky server data,sigmod_conference,2002.0
m_pss_b_smith_l_kollr_p_larson,tpcds taking decision support benchmarking to the next level,sigmod_conference,2002.0
n_jukic_s_vrbsky,asserting beliefs in mls relational models,sigmod_record,1997.0
a_silberschatz_s_zdonik,database systems breaking out of the box,sigmod_record,1997.0
t_team,midtier caching the timesten approach,sigmod_conference,2002.0
j_anton_l_jacobs_x_liu_j_parker_z_zeng_t_zhong,web caching for database applications with oracle web cache,sigmod_conference,2002.0
j_fong,converting relational to objectoriented databases,sigmod_record,1997.0
s_ramanathan_j_hodges,extraction of objectoriented structures from existing relational databases,sigmod_record,1997.0
q_luo_s_krishnamurthy_c_mohan_h_pirahesh_h_woo_b_lindsay_j_naughton,middletier database caching for ebusiness,sigmod_conference,2002.0
v_markl_g_lohman,learning table access cardinalities with leo,sigmod_conference,2002.0
s_chaudhuri_u_dayal,an overview of data warehousing and olap technology,sigmod_record,1997.0
x_zhang_m_mulchandani_s_christ_b_murphy_e_rundensteiner,rainbow mappingdriven xquery processing system,sigmod_conference,2002.0
,editors notes,,1997.0
a_theobald_g_weikum,the xxl search engine ranked retrieval of xml data using indexes and ontologies,sigmod_conference,2002.0
j_mchugh_s_abiteboul_r_goldman_d_quass_j_widom,lore a database management system for semistructured data,sigmod_record,1997.0
b_knigries_p_lockemann,research in databases and dataintensive applications computer science department and fzi university of karlsruhe,sigmod_record,1997.0
d_barbosa_a_mendelzon_j_keenleyside_k_lyons,toxgene a templatebased data generator for xml,sigmod_conference,2002.0
d_abadi_m_cherniack,visual coko a debugger for query optimizer development,sigmod_conference,2002.0
j_frew_j_dozier,data management for earth system science,sigmod_record,1997.0
l_chen_e_rundensteiner_s_wang,xcache a semantic caching system for xml queries,sigmod_conference,2002.0
a_rosenthal_e_hughes_s_renner_l_seligman,a consumer viewpoint on mediator languages a proposal for a standard,sigmod_record,1997.0
e_rundensteiner_m_ward_j_yang_p_doshi,xmdvtool visual interactive data exploration and trend discovery of highdimensional data sets,sigmod_conference,2002.0
,webdb 98 international workshop on the web and databases,,1998.0
h_lu_g_wang_g_yu_y_bao_j_lv_y_yu,xbase making your gigabyte disk queriable,sigmod_conference,2002.0
,chairs message,,1998.0
s_chang_l_gravano_g_kaiser_k_ross_s_stolfo,database research at columbia university,sigmod_record,1998.0
d_florescu_a_grnhagen_d_kossmann_s_rost,xl a platform for web services,sigmod_conference,2002.0
v_crescenzi_g_mecca_p_merialdo,roadrunner automatic data extraction from dataintensive web sites,sigmod_conference,2002.0
d_florescu_a_levy_a_mendelzon,database techniques for the worldwide web a survey,sigmod_record,1998.0
k_keeton_d_patterson_j_hellerstein,a case for intelligent disks idisks,sigmod_record,1998.0
,software as a service asp and asp aggregation,,2002.0
,tutorial application servers and associated technologies,,2002.0
d_lomet,btree page size when caching is considered,sigmod_record,1998.0
t_griffin_b_kumar,algebraic change propagation for semijoin and outerjoin queries,sigmod_record,1998.0
,querying and mining data streams you only get one look a tutorial,,2002.0
k_cheung_a_fu,enhanced nearest neighbour search on the rtree,sigmod_record,1998.0
p_cotton,implementing xquery,sigmod_conference,2002.0
m_breunig_h_kriegel_p_krger_j_sander,data bubbles quality preserving performance boosting for hierarchical clustering,sigmod_conference,2001.0
v_tsotras_c_jensen_r_snodgrass,an extensible notation for spatiotemporal index queries,sigmod_record,1998.0
b_burton_v_marek,applications of the java programming language to database management,sigmod_record,1998.0
d_rinfret_p_oneil_e_oneil,bitsliced index arithmetic,sigmod_conference,2001.0
s_chaudhuri_g_das_v_narasayya,a robust optimizationbased approach for approximate answering of aggregate queries,sigmod_conference,2001.0
m_franklin,editors notes,sigmod_record,1998.0
g_slivinskas_c_jensen_r_snodgrass,adaptable query optimization and evaluation in temporal middleware,sigmod_conference,2001.0
d_lomet_r_barga_s_chaudhuri_p_larson_v_narasayya,the microsoft database research group,sigmod_record,1998.0
a_eisenberg_j_melton,standards in practice,sigmod_record,1998.0
c_bhm_b_braunmller_f_krebs_h_kriegel,epsilon grid order an algorithm for the similarity join on massive highdimensional data,sigmod_conference,2001.0
j_chen_x_zhang_s_chen_a_koeller_e_rundensteiner,dyda data warehouse maintenance in fully concurrent environments,sigmod_conference,2001.0
g_kappel_w_retschitzegger,the trigs active objectoriented database system an overview,sigmod_record,1998.0
z_nazeri_e_bloedorn_p_ostwald,experiences in mining aviation safety data,sigmod_conference,2001.0
,reminiscences on influential papers,,1998.0
,krdb 98 the 5th international workshop on knowledge representation meets databases,,1998.0
h_jagadish_h_jin_b_ooi_k_tan,global optimization of histograms,sigmod_conference,2001.0
s_gatziu_a_koschel_g_bltzingsloewen_h_fritschi,unbundling active functionality,sigmod_record,1998.0
s_lee_k_whang_y_moon_i_song,dynamic buffer allocation in videoondemand systems,sigmod_conference,2001.0
j_han_h_jamil_y_lu_l_chen_y_liao_j_pei,dnaminer a system prototype for mining dna sequences,sigmod_conference,2001.0
c_kuok_a_fu_m_wong,mining fuzzy association rules in databases,sigmod_record,1998.0
a_datta_k_dutta_k_ramamritham_h_thomas_d_vandermeer,dynamic content acceleration a caching solution to enable scalable dynamic web page generation,sigmod_conference,2001.0
p_seshadri,predator a resource for database research,sigmod_record,1998.0
n_roussopoulos,materialized views and data warehouses,sigmod_record,1998.0
m_hernndez_r_miller_l_haas,clio a semiautomatic tool for schema mapping,sigmod_conference,2001.0
,workshop report on experiences using object data management in the realworld,,1998.0
m_fernandez_a_morishima_d_suciu,efficient evaluation of xml middleware queries,sigmod_conference,2001.0
k_candan_w_li_q_luo_w_hsiung_d_agrawal,enabling dynamic content caching for databasedriven web sites,sigmod_conference,2001.0
,report on the second ieee metadata conference metadata 97,,1998.0
w_kieling_s_holland_s_0003_t_ehm,cosima your smart speaking esalesperson,sigmod_conference,2001.0
,chairs message,,1998.0
,information directors message,,1998.0
l_yan_r_miller_l_haas_r_fagin,datadriven understanding and refinement of schema mappings,sigmod_conference,2001.0
j_han,towards online analytical mining in large databases,sigmod_record,1998.0
j_han_j_pei_g_dong_k_wang,efficient computation of iceberg cubes with complex measures,sigmod_conference,2001.0
t_maguire,catalog management in websphere commerce suite,sigmod_conference,2001.0
m_franklin,editors notes,sigmod_record,1997.0
a_rosenthal,where will object techonology drive data administration,sigmod_record,1998.0
v_borkar_k_deshmukh_s_sarawagi,automatic segmentation of text into structured records,sigmod_conference,2001.0
a_schuster_r_wolff,communication efficient distributed mining of association rules,sigmod_conference,2001.0
p_bernstein,repositories and object oriented databases,sigmod_record,1998.0
p_koksal_s_arpinar_a_dogac,workflow history management,sigmod_record,1998.0
c_olston_b_loo_j_widom,adaptive precision setting for cached approximate values,sigmod_conference,2001.0
f_manola,towards a richer web object model,sigmod_record,1998.0
t_lahiri_a_ganesh_r_weiss_a_joshi,faststart quick fault recovery in oracle,sigmod_conference,2001.0
,reminiscences on influential papers,,1998.0
p_godfrey_j_gryz_c_zuzarte,exploiting constraintlike data characterizations in query optimization,sigmod_conference,2001.0
f_fabret_h_jacobsen_f_llirbat_j_pereira_k_ross_d_shasha,filtering algorithms and implementation for very fast publishsubscribe,sigmod_conference,2001.0
c_chang_a_acharya_a_sussman_j_saltz,t2 a customizable parallel database for multidimensional data,sigmod_record,1998.0
d_buttler_l_liu_c_pu_h_paques,ominisearch a method for searching dynamic content on the web,sigmod_conference,2001.0
,actnet the active database management system manifesto a rulebase of adbms features,sigmod_record,1996.0
l_brunie_h_kosch,control strategies for complex relational query processing in shared nothing systems,sigmod_record,1996.0
f_afrati_c_li_j_ullman,generating efficient plans for queries using views,sigmod_conference,2001.0
,mpeg7 standard for multimedia databases,,2001.0
c_gerlhof_a_kemper_g_moerkotte,on the cost of monitoring and reorganization of object bases for clustering,sigmod_record,1996.0
c_lang_a_singh,modeling highdimensional index structures using sampling,sigmod_conference,2001.0
m_norman_t_zurek_p_thanisch,much ado about sharednothing,sigmod_record,1996.0
,report on first international workshop on realtime database systems,,1996.0
r_meseck,data management lasting impact of the wild wild web,sigmod_conference,2001.0
p_deolasee_a_katkar_a_panchbudhe_k_ramamritham_p_shenoy,dissemination of dynamic data,sigmod_conference,2001.0
w_hasan_d_florescu_p_valduriez,open issues in parallel query optimization,sigmod_record,1996.0
m_stonebraker_j_hellerstein,content integration for ebusiness,sigmod_conference,2001.0
a_dogac,middle east technical university software research and development center,sigmod_record,1996.0
m_shah_s_chandrasekaran,faulttolerant loadbalancing queries in telegraph,sigmod_conference,2001.0
a_biliris_e_panagos,the bess object storage manager architecture overview,sigmod_record,1996.0
a_dandrea_p_janus,unisqls nextgeneration objectrelational database management system,sigmod_record,1996.0
,online query processing,,2001.0
g_colliat,olap relational and multidimensional database systems,sigmod_record,1996.0
p_larson,xml data management go native or spruce up relational systems panel abstract,sigmod_conference,2001.0
j_widom,editors notes,sigmod_record,1996.0
,semantic b2b integration,,2001.0
x_qian,scientists called upon to take actions,sigmod_record,1996.0
j_goldstein_p_larson,optimizing queries using materialized views a practical scalable solution,sigmod_conference,2001.0
ulusoy_a_buchmann,exploiting main memory dbms features to improve realtime concurrency control protocols,sigmod_record,1996.0
l_shou_j_chionh_k_tan_y_ruan_z_huang,review a real time virtual walkthrough system,sigmod_conference,2001.0
a_bestavros,advances in realtime database systems research,sigmod_record,1996.0
i_tatarinov_z_ives_a_halevy_d_weld,updating xml,sigmod_conference,2001.0
h_mistry_p_roy_s_sudarshan_k_ramamritham,materialized view selection and maintenance using multiquery optimization,sigmod_conference,2001.0
s_andler_j_hansson_j_eriksson_j_mellin_m_berndtsson_b_eftring,deeds towards a distributed and active realtime database system,sigmod_record,1996.0
k_lin_s_peng,enhancing external consistency in realtime transactions,sigmod_record,1996.0
a_gionis_d_gunopulos_n_koudas,efficient and tunable similar set retrieval,sigmod_conference,2001.0
e_agichtein_l_gravano_j_pavel_v_sokolova_a_voskoboynik,snowball a prototype system for extracting relations from large text collections,sigmod_conference,2001.0
a_silberschatz_m_stonebraker_j_ullman,database research achievements and opportunities into the 21st century,sigmod_record,1996.0
k_kim_s_cha_k_kwon,optimizing multidimensional index trees for main memory access,sigmod_conference,2001.0
d_phatak_n_sarda_s_seshadri_s_sudarshan,database research at the indian institute of technology bombay,sigmod_record,1996.0
k_ramamritham_r_sivasankaran_j_stankovic_d_towsley_m_xiong,integrating temporal realtime and active databases,sigmod_record,1996.0
k_claypool_e_rundensteiner_x_zhang_h_su_h_kuno_w_lee_g_mitchell,gangam a solution to support multiple data models their mappings and maintenance,sigmod_conference,2001.0
e_bertino_s_castano_e_ferrari,securing xml documents the authorx project demonstration,sigmod_conference,2001.0
t_kuo_a_mok,realtime database similarity semantics and resource scheduling,sigmod_record,1996.0
s_babu_m_garofalakis_r_rastogi,spartan a modelbased semantic compression system for massive data tables,sigmod_conference,2001.0
s_son_r_david_b_thuraisingham,improving timeliness in realtime secure database systems,sigmod_record,1996.0
k_lam_e_chan_t_kuo_s_ng_d_hung,retina a realtime traffic navigation system,sigmod_conference,2001.0
b_adelberg_b_kao_h_garciamolina,overview of the stanford realtime information processor strip,sigmod_record,1996.0
m_greenwald_s_khanna,spaceefficient online computation of quantile summaries,sigmod_conference,2001.0
d_draper_a_halevy_d_weld,the nimble integration engine,sigmod_conference,2001.0
v_tsotras_a_kumar,temporal database bibliography update,sigmod_record,1996.0
c_galindolegaria_m_joshi,orthogonal optimization of subqueries and aggregation,sigmod_conference,2001.0
,workshop report the first international workshop on active and realtime database systems artdb95,,1996.0
a_deshpande_m_garofalakis_r_rastogi,independence is good dependencybased histogram synopses for highdimensional data,sigmod_conference,2001.0
r_baezayates_g_navarro,integrating contents and structure in text retrieval,sigmod_record,1996.0
e_freeman_d_gelernter,lifestreams a storage model for personal data,sigmod_record,1996.0
i_lazaridis_s_mehrotra,progressive approximate aggregate queries with a multiresolution tree structure,sigmod_conference,2001.0
a_wade,object query standards,sigmod_record,1996.0
n_bruno_s_chaudhuri_l_gravano,stholes a multidimensional workloadaware histogram,sigmod_conference,2001.0
s_urban_s_dietrich_f_golshani,database research at arizona state university,sigmod_record,1996.0
c_mohan,application servers bornagain tp monitors for the web panel abstract,sigmod_conference,2001.0
j_gaffney,illustras web datablade module,sigmod_record,1996.0
p_kalnis_d_papadias,proxyserver architectures for olap,sigmod_conference,2001.0
,mqseries and cics link for lotus notes,sigmod_record,1996.0
c_yu_w_meng_w_wu_k_liu,efficient and effective metasearch for text databases incorporating linkages among documents,sigmod_conference,2001.0
x_qian,shutdown budget and funding,sigmod_record,1996.0
z_chen_j_gehrke_f_korn,query optimization in compressed database systems,sigmod_conference,2001.0
r_kramer_r_nikolai_a_koschel_c_rolker_p_lockemann_a_keitel_r_legat_k_zirm,wwwudk a webbased environmental metainformation system,sigmod_record,1997.0
p_bohannon_p_mcilroy_r_rastogi,mainmemory index structures with fixedsize partial keys,sigmod_conference,2001.0
a_tomasic_e_simon,improving access to environmental data using context information,sigmod_record,1997.0
j_navas_m_wynblatt,the network is the database data management for highly distributed systems,sigmod_conference,2001.0
d_abel_k_taylor_d_kuo,integrating modelling systems for environmental management information systems,sigmod_record,1997.0
c_aggarwal_p_yu,outlier detection for high dimensional data,sigmod_conference,2001.0
f_cario_p_kostamaa_a_kaufmann_j_burgess,storhouse metanoia new applications for database storage data warehousing,sigmod_conference,2001.0
,environment information systems guest editors foreword,,1997.0
k_karadimitriou_j_tyler,minmax compression methods for medical image databases,sigmod_record,1997.0
c_zhang_j_naughton_d_dewitt_q_luo_g_lohman,on supporting containment queries in relational database management systems,sigmod_conference,2001.0
s_chen_p_gibbons_t_mowry,improving index performance through prefetching,sigmod_conference,2001.0
p_buneman_l_raschid_j_ullman,mediator languages a proposal for a standard,sigmod_record,1997.0
s_agrawal_s_chaudhuri_v_narasayya,materialized view and index selection tool for microsoft sql server 2000,sigmod_conference,2001.0
k_gardels,open gis and online environmental libraries,sigmod_record,1997.0
w_riekert_r_mayerfll_g_wiest,management of data and services in the environmental information system uis of badenwrttemberg,sigmod_record,1997.0
a_sahuguet,kweelt more than just yet another framework to query xml,sigmod_conference,2001.0
y_ioannidis,dynamic information visualization,sigmod_record,1996.0
l_getoor_b_taskar_d_koller,selectivity estimation using probabilistic models,sigmod_conference,2001.0
c_date,a response to r camps article domains relations and religious wars,sigmod_record,1996.0
v_hristidis_n_koudas_y_papakonstantinou,prefer a system for the efficient execution of multiparametric ranked queries,sigmod_conference,2001.0
x_qian,opportunities in information management and assurance,sigmod_record,1997.0
m_joshi_r_agarwal,mining needle in a haystack classifying rare classes via twophase rule induction,sigmod_conference,2001.0
k_doan_c_plaisant_b_shneiderman_t_bruns,query previews for networked information systems a case study with nasa environmental data,sigmod_record,1997.0
p_ipeirotis_l_gravano_m_sahami,probe count and classify categorizing hidden web databases,sigmod_conference,2001.0
r_ng_a_wagner_y_yin,icebergcube computation with pc clusters,sigmod_conference,2001.0
m_atkinson_l_dayns_m_jordan_t_printezis_s_spence,an orthogonally persistent java,sigmod_record,1996.0
a_doan_p_domingos_a_halevy,reconciling schemas of disparate data sources a machinelearning approach,sigmod_conference,2001.0
k_cox_s_eick_t_he,3d geographic network displays,sigmod_record,1996.0
e_keogh_k_chakrabarti_s_mehrotra_m_pazzani,locally adaptive dimensionality reduction for indexing large time series databases,sigmod_conference,2001.0
m_hasan_a_mendelzon_d_vista,applying database visualization to the world wide web,sigmod_record,1996.0
j_kennedy_k_mitchell_p_barclay,a framework for information visualisation,sigmod_record,1996.0
,time series similarity measures and time series indexing,,2001.0
s_chawathe_t_baby_j_yeo,vqbd exploring semistructured data,sigmod_conference,2001.0
m_rafanelli_a_bezenchek_l_tininini,the aggregate data problem a system for their definition and management,sigmod_record,1996.0
,models and languages for describing and discovering eservices,,2001.0
,information visualization guest editors foreword,,1996.0
a_whitney_d_shasha,lots o ticks realtime high performance time series queries on billions of trades and quotes,sigmod_conference,2001.0
jennifer_widom,editors notes,sigmod_record,1996.0
h_darwen,in reply to domains relations and religious wars,sigmod_record,1996.0
h_kriegel_a_mller_m_ptke_t_seidl,spatial data management for computer aided design,sigmod_conference,2001.0
a_adi_d_botzer_o_etzion_t_yatzkarhaham,monitoring business processes through event correlation based on dependency model,sigmod_conference,2001.0
d_keim,pixeloriented database visualizations,sigmod_record,1996.0
s_ameryahia_s_cho_l_lakshmanan_d_srivastava,minimization of tree pattern queries,sigmod_conference,2001.0
g_santucci_l_tarantino,to table or not to table a hypertabular answer,sigmod_record,1996.0
y_wu_d_agrawal_a_abbadi,using the golden rule of sampling for query estimation,sigmod_conference,2001.0
e_tanin_r_beigel_b_shneiderman,incremental data structures and algorithms for dynamic query interfaces,sigmod_record,1996.0
j_gehrke_f_korn_d_srivastava,on computing correlated aggregates over continual data streams,sigmod_conference,2001.0
c_ahlberg,spotfire an information exploration environment,sigmod_record,1996.0
a_eisenberg,new standard for stored procedures in sql,sigmod_record,1996.0
c_aggarwal_p_yu,finding generalized projected clusters in high dimensional spaces,sigmod_conference,2000.0
r_bhashyam,tcpd the challenges issues and results,sigmod_record,1996.0
c_palmer_c_faloutsos,density biased sampling an improved method for data mining and clustering,sigmod_conference,2000.0
d_lomet,high speed online backup when using logical log operations,sigmod_conference,2000.0
,report from the nsf workshop on workflow and process automation in information systems,,1996.0
j_sidell,the mariposa distributed database management system,sigmod_record,1996.0
w_labio_j_wiener_h_garciamolina_v_gorelik,efficient resumption of interrupted warehouse loads,sigmod_conference,2000.0
r_camps,domains relations and religious wars,sigmod_record,1996.0
t_catarci_g_santucci,the prototype of the dare system,sigmod_conference,2001.0
j_zobel_a_moffat_k_ramamohanarao,guidelines for presentation and comparison of indexing techniques,sigmod_record,1996.0
e_chang_t_cheng_l_chang,pbir perceptionbased image retrieval,sigmod_conference,2001.0
a_rosenthal,will database researchers have any role in data security panel abstract,sigmod_conference,2001.0
x_qian,new programs at darpa and nsf,sigmod_record,1996.0
b_nguyen_s_abiteboul_g_cobena_m_preda,monitoring xml data on the web,sigmod_conference,2001.0
j_widom,editors notes,sigmod_record,1996.0
j_cho_n_shivakumar_h_garciamolina,finding replicated web collections,sigmod_conference,2000.0
c_medsker_m_christensen_i_song,a comparison of three user interfaces to relational microcomputer data bases,sigmod_record,1995.0
j_oh_k_hua,efficient and costeffective techniques for browsing and indexing large video databases,sigmod_conference,2000.0
,editors farewell notes,,1995.0
s_ramaswamy_r_rastogi_k_shim,efficient algorithms for mining outliers from large data sets,sigmod_conference,2000.0
a_dogac_m_altinel_c_ozkan_i_durusoy,implementation aspects of an objectoriented dbms,sigmod_record,1995.0
k_karlapalem_q_li_c_shum,hodfa an architectural framework for homogenizing heterogeneous legacy database,sigmod_record,1995.0
a_szalay_p_kunszt_a_thakar_j_gray_d_slutz,designing and mining multiterabyte astronomy archives the sloan digital sky survey,sigmod_conference,2000.0
d_gunopulos_g_kollios_v_tsotras_c_domeniconi,approximating multidimensional aggregate range queries over real attributes,sigmod_conference,2000.0
m_hanna,a close look at the ifo data model,sigmod_record,1995.0
a_chaudhri,an annotated bibliography of benchmarks for object databases,sigmod_record,1995.0
s_acharya_p_gibbons_v_poosala,congressional samples for approximate answering of groupby queries,sigmod_conference,2000.0
f_waas_c_galindolegaria,counting enumerating and sampling of execution plans in a costbased query optimizer,sigmod_conference,2000.0
u_jaeger_j_freytag,an annotated bibliography on active databases,sigmod_record,1995.0
f_wattez_s_cluet_v_benzaken_g_ferran_c_fiegel,benchmarking queries over trees learning the hard truth the hard way,sigmod_conference,2000.0
p_berra_k_nwosu_b_thuraisingham,acm multimedia 94 conference workshop on multimedia database management systems,sigmod_record,1995.0
m_zaharioudakis_r_cochrane_g_lapis_h_pirahesh_m_urata,answering complex sql queries using automatic summary tables,sigmod_conference,2000.0
t_yan_h_garciamolina,information finding in a digital library the stanford perspective,sigmod_record,1995.0
x_qian,turmoil at nasa and numerous funding announcements,sigmod_record,1995.0
a_corral_y_manolopoulos_y_theodoridis_m_vassilakopoulos,closest pair queries in spatial databases,sigmod_conference,2000.0
p_roy_s_seshadri_s_sudarshan_s_bhobe,efficient and extensible algorithms for multi query optimization,sigmod_conference,2000.0
r_kimball_k_strehlo,why decision support fails and how to fix it,sigmod_record,1995.0
j_zhang,application of oodb and sgml techniques in text database an electronic dictionary system,sigmod_record,1995.0
r_avnur_j_hellerstein,eddies continuously adaptive query processing,sigmod_conference,2000.0
b_lee,normalization in oodb design,sigmod_record,1995.0
l_popa_a_deutsch_a_sahuguet_v_tannen,a chase too far,sigmod_conference,2000.0
s_kokkotos_e_ioannidis_t_panayiotopoulos_c_spyropoulos,on the issue of valid times in temporal databases,sigmod_record,1995.0
r_agrawal_e_wimmers,a framework for expressing and combining preferences,sigmod_conference,2000.0
a_gamache_n_sahraoui,addressing techniques used in database object managers o2 and orion,sigmod_record,1995.0
l_forlizzi_r_gting_e_nardelli_m_schneider,a data model and data structures for moving objects databases,sigmod_conference,2000.0
