,,,,,,,,,,,,,,,,,,,,,,
Mechanical restraint on males with disablities under IDEA,28,100.0,0,0.0,DS,7.1,10,35.7,6,21.4,10,35.7,0,0.0,0,0.0,0,0.0,"1,811",8,4,8
Mechanical restraint on females with disablities under IDEA,0,0.0,0,0.0,0,0.0,0,0.0,0,0.0,0,0.0,0,0.0,0,0.0,0,0.0,"1,811",8,4,8
Mechanical restraint total,28,100.0,0,0.0,DS,7.1,10,35.7,6,21.4,10,35.7,0,0.0,0,0.0,0,0.0,"1,811",8,4,8
Physical restraint on males with disabilities under IDEA,280,88.1,4,1.3,0,0.0,61,19.2,33,10.4,160,50.3,DS,0.6,20,6.3,16,5.0,"1,811",8,4,8
Physical restraint on females with disabilities under IDEA,38,11.9,0,0.0,DS,0.6,8,2.5,5,1.6,21,6.6,0,0.0,DS,0.6,DS,0.6,"1,811",8,4,8
Physical restraint total,318,100.0,4,1.3,DS,0.6,69,21.7,38,11.9,181,56.9,DS,0.6,22,6.9,18,5.7,"1,811",8,4,8
Seclusion on males with disabilities under IDEA,164,88.2,DS,1.1,0,0.0,46,24.7,12,6.5,97,52.2,DS,1.1,5,2.7,17,9.1,"1,811",8,4,8
Seclusion on females with disabilities under IDEA,22,11.8,0,0.0,0,0.0,7,3.8,DS,1.1,11,5.9,0,0.0,DS,1.1,DS,1.1,"1,811",8,4,8
Seclusion total,186,100.0,DS,1.1,0,0.0,53,28.5,14,7.5,108,58.1,DS,1.1,7,3.8,19,10.2,"1,811",8,4,8
