actor_id,film_id,title,description,release_year,language_id,original_language_id,rental_duration,rental_rate,length,replacement_cost,rating,language,first_name,last_name
187,768,SCARFACE BANG,A Emotional Yarn of a Teacher And a Girl who must Find a Teacher in A Baloon Factory,2006,1,,3,4.99,102,11.99,PG-13,English,RENEE,BALL
187,297,EXTRAORDINARY CONQUERER,A Stunning Story of a Dog And a Feminist who must Face a Forensic Psychologist in Berlin,2006,1,,6,2.99,122,29.99,G,English,RENEE,BALL
187,29,ANTITRUST TOMATOES,A Fateful Yarn of a Womanizer And a Feminist who must Succumb a Database Administrator in Ancient India,2006,1,,5,2.99,168,11.99,NC-17,English,RENEE,BALL
187,168,COMANCHEROS ENEMY,A Boring Saga of a Lumberjack And a Monkey who must Find a Monkey in The Gulf of Mexico,2006,1,,5,0.99,67,23.99,R,English,RENEE,BALL
187,923,UNFAITHFUL KILL,A Taut Documentary of a Waitress And a Mad Scientist who must Battle a Technical Writer in New Orleans,2006,1,,7,2.99,78,12.99,R,English,RENEE,BALL
187,51,BALLOON HOMEWARD,A Insightful Panorama of a Forensic Psychologist And a Mad Cow who must Build a Mad Scientist in The First Manned Space Station,2006,1,,5,2.99,75,10.99,NC-17,English,RENEE,BALL
187,76,BIRDCAGE CASPER,A Fast-Paced Saga of a Frisbee And a Astronaut who must Overcome a Feminist in Ancient India,2006,1,,4,0.99,103,23.99,NC-17,English,RENEE,BALL
187,906,TRAMP OTHERS,A Brilliant Display of a Composer And a Cat who must Succumb a A Shark in Ancient India,2006,1,,4,0.99,171,27.99,PG,English,RENEE,BALL
187,354,GHOST GROUNDHOG,A Brilliant Panorama of a Madman And a Composer who must Succumb a Car in Ancient India,2006,1,,6,4.99,85,18.99,G,English,RENEE,BALL
187,441,HUNTER ALTER,A Emotional Drama of a Mad Cow And a Boat who must Redeem a Secret Agent in A Shark Tank,2006,1,,5,2.99,125,21.99,PG-13,English,RENEE,BALL
187,499,KING EVOLUTION,A Action-Packed Tale of a Boy And a Lumberjack who must Chase a Madman in A Baloon,2006,1,,3,4.99,184,24.99,NC-17,English,RENEE,BALL
187,110,CABIN FLASH,A Stunning Epistle of a Boat And a Man who must Challenge a A Shark in A Baloon Factory,2006,1,,4,0.99,53,25.99,NC-17,English,RENEE,BALL
187,222,DESERT POSEIDON,A Brilliant Documentary of a Butler And a Frisbee who must Build a Astronaut in New Orleans,2006,1,,4,4.99,64,27.99,R,English,RENEE,BALL
187,779,SENSE GREEK,A Taut Saga of a Lumberjack And a Pastry Chef who must Escape a Sumo Wrestler in An Abandoned Fun House,2006,1,,4,4.99,54,23.99,R,English,RENEE,BALL
187,671,PERDITION FARGO,A Fast-Paced Story of a Car And a Cat who must Outgun a Hunter in Berlin,2006,1,,7,4.99,99,27.99,NC-17,English,RENEE,BALL
187,379,GREEDY ROOTS,A Amazing Reflection of a A Shark And a Butler who must Chase a Hunter in The Canadian Rockies,2006,1,,7,0.99,166,14.99,R,English,RENEE,BALL
187,417,HILLS NEIGHBORS,A Epic Display of a Hunter And a Feminist who must Sink a Car in A U-Boat,2006,1,,5,0.99,93,29.99,G,English,RENEE,BALL
187,224,DESPERATE TRAINSPOTTING,A Epic Yarn of a Forensic Psychologist And a Teacher who must Face a Lumberjack in California,2006,1,,7,4.99,81,29.99,G,English,RENEE,BALL
187,617,NATURAL STOCK,A Fast-Paced Story of a Sumo Wrestler And a Girl who must Defeat a Car in A Baloon Factory,2006,1,,4,0.99,50,24.99,PG-13,English,RENEE,BALL
187,625,NONE SPIKING,A Boring Reflection of a Secret Agent And a Astronaut who must Face a Composer in A Manhattan Penthouse,2006,1,,3,0.99,83,18.99,NC-17,English,RENEE,BALL
187,538,LOVERBOY ATTACKS,A Boring Story of a Car And a Butler who must Build a Girl in Soviet Georgia,2006,1,,7,0.99,162,19.99,PG-13,English,RENEE,BALL
187,548,MAGNIFICENT CHITTY,A Insightful Story of a Teacher And a Hunter who must Face a Mad Cow in California,2006,1,,3,2.99,53,27.99,R,English,RENEE,BALL
187,561,MASK PEACH,A Boring Character Study of a Student And a Robot who must Meet a Woman in California,2006,1,,6,2.99,123,26.99,NC-17,English,RENEE,BALL
187,664,PATRIOT ROMAN,A Taut Saga of a Robot And a Database Administrator who must Challenge a Astronaut in California,2006,1,,6,2.99,65,12.99,PG,English,RENEE,BALL
187,98,BRIGHT ENCOUNTERS,A Fateful Yarn of a Lumberjack And a Feminist who must Conquer a Student in A Jet Boat,2006,1,,4,4.99,73,12.99,PG-13,English,RENEE,BALL
187,25,ANGELS LIFE,A Thoughtful Display of a Woman And a Astronaut who must Battle a Robot in Berlin,2006,1,,3,2.99,74,15.99,G,English,RENEE,BALL
187,73,BINGO TALENTED,A Touching Tale of a Girl And a Crocodile who must Discover a Waitress in Nigeria,2006,1,,5,2.99,150,22.99,PG-13,English,RENEE,BALL
187,435,HOTEL HAPPINESS,A Thrilling Yarn of a Pastry Chef And a A Shark who must Challenge a Mad Scientist in The Outback,2006,1,,6,4.99,181,28.99,PG-13,English,RENEE,BALL
187,474,JADE BUNCH,A Insightful Panorama of a Squirrel And a Mad Cow who must Confront a Student in The First Manned Space Station,2006,1,,6,2.99,174,21.99,NC-17,English,RENEE,BALL
187,976,WIND PHANTOM,A Touching Saga of a Madman And a Forensic Psychologist who must Build a Sumo Wrestler in An Abandoned Mine Shaft,2006,1,,6,0.99,111,12.99,R,English,RENEE,BALL
187,127,CAT CONEHEADS,A Fast-Paced Panorama of a Girl And a A Shark who must Confront a Boy in Ancient India,2006,1,,5,4.99,112,14.99,G,English,RENEE,BALL
187,17,ALONE TRIP,A Fast-Paced Character Study of a Composer And a Dog who must Outgun a Boat in An Abandoned Fun House,2006,1,,3,0.99,82,14.99,R,English,RENEE,BALL
98,725,REQUIEM TYCOON,A Unbelieveable Character Study of a Cat And a Database Administrator who must Pursue a Teacher in A Monastery,2006,1,,6,4.99,167,25.99,R,English,CHRIS,BRIDGES
98,297,EXTRAORDINARY CONQUERER,A Stunning Story of a Dog And a Feminist who must Face a Forensic Psychologist in Berlin,2006,1,,6,2.99,122,29.99,G,English,CHRIS,BRIDGES
98,72,BILL OTHERS,A Stunning Saga of a Mad Scientist And a Forensic Psychologist who must Challenge a Squirrel in A MySQL Convention,2006,1,,6,2.99,93,12.99,PG,English,CHRIS,BRIDGES
98,87,BOONDOCK BALLROOM,A Fateful Panorama of a Crocodile And a Boy who must Defeat a Monkey in The Gulf of Mexico,2006,1,,7,0.99,76,14.99,NC-17,English,CHRIS,BRIDGES
98,710,RAGE GAMES,A Fast-Paced Saga of a Astronaut And a Secret Agent who must Escape a Hunter in An Abandoned Amusement Park,2006,1,,4,4.99,120,18.99,R,English,CHRIS,BRIDGES
98,738,ROCKETEER MOTHER,A Awe-Inspiring Character Study of a Robot And a Sumo Wrestler who must Discover a Womanizer in A Shark Tank,2006,1,,3,0.99,178,27.99,PG-13,English,CHRIS,BRIDGES
98,705,PURPLE MOVIE,A Boring Display of a Pastry Chef And a Sumo Wrestler who must Discover a Frisbee in An Abandoned Amusement Park,2006,1,,4,2.99,88,9.99,R,English,CHRIS,BRIDGES
98,120,CARIBBEAN LIBERTY,A Fanciful Tale of a Pioneer And a Technical Writer who must Outgun a Pioneer in A Shark Tank,2006,1,,3,4.99,92,16.99,NC-17,English,CHRIS,BRIDGES
98,607,MUPPET MILE,A Lacklusture Story of a Madman And a Teacher who must Kill a Frisbee in The Gulf of Mexico,2006,1,,5,4.99,50,18.99,PG,English,CHRIS,BRIDGES
98,212,DARN FORRESTER,A Fateful Story of a A Shark And a Explorer who must Succumb a Technical Writer in A Jet Boat,2006,1,,7,4.99,185,14.99,G,English,CHRIS,BRIDGES
98,721,REDS POCUS,A Lacklusture Yarn of a Sumo Wrestler And a Squirrel who must Redeem a Monkey in Soviet Georgia,2006,1,,7,4.99,182,23.99,PG-13,English,CHRIS,BRIDGES
98,107,BUNCH MINDS,A Emotional Story of a Feminist And a Feminist who must Escape a Pastry Chef in A MySQL Convention,2006,1,,4,2.99,63,13.99,G,English,CHRIS,BRIDGES
98,734,ROAD ROXANNE,A Boring Character Study of a Waitress And a Astronaut who must Fight a Crocodile in Ancient Japan,2006,1,,4,4.99,158,12.99,R,English,CHRIS,BRIDGES
98,829,SPINAL ROCKY,A Lacklusture Epistle of a Sumo Wrestler And a Squirrel who must Defeat a Explorer in California,2006,1,,7,2.99,138,12.99,PG-13,English,CHRIS,BRIDGES
98,66,BENEATH RUSH,A Astounding Panorama of a Man And a Monkey who must Discover a Man in The First Manned Space Station,2006,1,,6,0.99,53,27.99,NC-17,English,CHRIS,BRIDGES
98,782,SHAKESPEARE SADDLE,A Fast-Paced Panorama of a Lumberjack And a Database Administrator who must Defeat a Madman in A MySQL Convention,2006,1,,6,2.99,60,26.99,PG-13,English,CHRIS,BRIDGES
98,194,CROW GREASE,A Awe-Inspiring Documentary of a Woman And a Husband who must Sink a Database Administrator in The First Manned Space Station,2006,1,,6,0.99,104,22.99,PG,English,CHRIS,BRIDGES
98,686,PLUTO OLEANDER,A Action-Packed Reflection of a Car And a Moose who must Outgun a Car in A Shark Tank,2006,1,,5,4.99,84,9.99,R,English,CHRIS,BRIDGES
98,912,TROJAN TOMORROW,A Astounding Panorama of a Husband And a Sumo Wrestler who must Pursue a Boat in Ancient India,2006,1,,3,2.99,52,9.99,PG,English,CHRIS,BRIDGES
98,990,WORLD LEATHERNECKS,A Unbelieveable Tale of a Pioneer And a Astronaut who must Overcome a Robot in An Abandoned Amusement Park,2006,1,,3,0.99,171,13.99,PG-13,English,CHRIS,BRIDGES
98,985,WONDERLAND CHRISTMAS,A Awe-Inspiring Character Study of a Waitress And a Car who must Pursue a Mad Scientist in The First Manned Space Station,2006,1,,4,4.99,111,19.99,PG,English,CHRIS,BRIDGES
98,81,BLINDNESS GUN,A Touching Drama of a Robot And a Dentist who must Meet a Hunter in A Jet Boat,2006,1,,6,4.99,103,29.99,PG-13,English,CHRIS,BRIDGES
98,955,WALLS ARTIST,A Insightful Panorama of a Teacher And a Teacher who must Overcome a Mad Cow in An Abandoned Fun House,2006,1,,7,4.99,135,19.99,PG,English,CHRIS,BRIDGES
98,634,ODDS BOOGIE,A Thrilling Yarn of a Feminist And a Madman who must Battle a Hunter in Berlin,2006,1,,6,0.99,48,14.99,NC-17,English,CHRIS,BRIDGES
98,824,SPARTACUS CHEAPER,A Thrilling Panorama of a Pastry Chef And a Secret Agent who must Overcome a Student in A Manhattan Penthouse,2006,1,,4,4.99,52,19.99,NC-17,English,CHRIS,BRIDGES
98,183,CONVERSATION DOWNHILL,A Taut Character Study of a Husband And a Waitress who must Sink a Squirrel in A MySQL Convention,2006,1,,4,4.99,112,14.99,R,English,CHRIS,BRIDGES
98,765,SATURN NAME,A Fateful Epistle of a Butler And a Boy who must Redeem a Teacher in Berlin,2006,1,,7,4.99,182,18.99,R,English,CHRIS,BRIDGES
130,725,REQUIEM TYCOON,A Unbelieveable Character Study of a Cat And a Database Administrator who must Pursue a Teacher in A Monastery,2006,1,,6,4.99,167,25.99,R,English,GRETA,KEITEL
130,809,SLIPPER FIDELITY,A Taut Reflection of a Secret Agent And a Man who must Redeem a Explorer in A MySQL Convention,2006,1,,5,0.99,156,14.99,PG-13,English,GRETA,KEITEL
130,453,IMAGE PRINCESS,A Lacklusture Panorama of a Secret Agent And a Crocodile who must Discover a Madman in The Canadian Rockies,2006,1,,3,2.99,178,17.99,PG-13,English,GRETA,KEITEL
130,507,LADYBUGS ARMAGEDDON,A Fateful Reflection of a Dog And a Mad Scientist who must Meet a Mad Scientist in New Orleans,2006,1,,4,0.99,113,13.99,NC-17,English,GRETA,KEITEL
130,702,PULP BEVERLY,A Unbelieveable Display of a Dog And a Crocodile who must Outrace a Man in Nigeria,2006,1,,4,2.99,89,12.99,G,English,GRETA,KEITEL
130,326,FLYING HOOK,A Thrilling Display of a Mad Cow And a Dog who must Challenge a Frisbee in Nigeria,2006,1,,6,2.99,69,18.99,NC-17,English,GRETA,KEITEL
130,431,HOOSIERS BIRDCAGE,A Astounding Display of a Explorer And a Boat who must Vanquish a Car in The First Manned Space Station,2006,1,,3,2.99,176,12.99,G,English,GRETA,KEITEL
130,981,WOLVES DESIRE,A Fast-Paced Drama of a Squirrel And a Robot who must Succumb a Technical Writer in A Manhattan Penthouse,2006,1,,7,0.99,55,13.99,NC-17,English,GRETA,KEITEL
130,9,ALABAMA DEVIL,A Thoughtful Panorama of a Database Administrator And a Mad Scientist who must Outgun a Mad Scientist in A Jet Boat,2006,1,,3,2.99,114,21.99,PG-13,English,GRETA,KEITEL
130,57,BASIC EASY,A Stunning Epistle of a Man And a Husband who must Reach a Mad Scientist in A Jet Boat,2006,1,,4,2.99,90,18.99,PG-13,English,GRETA,KEITEL
130,26,ANNIE IDENTITY,A Amazing Panorama of a Pastry Chef And a Boat who must Escape a Woman in An Abandoned Amusement Park,2006,1,,3,0.99,86,15.99,G,English,GRETA,KEITEL
130,592,MONSTER SPARTACUS,A Fast-Paced Story of a Waitress And a Cat who must Fight a Girl in Australia,2006,1,,6,2.99,107,28.99,PG,English,GRETA,KEITEL
130,549,MAGNOLIA FORRESTER,A Thoughtful Documentary of a Composer And a Explorer who must Conquer a Dentist in New Orleans,2006,1,,4,0.99,171,28.99,PG-13,English,GRETA,KEITEL
130,869,SUSPECTS QUILLS,A Emotional Epistle of a Pioneer And a Crocodile who must Battle a Man in A Manhattan Penthouse,2006,1,,4,2.99,47,22.99,PG,English,GRETA,KEITEL
130,107,BUNCH MINDS,A Emotional Story of a Feminist And a Feminist who must Escape a Pastry Chef in A MySQL Convention,2006,1,,4,2.99,63,13.99,G,English,GRETA,KEITEL
130,43,ATLANTIS CAUSE,A Thrilling Yarn of a Feminist And a Hunter who must Fight a Technical Writer in A Shark Tank,2006,1,,6,2.99,170,15.99,G,English,GRETA,KEITEL
130,49,BADMAN DAWN,A Emotional Panorama of a Pioneer And a Composer who must Escape a Mad Scientist in A Jet Boat,2006,1,,6,2.99,162,22.99,R,English,GRETA,KEITEL
130,452,ILLUSION AMELIE,A Emotional Epistle of a Boat And a Mad Scientist who must Outrace a Robot in An Abandoned Mine Shaft,2006,1,,4,0.99,122,15.99,R,English,GRETA,KEITEL
130,112,CALENDAR GUNFIGHT,A Thrilling Drama of a Frisbee And a Lumberjack who must Sink a Man in Nigeria,2006,1,,4,4.99,120,22.99,NC-17,English,GRETA,KEITEL
130,375,GRAIL FRANKENSTEIN,A Unbelieveable Saga of a Teacher And a Monkey who must Fight a Girl in An Abandoned Mine Shaft,2006,1,,4,2.99,85,17.99,NC-17,English,GRETA,KEITEL
130,930,VACATION BOONDOCK,A Fanciful Character Study of a Secret Agent And a Mad Scientist who must Reach a Teacher in Australia,2006,1,,4,2.99,145,23.99,R,English,GRETA,KEITEL
130,37,ARIZONA BANG,A Brilliant Panorama of a Mad Scientist And a Mad Cow who must Meet a Pioneer in A Monastery,2006,1,,3,2.99,121,28.99,PG,English,GRETA,KEITEL
130,764,SATURDAY LAMBS,A Thoughtful Reflection of a Mad Scientist And a Moose who must Kill a Husband in A Baloon,2006,1,,3,4.99,150,28.99,G,English,GRETA,KEITEL
130,208,DARES PLUTO,A Fateful Story of a Robot And a Dentist who must Defeat a Astronaut in New Orleans,2006,1,,7,2.99,89,16.99,PG-13,English,GRETA,KEITEL
130,416,HIGHBALL POTTER,A Action-Packed Saga of a Husband And a Dog who must Redeem a Database Administrator in The Sahara Desert,2006,1,,6,0.99,110,10.99,R,English,GRETA,KEITEL
130,478,JAWS HARRY,A Thrilling Display of a Database Administrator And a Monkey who must Overcome a Dog in An Abandoned Fun House,2006,1,,4,2.99,112,10.99,G,English,GRETA,KEITEL
130,525,LOATHING LEGALLY,A Boring Epistle of a Pioneer And a Mad Scientist who must Escape a Frisbee in The Gulf of Mexico,2006,1,,4,0.99,140,29.99,R,English,GRETA,KEITEL
49,725,REQUIEM TYCOON,A Unbelieveable Character Study of a Cat And a Database Administrator who must Pursue a Teacher in A Monastery,2006,1,,6,4.99,167,25.99,R,English,ANNE,CRONYN
49,433,HORN WORKING,A Stunning Display of a Mad Scientist And a Technical Writer who must Succumb a Monkey in A Shark Tank,2006,1,,4,2.99,95,23.99,PG,English,ANNE,CRONYN
49,31,APACHE DIVINE,A Awe-Inspiring Reflection of a Pastry Chef And a Teacher who must Overcome a Sumo Wrestler in A U-Boat,2006,1,,5,4.99,92,16.99,NC-17,English,ANNE,CRONYN
49,662,PATHS CONTROL,A Astounding Documentary of a Butler And a Cat who must Find a Frisbee in Ancient China,2006,1,,3,4.99,118,9.99,PG,English,ANNE,CRONYN
49,151,CINCINATTI WHISPERER,A Brilliant Saga of a Pastry Chef And a Hunter who must Confront a Butler in Berlin,2006,1,,5,4.99,143,26.99,NC-17,English,ANNE,CRONYN
49,977,WINDOW SIDE,A Astounding Character Study of a Womanizer And a Hunter who must Escape a Robot in A Monastery,2006,1,,3,2.99,85,25.99,R,English,ANNE,CRONYN
49,980,WIZARD COLDBLOODED,A Lacklusture Display of a Robot And a Girl who must Defeat a Sumo Wrestler in A MySQL Convention,2006,1,,4,4.99,75,12.99,PG,English,ANNE,CRONYN
49,469,IRON MOON,A Fast-Paced Documentary of a Mad Cow And a Boy who must Pursue a Dentist in A Baloon,2006,1,,7,4.99,46,27.99,PG,English,ANNE,CRONYN
49,716,REAP UNFAITHFUL,A Thrilling Epistle of a Composer And a Sumo Wrestler who must Challenge a Mad Cow in A MySQL Convention,2006,1,,6,2.99,136,26.99,PG-13,English,ANNE,CRONYN
49,391,HALF OUTFIELD,A Epic Epistle of a Database Administrator And a Crocodile who must Face a Madman in A Jet Boat,2006,1,,6,2.99,146,25.99,PG-13,English,ANNE,CRONYN
49,348,GANDHI KWAI,A Thoughtful Display of a Mad Scientist And a Secret Agent who must Chase a Boat in Berlin,2006,1,,7,0.99,86,9.99,PG-13,English,ANNE,CRONYN
49,195,CROWDS TELEMARK,A Intrepid Documentary of a Astronaut And a Forensic Psychologist who must Find a Frisbee in An Abandoned Fun House,2006,1,,3,4.99,112,16.99,R,English,ANNE,CRONYN
49,400,HARDLY ROBBERS,A Emotional Character Study of a Hunter And a Car who must Kill a Woman in Berlin,2006,1,,7,2.99,72,15.99,R,English,ANNE,CRONYN
49,423,HOLLYWOOD ANONYMOUS,A Fast-Paced Epistle of a Boy And a Explorer who must Escape a Dog in A U-Boat,2006,1,,7,0.99,69,29.99,PG,English,ANNE,CRONYN
49,709,RACER EGG,A Emotional Display of a Monkey And a Waitress who must Reach a Secret Agent in California,2006,1,,7,2.99,147,19.99,NC-17,English,ANNE,CRONYN
49,506,LADY STAGE,A Beautiful Character Study of a Woman And a Man who must Pursue a Explorer in A U-Boat,2006,1,,4,4.99,67,14.99,PG,English,ANNE,CRONYN
49,407,HAWK CHILL,A Action-Packed Drama of a Mad Scientist And a Composer who must Outgun a Car in Australia,2006,1,,5,0.99,47,12.99,PG-13,English,ANNE,CRONYN
49,250,DRAGON SQUAD,A Taut Reflection of a Boy And a Waitress who must Outgun a Teacher in Ancient China,2006,1,,4,0.99,170,26.99,NC-17,English,ANNE,CRONYN
49,558,MANNEQUIN WORST,A Astounding Saga of a Mad Cow And a Pastry Chef who must Discover a Husband in Ancient India,2006,1,,3,2.99,71,18.99,PG-13,English,ANNE,CRONYN
49,729,RIDER CADDYSHACK,A Taut Reflection of a Monkey And a Womanizer who must Chase a Moose in Nigeria,2006,1,,5,2.99,177,28.99,PG,English,ANNE,CRONYN
49,811,SMILE EARRING,A Intrepid Drama of a Teacher And a Butler who must Build a Pastry Chef in Berlin,2006,1,,4,2.99,60,29.99,G,English,ANNE,CRONYN
49,282,ENCOUNTERS CURTAIN,A Insightful Epistle of a Pastry Chef And a Womanizer who must Build a Boat in New Orleans,2006,1,,5,0.99,92,20.99,NC-17,English,ANNE,CRONYN
49,927,UPRISING UPTOWN,A Fanciful Reflection of a Boy And a Butler who must Pursue a Woman in Berlin,2006,1,,6,2.99,174,16.99,NC-17,English,ANNE,CRONYN
49,207,DANGEROUS UPTOWN,A Unbelieveable Story of a Mad Scientist And a Woman who must Overcome a Dog in California,2006,1,,7,4.99,121,26.99,PG,English,ANNE,CRONYN
49,542,LUST LOCK,A Fanciful Panorama of a Hunter And a Dentist who must Meet a Secret Agent in The Sahara Desert,2006,1,,3,2.99,52,28.99,G,English,ANNE,CRONYN
49,579,MINDS TRUMAN,A Taut Yarn of a Mad Scientist And a Crocodile who must Outgun a Database Administrator in A Monastery,2006,1,,3,4.99,149,22.99,PG-13,English,ANNE,CRONYN
49,595,MOON BUNCH,A Beautiful Tale of a Astronaut And a Mad Cow who must Challenge a Cat in A Baloon Factory,2006,1,,7,0.99,83,20.99,PG,English,ANNE,CRONYN
61,433,HORN WORKING,A Stunning Display of a Mad Scientist And a Technical Writer who must Succumb a Monkey in A Shark Tank,2006,1,,4,2.99,95,23.99,PG,English,CHRISTIAN,NEESON
61,508,LAMBS CINCINATTI,A Insightful Story of a Man And a Feminist who must Fight a Composer in Australia,2006,1,,6,4.99,144,18.99,PG-13,English,CHRISTIAN,NEESON
61,518,LIAISONS SWEET,A Boring Drama of a A Shark And a Explorer who must Redeem a Waitress in The Canadian Rockies,2006,1,,5,4.99,140,15.99,PG,English,CHRISTIAN,NEESON
61,307,FELLOWSHIP AUTUMN,A Lacklusture Reflection of a Dentist And a Hunter who must Meet a Teacher in A Baloon,2006,1,,6,4.99,77,9.99,NC-17,English,CHRISTIAN,NEESON
61,766,SAVANNAH TOWN,A Awe-Inspiring Tale of a Astronaut And a Database Administrator who must Chase a Secret Agent in The Gulf of Mexico,2006,1,,5,0.99,84,25.99,PG-13,English,CHRISTIAN,NEESON
61,519,LIBERTY MAGNIFICENT,A Boring Drama of a Student And a Cat who must Sink a Technical Writer in A Baloon,2006,1,,3,2.99,138,27.99,G,English,CHRISTIAN,NEESON
61,374,GRAFFITI LOVE,A Unbelieveable Epistle of a Sumo Wrestler And a Hunter who must Build a Composer in Berlin,2006,1,,3,0.99,117,29.99,PG,English,CHRISTIAN,NEESON
61,237,DIVORCE SHINING,A Unbelieveable Saga of a Crocodile And a Student who must Discover a Cat in Ancient India,2006,1,,3,2.99,47,21.99,G,English,CHRISTIAN,NEESON
61,648,OUTLAW HANKY,A Thoughtful Story of a Astronaut And a Composer who must Conquer a Dog in The Sahara Desert,2006,1,,7,4.99,148,17.99,PG-13,English,CHRISTIAN,NEESON
61,832,SPLASH GUMP,A Taut Saga of a Crocodile And a Boat who must Conquer a Hunter in A Shark Tank,2006,1,,5,0.99,175,16.99,PG,English,CHRISTIAN,NEESON
61,423,HOLLYWOOD ANONYMOUS,A Fast-Paced Epistle of a Boy And a Explorer who must Escape a Dog in A U-Boat,2006,1,,7,0.99,69,29.99,PG,English,CHRISTIAN,NEESON
61,767,SCALAWAG DUCK,A Fateful Reflection of a Car And a Teacher who must Confront a Waitress in A Monastery,2006,1,,6,4.99,183,13.99,NC-17,English,CHRISTIAN,NEESON
61,990,WORLD LEATHERNECKS,A Unbelieveable Tale of a Pioneer And a Astronaut who must Overcome a Robot in An Abandoned Amusement Park,2006,1,,3,0.99,171,13.99,PG-13,English,CHRISTIAN,NEESON
61,780,SENSIBILITY REAR,A Emotional Tale of a Robot And a Sumo Wrestler who must Redeem a Pastry Chef in A Baloon Factory,2006,1,,7,4.99,98,15.99,PG,English,CHRISTIAN,NEESON
61,639,OPPOSITE NECKLACE,A Fateful Epistle of a Crocodile And a Moose who must Kill a Explorer in Nigeria,2006,1,,7,4.99,92,9.99,PG,English,CHRISTIAN,NEESON
61,362,GLORY TRACY,A Amazing Saga of a Woman And a Womanizer who must Discover a Cat in The First Manned Space Station,2006,1,,7,2.99,115,13.99,PG-13,English,CHRISTIAN,NEESON
61,649,OZ LIAISONS,A Epic Yarn of a Mad Scientist And a Cat who must Confront a Womanizer in A Baloon Factory,2006,1,,4,2.99,85,14.99,R,English,CHRISTIAN,NEESON
61,372,GRACELAND DYNAMITE,A Taut Display of a Cat And a Girl who must Overcome a Database Administrator in New Orleans,2006,1,,5,4.99,140,26.99,R,English,CHRISTIAN,NEESON
61,235,DIVIDE MONSTER,A Intrepid Saga of a Man And a Forensic Psychologist who must Reach a Squirrel in A Monastery,2006,1,,6,2.99,68,13.99,PG-13,English,CHRISTIAN,NEESON
61,537,LOVER TRUMAN,A Emotional Yarn of a Robot And a Boy who must Outgun a Technical Writer in A U-Boat,2006,1,,3,2.99,75,29.99,G,English,CHRISTIAN,NEESON
61,831,SPIRITED CASUALTIES,A Taut Story of a Waitress And a Man who must Face a Car in A Baloon Factory,2006,1,,5,0.99,138,20.99,PG-13,English,CHRISTIAN,NEESON
61,703,PUNK DIVORCE,A Fast-Paced Tale of a Pastry Chef And a Boat who must Face a Frisbee in The Canadian Rockies,2006,1,,6,4.99,100,18.99,PG,English,CHRISTIAN,NEESON
61,585,MOB DUFFEL,A Unbelieveable Documentary of a Frisbee And a Boat who must Meet a Boy in The Canadian Rockies,2006,1,,4,0.99,105,25.99,G,English,CHRISTIAN,NEESON
61,752,RUNNER MADIGAN,A Thoughtful Documentary of a Crocodile And a Robot who must Outrace a Womanizer in The Outback,2006,1,,6,0.99,101,27.99,NC-17,English,CHRISTIAN,NEESON
61,535,LOVE SUICIDES,A Brilliant Panorama of a Hunter And a Explorer who must Pursue a Dentist in An Abandoned Fun House,2006,1,,6,0.99,181,21.99,R,English,CHRISTIAN,NEESON
90,433,HORN WORKING,A Stunning Display of a Mad Scientist And a Technical Writer who must Succumb a Monkey in A Shark Tank,2006,1,,4,2.99,95,23.99,PG,English,SEAN,GUINESS
90,817,SOLDIERS EVOLUTION,A Lacklusture Panorama of a A Shark And a Pioneer who must Confront a Student in The First Manned Space Station,2006,1,,7,4.99,185,27.99,R,English,SEAN,GUINESS
90,442,HUNTING MUSKETEERS,A Thrilling Reflection of a Pioneer And a Dentist who must Outrace a Womanizer in An Abandoned Mine Shaft,2006,1,,6,2.99,65,24.99,NC-17,English,SEAN,GUINESS
90,520,LICENSE WEEKEND,A Insightful Story of a Man And a Husband who must Overcome a Madman in A Monastery,2006,1,,7,2.99,91,28.99,NC-17,English,SEAN,GUINESS
90,633,OCTOBER SUBMARINE,A Taut Epistle of a Monkey And a Boy who must Confront a Husband in A Jet Boat,2006,1,,6,4.99,54,10.99,PG-13,English,SEAN,GUINESS
90,868,SUPERFLY TRIP,A Beautiful Saga of a Lumberjack And a Teacher who must Build a Technical Writer in An Abandoned Fun House,2006,1,,5,0.99,114,27.99,PG,English,SEAN,GUINESS
90,880,TELEMARK HEARTBREAKERS,A Action-Packed Panorama of a Technical Writer And a Man who must Build a Forensic Psychologist in A Manhattan Penthouse,2006,1,,6,2.99,152,9.99,PG-13,English,SEAN,GUINESS
90,391,HALF OUTFIELD,A Epic Epistle of a Database Administrator And a Crocodile who must Face a Madman in A Jet Boat,2006,1,,6,2.99,146,25.99,PG-13,English,SEAN,GUINESS
90,858,SUBMARINE BED,A Amazing Display of a Car And a Monkey who must Fight a Teacher in Soviet Georgia,2006,1,,5,4.99,127,21.99,R,English,SEAN,GUINESS
90,262,DUMBO LUST,A Touching Display of a Feminist And a Dentist who must Conquer a Husband in The Gulf of Mexico,2006,1,,5,0.99,119,17.99,NC-17,English,SEAN,GUINESS
90,374,GRAFFITI LOVE,A Unbelieveable Epistle of a Sumo Wrestler And a Hunter who must Build a Composer in Berlin,2006,1,,3,0.99,117,29.99,PG,English,SEAN,GUINESS
90,855,STREAK RIDGEMONT,A Astounding Character Study of a Hunter And a Waitress who must Sink a Man in New Orleans,2006,1,,7,0.99,132,28.99,PG-13,English,SEAN,GUINESS
90,212,DARN FORRESTER,A Fateful Story of a A Shark And a Explorer who must Succumb a Technical Writer in A Jet Boat,2006,1,,7,4.99,185,14.99,G,English,SEAN,GUINESS
90,901,TRACY CIDER,A Touching Reflection of a Database Administrator And a Madman who must Build a Lumberjack in Nigeria,2006,1,,3,0.99,142,29.99,G,English,SEAN,GUINESS
90,838,STAGECOACH ARMAGEDDON,A Touching Display of a Pioneer And a Butler who must Chase a Car in California,2006,1,,5,4.99,112,25.99,R,English,SEAN,GUINESS
90,451,IGBY MAKER,A Epic Documentary of a Hunter And a Dog who must Outgun a Dog in A Baloon Factory,2006,1,,7,4.99,160,12.99,NC-17,English,SEAN,GUINESS
