actor_id,film_id,title,description,release_year,language_id,original_language_id,rental_duration,rental_rate,length,replacement_cost,rating,language,first_name,last_name
77,73,BINGO TALENTED,A Touching Tale of a Girl And a Crocodile who must Discover a Waitress in Nigeria,2006,1,,5,2.99,150,22.99,PG-13,English,CARY,MCCONAUGHEY
77,612,MUSSOLINI SPOILERS,A Thrilling Display of a Boat And a Monkey who must Meet a Composer in Ancient China,2006,1,,6,2.99,180,10.99,G,English,CARY,MCCONAUGHEY
77,943,VILLAIN DESPERATE,A Boring Yarn of a Pioneer And a Feminist who must Redeem a Cat in An Abandoned Amusement Park,2006,1,,4,4.99,76,27.99,PG-13,English,CARY,MCCONAUGHEY
77,240,DOLLS RAGE,A Thrilling Display of a Pioneer And a Frisbee who must Escape a Teacher in The Outback,2006,1,,7,2.99,120,10.99,PG-13,English,CARY,MCCONAUGHEY
177,458,INDIAN LOVE,A Insightful Saga of a Mad Scientist And a Mad Scientist who must Kill a Astronaut in An Abandoned Fun House,2006,1,,4,0.99,135,26.99,NC-17,English,GENE,MCKELLEN
177,956,WANDA CHAMBER,A Insightful Drama of a A Shark And a Pioneer who must Find a Womanizer in The Outback,2006,1,,7,4.99,107,23.99,PG-13,English,GENE,MCKELLEN
177,433,HORN WORKING,A Stunning Display of a Mad Scientist And a Technical Writer who must Succumb a Monkey in A Shark Tank,2006,1,,4,2.99,95,23.99,PG,English,GENE,MCKELLEN
177,175,CONFUSED CANDLES,A Stunning Epistle of a Cat And a Forensic Psychologist who must Confront a Pioneer in A Baloon,2006,1,,3,2.99,122,27.99,PG-13,English,GENE,MCKELLEN
177,751,RUNAWAY TENENBAUMS,A Thoughtful Documentary of a Boat And a Man who must Meet a Boat in An Abandoned Fun House,2006,1,,6,0.99,181,17.99,NC-17,English,GENE,MCKELLEN
177,726,RESERVOIR ADAPTATION,A Intrepid Drama of a Teacher And a Moose who must Kill a Car in California,2006,1,,7,2.99,61,29.99,PG-13,English,GENE,MCKELLEN
177,39,ARMAGEDDON LOST,A Fast-Paced Tale of a Boat And a Teacher who must Succumb a Composer in An Abandoned Mine Shaft,2006,1,,5,0.99,99,10.99,G,English,GENE,MCKELLEN
177,52,BALLROOM MOCKINGBIRD,A Thrilling Documentary of a Composer And a Monkey who must Find a Feminist in California,2006,1,,6,0.99,173,29.99,G,English,GENE,MCKELLEN
177,522,LIFE TWISTED,A Thrilling Reflection of a Teacher And a Composer who must Find a Man in The First Manned Space Station,2006,1,,4,2.99,137,9.99,NC-17,English,GENE,MCKELLEN
177,237,DIVORCE SHINING,A Unbelieveable Saga of a Crocodile And a Student who must Discover a Cat in Ancient India,2006,1,,3,2.99,47,21.99,G,English,GENE,MCKELLEN
177,12,ALASKA PHANTOM,A Fanciful Saga of a Hunter And a Pastry Chef who must Vanquish a Boy in Australia,2006,1,,6,0.99,136,22.99,PG,English,GENE,MCKELLEN
177,683,PITY BOUND,A Boring Panorama of a Feminist And a Moose who must Defeat a Database Administrator in Nigeria,2006,1,,5,4.99,60,19.99,NC-17,English,GENE,MCKELLEN
177,289,EVE RESURRECTION,A Awe-Inspiring Yarn of a Pastry Chef And a Database Administrator who must Challenge a Teacher in A Baloon,2006,1,,5,4.99,66,25.99,G,English,GENE,MCKELLEN
177,188,CRAZY HOME,A Fanciful Panorama of a Boy And a Woman who must Vanquish a Database Administrator in The Outback,2006,1,,7,2.99,136,24.99,PG,English,GENE,MCKELLEN
177,763,SATISFACTION CONFIDENTIAL,A Lacklusture Yarn of a Dentist And a Butler who must Meet a Secret Agent in Ancient China,2006,1,,3,4.99,75,26.99,G,English,GENE,MCKELLEN
177,401,HAROLD FRENCH,A Stunning Saga of a Sumo Wrestler And a Student who must Outrace a Moose in The Sahara Desert,2006,1,,6,0.99,168,10.99,NC-17,English,GENE,MCKELLEN
177,827,SPICE SORORITY,A Fateful Display of a Pioneer And a Hunter who must Defeat a Husband in An Abandoned Mine Shaft,2006,1,,5,4.99,141,22.99,NC-17,English,GENE,MCKELLEN
177,563,MASSACRE USUAL,A Fateful Reflection of a Waitress And a Crocodile who must Challenge a Forensic Psychologist in California,2006,1,,6,4.99,165,16.99,R,English,GENE,MCKELLEN
177,649,OZ LIAISONS,A Epic Yarn of a Mad Scientist And a Cat who must Confront a Womanizer in A Baloon Factory,2006,1,,4,2.99,85,14.99,R,English,GENE,MCKELLEN
177,86,BOOGIE AMELIE,A Lacklusture Character Study of a Husband And a Sumo Wrestler who must Succumb a Technical Writer in The Gulf of Mexico,2006,1,,6,4.99,121,11.99,R,English,GENE,MCKELLEN
177,764,SATURDAY LAMBS,A Thoughtful Reflection of a Mad Scientist And a Moose who must Kill a Husband in A Baloon,2006,1,,3,4.99,150,28.99,G,English,GENE,MCKELLEN
177,235,DIVIDE MONSTER,A Intrepid Saga of a Man And a Forensic Psychologist who must Reach a Squirrel in A Monastery,2006,1,,6,2.99,68,13.99,PG-13,English,GENE,MCKELLEN
177,684,PIZZA JUMANJI,A Epic Saga of a Cat And a Squirrel who must Outgun a Robot in A U-Boat,2006,1,,4,2.99,173,11.99,NC-17,English,GENE,MCKELLEN
177,910,TREATMENT JEKYLL,A Boring Story of a Teacher And a Student who must Outgun a Cat in An Abandoned Mine Shaft,2006,1,,3,0.99,87,19.99,PG,English,GENE,MCKELLEN
177,55,BARBARELLA STREETCAR,A Awe-Inspiring Story of a Feminist And a Cat who must Conquer a Dog in A Monastery,2006,1,,6,2.99,65,27.99,G,English,GENE,MCKELLEN
177,543,MADIGAN DORADO,A Astounding Character Study of a A Shark And a A Shark who must Discover a Crocodile in The Outback,2006,1,,5,4.99,116,20.99,R,English,GENE,MCKELLEN
177,363,GO PURPLE,A Fast-Paced Display of a Car And a Database Administrator who must Battle a Woman in A Baloon,2006,1,,3,0.99,54,12.99,R,English,GENE,MCKELLEN
135,458,INDIAN LOVE,A Insightful Saga of a Mad Scientist And a Mad Scientist who must Kill a Astronaut in An Abandoned Fun House,2006,1,,4,0.99,135,26.99,NC-17,English,RITA,REYNOLDS
135,170,COMMAND DARLING,A Awe-Inspiring Tale of a Forensic Psychologist And a Woman who must Challenge a Database Administrator in Ancient Japan,2006,1,,5,4.99,120,28.99,PG-13,English,RITA,REYNOLDS
135,553,MAKER GABLES,A Stunning Display of a Moose And a Database Administrator who must Pursue a Composer in A Jet Boat,2006,1,,4,0.99,136,12.99,PG-13,English,RITA,REYNOLDS
135,35,ARACHNOPHOBIA ROLLERCOASTER,A Action-Packed Reflection of a Pastry Chef And a Composer who must Discover a Mad Scientist in The First Manned Space Station,2006,1,,4,2.99,147,24.99,PG-13,English,RITA,REYNOLDS
135,719,RECORDS ZORRO,A Amazing Drama of a Mad Scientist And a Composer who must Build a Husband in The Outback,2006,1,,7,4.99,182,11.99,PG,English,RITA,REYNOLDS
135,905,TRAINSPOTTING STRANGERS,A Fast-Paced Drama of a Pioneer And a Mad Cow who must Challenge a Madman in Ancient Japan,2006,1,,7,4.99,132,10.99,PG-13,English,RITA,REYNOLDS
135,88,BORN SPINAL,A Touching Epistle of a Frisbee And a Husband who must Pursue a Student in Nigeria,2006,1,,7,4.99,179,17.99,PG,English,RITA,REYNOLDS
135,541,LUKE MUMMY,A Taut Character Study of a Boy And a Robot who must Redeem a Mad Scientist in Ancient India,2006,1,,5,2.99,74,21.99,NC-17,English,RITA,REYNOLDS
135,320,FLAMINGOS CONNECTICUT,A Fast-Paced Reflection of a Composer And a Composer who must Meet a Cat in The Sahara Desert,2006,1,,4,4.99,80,28.99,PG-13,English,RITA,REYNOLDS
135,814,SNATCH SLIPPER,A Insightful Panorama of a Woman And a Feminist who must Defeat a Forensic Psychologist in Berlin,2006,1,,6,4.99,110,15.99,PG,English,RITA,REYNOLDS
135,41,ARSENIC INDEPENDENCE,A Fanciful Documentary of a Mad Cow And a Womanizer who must Find a Dentist in Berlin,2006,1,,4,0.99,137,17.99,PG,English,RITA,REYNOLDS
135,357,GILBERT PELICAN,A Fateful Tale of a Man And a Feminist who must Conquer a Crocodile in A Manhattan Penthouse,2006,1,,7,0.99,114,13.99,G,English,RITA,REYNOLDS
135,269,EARRING INSTINCT,A Stunning Character Study of a Dentist And a Mad Cow who must Find a Teacher in Nigeria,2006,1,,3,0.99,98,22.99,R,English,RITA,REYNOLDS
135,616,NATIONAL STORY,A Taut Epistle of a Mad Scientist And a Girl who must Escape a Monkey in California,2006,1,,4,2.99,92,19.99,NC-17,English,RITA,REYNOLDS
135,353,GENTLEMEN STAGE,A Awe-Inspiring Reflection of a Monkey And a Student who must Overcome a Dentist in The First Manned Space Station,2006,1,,6,2.99,125,22.99,NC-17,English,RITA,REYNOLDS
135,628,NORTHWEST POLISH,A Boring Character Study of a Boy And a A Shark who must Outrace a Womanizer in The Outback,2006,1,,5,2.99,172,24.99,PG,English,RITA,REYNOLDS
135,65,BEHAVIOR RUNAWAY,A Unbelieveable Drama of a Student And a Husband who must Outrace a Sumo Wrestler in Berlin,2006,1,,3,4.99,100,20.99,PG,English,RITA,REYNOLDS
135,484,JERK PAYCHECK,A Touching Character Study of a Pastry Chef And a Database Administrator who must Reach a A Shark in Ancient Japan,2006,1,,3,2.99,172,13.99,NC-17,English,RITA,REYNOLDS
135,455,IMPOSSIBLE PREJUDICE,A Awe-Inspiring Yarn of a Monkey And a Hunter who must Chase a Teacher in Ancient China,2006,1,,7,4.99,103,11.99,NC-17,English,RITA,REYNOLDS
135,364,GODFATHER DIARY,A Stunning Saga of a Lumberjack And a Squirrel who must Chase a Car in The Outback,2006,1,,3,2.99,73,14.99,NC-17,English,RITA,REYNOLDS
2,458,INDIAN LOVE,A Insightful Saga of a Mad Scientist And a Mad Scientist who must Kill a Astronaut in An Abandoned Fun House,2006,1,,4,0.99,135,26.99,NC-17,English,NICK,WAHLBERG
2,540,LUCKY FLYING,A Lacklusture Character Study of a A Shark And a Man who must Find a Forensic Psychologist in A U-Boat,2006,1,,7,2.99,97,10.99,PG-13,English,NICK,WAHLBERG
2,31,APACHE DIVINE,A Awe-Inspiring Reflection of a Pastry Chef And a Teacher who must Overcome a Sumo Wrestler in A U-Boat,2006,1,,5,4.99,92,16.99,NC-17,English,NICK,WAHLBERG
2,518,LIAISONS SWEET,A Boring Drama of a A Shark And a Explorer who must Redeem a Waitress in The Canadian Rockies,2006,1,,5,4.99,140,15.99,PG,English,NICK,WAHLBERG
2,754,RUSHMORE MERMAID,A Boring Story of a Woman And a Moose who must Reach a Husband in A Shark Tank,2006,1,,6,2.99,150,17.99,PG-13,English,NICK,WAHLBERG
2,105,BULL SHAWSHANK,A Fanciful Drama of a Moose And a Squirrel who must Conquer a Pioneer in The Canadian Rockies,2006,1,,6,0.99,125,21.99,NC-17,English,NICK,WAHLBERG
2,369,GOODFELLAS SALUTE,A Unbelieveable Tale of a Dog And a Explorer who must Sink a Mad Cow in A Baloon Factory,2006,1,,4,4.99,56,22.99,PG,English,NICK,WAHLBERG
2,555,MALLRATS UNITED,A Thrilling Yarn of a Waitress And a Dentist who must Find a Hunter in A Monastery,2006,1,,4,0.99,133,25.99,PG,English,NICK,WAHLBERG
2,226,DESTINY SATURDAY,A Touching Drama of a Crocodile And a Crocodile who must Conquer a Explorer in Soviet Georgia,2006,1,,4,4.99,56,20.99,G,English,NICK,WAHLBERG
2,958,WARDROBE PHANTOM,A Action-Packed Display of a Mad Cow And a Astronaut who must Kill a Car in Ancient India,2006,1,,6,2.99,178,19.99,G,English,NICK,WAHLBERG
2,132,CHAINSAW UPTOWN,A Beautiful Documentary of a Boy And a Robot who must Discover a Squirrel in Australia,2006,1,,6,0.99,114,25.99,PG,English,NICK,WAHLBERG
2,249,DRACULA CRYSTAL,A Thrilling Reflection of a Feminist And a Cat who must Find a Frisbee in An Abandoned Fun House,2006,1,,7,0.99,176,26.99,G,English,NICK,WAHLBERG
2,357,GILBERT PELICAN,A Fateful Tale of a Man And a Feminist who must Conquer a Crocodile in A Manhattan Penthouse,2006,1,,7,0.99,114,13.99,G,English,NICK,WAHLBERG
2,3,ADAPTATION HOLES,A Astounding Reflection of a Lumberjack And a Car who must Sink a Lumberjack in A Baloon Factory,2006,1,,7,2.99,50,18.99,NC-17,English,NICK,WAHLBERG
2,485,JERSEY SASSY,A Lacklusture Documentary of a Madman And a Mad Cow who must Find a Feminist in Ancient Japan,2006,1,,6,4.99,60,16.99,PG,English,NICK,WAHLBERG
2,145,CHISUM BEHAVIOR,A Epic Documentary of a Sumo Wrestler And a Butler who must Kill a Car in Ancient India,2006,1,,5,4.99,124,25.99,G,English,NICK,WAHLBERG
2,561,MASK PEACH,A Boring Character Study of a Student And a Robot who must Meet a Woman in California,2006,1,,6,2.99,123,26.99,NC-17,English,NICK,WAHLBERG
2,811,SMILE EARRING,A Intrepid Drama of a Teacher And a Butler who must Build a Pastry Chef in Berlin,2006,1,,4,2.99,60,29.99,G,English,NICK,WAHLBERG
2,550,MAGUIRE APACHE,A Fast-Paced Reflection of a Waitress And a Hunter who must Defeat a Forensic Psychologist in A Baloon,2006,1,,6,2.99,74,22.99,NC-17,English,NICK,WAHLBERG
2,47,BABY HALL,A Boring Character Study of a A Shark And a Girl who must Outrace a Feminist in An Abandoned Mine Shaft,2006,1,,5,4.99,153,23.99,NC-17,English,NICK,WAHLBERG
2,742,ROOF CHAMPION,A Lacklusture Reflection of a Car And a Explorer who must Find a Monkey in A Baloon,2006,1,,7,0.99,101,25.99,R,English,NICK,WAHLBERG
2,399,HAPPINESS UNITED,A Action-Packed Panorama of a Husband And a Feminist who must Meet a Forensic Psychologist in Ancient Japan,2006,1,,6,2.99,100,23.99,G,English,NICK,WAHLBERG
2,321,FLASH WARS,A Astounding Saga of a Moose And a Pastry Chef who must Chase a Student in The Gulf of Mexico,2006,1,,3,4.99,123,21.99,NC-17,English,NICK,WAHLBERG
2,314,FIGHT JAWBREAKER,A Intrepid Panorama of a Womanizer And a Girl who must Escape a Girl in A Manhattan Penthouse,2006,1,,3,0.99,91,13.99,R,English,NICK,WAHLBERG
2,481,JEKYLL FROGMEN,A Fanciful Epistle of a Student And a Astronaut who must Kill a Waitress in A Shark Tank,2006,1,,4,2.99,58,22.99,PG,English,NICK,WAHLBERG
184,967,WEEKEND PERSONAL,A Fast-Paced Documentary of a Car And a Butler who must Find a Frisbee in A Jet Boat,2006,1,,5,2.99,134,26.99,R,English,HUMPHREY,GARLAND
184,640,OPUS ICE,A Fast-Paced Drama of a Hunter And a Boy who must Discover a Feminist in The Sahara Desert,2006,1,,5,4.99,102,21.99,R,English,HUMPHREY,GARLAND
184,580,MINE TITANS,A Amazing Yarn of a Robot And a Womanizer who must Discover a Forensic Psychologist in Berlin,2006,1,,3,4.99,166,12.99,PG-13,English,HUMPHREY,GARLAND
184,87,BOONDOCK BALLROOM,A Fateful Panorama of a Crocodile And a Boy who must Defeat a Monkey in The Gulf of Mexico,2006,1,,7,0.99,76,14.99,NC-17,English,HUMPHREY,GARLAND
184,35,ARACHNOPHOBIA ROLLERCOASTER,A Action-Packed Reflection of a Pastry Chef And a Composer who must Discover a Mad Scientist in The First Manned Space Station,2006,1,,4,2.99,147,24.99,PG-13,English,HUMPHREY,GARLAND
184,642,ORDER BETRAYED,A Amazing Saga of a Dog And a A Shark who must Challenge a Cat in The Sahara Desert,2006,1,,7,2.99,120,13.99,PG-13,English,HUMPHREY,GARLAND
184,969,WEST LION,A Intrepid Drama of a Butler And a Lumberjack who must Challenge a Database Administrator in A Manhattan Penthouse,2006,1,,4,4.99,159,29.99,G,English,HUMPHREY,GARLAND
184,336,FRENCH HOLIDAY,A Thrilling Epistle of a Dog And a Feminist who must Kill a Madman in Berlin,2006,1,,5,4.99,99,22.99,PG,English,HUMPHREY,GARLAND
184,966,WEDDING APOLLO,A Action-Packed Tale of a Student And a Waitress who must Conquer a Lumberjack in An Abandoned Mine Shaft,2006,1,,3,0.99,70,14.99,PG,English,HUMPHREY,GARLAND
184,169,COMFORTS RUSH,A Unbelieveable Panorama of a Pioneer And a Husband who must Meet a Mad Cow in An Abandoned Mine Shaft,2006,1,,3,2.99,76,19.99,NC-17,English,HUMPHREY,GARLAND
184,574,MIDNIGHT WESTWARD,A Taut Reflection of a Husband And a A Shark who must Redeem a Pastry Chef in A Monastery,2006,1,,3,0.99,86,19.99,G,English,HUMPHREY,GARLAND
184,745,ROSES TREASURE,A Astounding Panorama of a Monkey And a Secret Agent who must Defeat a Woman in The First Manned Space Station,2006,1,,5,4.99,162,23.99,PG-13,English,HUMPHREY,GARLAND
184,772,SEA VIRGIN,A Fast-Paced Documentary of a Technical Writer And a Pastry Chef who must Escape a Moose in A U-Boat,2006,1,,4,2.99,80,24.99,PG,English,HUMPHREY,GARLAND
184,146,CHITTY LOCK,A Boring Epistle of a Boat And a Database Administrator who must Kill a Sumo Wrestler in The First Manned Space Station,2006,1,,6,2.99,107,24.99,G,English,HUMPHREY,GARLAND
184,787,SHINING ROSES,A Awe-Inspiring Character Study of a Astronaut And a Forensic Psychologist who must Challenge a Madman in Ancient India,2006,1,,4,0.99,125,12.99,G,English,HUMPHREY,GARLAND
184,452,ILLUSION AMELIE,A Emotional Epistle of a Boat And a Mad Scientist who must Outrace a Robot in An Abandoned Mine Shaft,2006,1,,4,0.99,122,15.99,R,English,HUMPHREY,GARLAND
184,959,WARLOCK WEREWOLF,A Astounding Yarn of a Pioneer And a Crocodile who must Defeat a A Shark in The Outback,2006,1,,6,2.99,83,10.99,G,English,HUMPHREY,GARLAND
184,867,SUPER WYOMING,A Action-Packed Saga of a Pastry Chef And a Explorer who must Discover a A Shark in The Outback,2006,1,,5,4.99,58,10.99,PG,English,HUMPHREY,GARLAND
184,597,MOONWALKER FOOL,A Epic Drama of a Feminist And a Pioneer who must Sink a Composer in New Orleans,2006,1,,5,4.99,184,12.99,G,English,HUMPHREY,GARLAND
184,500,KISS GLORY,A Lacklusture Reflection of a Girl And a Husband who must Find a Robot in The Canadian Rockies,2006,1,,5,4.99,163,11.99,PG-13,English,HUMPHREY,GARLAND
184,661,PAST SUICIDES,A Intrepid Tale of a Madman And a Astronaut who must Challenge a Hunter in A Monastery,2006,1,,5,4.99,157,17.99,PG-13,English,HUMPHREY,GARLAND
184,486,JET NEIGHBORS,A Amazing Display of a Lumberjack And a Teacher who must Outrace a Woman in A U-Boat,2006,1,,7,4.99,59,14.99,R,English,HUMPHREY,GARLAND
184,492,JUNGLE CLOSER,A Boring Character Study of a Boy And a Woman who must Battle a Astronaut in Australia,2006,1,,6,0.99,134,11.99,NC-17,English,HUMPHREY,GARLAND
184,371,GOSFORD DONNIE,A Epic Panorama of a Mad Scientist And a Monkey who must Redeem a Secret Agent in Berlin,2006,1,,5,4.99,129,17.99,G,English,HUMPHREY,GARLAND
184,221,DELIVERANCE MULHOLLAND,A Astounding Saga of a Monkey And a Moose who must Conquer a Butler in A Shark Tank,2006,1,,4,0.99,100,9.99,R,English,HUMPHREY,GARLAND
184,985,WONDERLAND CHRISTMAS,A Awe-Inspiring Character Study of a Waitress And a Car who must Pursue a Mad Scientist in The First Manned Space Station,2006,1,,4,4.99,111,19.99,PG,English,HUMPHREY,GARLAND
184,615,NASH CHOCOLAT,A Epic Reflection of a Monkey And a Mad Cow who must Kill a Forensic Psychologist in An Abandoned Mine Shaft,2006,1,,6,2.99,180,21.99,PG-13,English,HUMPHREY,GARLAND
184,650,PACIFIC AMISTAD,A Thrilling Yarn of a Dog And a Moose who must Kill a Pastry Chef in A Manhattan Penthouse,2006,1,,3,0.99,144,27.99,G,English,HUMPHREY,GARLAND
184,684,PIZZA JUMANJI,A Epic Saga of a Cat And a Squirrel who must Outgun a Robot in A U-Boat,2006,1,,4,2.99,173,11.99,NC-17,English,HUMPHREY,GARLAND
158,967,WEEKEND PERSONAL,A Fast-Paced Documentary of a Car And a Butler who must Find a Frisbee in A Jet Boat,2006,1,,5,2.99,134,26.99,R,English,VIVIEN,BASINGER
158,32,APOCALYPSE FLAMINGOS,A Astounding Story of a Dog And a Squirrel who must Defeat a Woman in An Abandoned Amusement Park,2006,1,,6,4.99,119,11.99,R,English,VIVIEN,BASINGER
158,840,STAMPEDE DISTURBING,A Unbelieveable Tale of a Woman And a Lumberjack who must Fight a Frisbee in A U-Boat,2006,1,,5,0.99,75,26.99,R,English,VIVIEN,BASINGER
158,626,NOON PAPI,A Unbelieveable Character Study of a Mad Scientist And a Astronaut who must Find a Pioneer in A Manhattan Penthouse,2006,1,,5,2.99,57,12.99,G,English,VIVIEN,BASINGER
158,880,TELEMARK HEARTBREAKERS,A Action-Packed Panorama of a Technical Writer And a Man who must Build a Forensic Psychologist in A Manhattan Penthouse,2006,1,,6,2.99,152,9.99,PG-13,English,VIVIEN,BASINGER
158,894,TOMATOES HELLFIGHTERS,A Thoughtful Epistle of a Madman And a Astronaut who must Overcome a Monkey in A Shark Tank,2006,1,,6,0.99,68,23.99,PG,English,VIVIEN,BASINGER
158,830,SPIRIT FLINTSTONES,A Brilliant Yarn of a Cat And a Car who must Confront a Explorer in Ancient Japan,2006,1,,7,0.99,149,23.99,R,English,VIVIEN,BASINGER
158,178,CONNECTION MICROCOSMOS,A Fateful Documentary of a Crocodile And a Husband who must Face a Husband in The First Manned Space Station,2006,1,,6,0.99,115,25.99,G,English,VIVIEN,BASINGER
158,177,CONNECTICUT TRAMP,A Unbelieveable Drama of a Crocodile And a Mad Cow who must Reach a Dentist in A Shark Tank,2006,1,,4,4.99,172,20.99,R,English,VIVIEN,BASINGER
158,555,MALLRATS UNITED,A Thrilling Yarn of a Waitress And a Dentist who must Find a Hunter in A Monastery,2006,1,,4,0.99,133,25.99,PG,English,VIVIEN,BASINGER
158,869,SUSPECTS QUILLS,A Emotional Epistle of a Pioneer And a Crocodile who must Battle a Man in A Manhattan Penthouse,2006,1,,4,2.99,47,22.99,PG,English,VIVIEN,BASINGER
158,799,SIMON NORTH,A Thrilling Documentary of a Technical Writer And a A Shark who must Face a Pioneer in A Shark Tank,2006,1,,3,0.99,51,26.99,NC-17,English,VIVIEN,BASINGER
158,879,TELEGRAPH VOYAGE,A Fateful Yarn of a Husband And a Dog who must Battle a Waitress in A Jet Boat,2006,1,,3,4.99,148,20.99,PG,English,VIVIEN,BASINGER
158,437,HOUSE DYNAMITE,A Taut Story of a Pioneer And a Squirrel who must Battle a Student in Soviet Georgia,2006,1,,7,2.99,109,13.99,R,English,VIVIEN,BASINGER
158,64,BEETHOVEN EXORCIST,A Epic Display of a Pioneer And a Student who must Challenge a Butler in The Gulf of Mexico,2006,1,,6,0.99,151,26.99,PG-13,English,VIVIEN,BASINGER
158,66,BENEATH RUSH,A Astounding Panorama of a Man And a Monkey who must Discover a Man in The First Manned Space Station,2006,1,,6,0.99,53,27.99,NC-17,English,VIVIEN,BASINGER
158,121,CAROL TEXAS,A Astounding Character Study of a Composer And a Student who must Overcome a Composer in A Monastery,2006,1,,4,2.99,151,15.99,PG,English,VIVIEN,BASINGER
158,473,JACKET FRISCO,A Insightful Reflection of a Womanizer And a Husband who must Conquer a Pastry Chef in A Baloon,2006,1,,5,2.99,181,16.99,PG-13,English,VIVIEN,BASINGER
158,637,OPEN AFRICAN,A Lacklusture Drama of a Secret Agent And a Explorer who must Discover a Car in A U-Boat,2006,1,,7,4.99,131,16.99,PG,English,VIVIEN,BASINGER
158,215,DAWN POND,A Thoughtful Documentary of a Dentist And a Forensic Psychologist who must Defeat a Waitress in Berlin,2006,1,,4,4.99,57,27.99,PG,English,VIVIEN,BASINGER
158,812,SMOKING BARBARELLA,A Lacklusture Saga of a Mad Cow And a Mad Scientist who must Sink a Cat in A MySQL Convention,2006,1,,7,0.99,50,13.99,PG-13,English,VIVIEN,BASINGER
158,188,CRAZY HOME,A Fanciful Panorama of a Boy And a Woman who must Vanquish a Database Administrator in The Outback,2006,1,,7,2.99,136,24.99,PG,English,VIVIEN,BASINGER
158,990,WORLD LEATHERNECKS,A Unbelieveable Tale of a Pioneer And a Astronaut who must Overcome a Robot in An Abandoned Amusement Park,2006,1,,3,0.99,171,13.99,PG-13,English,VIVIEN,BASINGER
158,483,JERICHO MULAN,A Amazing Yarn of a Hunter And a Butler who must Defeat a Boy in A Jet Boat,2006,1,,3,2.99,171,29.99,NC-17,English,VIVIEN,BASINGER
158,896,TOOTSIE PILOT,A Awe-Inspiring Documentary of a Womanizer And a Pastry Chef who must Kill a Lumberjack in Berlin,2006,1,,3,0.99,157,10.99,PG,English,VIVIEN,BASINGER
158,601,MOULIN WAKE,A Astounding Story of a Forensic Psychologist And a Cat who must Battle a Teacher in An Abandoned Mine Shaft,2006,1,,4,0.99,79,20.99,PG-13,English,VIVIEN,BASINGER
158,616,NATIONAL STORY,A Taut Epistle of a Mad Scientist And a Girl who must Escape a Monkey in California,2006,1,,4,2.99,92,19.99,NC-17,English,VIVIEN,BASINGER
158,47,BABY HALL,A Boring Character Study of a A Shark And a Girl who must Outrace a Feminist in An Abandoned Mine Shaft,2006,1,,5,4.99,153,23.99,NC-17,English,VIVIEN,BASINGER
158,581,MINORITY KISS,A Insightful Display of a Lumberjack And a Sumo Wrestler who must Meet a Man in The Outback,2006,1,,4,0.99,59,16.99,G,English,VIVIEN,BASINGER
158,824,SPARTACUS CHEAPER,A Thrilling Panorama of a Pastry Chef And a Secret Agent who must Overcome a Student in A Manhattan Penthouse,2006,1,,4,4.99,52,19.99,NC-17,English,VIVIEN,BASINGER
158,102,BUBBLE GROSSE,A Awe-Inspiring Panorama of a Crocodile And a Moose who must Confront a Girl in A Baloon,2006,1,,4,4.99,60,20.99,R,English,VIVIEN,BASINGER
158,241,DONNIE ALLEY,A Awe-Inspiring Tale of a Butler And a Frisbee who must Vanquish a Teacher in Ancient Japan,2006,1,,4,0.99,125,20.99,NC-17,English,VIVIEN,BASINGER
158,968,WEREWOLF LOLA,A Fanciful Story of a Man And a Sumo Wrestler who must Outrace a Student in A Monastery,2006,1,,6,4.99,79,19.99,G,English,VIVIEN,BASINGER
158,532,LOSER HUSTLER,A Stunning Drama of a Robot And a Feminist who must Outgun a Butler in Nigeria,2006,1,,5,4.99,80,28.99,PG,English,VIVIEN,BASINGER
158,293,EXORCIST STING,A Touching Drama of a Dog And a Sumo Wrestler who must Conquer a Mad Scientist in Berlin,2006,1,,6,2.99,167,17.99,G,English,VIVIEN,BASINGER
197,967,WEEKEND PERSONAL,A Fast-Paced Documentary of a Car And a Butler who must Find a Frisbee in A Jet Boat,2006,1,,5,2.99,134,26.99,R,English,REESE,WEST
197,29,ANTITRUST TOMATOES,A Fateful Yarn of a Womanizer And a Feminist who must Succumb a Database Administrator in Ancient India,2006,1,,5,2.99,168,11.99,NC-17,English,REESE,WEST
197,974,WILD APOLLO,A Beautiful Story of a Monkey And a Sumo Wrestler who must Conquer a A Shark in A MySQL Convention,2006,1,,4,0.99,181,24.99,R,English,REESE,WEST
197,418,HOBBIT ALIEN,A Emotional Drama of a Husband And a Girl who must Outgun a Composer in The First Manned Space Station,2006,1,,5,0.99,157,27.99,PG-13,English,REESE,WEST
197,522,LIFE TWISTED,A Thrilling Reflection of a Teacher And a Composer who must Find a Man in The First Manned Space Station,2006,1,,4,2.99,137,9.99,NC-17,English,REESE,WEST
197,369,GOODFELLAS SALUTE,A Unbelieveable Tale of a Dog And a Explorer who must Sink a Mad Cow in A Baloon Factory,2006,1,,4,4.99,56,22.99,PG,English,REESE,WEST
197,691,POSEIDON FOREVER,A Thoughtful Epistle of a Womanizer And a Monkey who must Vanquish a Dentist in A Monastery,2006,1,,6,4.99,159,29.99,PG-13,English,REESE,WEST
197,164,COAST RAINBOW,A Astounding Documentary of a Mad Cow And a Pioneer who must Challenge a Butler in The Sahara Desert,2006,1,,4,0.99,55,20.99,PG,English,REESE,WEST
197,249,DRACULA CRYSTAL,A Thrilling Reflection of a Feminist And a Cat who must Find a Frisbee in An Abandoned Fun House,2006,1,,7,0.99,176,26.99,G,English,REESE,WEST
197,370,GORGEOUS BINGO,A Action-Packed Display of a Sumo Wrestler And a Car who must Overcome a Waitress in A Baloon Factory,2006,1,,4,2.99,108,26.99,R,English,REESE,WEST
197,598,MOSQUITO ARMAGEDDON,A Thoughtful Character Study of a Waitress And a Feminist who must Build a Teacher in Ancient Japan,2006,1,,6,0.99,57,22.99,G,English,REESE,WEST
197,815,SNATCHERS MONTEZUMA,A Boring Epistle of a Sumo Wrestler And a Woman who must Escape a Man in The Canadian Rockies,2006,1,,4,2.99,74,14.99,PG-13,English,REESE,WEST
