film_id,category_id,category_name,title,description,release_year,language_id,original_language_id,rental_duration,rental_rate,length,replacement_cost,rating,language
279,15,Sports,ELIZABETH SHANE,A Lacklusture Display of a Womanizer And a Dog who must Face a Sumo Wrestler in Ancient Japan,2006,1,,7,4.99,152,11.99,NC-17,English
902,15,Sports,TRADING PINOCCHIO,A Emotional Character Study of a Student And a Explorer who must Discover a Frisbee in The First Manned Space Station,2006,1,,6,4.99,170,22.99,PG,English
631,15,Sports,NOVOCAINE FLIGHT,A Fanciful Display of a Student And a Teacher who must Outgun a Crocodile in Nigeria,2006,1,,4,0.99,64,11.99,G,English
10,15,Sports,ALADDIN CALENDAR,A Action-Packed Tale of a Man And a Lumberjack who must Reach a Feminist in Ancient China,2006,1,,6,4.99,63,24.99,NC-17,English
599,15,Sports,MOTHER OLEANDER,A Boring Tale of a Husband And a Boy who must Fight a Squirrel in Ancient China,2006,1,,3,0.99,103,20.99,R,English
667,15,Sports,PEACH INNOCENT,A Action-Packed Drama of a Monkey And a Dentist who must Chase a Butler in Berlin,2006,1,,3,2.99,160,20.99,PG-13,English
733,15,Sports,RIVER OUTLAW,A Thrilling Character Study of a Squirrel And a Lumberjack who must Face a Hunter in A MySQL Convention,2006,1,,4,0.99,149,29.99,PG-13,English
577,15,Sports,MILE MULAN,A Lacklusture Epistle of a Cat And a Husband who must Confront a Boy in A MySQL Convention,2006,1,,4,0.99,64,10.99,PG,English
488,15,Sports,JOON NORTHWEST,A Thrilling Panorama of a Technical Writer And a Car who must Discover a Forensic Psychologist in A Shark Tank,2006,1,,3,0.99,105,23.99,NC-17,English
517,15,Sports,LESSON CLEOPATRA,A Emotional Display of a Man And a Explorer who must Build a Boy in A Manhattan Penthouse,2006,1,,3,0.99,167,28.99,NC-17,English
898,15,Sports,TOURIST PELICAN,A Boring Story of a Butler And a Astronaut who must Outrace a Pioneer in Australia,2006,1,,4,4.99,152,18.99,PG-13,English
671,15,Sports,PERDITION FARGO,A Fast-Paced Story of a Car And a Cat who must Outgun a Hunter in Berlin,2006,1,,7,4.99,99,27.99,NC-17,English
453,15,Sports,IMAGE PRINCESS,A Lacklusture Panorama of a Secret Agent And a Crocodile who must Discover a Madman in The Canadian Rockies,2006,1,,3,2.99,178,17.99,PG-13,English
372,15,Sports,GRACELAND DYNAMITE,A Taut Display of a Cat And a Girl who must Overcome a Database Administrator in New Orleans,2006,1,,5,4.99,140,26.99,R,English
254,15,Sports,DRIVER ANNIE,A Lacklusture Character Study of a Butler And a Car who must Redeem a Boat in An Abandoned Fun House,2006,1,,4,2.99,159,11.99,PG-13,English
796,15,Sports,SIERRA DIVIDE,A Emotional Character Study of a Frisbee And a Mad Scientist who must Build a Madman in California,2006,1,,3,0.99,135,12.99,NC-17,English
851,15,Sports,STRAIGHT HOURS,A Boring Panorama of a Secret Agent And a Girl who must Sink a Waitress in The Outback,2006,1,,3,0.99,151,19.99,R,English
463,15,Sports,INSTINCT AIRPORT,A Touching Documentary of a Mad Cow And a Explorer who must Confront a Butler in A Manhattan Penthouse,2006,1,,4,2.99,116,21.99,PG,English
598,15,Sports,MOSQUITO ARMAGEDDON,A Thoughtful Character Study of a Waitress And a Feminist who must Build a Teacher in Ancient Japan,2006,1,,6,0.99,57,22.99,G,English
260,15,Sports,DUDE BLINDNESS,A Stunning Reflection of a Husband And a Lumberjack who must Face a Frisbee in An Abandoned Fun House,2006,1,,3,4.99,132,9.99,G,English
27,15,Sports,ANONYMOUS HUMAN,A Amazing Reflection of a Database Administrator And a Astronaut who must Outrace a Database Administrator in A Shark Tank,2006,1,,7,0.99,179,12.99,NC-17,English
836,15,Sports,SQUAD FISH,A Fast-Paced Display of a Pastry Chef And a Dog who must Kill a Teacher in Berlin,2006,1,,3,2.99,136,14.99,PG,English
42,15,Sports,ARTIST COLDBLOODED,A Stunning Reflection of a Robot And a Moose who must Challenge a Woman in California,2006,1,,5,2.99,170,10.99,NC-17,English
841,15,Sports,STAR OPERATION,A Insightful Character Study of a Girl And a Car who must Pursue a Mad Cow in A Shark Tank,2006,1,,5,2.99,181,9.99,PG,English
619,15,Sports,NEIGHBORS CHARADE,A Fanciful Reflection of a Crocodile And a Astronaut who must Outrace a Feminist in An Abandoned Amusement Park,2006,1,,3,0.99,161,20.99,R,English
519,15,Sports,LIBERTY MAGNIFICENT,A Boring Drama of a Student And a Cat who must Sink a Technical Writer in A Baloon,2006,1,,3,2.99,138,27.99,G,English
532,15,Sports,LOSER HUSTLER,A Stunning Drama of a Robot And a Feminist who must Outgun a Butler in Nigeria,2006,1,,5,4.99,80,28.99,PG,English
729,15,Sports,RIDER CADDYSHACK,A Taut Reflection of a Monkey And a Womanizer who must Chase a Moose in Nigeria,2006,1,,5,2.99,177,28.99,PG,English
293,15,Sports,EXORCIST STING,A Touching Drama of a Dog And a Sumo Wrestler who must Conquer a Mad Scientist in Berlin,2006,1,,6,2.99,167,17.99,G,English
628,15,Sports,NORTHWEST POLISH,A Boring Character Study of a Boy And a A Shark who must Outrace a Womanizer in The Outback,2006,1,,5,2.99,172,24.99,PG,English
237,15,Sports,DIVORCE SHINING,A Unbelieveable Saga of a Crocodile And a Student who must Discover a Cat in Ancient India,2006,1,,3,2.99,47,21.99,G,English
681,15,Sports,PIRATES ROXANNE,A Stunning Drama of a Woman And a Lumberjack who must Overcome a A Shark in The Canadian Rockies,2006,1,,4,0.99,100,20.99,PG,English
773,15,Sports,SEABISCUIT PUNK,A Insightful Saga of a Man And a Forensic Psychologist who must Discover a Mad Cow in A MySQL Convention,2006,1,,6,2.99,112,28.99,NC-17,English
764,15,Sports,SATURDAY LAMBS,A Thoughtful Reflection of a Mad Scientist And a Moose who must Kill a Husband in A Baloon,2006,1,,3,4.99,150,28.99,G,English
291,15,Sports,EVOLUTION ALTER,A Fanciful Character Study of a Feminist And a Madman who must Find a Explorer in A Baloon Factory,2006,1,,5,0.99,174,10.99,PG-13,English
809,15,Sports,SLIPPER FIDELITY,A Taut Reflection of a Secret Agent And a Man who must Redeem a Explorer in A MySQL Convention,2006,1,,5,0.99,156,14.99,PG-13,English
668,15,Sports,PEAK FOREVER,A Insightful Reflection of a Boat And a Secret Agent who must Vanquish a Astronaut in An Abandoned Mine Shaft,2006,1,,7,4.99,80,25.99,PG,English
503,15,Sports,KRAMER CHOCOLATE,A Amazing Yarn of a Robot And a Pastry Chef who must Redeem a Mad Scientist in The Outback,2006,1,,3,2.99,171,24.99,R,English
322,15,Sports,FLATLINERS KILLER,A Taut Display of a Secret Agent And a Waitress who must Sink a Robot in An Abandoned Mine Shaft,2006,1,,5,2.99,100,29.99,G,English
176,15,Sports,CONGENIALITY QUEST,A Touching Documentary of a Cat And a Pastry Chef who must Find a Lumberjack in A Baloon,2006,1,,6,0.99,87,21.99,PG-13,English
779,15,Sports,SENSE GREEK,A Taut Saga of a Lumberjack And a Pastry Chef who must Escape a Sumo Wrestler in An Abandoned Fun House,2006,1,,4,4.99,54,23.99,R,English
263,15,Sports,DURHAM PANKY,A Brilliant Panorama of a Girl And a Boy who must Face a Mad Scientist in An Abandoned Mine Shaft,2006,1,,6,4.99,154,14.99,R,English
691,15,Sports,POSEIDON FOREVER,A Thoughtful Epistle of a Womanizer And a Monkey who must Vanquish a Dentist in A Monastery,2006,1,,6,4.99,159,29.99,PG-13,English
429,15,Sports,HONEY TIES,A Taut Story of a Waitress And a Crocodile who must Outrace a Lumberjack in A Shark Tank,2006,1,,3,0.99,84,29.99,R,English
745,15,Sports,ROSES TREASURE,A Astounding Panorama of a Monkey And a Secret Agent who must Defeat a Woman in The First Manned Space Station,2006,1,,5,4.99,162,23.99,PG-13,English
606,15,Sports,MUMMY CREATURES,A Fateful Character Study of a Crocodile And a Monkey who must Meet a Dentist in Australia,2006,1,,3,0.99,160,15.99,NC-17,English
719,15,Sports,RECORDS ZORRO,A Amazing Drama of a Mad Scientist And a Composer who must Build a Husband in The Outback,2006,1,,7,4.99,182,11.99,PG,English
763,15,Sports,SATISFACTION CONFIDENTIAL,A Lacklusture Yarn of a Dentist And a Butler who must Meet a Secret Agent in Ancient China,2006,1,,3,4.99,75,26.99,G,English
187,15,Sports,CRANES RESERVOIR,A Fanciful Documentary of a Teacher And a Dog who must Outgun a Forensic Psychologist in A Baloon Factory,2006,1,,5,2.99,57,12.99,NC-17,English
940,15,Sports,VICTORY ACADEMY,A Insightful Epistle of a Mad Scientist And a Explorer who must Challenge a Cat in The Sahara Desert,2006,1,,6,0.99,64,19.99,PG-13,English
197,15,Sports,CRUSADE HONEY,A Fast-Paced Reflection of a Explorer And a Butler who must Battle a Madman in An Abandoned Amusement Park,2006,1,,4,2.99,112,27.99,R,English
420,15,Sports,HOLES BRANNIGAN,A Fast-Paced Reflection of a Technical Writer And a Student who must Fight a Boy in The Canadian Rockies,2006,1,,7,4.99,128,27.99,PG,English
323,15,Sports,FLIGHT LIES,A Stunning Character Study of a Crocodile And a Pioneer who must Pursue a Teacher in New Orleans,2006,1,,7,4.99,179,22.99,R,English
676,15,Sports,PHILADELPHIA WIFE,A Taut Yarn of a Hunter And a Astronaut who must Conquer a Database Administrator in The Sahara Desert,2006,1,,7,4.99,137,16.99,PG-13,English
383,15,Sports,GROOVE FICTION,A Unbelieveable Reflection of a Moose And a A Shark who must Defeat a Lumberjack in An Abandoned Mine Shaft,2006,1,,6,0.99,111,13.99,NC-17,English
120,15,Sports,CARIBBEAN LIBERTY,A Fanciful Tale of a Pioneer And a Technical Writer who must Outgun a Pioneer in A Shark Tank,2006,1,,3,4.99,92,16.99,NC-17,English
135,15,Sports,CHANCE RESURRECTION,A Astounding Story of a Forensic Psychologist And a Forensic Psychologist who must Overcome a Moose in Ancient China,2006,1,,3,2.99,70,22.99,R,English
813,15,Sports,SMOOCHY CONTROL,A Thrilling Documentary of a Husband And a Feminist who must Face a Mad Scientist in Ancient China,2006,1,,7,0.99,184,18.99,R,English
917,15,Sports,TUXEDO MILE,A Boring Drama of a Man And a Forensic Psychologist who must Face a Frisbee in Ancient India,2006,1,,3,2.99,152,24.99,R,English
102,15,Sports,BUBBLE GROSSE,A Awe-Inspiring Panorama of a Crocodile And a Moose who must Confront a Girl in A Baloon,2006,1,,4,4.99,60,20.99,R,English
474,15,Sports,JADE BUNCH,A Insightful Panorama of a Squirrel And a Mad Cow who must Confront a Student in The First Manned Space Station,2006,1,,6,2.99,174,21.99,NC-17,English
612,15,Sports,MUSSOLINI SPOILERS,A Thrilling Display of a Boat And a Monkey who must Meet a Composer in Ancient China,2006,1,,6,2.99,180,10.99,G,English
570,15,Sports,MERMAID INSECTS,A Lacklusture Drama of a Waitress And a Husband who must Fight a Husband in California,2006,1,,5,4.99,104,20.99,NC-17,English
844,15,Sports,STEERS ARMAGEDDON,A Stunning Character Study of a Car And a Girl who must Succumb a Car in A MySQL Convention,2006,1,,6,4.99,140,16.99,PG,English
361,15,Sports,GLEAMING JAWBREAKER,A Amazing Display of a Composer And a Forensic Psychologist who must Discover a Car in The Canadian Rockies,2006,1,,5,2.99,89,25.99,NC-17,English
678,15,Sports,PICKUP DRIVING,A Touching Documentary of a Husband And a Boat who must Meet a Pastry Chef in A Baloon Factory,2006,1,,3,2.99,77,23.99,G,English
786,3,Children,SHEPHERD MIDSUMMER,A Thoughtful Drama of a Robot And a Womanizer who must Kill a Lumberjack in A Baloon,2006,1,,7,0.99,113,14.99,R,English
896,3,Children,TOOTSIE PILOT,A Awe-Inspiring Documentary of a Womanizer And a Pastry Chef who must Kill a Lumberjack in Berlin,2006,1,,3,0.99,157,10.99,PG,English
304,3,Children,FARGO GANDHI,A Thrilling Reflection of a Pastry Chef And a Crocodile who must Reach a Teacher in The Outback,2006,1,,3,2.99,130,28.99,G,English
801,3,Children,SISTER FREDDY,A Stunning Saga of a Butler And a Woman who must Pursue a Explorer in Australia,2006,1,,5,4.99,152,19.99,PG-13,English
423,3,Children,HOLLYWOOD ANONYMOUS,A Fast-Paced Epistle of a Boy And a Explorer who must Escape a Dog in A U-Boat,2006,1,,7,0.99,69,29.99,PG,English
509,3,Children,LANGUAGE COWBOY,A Epic Yarn of a Cat And a Madman who must Vanquish a Dentist in An Abandoned Amusement Park,2006,1,,5,0.99,78,26.99,NC-17,English
999,3,Children,ZOOLANDER FICTION,A Fateful Reflection of a Waitress And a Boat who must Discover a Sumo Wrestler in Ancient China,2006,1,,5,2.99,101,28.99,R,English
955,3,Children,WALLS ARTIST,A Insightful Panorama of a Teacher And a Teacher who must Overcome a Mad Cow in An Abandoned Fun House,2006,1,,7,4.99,135,19.99,PG,English
157,3,Children,CLOCKWORK PARADISE,A Insightful Documentary of a Technical Writer And a Feminist who must Challenge a Cat in A Baloon,2006,1,,7,0.99,143,29.99,PG-13,English
761,3,Children,SANTA PARIS,A Emotional Documentary of a Moose And a Car who must Redeem a Mad Cow in A Baloon Factory,2006,1,,7,2.99,154,23.99,PG,English
735,3,Children,ROBBERS JOON,A Thoughtful Story of a Mad Scientist And a Waitress who must Confront a Forensic Psychologist in Soviet Georgia,2006,1,,7,2.99,102,26.99,PG-13,English
853,3,Children,STRANGER STRANGERS,A Awe-Inspiring Yarn of a Womanizer And a Explorer who must Fight a Woman in The First Manned Space Station,2006,1,,3,4.99,139,12.99,G,English
688,3,Children,POLISH BROOKLYN,A Boring Character Study of a Database Administrator And a Lumberjack who must Reach a Madman in The Outback,2006,1,,6,0.99,61,12.99,PG,English
354,3,Children,GHOST GROUNDHOG,A Brilliant Panorama of a Madman And a Composer who must Succumb a Car in Ancient India,2006,1,,6,4.99,85,18.99,G,English
124,3,Children,CASPER DRAGONFLY,A Intrepid Documentary of a Boat And a Crocodile who must Chase a Robot in The Sahara Desert,2006,1,,3,4.99,163,16.99,PG-13,English
833,3,Children,SPLENDOR PATTON,A Taut Story of a Dog And a Explorer who must Find a Astronaut in Berlin,2006,1,,5,0.99,134,20.99,R,English
450,3,Children,IDOLS SNATCHERS,A Insightful Drama of a Car And a Composer who must Fight a Man in A Monastery,2006,1,,5,2.99,84,29.99,NC-17,English
547,3,Children,MAGIC MALLRATS,A Touching Documentary of a Pastry Chef And a Pastry Chef who must Build a Mad Scientist in California,2006,1,,3,0.99,117,19.99,PG,English
626,3,Children,NOON PAPI,A Unbelieveable Character Study of a Mad Scientist And a Astronaut who must Find a Pioneer in A Manhattan Penthouse,2006,1,,5,2.99,57,12.99,G,English
343,3,Children,FULL FLATLINERS,A Beautiful Documentary of a Astronaut And a Moose who must Pursue a Monkey in A Shark Tank,2006,1,,6,2.99,94,14.99,PG,English
328,3,Children,FOREVER CANDIDATE,A Unbelieveable Panorama of a Technical Writer And a Man who must Pursue a Frisbee in A U-Boat,2006,1,,7,2.99,131,28.99,NC-17,English
409,3,Children,HEARTBREAKERS BRIGHT,A Awe-Inspiring Documentary of a A Shark And a Dentist who must Outrace a Pastry Chef in The Canadian Rockies,2006,1,,3,4.99,59,9.99,G,English
505,3,Children,LABYRINTH LEAGUE,A Awe-Inspiring Saga of a Composer And a Frisbee who must Succumb a Pioneer in The Sahara Desert,2006,1,,6,2.99,46,24.99,PG-13,English
873,3,Children,SWEETHEARTS SUSPECTS,A Brilliant Character Study of a Frisbee And a Sumo Wrestler who must Confront a Woman in The Gulf of Mexico,2006,1,,3,0.99,108,13.99,G,English
755,3,Children,SABRINA MIDNIGHT,A Emotional Story of a Squirrel And a Crocodile who must Succumb a Husband in The Sahara Desert,2006,1,,5,4.99,99,11.99,PG,English
191,3,Children,CROOKED FROGMEN,A Unbelieveable Drama of a Hunter And a Database Administrator who must Battle a Crocodile in An Abandoned Amusement Park,2006,1,,6,0.99,143,27.99,PG-13,English
608,3,Children,MURDER ANTITRUST,A Brilliant Yarn of a Car And a Database Administrator who must Escape a Boy in A MySQL Convention,2006,1,,6,2.99,166,11.99,PG,English
344,3,Children,FURY MURDER,A Lacklusture Reflection of a Boat And a Forensic Psychologist who must Fight a Waitress in A Monastery,2006,1,,3,0.99,178,28.99,PG-13,English
889,3,Children,TIES HUNGER,A Insightful Saga of a Astronaut And a Explorer who must Pursue a Mad Scientist in A U-Boat,2006,1,,3,4.99,111,28.99,R,English
66,3,Children,BENEATH RUSH,A Astounding Panorama of a Man And a Monkey who must Discover a Man in The First Manned Space Station,2006,1,,6,0.99,53,27.99,NC-17,English
238,3,Children,DOCTOR GRAIL,A Insightful Drama of a Womanizer And a Waitress who must Reach a Forensic Psychologist in The Outback,2006,1,,4,2.99,57,29.99,G,English
59,3,Children,BEAR GRACELAND,A Astounding Saga of a Dog And a Boy who must Kill a Teacher in The First Manned Space Station,2006,1,,4,2.99,160,20.99,R,English
491,3,Children,JUMPING WRATH,A Touching Epistle of a Monkey And a Feminist who must Discover a Boat in Berlin,2006,1,,4,0.99,74,18.99,NC-17,English
214,3,Children,DAUGHTER MADIGAN,A Beautiful Tale of a Hunter And a Mad Scientist who must Confront a Squirrel in The First Manned Space Station,2006,1,,3,4.99,59,13.99,PG-13,English
110,3,Children,CABIN FLASH,A Stunning Epistle of a Boat And a Man who must Challenge a A Shark in A Baloon Factory,2006,1,,4,0.99,53,25.99,NC-17,English
588,3,Children,MODEL FISH,A Beautiful Panorama of a Boat And a Crocodile who must Outrace a Dog in Australia,2006,1,,4,4.99,175,11.99,NC-17,English
424,3,Children,HOLOCAUST HIGHBALL,A Awe-Inspiring Yarn of a Composer And a Man who must Find a Robot in Soviet Georgia,2006,1,,6,0.99,149,12.99,R,English
515,3,Children,LEGALLY SECRETARY,A Astounding Tale of a A Shark And a Moose who must Meet a Womanizer in The Sahara Desert,2006,1,,7,4.99,113,14.99,PG,English
928,3,Children,UPTOWN YOUNG,A Fateful Documentary of a Dog And a Hunter who must Pursue a Teacher in An Abandoned Amusement Park,2006,1,,5,2.99,84,16.99,PG,English
152,3,Children,CIRCUS YOUTH,A Thoughtful Drama of a Pastry Chef And a Dentist who must Pursue a Girl in A Baloon,2006,1,,5,2.99,90,13.99,PG-13,English
149,3,Children,CHRISTMAS MOONSHINE,A Action-Packed Epistle of a Feminist And a Astronaut who must Conquer a Boat in A Manhattan Penthouse,2006,1,,7,0.99,150,21.99,NC-17,English
280,3,Children,EMPIRE MALKOVICH,A Amazing Story of a Feminist And a Cat who must Face a Car in An Abandoned Fun House,2006,1,,7,0.99,177,26.99,G,English
883,3,Children,TEQUILA PAST,A Action-Packed Panorama of a Mad Scientist And a Robot who must Challenge a Student in Nigeria,2006,1,,6,4.99,53,17.99,PG,English
468,3,Children,INVASION CYCLONE,A Lacklusture Character Study of a Mad Scientist And a Womanizer who must Outrace a Explorer in A Monastery,2006,1,,5,2.99,97,12.99,PG,English
553,3,Children,MAKER GABLES,A Stunning Display of a Moose And a Database Administrator who must Pursue a Composer in A Jet Boat,2006,1,,4,0.99,136,12.99,PG-13,English
768,3,Children,SCARFACE BANG,A Emotional Yarn of a Teacher And a Girl who must Find a Teacher in A Baloon Factory,2006,1,,3,4.99,102,11.99,PG-13,English
993,3,Children,WRONG BEHAVIOR,A Emotional Saga of a Crocodile And a Sumo Wrestler who must Discover a Mad Cow in New Orleans,2006,1,,6,2.99,178,10.99,PG-13,English
485,3,Children,JERSEY SASSY,A Lacklusture Documentary of a Madman And a Mad Cow who must Find a Feminist in Ancient Japan,2006,1,,6,4.99,60,16.99,PG,English
573,3,Children,MICROCOSMOS PARADISE,A Touching Character Study of a Boat And a Student who must Sink a A Shark in Nigeria,2006,1,,6,2.99,105,22.99,PG-13,English
168,3,Children,COMANCHEROS ENEMY,A Boring Saga of a Lumberjack And a Monkey who must Find a Monkey in The Gulf of Mexico,2006,1,,5,0.99,67,23.99,R,English
68,3,Children,BETRAYED REAR,A Emotional Character Study of a Boat And a Pioneer who must Find a Explorer in A Shark Tank,2006,1,,5,4.99,122,26.99,NC-17,English
959,3,Children,WARLOCK WEREWOLF,A Astounding Yarn of a Pioneer And a Crocodile who must Defeat a A Shark in The Outback,2006,1,,6,2.99,83,10.99,G,English
392,3,Children,HALL CASSIDY,A Beautiful Panorama of a Pastry Chef And a A Shark who must Battle a Pioneer in Soviet Georgia,2006,1,,5,4.99,51,13.99,NC-17,English
356,3,Children,GIANT TROOPERS,A Fateful Display of a Feminist And a Monkey who must Vanquish a Monkey in The Canadian Rockies,2006,1,,5,2.99,102,10.99,R,English
373,3,Children,GRADUATE LORD,A Lacklusture Epistle of a Girl And a A Shark who must Meet a Mad Scientist in Ancient China,2006,1,,7,2.99,156,14.99,G,English
48,3,Children,BACKLASH UNDEFEATED,A Stunning Character Study of a Mad Scientist And a Mad Cow who must Kill a Car in A Monastery,2006,1,,3,4.99,118,24.99,PG-13,English
370,3,Children,GORGEOUS BINGO,A Action-Packed Display of a Sumo Wrestler And a Car who must Overcome a Waitress in A Baloon Factory,2006,1,,4,2.99,108,26.99,R,English
918,3,Children,TWISTED PIRATES,A Touching Display of a Frisbee And a Boat who must Kill a Girl in A MySQL Convention,2006,1,,4,4.99,152,23.99,PG,English
864,3,Children,SUNDANCE INVASION,A Epic Drama of a Lumberjack And a Explorer who must Confront a Hunter in A Baloon Factory,2006,1,,5,0.99,92,21.99,NC-17,English
852,3,Children,STRANGELOVE DESIRE,A Awe-Inspiring Panorama of a Lumberjack And a Waitress who must Defeat a Crocodile in An Abandoned Amusement Park,2006,1,,4,0.99,103,27.99,NC-17,English
585,7,Drama,MOB DUFFEL,A Unbelieveable Documentary of a Frisbee And a Boat who must Meet a Boy in The Canadian Rockies,2006,1,,4,0.99,105,25.99,G,English
942,7,Drama,VIETNAM SMOOCHY,A Lacklusture Display of a Butler And a Man who must Sink a Explorer in Soviet Georgia,2006,1,,7,0.99,174,27.99,PG-13,English
882,7,Drama,TENENBAUMS COMMAND,A Taut Display of a Pioneer And a Man who must Reach a Girl in The Gulf of Mexico,2006,1,,4,0.99,99,24.99,PG-13,English
396,7,Drama,HANGING DEEP,A Action-Packed Yarn of a Boat And a Crocodile who must Build a Monkey in Berlin,2006,1,,5,4.99,62,18.99,G,English
368,7,Drama,GONE TROUBLE,A Insightful Character Study of a Mad Cow And a Forensic Psychologist who must Conquer a A Shark in A Manhattan Penthouse,2006,1,,7,2.99,84,20.99,R,English
107,7,Drama,BUNCH MINDS,A Emotional Story of a Feminist And a Feminist who must Escape a Pastry Chef in A MySQL Convention,2006,1,,4,2.99,63,13.99,G,English
771,7,Drama,SCORPION APOLLO,A Awe-Inspiring Documentary of a Technical Writer And a Husband who must Meet a Monkey in An Abandoned Fun House,2006,1,,3,4.99,137,23.99,NC-17,English
33,7,Drama,APOLLO TEEN,A Action-Packed Reflection of a Crocodile And a Explorer who must Find a Sumo Wrestler in An Abandoned Mine Shaft,2006,1,,5,2.99,153,15.99,PG-13,English
706,7,Drama,QUEEN LUKE,A Astounding Story of a Girl And a Boy who must Challenge a Composer in New Orleans,2006,1,,5,4.99,163,22.99,PG,English
923,7,Drama,UNFAITHFUL KILL,A Taut Documentary of a Waitress And a Mad Scientist who must Battle a Technical Writer in New Orleans,2006,1,,7,2.99,78,12.99,R,English
61,7,Drama,BEAUTY GREASE,A Fast-Paced Display of a Composer And a Moose who must Sink a Robot in An Abandoned Mine Shaft,2006,1,,5,4.99,175,28.99,G,English
209,7,Drama,DARKNESS WAR,A Touching Documentary of a Husband And a Hunter who must Escape a Boy in The Sahara Desert,2006,1,,6,2.99,99,24.99,NC-17,English
173,7,Drama,CONFESSIONS MAGUIRE,A Insightful Story of a Car And a Boy who must Battle a Technical Writer in A Baloon,2006,1,,7,4.99,65,25.99,PG-13,English
758,7,Drama,SAINTS BRIDE,A Fateful Tale of a Technical Writer And a Composer who must Pursue a Explorer in The Gulf of Mexico,2006,1,,5,2.99,125,11.99,G,English
146,7,Drama,CHITTY LOCK,A Boring Epistle of a Boat And a Database Administrator who must Kill a Sumo Wrestler in The First Manned Space Station,2006,1,,6,2.99,107,24.99,G,English
179,7,Drama,CONQUERER NUTS,A Taut Drama of a Mad Scientist And a Man who must Escape a Pioneer in An Abandoned Mine Shaft,2006,1,,4,4.99,173,14.99,G,English
98,7,Drama,BRIGHT ENCOUNTERS,A Fateful Yarn of a Lumberjack And a Feminist who must Conquer a Student in A Jet Boat,2006,1,,4,4.99,73,12.99,PG-13,English
683,7,Drama,PITY BOUND,A Boring Panorama of a Feminist And a Moose who must Defeat a Database Administrator in Nigeria,2006,1,,5,4.99,60,19.99,NC-17,English
439,7,Drama,HUNCHBACK IMPOSSIBLE,A Touching Yarn of a Frisbee And a Dentist who must Fight a Composer in Ancient Japan,2006,1,,4,4.99,151,28.99,PG-13,English
204,7,Drama,DALMATIONS SWEDEN,A Emotional Epistle of a Moose And a Hunter who must Overcome a Robot in A Manhattan Penthouse,2006,1,,4,0.99,106,25.99,PG,English
979,7,Drama,WITCHES PANIC,A Awe-Inspiring Drama of a Secret Agent And a Hunter who must Fight a Moose in Nigeria,2006,1,,6,4.99,100,10.99,NC-17,English
766,7,Drama,SAVANNAH TOWN,A Awe-Inspiring Tale of a Astronaut And a Database Administrator who must Chase a Secret Agent in The Gulf of Mexico,2006,1,,5,0.99,84,25.99,PG-13,English
64,7,Drama,BEETHOVEN EXORCIST,A Epic Display of a Pioneer And a Student who must Challenge a Butler in The Gulf of Mexico,2006,1,,6,0.99,151,26.99,PG-13,English
473,7,Drama,JACKET FRISCO,A Insightful Reflection of a Womanizer And a Husband who must Conquer a Pastry Chef in A Baloon,2006,1,,5,2.99,181,16.99,PG-13,English
230,7,Drama,DIARY PANIC,A Thoughtful Character Study of a Frisbee And a Mad Cow who must Outgun a Man in Ancient India,2006,1,,7,2.99,107,20.99,G,English
401,7,Drama,HAROLD FRENCH,A Stunning Saga of a Sumo Wrestler And a Student who must Outrace a Moose in The Sahara Desert,2006,1,,6,0.99,168,10.99,NC-17,English
272,7,Drama,EDGE KISSING,A Beautiful Yarn of a Composer And a Mad Cow who must Redeem a Mad Scientist in A Jet Boat,2006,1,,5,4.99,153,9.99,NC-17,English
772,7,Drama,SEA VIRGIN,A Fast-Paced Documentary of a Technical Writer And a Pastry Chef who must Escape a Moose in A U-Boat,2006,1,,4,2.99,80,24.99,PG,English
618,7,Drama,NECKLACE OUTBREAK,A Astounding Epistle of a Database Administrator And a Mad Scientist who must Pursue a Cat in California,2006,1,,3,0.99,132,21.99,PG,English
818,7,Drama,SOMETHING DUCK,A Boring Character Study of a Car And a Husband who must Outgun a Frisbee in The First Manned Space Station,2006,1,,4,4.99,180,17.99,NC-17,English
907,7,Drama,TRANSLATION SUMMER,A Touching Reflection of a Man And a Monkey who must Pursue a Womanizer in A MySQL Convention,2006,1,,4,0.99,168,10.99,PG-13,English
827,7,Drama,SPICE SORORITY,A Fateful Display of a Pioneer And a Hunter who must Defeat a Husband in An Abandoned Mine Shaft,2006,1,,5,4.99,141,22.99,NC-17,English
79,7,Drama,BLADE POLISH,A Thoughtful Character Study of a Frisbee And a Pastry Chef who must Fight a Dentist in The First Manned Space Station,2006,1,,5,0.99,114,10.99,PG-13,English
