film_id,category_id,category_name,title,description,release_year,language_id,original_language_id,rental_duration,rental_rate,length,replacement_cost,rating,language
261,6,Documentary,DUFFEL APOCALYPSE,A Emotional Display of a Boat And a Explorer who must Challenge a Madman in A MySQL Convention,2006,1,,5,0.99,171,13.99,G,English
589,6,Documentary,MODERN DORADO,A Awe-Inspiring Story of a Butler And a Sumo Wrestler who must Redeem a Boy in New Orleans,2006,1,,3,0.99,74,20.99,PG,English
776,6,Documentary,SECRET GROUNDHOG,A Astounding Story of a Cat And a Database Administrator who must Build a Technical Writer in New Orleans,2006,1,,6,4.99,90,11.99,PG,English
788,6,Documentary,SHIP WONDERLAND,A Thrilling Saga of a Monkey And a Frisbee who must Escape a Explorer in The Outback,2006,1,,5,2.99,104,15.99,R,English
274,6,Documentary,EGG IGBY,A Beautiful Documentary of a Boat And a Sumo Wrestler who must Succumb a Database Administrator in The First Manned Space Station,2006,1,,4,2.99,67,20.99,PG,English
206,6,Documentary,DANCING FEVER,A Stunning Story of a Explorer And a Forensic Psychologist who must Face a Crocodile in A Shark Tank,2006,1,,6,0.99,144,25.99,G,English
221,6,Documentary,DELIVERANCE MULHOLLAND,A Astounding Saga of a Monkey And a Moose who must Conquer a Butler in A Shark Tank,2006,1,,4,0.99,100,9.99,R,English
698,6,Documentary,PRINCESS GIANT,A Thrilling Yarn of a Pastry Chef And a Monkey who must Battle a Monkey in A Shark Tank,2006,1,,3,2.99,71,29.99,NC-17,English
622,6,Documentary,NEWSIES STORY,A Action-Packed Character Study of a Dog And a Lumberjack who must Outrace a Moose in The Gulf of Mexico,2006,1,,4,0.99,159,25.99,G,English
791,6,Documentary,SHOW LORD,A Fanciful Saga of a Student And a Girl who must Find a Butler in Ancient Japan,2006,1,,3,4.99,167,24.99,PG-13,English
497,6,Documentary,KILL BROTHERHOOD,A Touching Display of a Hunter And a Secret Agent who must Redeem a Husband in The Outback,2006,1,,4,0.99,54,15.99,G,English
629,6,Documentary,NOTORIOUS REUNION,A Amazing Epistle of a Woman And a Squirrel who must Fight a Hunter in A Baloon,2006,1,,7,0.99,128,9.99,NC-17,English
3,6,Documentary,ADAPTATION HOLES,A Astounding Reflection of a Lumberjack And a Car who must Sink a Lumberjack in A Baloon Factory,2006,1,,7,2.99,50,18.99,NC-17,English
587,6,Documentary,MOD SECRETARY,A Boring Documentary of a Mad Cow And a Cat who must Build a Lumberjack in New Orleans,2006,1,,6,4.99,77,20.99,NC-17,English
466,6,Documentary,INTOLERABLE INTENTIONS,A Awe-Inspiring Story of a Monkey And a Pastry Chef who must Succumb a Womanizer in A MySQL Convention,2006,1,,6,4.99,63,20.99,PG-13,English
85,6,Documentary,BONNIE HOLOCAUST,A Fast-Paced Story of a Crocodile And a Robot who must Find a Moose in Ancient Japan,2006,1,,4,0.99,63,29.99,G,English
457,6,Documentary,INDEPENDENCE HOTEL,A Thrilling Tale of a Technical Writer And a Boy who must Face a Pioneer in A Monastery,2006,1,,5,0.99,157,21.99,NC-17,English
544,6,Documentary,MADISON TRAP,A Awe-Inspiring Reflection of a Monkey And a Dentist who must Overcome a Pioneer in A U-Boat,2006,1,,4,2.99,147,11.99,R,English
576,6,Documentary,MIGHTY LUCK,A Astounding Epistle of a Mad Scientist And a Pioneer who must Escape a Database Administrator in A MySQL Convention,2006,1,,7,2.99,122,13.99,PG,English
219,6,Documentary,DEEP CRUSADE,A Amazing Tale of a Crocodile And a Squirrel who must Discover a Composer in Australia,2006,1,,6,4.99,51,20.99,PG-13,English
407,6,Documentary,HAWK CHILL,A Action-Packed Drama of a Mad Scientist And a Composer who must Outgun a Car in Australia,2006,1,,5,0.99,47,12.99,PG-13,English
441,6,Documentary,HUNTER ALTER,A Emotional Drama of a Mad Cow And a Boat who must Redeem a Secret Agent in A Shark Tank,2006,1,,5,2.99,125,21.99,PG-13,English
295,6,Documentary,EXPENDABLE STALLION,A Amazing Character Study of a Mad Cow And a Squirrel who must Discover a Hunter in A U-Boat,2006,1,,3,0.99,97,14.99,PG,English
834,6,Documentary,SPOILERS HELLFIGHTERS,A Fanciful Story of a Technical Writer And a Squirrel who must Defeat a Dog in The Gulf of Mexico,2006,1,,4,0.99,151,26.99,G,English
952,6,Documentary,WAGON JAWS,A Intrepid Drama of a Moose And a Boat who must Kill a Explorer in A Manhattan Penthouse,2006,1,,7,2.99,152,17.99,PG,English
129,6,Documentary,CAUSE DATE,A Taut Tale of a Explorer And a Pastry Chef who must Conquer a Hunter in A MySQL Convention,2006,1,,3,2.99,179,16.99,R,English
336,6,Documentary,FRENCH HOLIDAY,A Thrilling Epistle of a Dog And a Feminist who must Kill a Madman in Berlin,2006,1,,5,4.99,99,22.99,PG,English
966,6,Documentary,WEDDING APOLLO,A Action-Packed Tale of a Student And a Waitress who must Conquer a Lumberjack in An Abandoned Mine Shaft,2006,1,,3,0.99,70,14.99,PG,English
973,6,Documentary,WIFE TURN,A Awe-Inspiring Epistle of a Teacher And a Feminist who must Confront a Pioneer in Ancient Japan,2006,1,,3,4.99,183,27.99,NC-17,English
199,6,Documentary,CUPBOARD SINNERS,A Emotional Reflection of a Frisbee And a Boat who must Reach a Pastry Chef in An Abandoned Amusement Park,2006,1,,4,2.99,56,29.99,R,English
757,6,Documentary,SAGEBRUSH CLUELESS,A Insightful Story of a Lumberjack And a Hunter who must Kill a Boy in Ancient Japan,2006,1,,4,2.99,106,28.99,G,English
945,6,Documentary,VIRGINIAN PLUTO,A Emotional Panorama of a Dentist And a Crocodile who must Meet a Boy in Berlin,2006,1,,5,0.99,164,22.99,R,English
708,6,Documentary,QUILLS BULL,A Thoughtful Story of a Pioneer And a Woman who must Reach a Moose in Australia,2006,1,,4,4.99,112,19.99,R,English
713,6,Documentary,RAINBOW SHOCK,A Action-Packed Story of a Hunter And a Boy who must Discover a Lumberjack in Ancient India,2006,1,,3,4.99,74,14.99,PG,English
996,6,Documentary,YOUNG LANGUAGE,A Unbelieveable Yarn of a Boat And a Database Administrator who must Meet a Boy in The First Manned Space Station,2006,1,,6,0.99,183,9.99,G,English
925,6,Documentary,UNITED PILOT,A Fast-Paced Reflection of a Cat And a Mad Cow who must Fight a Car in The Sahara Desert,2006,1,,3,0.99,164,27.99,R,English
960,6,Documentary,WARS PLUTO,A Taut Reflection of a Teacher And a Database Administrator who must Chase a Madman in The Sahara Desert,2006,1,,5,2.99,128,15.99,G,English
670,6,Documentary,PELICAN COMFORTS,A Epic Documentary of a Boy And a Monkey who must Pursue a Astronaut in Berlin,2006,1,,4,4.99,48,17.99,PG,English
412,6,Documentary,HEAVYWEIGHTS BEAST,A Unbelieveable Story of a Composer And a Dog who must Overcome a Womanizer in An Abandoned Amusement Park,2006,1,,6,4.99,102,25.99,G,English
812,6,Documentary,SMOKING BARBARELLA,A Lacklusture Saga of a Mad Cow And a Mad Scientist who must Sink a Cat in A MySQL Convention,2006,1,,7,0.99,50,13.99,PG-13,English
62,6,Documentary,BED HIGHBALL,A Astounding Panorama of a Lumberjack And a Dog who must Redeem a Woman in An Abandoned Fun House,2006,1,,5,2.99,106,23.99,NC-17,English
150,6,Documentary,CIDER DESIRE,A Stunning Character Study of a Composer And a Mad Cow who must Succumb a Cat in Soviet Georgia,2006,1,,7,2.99,101,9.99,PG,English
650,6,Documentary,PACIFIC AMISTAD,A Thrilling Yarn of a Dog And a Moose who must Kill a Pastry Chef in A Manhattan Penthouse,2006,1,,3,0.99,144,27.99,G,English
58,6,Documentary,BEACH HEARTBREAKERS,A Fateful Display of a Womanizer And a Mad Scientist who must Outgun a A Shark in Soviet Georgia,2006,1,,6,2.99,122,16.99,G,English
1,6,Documentary,ACADEMY DINOSAUR,A Epic Drama of a Feminist And a Mad Scientist who must Battle a Teacher in The Canadian Rockies,2006,1,,6,0.99,86,20.99,PG,English
616,6,Documentary,NATIONAL STORY,A Taut Epistle of a Mad Scientist And a Girl who must Escape a Monkey in California,2006,1,,4,2.99,92,19.99,NC-17,English
926,6,Documentary,UNTOUCHABLES SUNRISE,A Amazing Documentary of a Woman And a Astronaut who must Outrace a Teacher in An Abandoned Fun House,2006,1,,5,2.99,120,11.99,NC-17,English
248,6,Documentary,DOZEN LION,A Taut Drama of a Cat And a Girl who must Defeat a Frisbee in The Canadian Rockies,2006,1,,6,4.99,177,20.99,NC-17,English
552,6,Documentary,MAJESTIC FLOATS,A Thrilling Character Study of a Moose And a Student who must Escape a Butler in The First Manned Space Station,2006,1,,5,0.99,130,15.99,PG,English
992,6,Documentary,WRATH MILE,A Intrepid Reflection of a Technical Writer And a Hunter who must Defeat a Sumo Wrestler in A Monastery,2006,1,,5,0.99,176,17.99,NC-17,English
575,6,Documentary,MIDSUMMER GROUNDHOG,A Fateful Panorama of a Moose And a Dog who must Chase a Crocodile in Ancient Japan,2006,1,,3,4.99,48,27.99,G,English
627,6,Documentary,NORTH TEQUILA,A Beautiful Character Study of a Mad Cow And a Robot who must Reach a Womanizer in New Orleans,2006,1,,4,4.99,67,9.99,NC-17,English
142,6,Documentary,CHICKEN HELLFIGHTERS,A Emotional Drama of a Dog And a Explorer who must Outrace a Technical Writer in Australia,2006,1,,3,0.99,122,24.99,PG,English
687,6,Documentary,POCUS PULP,A Intrepid Yarn of a Frisbee And a Dog who must Build a Astronaut in A Baloon Factory,2006,1,,6,0.99,138,15.99,NC-17,English
156,6,Documentary,CLERKS ANGELS,A Thrilling Display of a Sumo Wrestler And a Girl who must Confront a Man in A Baloon,2006,1,,3,4.99,164,15.99,G,English
712,6,Documentary,RAIDERS ANTITRUST,A Amazing Drama of a Teacher And a Feminist who must Meet a Woman in The First Manned Space Station,2006,1,,4,0.99,82,11.99,PG-13,English
571,6,Documentary,METAL ARMAGEDDON,A Thrilling Display of a Lumberjack And a Crocodile who must Meet a Monkey in A Baloon Factory,2006,1,,6,2.99,161,26.99,PG-13,English
427,6,Documentary,HOMEWARD CIDER,A Taut Reflection of a Astronaut And a Squirrel who must Fight a Squirrel in A Manhattan Penthouse,2006,1,,5,0.99,103,19.99,R,English
393,6,Documentary,HALLOWEEN NUTS,A Amazing Panorama of a Forensic Psychologist And a Technical Writer who must Fight a Dentist in A U-Boat,2006,1,,6,2.99,47,19.99,PG-13,English
40,6,Documentary,ARMY FLINTSTONES,A Boring Saga of a Database Administrator And a Womanizer who must Battle a Waitress in Nigeria,2006,1,,4,0.99,148,22.99,R,English
943,6,Documentary,VILLAIN DESPERATE,A Boring Yarn of a Pioneer And a Feminist who must Redeem a Cat in An Abandoned Amusement Park,2006,1,,4,4.99,76,27.99,PG-13,English
888,6,Documentary,THIN SAGEBRUSH,A Emotional Drama of a Husband And a Lumberjack who must Build a Cat in Ancient India,2006,1,,5,4.99,53,9.99,PG-13,English
164,6,Documentary,COAST RAINBOW,A Astounding Documentary of a Mad Cow And a Pioneer who must Challenge a Butler in The Sahara Desert,2006,1,,4,0.99,55,20.99,PG,English
400,6,Documentary,HARDLY ROBBERS,A Emotional Character Study of a Hunter And a Car who must Kill a Woman in Berlin,2006,1,,7,2.99,72,15.99,R,English
734,6,Documentary,ROAD ROXANNE,A Boring Character Study of a Waitress And a Astronaut who must Fight a Crocodile in Ancient Japan,2006,1,,4,4.99,158,12.99,R,English
72,6,Documentary,BILL OTHERS,A Stunning Saga of a Mad Scientist And a Forensic Psychologist who must Challenge a Squirrel in A MySQL Convention,2006,1,,6,2.99,93,12.99,PG,English
855,6,Documentary,STREAK RIDGEMONT,A Astounding Character Study of a Hunter And a Waitress who must Sink a Man in New Orleans,2006,1,,7,0.99,132,28.99,PG-13,English
101,6,Documentary,BROTHERHOOD BLANKET,A Fateful Character Study of a Butler And a Technical Writer who must Sink a Astronaut in Ancient Japan,2006,1,,3,0.99,73,26.99,R,English
737,11,Horror,ROCK INSTINCT,A Astounding Character Study of a Robot And a Moose who must Overcome a Astronaut in Ancient India,2006,1,,4,0.99,102,28.99,G,English
9,11,Horror,ALABAMA DEVIL,A Thoughtful Panorama of a Database Administrator And a Mad Scientist who must Outgun a Mad Scientist in A Jet Boat,2006,1,,3,2.99,114,21.99,PG-13,English
494,11,Horror,KARATE MOON,A Astounding Yarn of a Womanizer And a Dog who must Reach a Waitress in A MySQL Convention,2006,1,,4,0.99,120,21.99,PG-13,English
506,11,Horror,LADY STAGE,A Beautiful Character Study of a Woman And a Man who must Pursue a Explorer in A U-Boat,2006,1,,4,4.99,67,14.99,PG,English
171,11,Horror,COMMANDMENTS EXPRESS,A Fanciful Saga of a Student And a Mad Scientist who must Battle a Hunter in An Abandoned Mine Shaft,2006,1,,6,4.99,59,13.99,R,English
313,11,Horror,FIDELITY DEVIL,A Awe-Inspiring Drama of a Technical Writer And a Composer who must Reach a Pastry Chef in A U-Boat,2006,1,,5,4.99,118,11.99,G,English
275,11,Horror,EGYPT TENENBAUMS,A Intrepid Story of a Madman And a Secret Agent who must Outrace a Astronaut in An Abandoned Amusement Park,2006,1,,3,0.99,85,11.99,PG,English
8,11,Horror,AIRPORT POLLOCK,A Epic Tale of a Moose And a Girl who must Confront a Monkey in Ancient India,2006,1,,6,4.99,54,15.99,R,English
881,11,Horror,TEMPLE ATTRACTION,A Action-Packed Saga of a Forensic Psychologist And a Woman who must Battle a Womanizer in Soviet Georgia,2006,1,,5,4.99,71,13.99,PG,English
92,11,Horror,BOWFINGER GABLES,A Fast-Paced Yarn of a Waitress And a Composer who must Outgun a Dentist in California,2006,1,,7,4.99,72,19.99,NC-17,English
475,11,Horror,JAPANESE RUN,A Awe-Inspiring Epistle of a Feminist And a Girl who must Sink a Girl in The Outback,2006,1,,6,0.99,135,29.99,G,English
876,11,Horror,TARZAN VIDEOTAPE,A Fast-Paced Display of a Lumberjack And a Mad Scientist who must Succumb a Sumo Wrestler in The Sahara Desert,2006,1,,3,2.99,91,11.99,PG-13,English
34,11,Horror,ARABIA DOGMA,A Touching Epistle of a Madman And a Mad Cow who must Defeat a Student in Nigeria,2006,1,,6,0.99,62,29.99,NC-17,English
665,11,Horror,PATTON INTERVIEW,A Thrilling Documentary of a Composer And a Secret Agent who must Succumb a Cat in Berlin,2006,1,,4,2.99,175,22.99,PG,English
415,11,Horror,HIGH ENCINO,A Fateful Saga of a Waitress And a Hunter who must Outrace a Sumo Wrestler in Australia,2006,1,,3,2.99,84,23.99,R,English
716,11,Horror,REAP UNFAITHFUL,A Thrilling Epistle of a Composer And a Sumo Wrestler who must Challenge a Mad Cow in A MySQL Convention,2006,1,,6,2.99,136,26.99,PG-13,English
334,11,Horror,FREDDY STORM,A Intrepid Saga of a Man And a Lumberjack who must Vanquish a Husband in The Outback,2006,1,,6,4.99,65,21.99,NC-17,English
904,11,Horror,TRAIN BUNCH,A Thrilling Character Study of a Robot And a Squirrel who must Face a Dog in Ancient India,2006,1,,3,4.99,71,26.99,R,English
965,11,Horror,WATERSHIP FRONTIER,A Emotional Yarn of a Boat And a Crocodile who must Meet a Moose in Soviet Georgia,2006,1,,6,0.99,112,28.99,G,English
870,11,Horror,SWARM GOLD,A Insightful Panorama of a Crocodile And a Boat who must Conquer a Sumo Wrestler in A MySQL Convention,2006,1,,4,0.99,123,12.99,PG-13,English
24,11,Horror,ANALYZE HOOSIERS,A Thoughtful Display of a Explorer And a Pastry Chef who must Overcome a Feminist in The Sahara Desert,2006,1,,6,2.99,181,19.99,R,English
527,11,Horror,LOLA AGENT,A Astounding Tale of a Mad Scientist And a Husband who must Redeem a Database Administrator in Ancient Japan,2006,1,,4,4.99,85,24.99,PG,English
65,11,Horror,BEHAVIOR RUNAWAY,A Unbelieveable Drama of a Student And a Husband who must Outrace a Sumo Wrestler in Berlin,2006,1,,3,4.99,100,20.99,PG,English
998,11,Horror,ZHIVAGO CORE,A Fateful Yarn of a Composer And a Man who must Face a Boy in The Canadian Rockies,2006,1,,6,0.99,105,10.99,NC-17,English
830,11,Horror,SPIRIT FLINTSTONES,A Brilliant Yarn of a Cat And a Car who must Confront a Explorer in Ancient Japan,2006,1,,7,0.99,149,23.99,R,English
995,11,Horror,YENTL IDAHO,A Amazing Display of a Robot And a Astronaut who must Fight a Womanizer in Berlin,2006,1,,5,4.99,86,11.99,R,English
804,11,Horror,SLEEPING SUSPECTS,A Stunning Reflection of a Sumo Wrestler And a Explorer who must Sink a Frisbee in A MySQL Convention,2006,1,,7,4.99,129,13.99,PG-13,English
351,11,Horror,GASLIGHT CRUSADE,A Amazing Epistle of a Boy And a Astronaut who must Redeem a Man in The Gulf of Mexico,2006,1,,4,2.99,106,10.99,PG,English
122,11,Horror,CARRIE BUNCH,A Amazing Epistle of a Student And a Astronaut who must Discover a Frisbee in The Canadian Rockies,2006,1,,7,0.99,114,11.99,PG,English
856,11,Horror,STREETCAR INTENTIONS,A Insightful Character Study of a Waitress And a Crocodile who must Sink a Waitress in The Gulf of Mexico,2006,1,,5,4.99,73,11.99,R,English
740,11,Horror,ROLLERCOASTER BRINGING,A Beautiful Drama of a Robot And a Lumberjack who must Discover a Technical Writer in A Shark Tank,2006,1,,5,2.99,153,13.99,PG-13,English
658,11,Horror,PARIS WEEKEND,A Intrepid Story of a Squirrel And a Crocodile who must Defeat a Monkey in The Outback,2006,1,,7,2.99,121,19.99,PG-13,English
800,11,Horror,SINNERS ATLANTIS,A Epic Display of a Dog And a Boat who must Succumb a Mad Scientist in An Abandoned Mine Shaft,2006,1,,7,2.99,126,19.99,PG-13,English
35,11,Horror,ARACHNOPHOBIA ROLLERCOASTER,A Action-Packed Reflection of a Pastry Chef And a Composer who must Discover a Mad Scientist in The First Manned Space Station,2006,1,,4,2.99,147,24.99,PG-13,English
922,11,Horror,UNDEFEATED DALMATIONS,A Unbelieveable Display of a Crocodile And a Feminist who must Overcome a Moose in An Abandoned Amusement Park,2006,1,,7,4.99,107,22.99,PG-13,English
702,11,Horror,PULP BEVERLY,A Unbelieveable Display of a Dog And a Crocodile who must Outrace a Man in Nigeria,2006,1,,4,2.99,89,12.99,G,English
495,11,Horror,KENTUCKIAN GIANT,A Stunning Yarn of a Woman And a Frisbee who must Escape a Waitress in A U-Boat,2006,1,,5,2.99,169,10.99,PG,English
593,11,Horror,MONTEREY LABYRINTH,A Awe-Inspiring Drama of a Monkey And a Composer who must Escape a Feminist in A U-Boat,2006,1,,6,0.99,158,13.99,G,English
13,11,Horror,ALI FOREVER,A Action-Packed Drama of a Dentist And a Crocodile who must Battle a Feminist in The Canadian Rockies,2006,1,,4,4.99,150,21.99,PG,English
301,11,Horror,FAMILY SWEET,A Epic Documentary of a Teacher And a Boy who must Escape a Woman in Berlin,2006,1,,4,0.99,155,24.99,R,English
2,11,Horror,ACE GOLDFINGER,A Astounding Epistle of a Database Administrator And a Explorer who must Find a Car in Ancient China,2006,1,,3,4.99,48,12.99,G,English
854,11,Horror,STRANGERS GRAFFITI,A Brilliant Character Study of a Secret Agent And a Man who must Find a Cat in The Gulf of Mexico,2006,1,,4,4.99,119,22.99,R,English
535,11,Horror,LOVE SUICIDES,A Brilliant Panorama of a Hunter And a Explorer who must Pursue a Dentist in An Abandoned Fun House,2006,1,,6,0.99,181,21.99,R,English
277,11,Horror,ELEPHANT TROJAN,A Beautiful Panorama of a Lumberjack And a Forensic Psychologist who must Overcome a Frisbee in A Baloon,2006,1,,4,4.99,126,24.99,PG-13,English
722,11,Horror,REEF SALUTE,A Action-Packed Saga of a Teacher And a Lumberjack who must Battle a Dentist in A Baloon,2006,1,,5,0.99,123,26.99,NC-17,English
222,11,Horror,DESERT POSEIDON,A Brilliant Documentary of a Butler And a Frisbee who must Build a Astronaut in New Orleans,2006,1,,4,4.99,64,27.99,R,English
4,11,Horror,AFFAIR PREJUDICE,A Fanciful Documentary of a Frisbee And a Lumberjack who must Chase a Monkey in A Shark Tank,2006,1,,5,2.99,117,26.99,G,English
799,11,Horror,SIMON NORTH,A Thrilling Documentary of a Technical Writer And a A Shark who must Face a Pioneer in A Shark Tank,2006,1,,3,0.99,51,26.99,NC-17,English
30,11,Horror,ANYTHING SAVANNAH,A Epic Story of a Pastry Chef And a Woman who must Chase a Feminist in An Abandoned Fun House,2006,1,,4,2.99,82,27.99,R,English
653,11,Horror,PANIC CLUB,A Fanciful Display of a Teacher And a Crocodile who must Succumb a Girl in A Baloon,2006,1,,3,4.99,102,15.99,G,English
990,11,Horror,WORLD LEATHERNECKS,A Unbelieveable Tale of a Pioneer And a Astronaut who must Overcome a Robot in An Abandoned Amusement Park,2006,1,,3,0.99,171,13.99,PG-13,English
258,11,Horror,DRUMS DYNAMITE,A Epic Display of a Crocodile And a Crocodile who must Confront a Dog in An Abandoned Amusement Park,2006,1,,6,0.99,96,11.99,PG,English
749,11,Horror,RULES HUMAN,A Beautiful Epistle of a Astronaut And a Student who must Confront a Monkey in An Abandoned Fun House,2006,1,,6,4.99,153,19.99,R,English
909,11,Horror,TREASURE COMMAND,A Emotional Saga of a Car And a Madman who must Discover a Pioneer in California,2006,1,,3,0.99,102,28.99,PG-13,English
885,11,Horror,TEXAS WATCH,A Awe-Inspiring Yarn of a Student And a Teacher who must Fight a Teacher in An Abandoned Amusement Park,2006,1,,7,0.99,179,22.99,NC-17,English
600,11,Horror,MOTIONS DETAILS,A Awe-Inspiring Reflection of a Dog And a Student who must Kill a Car in An Abandoned Fun House,2006,1,,5,0.99,166,16.99,PG,English
956,10,Games,WANDA CHAMBER,A Insightful Drama of a A Shark And a Pioneer who must Find a Womanizer in The Outback,2006,1,,7,4.99,107,23.99,PG-13,English
597,10,Games,MOONWALKER FOOL,A Epic Drama of a Feminist And a Pioneer who must Sink a Composer in New Orleans,2006,1,,5,4.99,184,12.99,G,English
189,10,Games,CREATURES SHAKESPEARE,A Emotional Drama of a Womanizer And a Squirrel who must Vanquish a Crocodile in Ancient India,2006,1,,3,0.99,139,23.99,NC-17,English
563,10,Games,MASSACRE USUAL,A Fateful Reflection of a Waitress And a Crocodile who must Challenge a Forensic Psychologist in California,2006,1,,6,4.99,165,16.99,R,English
596,10,Games,MOONSHINE CABIN,A Thoughtful Display of a Astronaut And a Feminist who must Chase a Frisbee in A Jet Boat,2006,1,,4,4.99,171,25.99,PG-13,English
200,10,Games,CURTAIN VIDEOTAPE,A Boring Reflection of a Dentist And a Mad Cow who must Chase a Secret Agent in A Shark Tank,2006,1,,7,0.99,133,27.99,PG-13,English
217,10,Games,DAZED PUNK,A Action-Packed Story of a Pioneer And a Technical Writer who must Discover a Forensic Psychologist in An Abandoned Amusement Park,2006,1,,6,4.99,120,20.99,G,English
861,10,Games,SUIT WALLS,A Touching Panorama of a Lumberjack And a Frisbee who must Build a Dog in Australia,2006,1,,3,4.99,111,12.99,R,English
352,10,Games,GATHERING CALENDAR,A Intrepid Tale of a Pioneer And a Moose who must Conquer a Frisbee in A MySQL Convention,2006,1,,4,0.99,176,22.99,PG-13,English
447,10,Games,ICE CROSSING,A Fast-Paced Tale of a Butler And a Moose who must Overcome a Pioneer in A Manhattan Penthouse,2006,1,,5,2.99,131,28.99,R,English
654,10,Games,PANKY SUBMARINE,A Touching Documentary of a Dentist And a Sumo Wrestler who must Overcome a Boy in The Gulf of Mexico,2006,1,,4,4.99,93,19.99,G,English
624,10,Games,NIGHTMARE CHILL,A Brilliant Display of a Robot And a Butler who must Fight a Waitress in An Abandoned Mine Shaft,2006,1,,3,4.99,149,25.99,PG,English
46,10,Games,AUTUMN CROW,A Beautiful Tale of a Dentist And a Mad Cow who must Battle a Moose in The Sahara Desert,2006,1,,3,4.99,108,13.99,G,English
919,10,Games,TYCOON GATHERING,A Emotional Display of a Husband And a A Shark who must Succumb a Madman in A Manhattan Penthouse,2006,1,,3,4.99,82,17.99,G,English
684,10,Games,PIZZA JUMANJI,A Epic Saga of a Cat And a Squirrel who must Outgun a Robot in A U-Boat,2006,1,,4,2.99,173,11.99,NC-17,English
483,10,Games,JERICHO MULAN,A Amazing Yarn of a Hunter And a Butler who must Defeat a Boy in A Jet Boat,2006,1,,3,2.99,171,29.99,NC-17,English
762,10,Games,SASSY PACKER,A Fast-Paced Documentary of a Dog And a Teacher who must Find a Moose in A Manhattan Penthouse,2006,1,,6,0.99,154,29.99,G,English
382,10,Games,GRIT CLOCKWORK,A Thoughtful Display of a Dentist And a Squirrel who must Confront a Lumberjack in A Shark Tank,2006,1,,3,0.99,137,21.99,PG,English
306,10,Games,FEATHERS METAL,A Thoughtful Yarn of a Monkey And a Teacher who must Find a Dog in Australia,2006,1,,3,0.99,104,12.99,PG-13,English
742,10,Games,ROOF CHAMPION,A Lacklusture Reflection of a Car And a Explorer who must Find a Monkey in A Baloon,2006,1,,7,0.99,101,25.99,R,English
381,10,Games,GRINCH MASSAGE,A Intrepid Display of a Madman And a Feminist who must Pursue a Pioneer in The First Manned Space Station,2006,1,,7,4.99,150,25.99,R,English
949,10,Games,VOLCANO TEXAS,A Awe-Inspiring Yarn of a Hunter And a Feminist who must Challenge a Dentist in The Outback,2006,1,,6,0.99,157,27.99,NC-17,English
310,10,Games,FEVER EMPIRE,A Insightful Panorama of a Cat And a Boat who must Defeat a Boat in The Gulf of Mexico,2006,1,,5,4.99,158,20.99,R,English
331,10,Games,FORWARD TEMPLE,A Astounding Display of a Forensic Psychologist And a Mad Scientist who must Challenge a Girl in New Orleans,2006,1,,6,2.99,90,25.99,NC-17,English
781,10,Games,SEVEN SWARM,A Unbelieveable Character Study of a Dog And a Mad Cow who must Kill a Monkey in Berlin,2006,1,,4,4.99,127,15.99,R,English
747,10,Games,ROXANNE REBEL,A Astounding Story of a Pastry Chef And a Database Administrator who must Fight a Man in The Outback,2006,1,,5,0.99,171,9.99,R,English
556,10,Games,MALTESE HOPE,A Fast-Paced Documentary of a Crocodile And a Sumo Wrestler who must Conquer a Explorer in California,2006,1,,6,4.99,127,26.99,PG-13,English
211,10,Games,DARLING BREAKING,A Brilliant Documentary of a Astronaut And a Squirrel who must Succumb a Student in The Gulf of Mexico,2006,1,,7,4.99,165,20.99,PG-13,English
302,10,Games,FANTASIA PARK,A Thoughtful Documentary of a Mad Scientist And a A Shark who must Outrace a Feminist in Australia,2006,1,,5,2.99,131,29.99,G,English
842,10,Games,STATE WASTELAND,A Beautiful Display of a Cat And a Pastry Chef who must Outrace a Mad Cow in A Jet Boat,2006,1,,4,2.99,113,13.99,NC-17,English
591,10,Games,MONSOON CAUSE,A Astounding Tale of a Crocodile And a Car who must Outrace a Squirrel in A U-Boat,2006,1,,6,4.99,182,20.99,PG,English
508,10,Games,LAMBS CINCINATTI,A Insightful Story of a Man And a Feminist who must Fight a Composer in Australia,2006,1,,6,4.99,144,18.99,PG-13,English
106,10,Games,BULWORTH COMMANDMENTS,A Amazing Display of a Mad Cow And a Pioneer who must Redeem a Sumo Wrestler in The Outback,2006,1,,4,2.99,61,14.99,G,English
236,10,Games,DIVINE RESURRECTION,A Boring Character Study of a Man And a Womanizer who must Succumb a Teacher in An Abandoned Amusement Park,2006,1,,4,2.99,100,19.99,R,English
438,10,Games,HUMAN GRAFFITI,A Beautiful Reflection of a Womanizer And a Sumo Wrestler who must Chase a Database Administrator in The Gulf of Mexico,2006,1,,3,2.99,68,22.99,NC-17,English
