actor_id,film_id,title,description,release_year,language_id,original_language_id,rental_duration,rental_rate,length,replacement_cost,rating,language,first_name,last_name
126,419,HOCUS FRIDA,A Awe-Inspiring Tale of a Girl And a Madman who must Outgun a Student in A Shark Tank,2006,1,,4,2.99,141,19.99,G,English,FRANCES,TOMEI
126,199,CUPBOARD SINNERS,A Emotional Reflection of a Frisbee And a Boat who must Reach a Pastry Chef in An Abandoned Amusement Park,2006,1,,4,2.99,56,29.99,R,English,FRANCES,TOMEI
126,370,GORGEOUS BINGO,A Action-Packed Display of a Sumo Wrestler And a Car who must Overcome a Waitress in A Baloon Factory,2006,1,,4,2.99,108,26.99,R,English,FRANCES,TOMEI
126,194,CROW GREASE,A Awe-Inspiring Documentary of a Woman And a Husband who must Sink a Database Administrator in The First Manned Space Station,2006,1,,6,0.99,104,22.99,PG,English,FRANCES,TOMEI
126,21,AMERICAN CIRCUS,A Insightful Drama of a Girl And a Astronaut who must Face a Database Administrator in A Shark Tank,2006,1,,3,4.99,129,17.99,R,English,FRANCES,TOMEI
126,58,BEACH HEARTBREAKERS,A Fateful Display of a Womanizer And a Mad Scientist who must Outgun a A Shark in Soviet Georgia,2006,1,,6,2.99,122,16.99,G,English,FRANCES,TOMEI
126,860,SUICIDES SILENCE,A Emotional Character Study of a Car And a Girl who must Face a Composer in A U-Boat,2006,1,,4,4.99,93,13.99,G,English,FRANCES,TOMEI
126,288,ESCAPE METROPOLIS,A Taut Yarn of a Astronaut And a Technical Writer who must Outgun a Boat in New Orleans,2006,1,,7,2.99,167,20.99,R,English,FRANCES,TOMEI
126,685,PLATOON INSTINCT,A Thrilling Panorama of a Man And a Woman who must Reach a Woman in Australia,2006,1,,6,4.99,132,10.99,PG-13,English,FRANCES,TOMEI
147,85,BONNIE HOLOCAUST,A Fast-Paced Story of a Crocodile And a Robot who must Find a Moose in Ancient Japan,2006,1,,4,0.99,63,29.99,G,English,FAY,WINSLET
147,295,EXPENDABLE STALLION,A Amazing Character Study of a Mad Cow And a Squirrel who must Discover a Hunter in A U-Boat,2006,1,,3,0.99,97,14.99,PG,English,FAY,WINSLET
147,341,FROST HEAD,A Amazing Reflection of a Lumberjack And a Cat who must Discover a Husband in A MySQL Convention,2006,1,,5,0.99,82,13.99,PG,English,FAY,WINSLET
147,351,GASLIGHT CRUSADE,A Amazing Epistle of a Boy And a Astronaut who must Redeem a Man in The Gulf of Mexico,2006,1,,4,2.99,106,10.99,PG,English,FAY,WINSLET
147,508,LAMBS CINCINATTI,A Insightful Story of a Man And a Feminist who must Fight a Composer in Australia,2006,1,,6,4.99,144,18.99,PG-13,English,FAY,WINSLET
147,402,HARPER DYING,A Awe-Inspiring Reflection of a Woman And a Cat who must Confront a Feminist in The Sahara Desert,2006,1,,3,0.99,52,15.99,G,English,FAY,WINSLET
147,864,SUNDANCE INVASION,A Epic Drama of a Lumberjack And a Explorer who must Confront a Hunter in A Baloon Factory,2006,1,,5,0.99,92,21.99,NC-17,English,FAY,WINSLET
147,410,HEAVEN FREEDOM,A Intrepid Story of a Butler And a Car who must Vanquish a Man in New Orleans,2006,1,,7,2.99,48,19.99,PG,English,FAY,WINSLET
147,318,FIREHOUSE VIETNAM,A Awe-Inspiring Character Study of a Boat And a Boy who must Kill a Pastry Chef in The Sahara Desert,2006,1,,7,0.99,103,14.99,G,English,FAY,WINSLET
147,708,QUILLS BULL,A Thoughtful Story of a Pioneer And a Woman who must Reach a Moose in Australia,2006,1,,4,4.99,112,19.99,R,English,FAY,WINSLET
147,431,HOOSIERS BIRDCAGE,A Astounding Display of a Explorer And a Boat who must Vanquish a Car in The First Manned Space Station,2006,1,,3,2.99,176,12.99,G,English,FAY,WINSLET
147,178,CONNECTION MICROCOSMOS,A Fateful Documentary of a Crocodile And a Husband who must Face a Husband in The First Manned Space Station,2006,1,,6,0.99,115,25.99,G,English,FAY,WINSLET
147,4,AFFAIR PREJUDICE,A Fanciful Documentary of a Frisbee And a Lumberjack who must Chase a Monkey in A Shark Tank,2006,1,,5,2.99,117,26.99,G,English,FAY,WINSLET
147,305,FATAL HAUNTED,A Beautiful Drama of a Student And a Secret Agent who must Confront a Dentist in Ancient Japan,2006,1,,6,2.99,91,24.99,PG,English,FAY,WINSLET
147,251,DRAGONFLY STRANGERS,A Boring Documentary of a Pioneer And a Man who must Vanquish a Man in Nigeria,2006,1,,6,4.99,133,19.99,NC-17,English,FAY,WINSLET
147,957,WAR NOTTING,A Boring Drama of a Teacher And a Sumo Wrestler who must Challenge a Secret Agent in The Canadian Rockies,2006,1,,7,4.99,80,26.99,G,English,FAY,WINSLET
147,145,CHISUM BEHAVIOR,A Epic Documentary of a Sumo Wrestler And a Butler who must Kill a Car in Ancient India,2006,1,,5,4.99,124,25.99,G,English,FAY,WINSLET
147,310,FEVER EMPIRE,A Insightful Panorama of a Cat And a Boat who must Defeat a Boat in The Gulf of Mexico,2006,1,,5,4.99,158,20.99,R,English,FAY,WINSLET
147,254,DRIVER ANNIE,A Lacklusture Character Study of a Butler And a Car who must Redeem a Boat in An Abandoned Fun House,2006,1,,4,2.99,159,11.99,PG-13,English,FAY,WINSLET
147,298,EYES DRIVING,A Thrilling Story of a Cat And a Waitress who must Fight a Explorer in The Outback,2006,1,,4,2.99,172,13.99,PG-13,English,FAY,WINSLET
147,394,HAMLET WISDOM,A Touching Reflection of a Man And a Man who must Sink a Robot in The Outback,2006,1,,7,2.99,146,21.99,R,English,FAY,WINSLET
147,131,CENTER DINOSAUR,A Beautiful Character Study of a Sumo Wrestler And a Dentist who must Find a Dog in California,2006,1,,5,4.99,152,12.99,PG,English,FAY,WINSLET
147,688,POLISH BROOKLYN,A Boring Character Study of a Database Administrator And a Lumberjack who must Reach a Madman in The Outback,2006,1,,6,0.99,61,12.99,PG,English,FAY,WINSLET
147,139,CHASING FIGHT,A Astounding Saga of a Technical Writer And a Butler who must Battle a Butler in A Shark Tank,2006,1,,7,4.99,114,21.99,PG,English,FAY,WINSLET
147,443,HURRICANE AFFAIR,A Lacklusture Epistle of a Database Administrator And a Woman who must Meet a Hunter in An Abandoned Mine Shaft,2006,1,,6,2.99,49,11.99,PG,English,FAY,WINSLET
147,563,MASSACRE USUAL,A Fateful Reflection of a Waitress And a Crocodile who must Challenge a Forensic Psychologist in California,2006,1,,6,4.99,165,16.99,R,English,FAY,WINSLET
147,333,FREAKY POCUS,A Fast-Paced Documentary of a Pastry Chef And a Crocodile who must Chase a Squirrel in The Gulf of Mexico,2006,1,,7,2.99,126,16.99,R,English,FAY,WINSLET
147,554,MALKOVICH PET,A Intrepid Reflection of a Waitress And a A Shark who must Kill a Squirrel in The Outback,2006,1,,6,2.99,159,22.99,G,English,FAY,WINSLET
147,649,OZ LIAISONS,A Epic Yarn of a Mad Scientist And a Cat who must Confront a Womanizer in A Baloon Factory,2006,1,,4,2.99,85,14.99,R,English,FAY,WINSLET
147,987,WORDS HUNTER,A Action-Packed Reflection of a Composer And a Mad Scientist who must Face a Pioneer in A MySQL Convention,2006,1,,3,2.99,116,13.99,PG,English,FAY,WINSLET
147,405,HAUNTED ANTITRUST,A Amazing Saga of a Man And a Dentist who must Reach a Technical Writer in Ancient India,2006,1,,6,4.99,76,13.99,NC-17,English,FAY,WINSLET
101,85,BONNIE HOLOCAUST,A Fast-Paced Story of a Crocodile And a Robot who must Find a Moose in Ancient Japan,2006,1,,4,0.99,63,29.99,G,English,SUSAN,DAVIS
101,263,DURHAM PANKY,A Brilliant Panorama of a Girl And a Boy who must Face a Mad Scientist in An Abandoned Mine Shaft,2006,1,,6,4.99,154,14.99,R,English,SUSAN,DAVIS
101,491,JUMPING WRATH,A Touching Epistle of a Monkey And a Feminist who must Discover a Boat in Berlin,2006,1,,4,0.99,74,18.99,NC-17,English,SUSAN,DAVIS
101,662,PATHS CONTROL,A Astounding Documentary of a Butler And a Cat who must Find a Frisbee in Ancient China,2006,1,,3,4.99,118,9.99,PG,English,SUSAN,DAVIS
101,941,VIDEOTAPE ARSENIC,A Lacklusture Display of a Girl And a Astronaut who must Succumb a Student in Australia,2006,1,,4,4.99,145,10.99,NC-17,English,SUSAN,DAVIS
101,702,PULP BEVERLY,A Unbelieveable Display of a Dog And a Crocodile who must Outrace a Man in Nigeria,2006,1,,4,2.99,89,12.99,G,English,SUSAN,DAVIS
101,980,WIZARD COLDBLOODED,A Lacklusture Display of a Robot And a Girl who must Defeat a Sumo Wrestler in A MySQL Convention,2006,1,,4,4.99,75,12.99,PG,English,SUSAN,DAVIS
101,988,WORKER TARZAN,A Action-Packed Yarn of a Secret Agent And a Technical Writer who must Battle a Sumo Wrestler in The First Manned Space Station,2006,1,,7,2.99,139,26.99,R,English,SUSAN,DAVIS
101,608,MURDER ANTITRUST,A Brilliant Yarn of a Car And a Database Administrator who must Escape a Boy in A MySQL Convention,2006,1,,6,2.99,166,11.99,PG,English,SUSAN,DAVIS
101,568,MEMENTO ZOOLANDER,A Touching Epistle of a Squirrel And a Explorer who must Redeem a Pastry Chef in The Sahara Desert,2006,1,,4,4.99,77,11.99,NC-17,English,SUSAN,DAVIS
101,275,EGYPT TENENBAUMS,A Intrepid Story of a Madman And a Secret Agent who must Outrace a Astronaut in An Abandoned Amusement Park,2006,1,,3,0.99,85,11.99,PG,English,SUSAN,DAVIS
101,255,DRIVING POLISH,A Action-Packed Yarn of a Feminist And a Technical Writer who must Sink a Boat in An Abandoned Mine Shaft,2006,1,,6,4.99,175,21.99,NC-17,English,SUSAN,DAVIS
101,978,WISDOM WORKER,A Unbelieveable Saga of a Forensic Psychologist And a Student who must Face a Squirrel in The First Manned Space Station,2006,1,,3,0.99,98,12.99,R,English,SUSAN,DAVIS
101,841,STAR OPERATION,A Insightful Character Study of a Girl And a Car who must Pursue a Mad Cow in A Shark Tank,2006,1,,5,2.99,181,9.99,PG,English,SUSAN,DAVIS
101,828,SPIKING ELEMENT,A Lacklusture Epistle of a Dentist And a Technical Writer who must Find a Dog in A Monastery,2006,1,,7,2.99,79,12.99,G,English,SUSAN,DAVIS
101,932,VALLEY PACKER,A Astounding Documentary of a Astronaut And a Boy who must Outrace a Sumo Wrestler in Berlin,2006,1,,3,0.99,73,21.99,G,English,SUSAN,DAVIS
101,146,CHITTY LOCK,A Boring Epistle of a Boat And a Database Administrator who must Kill a Sumo Wrestler in The First Manned Space Station,2006,1,,6,2.99,107,24.99,G,English,SUSAN,DAVIS
101,787,SHINING ROSES,A Awe-Inspiring Character Study of a Astronaut And a Forensic Psychologist who must Challenge a Madman in Ancient India,2006,1,,4,0.99,125,12.99,G,English,SUSAN,DAVIS
101,66,BENEATH RUSH,A Astounding Panorama of a Man And a Monkey who must Discover a Man in The First Manned Space Station,2006,1,,6,0.99,53,27.99,NC-17,English,SUSAN,DAVIS
101,700,PRIX UNDEFEATED,A Stunning Saga of a Mad Scientist And a Boat who must Overcome a Dentist in Ancient China,2006,1,,4,2.99,115,13.99,R,English,SUSAN,DAVIS
101,617,NATURAL STOCK,A Fast-Paced Story of a Sumo Wrestler And a Girl who must Defeat a Car in A Baloon Factory,2006,1,,4,0.99,50,24.99,PG-13,English,SUSAN,DAVIS
101,250,DRAGON SQUAD,A Taut Reflection of a Boy And a Waitress who must Outgun a Teacher in Ancient China,2006,1,,4,0.99,170,26.99,NC-17,English,SUSAN,DAVIS
101,289,EVE RESURRECTION,A Awe-Inspiring Yarn of a Pastry Chef And a Database Administrator who must Challenge a Teacher in A Baloon,2006,1,,5,4.99,66,25.99,G,English,SUSAN,DAVIS
101,774,SEARCHERS WAIT,A Fast-Paced Tale of a Car And a Mad Scientist who must Kill a Womanizer in Ancient Japan,2006,1,,3,2.99,182,22.99,NC-17,English,SUSAN,DAVIS
101,928,UPTOWN YOUNG,A Fateful Documentary of a Dog And a Hunter who must Pursue a Teacher in An Abandoned Amusement Park,2006,1,,5,2.99,84,16.99,PG,English,SUSAN,DAVIS
101,60,BEAST HUNCHBACK,A Awe-Inspiring Epistle of a Student And a Squirrel who must Defeat a Boy in Ancient China,2006,1,,3,4.99,89,22.99,R,English,SUSAN,DAVIS
101,655,PANTHER REDS,A Brilliant Panorama of a Moose And a Man who must Reach a Teacher in The Gulf of Mexico,2006,1,,5,4.99,109,22.99,NC-17,English,SUSAN,DAVIS
101,758,SAINTS BRIDE,A Fateful Tale of a Technical Writer And a Composer who must Pursue a Explorer in The Gulf of Mexico,2006,1,,5,2.99,125,11.99,G,English,SUSAN,DAVIS
101,494,KARATE MOON,A Astounding Yarn of a Womanizer And a Dog who must Reach a Waitress in A MySQL Convention,2006,1,,4,0.99,120,21.99,PG-13,English,SUSAN,DAVIS
101,511,LAWRENCE LOVE,A Fanciful Yarn of a Database Administrator And a Mad Cow who must Pursue a Womanizer in Berlin,2006,1,,7,0.99,175,23.99,NC-17,English,SUSAN,DAVIS
101,189,CREATURES SHAKESPEARE,A Emotional Drama of a Womanizer And a Squirrel who must Vanquish a Crocodile in Ancient India,2006,1,,3,0.99,139,23.99,NC-17,English,SUSAN,DAVIS
101,936,VANISHING ROCKY,A Brilliant Reflection of a Man And a Woman who must Conquer a Pioneer in A MySQL Convention,2006,1,,3,2.99,123,21.99,NC-17,English,SUSAN,DAVIS
101,984,WONDERFUL DROP,A Boring Panorama of a Woman And a Madman who must Overcome a Butler in A U-Boat,2006,1,,3,2.99,126,20.99,NC-17,English,SUSAN,DAVIS
162,85,BONNIE HOLOCAUST,A Fast-Paced Story of a Crocodile And a Robot who must Find a Moose in Ancient Japan,2006,1,,4,0.99,63,29.99,G,English,OPRAH,KILMER
162,1,ACADEMY DINOSAUR,A Epic Drama of a Feminist And a Mad Scientist who must Battle a Teacher in The Canadian Rockies,2006,1,,6,0.99,86,20.99,PG,English,OPRAH,KILMER
162,33,APOLLO TEEN,A Action-Packed Reflection of a Crocodile And a Explorer who must Find a Sumo Wrestler in An Abandoned Mine Shaft,2006,1,,5,2.99,153,15.99,PG-13,English,OPRAH,KILMER
162,410,HEAVEN FREEDOM,A Intrepid Story of a Butler And a Car who must Vanquish a Man in New Orleans,2006,1,,7,2.99,48,19.99,PG,English,OPRAH,KILMER
162,409,HEARTBREAKERS BRIGHT,A Awe-Inspiring Documentary of a A Shark And a Dentist who must Outrace a Pastry Chef in The Canadian Rockies,2006,1,,3,4.99,59,9.99,G,English,OPRAH,KILMER
162,32,APOCALYPSE FLAMINGOS,A Astounding Story of a Dog And a Squirrel who must Defeat a Woman in An Abandoned Amusement Park,2006,1,,6,4.99,119,11.99,R,English,OPRAH,KILMER
162,415,HIGH ENCINO,A Fateful Saga of a Waitress And a Hunter who must Outrace a Sumo Wrestler in Australia,2006,1,,3,2.99,84,23.99,R,English,OPRAH,KILMER
162,4,AFFAIR PREJUDICE,A Fanciful Documentary of a Frisbee And a Lumberjack who must Chase a Monkey in A Shark Tank,2006,1,,5,2.99,117,26.99,G,English,OPRAH,KILMER
162,574,MIDNIGHT WESTWARD,A Taut Reflection of a Husband And a A Shark who must Redeem a Pastry Chef in A Monastery,2006,1,,3,0.99,86,19.99,G,English,OPRAH,KILMER
162,636,OLEANDER CLUE,A Boring Story of a Teacher And a Monkey who must Succumb a Forensic Psychologist in A Jet Boat,2006,1,,5,0.99,161,12.99,PG,English,OPRAH,KILMER
162,786,SHEPHERD MIDSUMMER,A Thoughtful Drama of a Robot And a Womanizer who must Kill a Lumberjack in A Baloon,2006,1,,7,0.99,113,14.99,R,English,OPRAH,KILMER
162,844,STEERS ARMAGEDDON,A Stunning Character Study of a Car And a Girl who must Succumb a Car in A MySQL Convention,2006,1,,6,4.99,140,16.99,PG,English,OPRAH,KILMER
162,41,ARSENIC INDEPENDENCE,A Fanciful Documentary of a Mad Cow And a Womanizer who must Find a Dentist in Berlin,2006,1,,4,0.99,137,17.99,PG,English,OPRAH,KILMER
162,274,EGG IGBY,A Beautiful Documentary of a Boat And a Sumo Wrestler who must Succumb a Database Administrator in The First Manned Space Station,2006,1,,4,2.99,67,20.99,PG,English,OPRAH,KILMER
162,164,COAST RAINBOW,A Astounding Documentary of a Mad Cow And a Pioneer who must Challenge a Butler in The Sahara Desert,2006,1,,4,0.99,55,20.99,PG,English,OPRAH,KILMER
162,121,CAROL TEXAS,A Astounding Character Study of a Composer And a Student who must Overcome a Composer in A Monastery,2006,1,,4,2.99,151,15.99,PG,English,OPRAH,KILMER
162,659,PARK CITIZEN,A Taut Epistle of a Sumo Wrestler And a Girl who must Face a Husband in Ancient Japan,2006,1,,3,4.99,109,14.99,PG-13,English,OPRAH,KILMER
162,279,ELIZABETH SHANE,A Lacklusture Display of a Womanizer And a Dog who must Face a Sumo Wrestler in Ancient Japan,2006,1,,7,4.99,152,11.99,NC-17,English,OPRAH,KILMER
162,500,KISS GLORY,A Lacklusture Reflection of a Girl And a Husband who must Find a Robot in The Canadian Rockies,2006,1,,5,4.99,163,11.99,PG-13,English,OPRAH,KILMER
162,7,AIRPLANE SIERRA,A Touching Saga of a Hunter And a Butler who must Discover a Butler in A Jet Boat,2006,1,,6,4.99,62,28.99,PG-13,English,OPRAH,KILMER
162,612,MUSSOLINI SPOILERS,A Thrilling Display of a Boat And a Monkey who must Meet a Composer in Ancient China,2006,1,,6,2.99,180,10.99,G,English,OPRAH,KILMER
162,18,ALTER VICTORY,A Thoughtful Drama of a Composer And a Feminist who must Meet a Secret Agent in The Canadian Rockies,2006,1,,6,0.99,57,27.99,PG-13,English,OPRAH,KILMER
162,909,TREASURE COMMAND,A Emotional Saga of a Car And a Madman who must Discover a Pioneer in California,2006,1,,3,0.99,102,28.99,PG-13,English,OPRAH,KILMER
162,968,WEREWOLF LOLA,A Fanciful Story of a Man And a Sumo Wrestler who must Outrace a Student in A Monastery,2006,1,,6,4.99,79,19.99,G,English,OPRAH,KILMER
162,28,ANTHEM LUKE,A Touching Panorama of a Waitress And a Woman who must Outrace a Dog in An Abandoned Amusement Park,2006,1,,5,4.99,91,16.99,PG-13,English,OPRAH,KILMER
60,85,BONNIE HOLOCAUST,A Fast-Paced Story of a Crocodile And a Robot who must Find a Moose in Ancient Japan,2006,1,,4,0.99,63,29.99,G,English,HENRY,BERRY
60,31,APACHE DIVINE,A Awe-Inspiring Reflection of a Pastry Chef And a Teacher who must Overcome a Sumo Wrestler in A U-Boat,2006,1,,5,4.99,92,16.99,NC-17,English,HENRY,BERRY
60,297,EXTRAORDINARY CONQUERER,A Stunning Story of a Dog And a Feminist who must Face a Forensic Psychologist in Berlin,2006,1,,6,2.99,122,29.99,G,English,HENRY,BERRY
60,534,LOUISIANA HARRY,A Lacklusture Drama of a Girl And a Technical Writer who must Redeem a Monkey in A Shark Tank,2006,1,,5,0.99,70,18.99,PG-13,English,HENRY,BERRY
60,133,CHAMBER ITALIAN,A Fateful Reflection of a Moose And a Husband who must Overcome a Monkey in Nigeria,2006,1,,7,4.99,117,14.99,NC-17,English,HENRY,BERRY
60,784,SHANGHAI TYCOON,A Fast-Paced Character Study of a Crocodile And a Lumberjack who must Build a Husband in An Abandoned Fun House,2006,1,,7,2.99,47,20.99,PG,English,HENRY,BERRY
60,754,RUSHMORE MERMAID,A Boring Story of a Woman And a Moose who must Reach a Husband in A Shark Tank,2006,1,,6,2.99,150,17.99,PG-13,English,HENRY,BERRY
60,239,DOGMA FAMILY,A Brilliant Character Study of a Database Administrator And a Monkey who must Succumb a Astronaut in New Orleans,2006,1,,5,4.99,122,16.99,G,English,HENRY,BERRY
60,830,SPIRIT FLINTSTONES,A Brilliant Yarn of a Cat And a Car who must Confront a Explorer in Ancient Japan,2006,1,,7,0.99,149,23.99,R,English,HENRY,BERRY
60,493,KANE EXORCIST,A Epic Documentary of a Composer And a Robot who must Overcome a Car in Berlin,2006,1,,5,0.99,92,18.99,R,English,HENRY,BERRY
60,262,DUMBO LUST,A Touching Display of a Feminist And a Dentist who must Conquer a Husband in The Gulf of Mexico,2006,1,,5,0.99,119,17.99,NC-17,English,HENRY,BERRY
60,783,SHANE DARKNESS,A Action-Packed Saga of a Moose And a Lumberjack who must Find a Woman in Berlin,2006,1,,5,2.99,93,22.99,PG,English,HENRY,BERRY
60,436,HOURS RAGE,A Fateful Story of a Explorer And a Feminist who must Meet a Technical Writer in Soviet Georgia,2006,1,,4,0.99,122,14.99,NC-17,English,HENRY,BERRY
60,177,CONNECTICUT TRAMP,A Unbelieveable Drama of a Crocodile And a Mad Cow who must Reach a Dentist in A Shark Tank,2006,1,,4,4.99,172,20.99,R,English,HENRY,BERRY
60,665,PATTON INTERVIEW,A Thrilling Documentary of a Composer And a Secret Agent who must Succumb a Cat in Berlin,2006,1,,4,2.99,175,22.99,PG,English,HENRY,BERRY
60,334,FREDDY STORM,A Intrepid Saga of a Man And a Lumberjack who must Vanquish a Husband in The Outback,2006,1,,6,4.99,65,21.99,NC-17,English,HENRY,BERRY
60,658,PARIS WEEKEND,A Intrepid Story of a Squirrel And a Crocodile who must Defeat a Monkey in The Outback,2006,1,,7,2.99,121,19.99,PG-13,English,HENRY,BERRY
60,222,DESERT POSEIDON,A Brilliant Documentary of a Butler And a Frisbee who must Build a Astronaut in New Orleans,2006,1,,4,4.99,64,27.99,R,English,HENRY,BERRY
60,423,HOLLYWOOD ANONYMOUS,A Fast-Paced Epistle of a Boy And a Explorer who must Escape a Dog in A U-Boat,2006,1,,7,0.99,69,29.99,PG,English,HENRY,BERRY
60,253,DRIFTER COMMANDMENTS,A Epic Reflection of a Womanizer And a Squirrel who must Discover a Husband in A Jet Boat,2006,1,,5,4.99,61,18.99,PG-13,English,HENRY,BERRY
60,299,FACTORY DRAGON,A Action-Packed Saga of a Teacher And a Frisbee who must Escape a Lumberjack in The Sahara Desert,2006,1,,4,0.99,144,9.99,PG-13,English,HENRY,BERRY
60,551,MAIDEN HOME,A Lacklusture Saga of a Moose And a Teacher who must Kill a Forensic Psychologist in A MySQL Convention,2006,1,,3,4.99,138,9.99,PG,English,HENRY,BERRY
60,971,WHALE BIKINI,A Intrepid Story of a Pastry Chef And a Database Administrator who must Kill a Feminist in A MySQL Convention,2006,1,,4,4.99,109,11.99,PG-13,English,HENRY,BERRY
60,186,CRAFT OUTFIELD,A Lacklusture Display of a Explorer And a Hunter who must Succumb a Database Administrator in A Baloon Factory,2006,1,,6,0.99,64,17.99,NC-17,English,HENRY,BERRY
60,679,PILOT HOOSIERS,A Awe-Inspiring Reflection of a Crocodile And a Sumo Wrestler who must Meet a Forensic Psychologist in An Abandoned Mine Shaft,2006,1,,6,2.99,50,17.99,PG,English,HENRY,BERRY
60,952,WAGON JAWS,A Intrepid Drama of a Moose And a Boat who must Kill a Explorer in A Manhattan Penthouse,2006,1,,7,2.99,152,17.99,PG,English,HENRY,BERRY
60,835,SPY MILE,A Thrilling Documentary of a Feminist And a Feminist who must Confront a Feminist in A Baloon,2006,1,,6,2.99,112,13.99,PG-13,English,HENRY,BERRY
60,928,UPTOWN YOUNG,A Fateful Documentary of a Dog And a Hunter who must Pursue a Teacher in An Abandoned Amusement Park,2006,1,,5,2.99,84,16.99,PG,English,HENRY,BERRY
60,142,CHICKEN HELLFIGHTERS,A Emotional Drama of a Dog And a Explorer who must Outrace a Technical Writer in Australia,2006,1,,3,0.99,122,24.99,PG,English,HENRY,BERRY
60,376,GRAPES FURY,A Boring Yarn of a Mad Cow And a Sumo Wrestler who must Meet a Robot in Australia,2006,1,,4,0.99,155,20.99,G,English,HENRY,BERRY
60,179,CONQUERER NUTS,A Taut Drama of a Mad Scientist And a Man who must Escape a Pioneer in An Abandoned Mine Shaft,2006,1,,4,4.99,173,14.99,G,English,HENRY,BERRY
60,235,DIVIDE MONSTER,A Intrepid Saga of a Man And a Forensic Psychologist who must Reach a Squirrel in A Monastery,2006,1,,6,2.99,68,13.99,PG-13,English,HENRY,BERRY
60,771,SCORPION APOLLO,A Awe-Inspiring Documentary of a Technical Writer And a Husband who must Meet a Monkey in An Abandoned Fun House,2006,1,,3,4.99,137,23.99,NC-17,English,HENRY,BERRY
60,805,SLEEPLESS MONSOON,A Amazing Saga of a Moose And a Pastry Chef who must Escape a Butler in Australia,2006,1,,5,4.99,64,12.99,G,English,HENRY,BERRY
60,986,WONKA SEA,A Brilliant Saga of a Boat And a Mad Scientist who must Meet a Moose in Ancient India,2006,1,,6,2.99,85,24.99,NC-17,English,HENRY,BERRY
5,85,BONNIE HOLOCAUST,A Fast-Paced Story of a Crocodile And a Robot who must Find a Moose in Ancient Japan,2006,1,,4,0.99,63,29.99,G,English,JOHNNY,LOLLOBRIGIDA
5,316,FIRE WOLVES,A Intrepid Documentary of a Frisbee And a Dog who must Outrace a Lumberjack in Nigeria,2006,1,,5,4.99,173,18.99,R,English,JOHNNY,LOLLOBRIGIDA
5,817,SOLDIERS EVOLUTION,A Lacklusture Panorama of a A Shark And a Pioneer who must Confront a Student in The First Manned Space Station,2006,1,,7,4.99,185,27.99,R,English,JOHNNY,LOLLOBRIGIDA
5,203,DAISY MENAGERIE,A Fast-Paced Saga of a Pastry Chef And a Monkey who must Sink a Composer in Ancient India,2006,1,,5,4.99,84,9.99,G,English,JOHNNY,LOLLOBRIGIDA
5,172,CONEHEADS SMOOCHY,A Touching Story of a Womanizer And a Composer who must Pursue a Husband in Nigeria,2006,1,,7,4.99,112,12.99,NC-17,English,JOHNNY,LOLLOBRIGIDA
5,19,AMADEUS HOLY,A Emotional Display of a Pioneer And a Technical Writer who must Battle a Man in A Baloon,2006,1,,6,0.99,113,20.99,PG,English,JOHNNY,LOLLOBRIGIDA
5,571,METAL ARMAGEDDON,A Thrilling Display of a Lumberjack And a Crocodile who must Meet a Monkey in A Baloon Factory,2006,1,,6,2.99,161,26.99,PG-13,English,JOHNNY,LOLLOBRIGIDA
5,369,GOODFELLAS SALUTE,A Unbelieveable Tale of a Dog And a Explorer who must Sink a Mad Cow in A Baloon Factory,2006,1,,4,4.99,56,22.99,PG,English,JOHNNY,LOLLOBRIGIDA
5,687,POCUS PULP,A Intrepid Yarn of a Frisbee And a Dog who must Build a Astronaut in A Baloon Factory,2006,1,,6,0.99,138,15.99,NC-17,English,JOHNNY,LOLLOBRIGIDA
5,665,PATTON INTERVIEW,A Thrilling Documentary of a Composer And a Secret Agent who must Succumb a Cat in Berlin,2006,1,,4,2.99,175,22.99,PG,English,JOHNNY,LOLLOBRIGIDA
5,411,HEAVENLY GUN,A Beautiful Yarn of a Forensic Psychologist And a Frisbee who must Battle a Moose in A Jet Boat,2006,1,,5,4.99,49,13.99,NC-17,English,JOHNNY,LOLLOBRIGIDA
5,841,STAR OPERATION,A Insightful Character Study of a Girl And a Car who must Pursue a Mad Cow in A Shark Tank,2006,1,,5,2.99,181,9.99,PG,English,JOHNNY,LOLLOBRIGIDA
5,286,ENOUGH RAGING,A Astounding Character Study of a Boat And a Secret Agent who must Find a Mad Cow in The Sahara Desert,2006,1,,7,2.99,158,16.99,NC-17,English,JOHNNY,LOLLOBRIGIDA
5,146,CHITTY LOCK,A Boring Epistle of a Boat And a Database Administrator who must Kill a Sumo Wrestler in The First Manned Space Station,2006,1,,6,2.99,107,24.99,G,English,JOHNNY,LOLLOBRIGIDA
5,202,DADDY PITTSBURGH,A Epic Story of a A Shark And a Student who must Confront a Explorer in The Gulf of Mexico,2006,1,,5,4.99,161,26.99,G,English,JOHNNY,LOLLOBRIGIDA
5,503,KRAMER CHOCOLATE,A Amazing Yarn of a Robot And a Pastry Chef who must Redeem a Mad Scientist in The Outback,2006,1,,3,2.99,171,24.99,R,English,JOHNNY,LOLLOBRIGIDA
5,383,GROOVE FICTION,A Unbelieveable Reflection of a Moose And a A Shark who must Defeat a Lumberjack in An Abandoned Mine Shaft,2006,1,,6,0.99,111,13.99,NC-17,English,JOHNNY,LOLLOBRIGIDA
5,288,ESCAPE METROPOLIS,A Taut Yarn of a Astronaut And a Technical Writer who must Outgun a Boat in New Orleans,2006,1,,7,2.99,167,20.99,R,English,JOHNNY,LOLLOBRIGIDA
5,375,GRAIL FRANKENSTEIN,A Unbelieveable Saga of a Teacher And a Monkey who must Fight a Girl in An Abandoned Mine Shaft,2006,1,,4,2.99,85,17.99,NC-17,English,JOHNNY,LOLLOBRIGIDA
5,54,BANGER PINOCCHIO,A Awe-Inspiring Drama of a Car And a Pastry Chef who must Chase a Crocodile in The First Manned Space Station,2006,1,,5,0.99,113,15.99,R,English,JOHNNY,LOLLOBRIGIDA
5,811,SMILE EARRING,A Intrepid Drama of a Teacher And a Butler who must Build a Pastry Chef in Berlin,2006,1,,4,2.99,60,29.99,G,English,JOHNNY,LOLLOBRIGIDA
