Alienware 14 Intel Core i5-4200M 2.5GHz 8GB DDR3 1TB HDD NVIDIA GeForce GT 750M 14 Display Windows 7 Professional 64-bit - ALW14-2500SLV at TigerDirect.com,,,New,,,,1 - Mini-DisplayPort,,,DDR3,,,Laptop,14 '',,,,6.12 lbs,Audio Powered by Klipsch,6-Cell Lithium-ion,1TB,Silver,Integrated LAN,10.17 '',HD Widescreen,HDD,NVIDIA GeForce GT 750M,1x 1TB,1,1.64 '',Yes,Killer NIC 1202 802.11n WiFi and Bluetooth 4.0,AlienFX Illuminated Keyboard,1 - RJ-45,,1366 x 768,,,Integrated Touchpad,Windows 7 Home Premium 64-Bit,DVDRW,,Intel,Core i5,4200M,2.5GHz,Dual-Core,802.11n,"[ 1 ] To provide the most accurate specifications , the specifications listed are based upon the manufacturer 's exact model specification as published on the manufacturer 's website , and the manufacturer 's product documentation .",9-in-1,8GB,,,,13.19 '',Integrated Wireless LAN Integrated Bluetooth Bluetooth,Integrated Audio,,,,Gaming,,,,3 - USB 3.0,1 - Headphone,,,,,,,,,,,,,,,,,,,,,,,,,,Media Reader,1 GB,,,,,,,,,,,,,,1 - Microphone input port,,,,,,,,,,,,,,,,,,,,,,,,,,,,,,,,,,,,,,
ASUS N550JK Intel Quad-Core i7 4700HQ 2.4GHz 8GB Memory 1TB HDD NVIDIA GeForce GT 850M 15.6 HD 1920 x 1080 Gaming Laptop Windows 8.1 64-bit - N550JK-DS71T 1YR Accidental Damage Protection Included at TigerDirect.com,,,New,,,,1 - Mini DisplayPort,,,DDR3,,,Laptop,15.6 '',,,,5.73 lbs,SonicMaster,4-Cell Lithium-Polymer,1TB,,"Integrated LAN , Integrated Wireless LAN , Integrated Bluetooth",10.03 '',Full HD Display,HDD,NVIDIA GeForce GT 850M,1x TB,1,1.09 '',Yes,"RJ-45 Ethernet Connector , IEEE 802.11 b/g/n , Bluetooth 4.0",Standard Size,1 - RJ-45,,1920 x 1080,SD/ SDXC/ MMC,,Integrated Touchpad,Windows 8.1 64-Bit,,,Intel,Core i7,4700HQ,2.4GHz,Quad-Core,"802.11 b/g/n , Bluetooth","[ 1 ] To provide the most accurate specifications , the specifications listed are based upon the manufacturer 's exact model specification as published on the manufacturer 's website , and the manufacturer 's product documentation .",2-in-1,8GB,,,,15.07 '',,,,,,Gaming,,,,3 - USB 3.0,1 - Combo Headphone/Microphone Jack,,,,,,,,,,,,,,,,,,,,,,,,,,,,,,,,,,,,,,,,,,,,,,,,,,,,,,,,,,,,,,,,,,,,,,,,,,,,,,,
Alienware 14 Intel Core i5-4200M 2.5GHz 8GB DDR3 1TB HDD NVIDIA GeForce GT 750M 14 Display Windows 7 Professional 64-bit - ALW14-2500SLV at TigerDirect.com,,,New,,,,1 - Mini-DisplayPort,,,DDR3,,,Laptop,14 '',,,,6.12 lbs,Audio Powered by Klipsch,6-Cell Lithium-ion,1TB,Silver,Integrated LAN,10.17 '',HD Widescreen,HDD,NVIDIA GeForce GT 750M,1x 1TB,1,1.64 '',Yes,Killer NIC 1202 802.11n WiFi and Bluetooth 4.0,AlienFX Illuminated Keyboard,1 - RJ-45,,1366 x 768,,,Integrated Touchpad,Windows 7 Home Premium 64-Bit,DVDRW,,Intel,Core i5,4200M,2.5GHz,Dual-Core,802.11n,"[ 1 ] To provide the most accurate specifications , the specifications listed are based upon the manufacturer 's exact model specification as published on the manufacturer 's website , and the manufacturer 's product documentation .",9-in-1,8GB,,,,13.19 '',Bluetooth Integrated Bluetooth Integrated Wireless LAN,Integrated Audio,,,,Gaming,,,,3 - USB 3.0,1 - Headphone,,,,,,,,,,,,,,,,,,,,,,,,,,Media Reader,1 GB,,,,,,,,,,,,,,1 - Microphone input port,,,,,,,,,,,,,,,,,,,,,,,,,,,,,,,,,,,,,,
"Lenovo ThinkServer TD340 Tower Server - Intel Xeon E5-2407 v2 2.40GHz, 8GB Memory, No HDD, RAID, DVDRW, No OS - 70B7002KUX at TigerDirect.com",,,New,,,,,,,DDR3,,,,,,,,,,,,,,23.4 '',,,Aspeed AST2300,,,16.9 '',,,,2,192GB,,,,,No OS,,,Intel,Xeon,E5-2407 v2,2.40GHz,,,"[ 6 ] To provide the most accurate specifications , the specifications listed are based upon information provided by the vendor .",,8GB,,,1,7.68 '',1 10,,,,,,,12.0,,6 - USB 2.0,,Integrated,,,,,,,,,,Intel 82574L,10/100/1000Mbps,Gigabit Ethernet,RJ-45,1 x 8GB,,,,800 Watt,LGA1356,,1.0,,,,,,,DVDÂ±RW,1.0,2.0,,,,,,,,,,,,,,,,,,,1600MHz PC3-12800,1600MHz,,,,,,,0,,,,,11.0,,4.0,10MB,No HDD,Tower,,,,Intel,,Single,1.0,1.0,ThinkServer RAID 300,,
ASUS N550JK Intel Quad-Core i7 4700HQ 2.4GHz 8GB Memory 1TB HDD NVIDIA GeForce GT 850M 15.6 HD 1920 x 1080 Gaming Laptop Windows 8.1 64-bit - N550JK-DS71T 1YR Accidental Damage Protection Included at TigerDirect.com,,,New,,,,1 - Mini DisplayPort,,,DDR3,,,Laptop,15.6 '',,,,5.73 lbs,SonicMaster,4-Cell Lithium-Polymer,1TB,,"Integrated LAN , Integrated Wireless LAN , Integrated Bluetooth",10.03 '',Full HD Display,HDD,NVIDIA GeForce GT 850M,1x TB,1,1.09 '',Yes,"RJ-45 Ethernet Connector , IEEE 802.11 b/g/n , Bluetooth 4.0",Standard Size,1 - RJ-45,,1920 x 1080,SD/ SDXC/ MMC,,Integrated Touchpad,Windows 8.1 64-Bit,,,Intel,Core i7,4700HQ,2.4GHz,Quad-Core,"802.11 b/g/n , Bluetooth","[ 1 ] To provide the most accurate specifications , the specifications listed are based upon the manufacturer 's exact model specification as published on the manufacturer 's website , and the manufacturer 's product documentation .",2-in-1,8GB,,,,15.07 '',,,,,,Gaming,,,,3 - USB 3.0,1 - Combo Headphone/Microphone Jack,,,,,,,,,,,,,,,,,,,,,,,,,,,,,,,,,,,,,,,,,,,,,,,,,,,,,,,,,,,,,,,,,,,,,,,,,,,,,,,
"Samsung ATIV Tab 3 Tablet PC - Intel Atom Processor Z2760 1.80GHz,  64GB eMMC, Intel GMA, 10.1 Touch Display, Windows 8 (32-bit) (Refurbished) - XE300TZC-K01US at TigerDirect.com",,,Refurbished,,,,,,,LPDDR2,,,2-in-One,10.1 '',,,,1.28 lb .,,2-Cell Lithium Polymer,64GB,,Integrated Wireless LAN,6.51 '',LED HD,eMMC,Intel Graphics Media Accelerator,1x 64GB,1 - micro,0.31 '',Yes,,Standard Size,,2GB,1366 x 768,Secure Digital ( SD ),1 Slot,Touch screen,Windows 8 64-Bit,,,Intel,Atom,Z2760,1.80GHz,,802.11b,"[ 1 ] To provide the most accurate specifications , the specifications listed are based upon the manufacturer 's exact model specification as published on the manufacturer 's website , and the manufacturer 's product documentation .",,2GB,Yes,,,10.13 '',Bluetooth 4.0 802.11n 802.11g 802.11a Integrated Bluetooth,Integrated Audio,,,,,,,,1 - Micro-USB Port,1 - Headphone/line-out,Integrated Graphics,,,,,,,,,,,,,,,,,,,,,,,,,,,,,,,,,,,,,,,,1,,,,,,2.0MP,,,,,,,,,,,,,,,,,,,,,,,,,,,,,,,,
"Acer Aspire AXC-603-UR10 Desktop Intel Pentium Quad-Core J2900 2.41GHz, 4GB Memory, 1TB HDD, DVDRW, Windows 8.1 64-bit - DT.SUMAA.001 at TigerDirect.com",,,New,,,,,,,DDR3,,,PC,,,,,,High Definition Audio,,1TB,,,10.5 '',Monitor Not Included,,Intel HD Graphics,,1,3.9 '',,,,1,8GB,,,,,Windows 8.1 64-Bit,,,Intel,Pentium,J2900,2.41GHz,,,"[ 6 ] To provide the most accurate specifications , the specifications listed are based upon information provided by the vendor .",,4GB,,,1,14.6 '',4 - USB 2.0,Integrated Audio,,,,Home & Student,,,,1 - USB 3.0,,Integrated Graphics,,,Black,USB Mouse USB Keyboard,,Small Form Factor ( SFF ),HDD,1,Serial ATA/300,Integrated,10/100/1000Mbps,Gigabit Ethernet,RJ-45,,,DVD±RW,Vertical,220 Watt,,,,,,,,,,,,,,,,,,,,,,,,,,,,,,,,,,,5.1,,,,,,,,,,,,,,,,,,,,,,,,,
ASUS Transformer Book Intel Core i3 4020Y 1.5GHz 4GB Memory 64GB SSD 13.3 Touchscreen Full HD 1920 x 1080 2-in-One Notebook Windows 8 64-bit - T300LA-BB31T at TigerDirect.com,,,New,,,,,,,DDR3L,,,2-in-One,13.3 '',,,,4.1 lbs,ASUS SonicMaster,4-Cell Lithium-Polymer,64GB,Silver,"Integrated Wireless LAN , Integrated Bluetooth",8.5 '',Full HD Display,SSD,Intel HD Graphics 4200,1x 64GB,1 - micro,0.9 '',Yes,"802.11n , Bluetooth 4.0",Standard Size,,,1920 x 1080,microSD,,Integrated Touchpad,Windows 8 64-Bit,None,,Intel,Core i3,4020Y,1.5GHz,Dual-Core,"IEEE 802.11n , Bluetooth","[ 1 ] To provide the most accurate specifications , the specifications listed are based upon the manufacturer 's exact model specification as published on the manufacturer 's website , and the manufacturer 's product documentation .",,4GB,Yes,,,13.5 '',,,,,,,,,,1 - USB 3.0,1 - Headphone out/Microphone-in combo jack,,,,,,,,,,,,,,,,,,,,,,,,,,,,,,,,,,,,,,,,,,,,,,,,,,,,,,,,,,,,,,,,,,,,,,,,,,,,,,,
"Gateway ZX4270-UR30 All-In-One PC - AMD E1-2500 1.40GHz, 4GB DDR3 Memory, 750GB HDD, DVDRW, 19.5 Display, Windows 8 64-bit - DQ.GEUAA.001 at TigerDirect.com",,,New,,,,,,,DDR3,,,PC,19.5 '',,,,,High Definition Audio,,750GB,,,2.1 '',HD+ LED Backlit Display,,AMD Radeon HD 8240,,,12.3 '',,,,1,8GB,1600 x 900,,,,Windows 8 64-Bit,,,AMD,E Series,E1-2500,1.40GHz,,,"[ 1 ] To provide the most accurate specifications , the specifications listed are based upon the manufacturer 's exact model specification as published on the manufacturer 's website , and the manufacturer 's product documentation .",,4GB,No,,,18.9 '',,Integrated Audio,,,,All-In-One,,,,"4 - USB 2.0 , 2 - USB 3.0",Yes,Integrated Graphics,,,Black,USB Mouse USB Keyboard,,All-In-One,HDD,1,SATA,Integrated,10/100/1000Mbps,Gigabit Ethernet,RJ-45,,,DVD±RW,Vertical,65 Watt,,,,"5,400RPM",,,,,,,,,"Wireless LAN 802.11 b/g/n , Bluetooth",,,,,,,,,Yes,Yes,Yes,,Media Reader,Built-In,,,,,,,,,,,,,,,,,,,,,,,,,,,,,,,,,
Lenovo ThinkPad Helix 3698 - Ultrabook - Core i7 3667U / 2 GHz - Windows 8 Pro 64-bit - 8 GB RAM - 256 GB SSD - 11.6 VibrantView wide 1920 x 1080 / Full HD - Intel HD Graphics 4000 - NFC - black - To at TigerDirect.com,,,New,,,,,,,,,,2-in-One,11.6 '',,,,3.8 lbs,,,256GB,Black,,7.3 '',Widescreen,SSD,,,,0.5 '' / 0.8 '',Yes,RJ-45 Ethernet Connector,Precision ThinkPad Keyboard,,,1920 x 1080,,,,Windows 8 Pro 64-Bit,None,,Intel,Core i7,3667U,,,,"[ 3 ] To provide the most accurate specifications , the specifications listed are based upon the manufacturer 's exact model specification as published on the manufacturer 's website .",,8GB,Yes,,,11.7 '',1.8 lbs IntelÂ® CentrinoÂ® Advanced-N 6235 HD Webcam,,,,,,,,,2,1 Headphone out/Microphone-in combo jack,,,,,,,,,,,,,,,,,,,,,,,,,,,,,,,,,,,,,,,,,,,,,,Low Light Sensitive,,,,DDR3 1333MHz,,,,,,,,,,,,,,,,,,,,,,,,,,,,,
ASUS T100TA-C1-RD Transformer Intel Atom 2GB Memory 64GB SSD 10.1 2-In-1 Touch Notebook Windows 8.1 - T100TA-C1-RD at TigerDirect.com,,,New,,,,,,,DDR3,,,2-in-One,10.1 '',,,,2.4 lbs,SonicMaster Audio,2-Cell Lithium-Polymer,64GB,Red,,6.7 '',IPS HD,SSD,IntelÂ® HD Graphics,1x 64GB SSD,1 - Micro-HDMI,0.93 '',Yes,"RJ-45 Ethernet Connector , IEEE 802.11a/g/n",Keyboard Dock,,2GB,1368 x 768,SDXC,,Integrated Touchpad,Windows 8.1,,,Intel,Atom,Z3775,1.46GHz,Quad-Core,"802.11 a/g/n , Bluetooth","[ 1 ] To provide the most accurate specifications , the specifications listed are based upon the manufacturer 's exact model specification as published on the manufacturer 's website , and the manufacturer 's product documentation .",,2GB,Yes,,,10.4 '',,,,,,Home & Student,,,,"1 - USB 3.0 , Micro-USB Port",1 - Combo Headphone/Microphone Jack,,,,,,,,,,,,,,,,,,,,,,,,,,,,,,,,,,,,,,,,,,,,,,,,,,,,,,,,,,,,,,,,,,,,,,,,,,,,,,,
HP ProBook 450 G2 Intel Core i7 8GB Memory 1TB HDD 15.6 Notebook PC Windows 7 Professional/Windows 8 Pro 64-bit - J8V34UT#ABA at TigerDirect.com,,,New,,,,,,,DDR3,,,Laptop,15.6 '',,,,5.1 lbs,DTS Sound+,4-Cell Lithium-ion,1TB,,"Integrated LAN , Integrated Wireless LAN , Integrated Bluetooth",10.3 '',LED-backlit HD anti-glare,HDD,Intel HD Graphics 4400,1x 1TB,1,1 '',Yes,"RJ-45 Ethernet Connector , IEEE 802.11ac , Bluetooth 4.0",Standard Size,1 - RJ-45,,1366 x 768,SD/SDHC/SDXC,,Integrated Touchpad,Windows 7 Professional 64-Bit,DVDRW,Windows 8 Pro 64-Bit,Intel,Core i7,4510U,2GHz,Dual-Core,"IEEE 802.11ac , Bluetooth v4.0","[ 1 ] To provide the most accurate specifications , the specifications listed are based upon the manufacturer 's exact model specification as published on the manufacturer 's website , and the manufacturer 's product documentation .",,8GB,,,1,14.8 '',,,,,,Business,,,,"2 - USB 2.0 , 2 - USB 3.0",1 - Combo Headphone/Microphone Jack,,Yes,,,,,,,,,,,,,,,,,,,,,,,,Media Reader,,,,,,,,,,,,,,,,,,,,,,,,,,,,,Built-in Stereo Speakers,,,,,,,,,,,,,,,,,,,,,,,,
"HP ProOne 400 G1 All-In-One PC - Intel Core i3-4330T 3.00GHz, 4GB DDR3 Memory, 500GB HDD, DVDRW, 19.5 Display, Windows 7/8.1 Pro 64-bit - F4J79UT#ABA at TigerDirect.com",,,New,,,,1,,,DDR3,,,PC,19.5 '',,,,,DTS Sound+,,500GB,,,3 '',Widescreen HD LED Backlit Display,,Intel HD Graphics 4600,,,13.5 '',,,HP Standard Keyboard,1,16GB,1600 x 900,,2 Slots Total / 1 Free,Optical,Windows 7 Professional 64-Bit,,Windows 8.1 Pro 64-Bit,Intel,Core i3,i3-4330T,3.00GHz,,,"[ 9 ] To provide the most accurate specifications , the specifications listed are based upon the exact model specification as published by CNET .",,4GB,No,,,19.5 '',,Integrated Audio,,,,All-In-One,,,,"4 - USB 3.0 , 2 - USB 2.0",2,Integrated Graphics,,,Black,USB USB,,All-In-One,HDD,1,SATA 6.0Gb/s,Realtek RTL8151GH-CG,10/100/1000Mbps,Gigabit Ethernet,RJ-45,1 x 4GB,1 - PCIe Mini Card,DVD±RW DL,Vertical,120 Watt,,PC3-12800 1600MHz,1.0,"7,200RPM",,,,,,,,,Wireless LAN 802.11 a/b/g/n,,,,,,,,,1,Yes,Yes,AC 120/230 V ( 50/60 Hz ),,Built-In,,Intel Dual Band Wireless-N 7260,,,,,,,,1 - 5.25 '' Bay,1 - 2.5 '' /3.5 '' Bay,,,,,,,,,,,,,,,,,,,,,,
MSI GT70 Dominator-895 Intel Core i7 8GB Memory 1TB HDD NVIDIA Geforce GTX 870M 17.3 Gaming Laptop Windows 8.1 64-bit - 9S7-1763A2-2015 at TigerDirect.com,,,New,,,,1 - Mini-DisplayPort,,,DDR3L,,,Laptop,17.3 '',,,,8.6 lbs,Dynaudio Tech,9-Cell,1TB,Black,"Integrated LAN , Integrated Wireless LAN , Integrated Bluetooth",11.34 '',Full HD Display,HDD,NVIDIA GeForce GTX 870M,1x 1TB,1,2.17 '',Yes,"Killer Gaming Network , Intel 7260 Wilkins Peak 2 ( 2x2 802.11 ac ) , Bluetooth 4.0",Steel Series Gaming Backlit 102 keys,,,1920 x 1080,SD ( XC/HC ),,Integrated Touchpad,Windows 8.1 64-Bit,DVDRW,,Intel,Core i7,4800MQ,2.7GHz,Quad-Core,"IEEE 802.11ac , Bluetooth v4.0","[ 1 ] To provide the most accurate specifications , the specifications listed are based upon the manufacturer 's exact model specification as published on the manufacturer 's website , and the manufacturer 's product documentation .",,8GB,,,1,16.85 '',,,,,,Gaming,,,,"3x USB 3.0 , 2x USB 2.0",,,Yes,,,,,,,,,,,,,,,,,,,,,,,7200 RPM,,3G GDDR5,,,,,,,,,,,,,,,,,,,,,,,,,,,,Built-in Stereo Speakers,,,,,,,,,,,,,,,,,,,,,,,,
"Dell Inspiron 19.5 Touchscreen All-In-One PC - Intel Pentium 2.16GHz, 4GB Memory, 500GB HDD, Windows 8.1 64-bit - I3043-5000BLK at TigerDirect.com",,,New,,,,,,,DDR3,,,PC,19.5 '',,,,,HD Audio with Waves MaxxAudioÂ®,,500GB,,,,Touch Full HD Display,,Intel HD Graphics,,1,,,,Standard,1 - RJ-45 Ethernet Connector,,1600 x 900,"SD , SDHC , SDXC , MMC",,USB Optical Mouse,Windows 8.1 64-Bit,,,Intel,Pentium,,2.16GHz,,,"[ 1 ] To provide the most accurate specifications , the specifications listed are based upon the manufacturer 's exact model specification as published on the manufacturer 's website , and the manufacturer 's product documentation .",,4GB,Yes,,,,,,,,,All-In-One,,,,3x USB 2.0,1 - Headphone,,,,,,,All-In-One,HDD,,,,,,,,,,Vertical,,,,,"5,400RPM",,,,,,,1.0,,Dell Wireless-N 1705,,,,,,,,,,,,,Card Reader,,,,,,,,,,,,,,,,,,,,,,,,,,,,,,,,,,
Acer TravelMate P276-MG Intel Core i7 8GB Memory 1TB HDD 17.3 Notebook Windows 7 Professional/Windows 8 Pro 64-bit - NX.V9WAA.002 at TigerDirect.com,,,New,,,,,,,DDR3,,,Laptop,17.3 '',,,,6.61 lbs,,4-Cell Lithium-ion,1TB,,"Integrated LAN , Integrated Wireless LAN , Integrated Bluetooth",11.4 '',Active Matrix TFT Color LCD,HDD,NVIDIA GeForce 820M,1x 1TB,1,1.2 '',Yes,"Gigabit Ethernet , Intel Wireless-N 7260 IEEE 802.11a/b/g/n , Bluetooth",Standard Size,1 - RJ-45,16GB,1600 x 900,Secure Digital ( SD ),,Integrated Touchpad,Windows 7 Professional 64-Bit,DVDRW,Windows 8 Pro 64-Bit,Intel,Core i7,4510U,2GHz,Dual-Core,"IEEE 802.11a/b/g/n , Bluetooth","[ 1 ] To provide the most accurate specifications , the specifications listed are based upon the manufacturer 's exact model specification as published on the manufacturer 's website , and the manufacturer 's product documentation .",,8GB,,,1,16.7 '',,Integrated Audio,,,,,,,,"2 - USB 2.0 , 1 - USB 3.0",1,,,,,,,,,,,,,,,,,,,,,,,,,,,2GB,,,,,,,,,,,,,,,,,,,,,,,,,,,,,,,,,,,,,,,,,,,,,,,,,,,,
"Alienware 18.4 Gaming Notebook - Intel Quad-Core i7-4710MQ, 2.50GHz, 8GB DDR3L, 1TB HDD + 80GB SSD, 4GB GeForce GTX 860M, DVDRW, Windows 7 Home Premium, - ALW183006SLV at TigerDirect.com",,,New,,,,1 - Mini-DisplayPort,,,DDR3L,,,,18.4 '',,,,,,,1080GB,Silver,,,WLED FHD,HDD + SSD,NVIDIA Geforce GTX 860M,"1x 1TB HDD , 1x 80GB SSD",1,,,Gigabit LAN,,,32GB,1920 x 1080,,,,Windows 7 Home Premium 64-Bit,DVDRW,Windows 8 64-Bit,Intel,Core i7,4710MQ,2.50GHz,Quad-Core,802.11ac,,,8GB,,,,,Bluetooth 4.0,,,,,Gaming,,,,4,,Dedicated Graphics,,,,,,,,,,,,,,,,,,,,PC3-12800 1600MHz,,,Windows 7 Home Premium 64-Bit,7200 RPM,,Up to 4GB,,,,,,,,,,,,,,,,,,,,,,,,,,,,,,,,,,,,,,,,,,,,,,,,,,,,
"Microsoft Surface Pro 3 Intel Core i7 8GB Memory 256GB Storage 12 Tablet - WiFi, Windows 8.1 Pro 64-bit - 5D2-00001 at TigerDirect.com",Yes,2 - Front & Rear,New,Intel Core i7,7.93 in x 11.5 in x 0.36 in,2160 x 1440,Yes,5MP,1,LPDDR3,Yes,Windows 8.1 Pro,Windows,12 '',256GB,Yes,1.0,1.76 lbs,,,,,,,,,,,,,,,,,,,,,,,,,,,,,,,,,,,,,,,,,,,,,,,,,,,,,,,,,,,,,,,,,,,,,,,,,,,,,,,,,,,,,,,,,,,,,,,,,,,,,,,,,,,,,,,,,,,,,,,,,,,,,,,
"HP ML310e ProLiant Gen8 v2 Hot Plug 4 LFF 350W PS Smart Server - 4 Core IntelÂ® XeonÂ® Processor E3-1220v3, 3.10 GHz, 1P 4GB, Dual Rank PC3L-10600E Memory, 500GB, 1Gb 332i Adapter, DVD RW - 724978-S01 at TigerDirect.com",,,,,,,,,,DDR3 SDRAM SDRAM,,,,,,,,,,,500 GB,,,18.7 '',,HDD - hot-swap,,,,14.5 '',,,,2,32GB 32GB,,,,,,,,Intel,Quad Core Xeon,E3-1220v3,3.10GHz,,,,,4GB,,,,6.9 '',VMware Red Hat Enterprise Linux ( RHEL ) SUSE Linux Enterprise Server ( SLES ) DDR3,,,,,,,,,,,,,,,,,4U Tower,,,,HP Ethernet 1Gb 2-port 332i Adapter,,Gigabit Ethernet,,1 x 4GB,,,,350 Watt,,,,,,7200 RPM,,,,DVDRW,,,,,,,,,,,,,,,microATX,,,,,,PC3L-10600E 1333 MHz,,,,,,,,,4,2.0,,,,,,8MB,,,,,,Intel,,,,,,,
ASUS GL551JM Intel Core i7 16GB Memory 1TB HDD NVIDIA GTX 860M 2G 15.6 Gaming Laptop Windows 8.1 64-bit - GL551JM-DH71 at TigerDirect.com,,,New,,,,,,,DDR3,,,Laptop,15.6 '',,,,,,,1TB,Black,"Integrated Wireless LAN , Integrated Bluetooth",,Full HD Display,HDD,NVIDIA GTX 860M,1x 1TB,,,Yes,"IEEE 802.11a/g/n , Bluetooth 4.0",Illuminated Backlit,,,1920 x 1080,,,Integrated Touchpad,Windows 8.1 64-Bit,DVD Super Multi Dual Layer Burner,,Intel,Core i7,4710HQ,2.5GHz,Quad-Core,"IEEE 802.11a/g/n , Bluetooth 4.0","[ 1 ] To provide the most accurate specifications , the specifications listed are based upon the manufacturer 's exact model specification as published on the manufacturer 's website , and the manufacturer 's product documentation .",,16GB,,,,,,Integrated Audio,,,,Gaming,,,,,,,,,,,,,,,,,,,,,,,,,,,,,,,,2GB,,,,,,,,,,,,,,,,,,,,,,,,,,,,,,,,,,,,,,,,,,Up to 5 hours,,,,,,,,,,
SONY SVD13213CXB I54200U 4/128SSD/W8H/13UBK (Scratch & Dent) at TigerDirect.com,,,Scratch and Dent,,,,,,,DDR3,,,Ultrabook,13.3 '',,,,2.93 lbs,IntelÂ® High Definition Audio,Lithium Polymer,128GB,Black,Integrated Wireless LAN,8.27 '',Widescreen HD LED-Backlit Capacitive Touchscreen,SSD,Intel HD Graphics 4400,,1,0.77 '',Yes,,QWERTY 83 Keys with 1.0mm Stroke and 19.05mm Pitch,,,1920 x 1080,,,Integrated Touchpad,Windows 8 64-Bit,,,Intel,Core i5,i5-4200U,1.60GHz,Dual-Core,,"[ 1 ] To provide the most accurate specifications , the specifications listed are based upon the manufacturer 's exact model specification as published on the manufacturer 's website , and the manufacturer 's product documentation .",,4GB,Yes,,,13.00 '',Integrated Bluetooth 8.0MP ( Rear ),Integrated Audio,Bluetooth 4.0+HS,,,Home & Student,,,,2 - USB 3.0,1,Integrated Graphics,,,,,,,,,,,,,,1 x 4GB,,,,,,PC3-12800 1600MHz,,,,,Media Reader,,,,,,,,,,,,,,,1,,,,,,2.0MP ( Front ),,,,,Yes,,,,,,,,,,,,,,,,,Up to 10 hours,,,,,,,,,,
ASUS Transformer Book T200TA 4GB Memory 64GB SSD 11.6 2-in-One Notebook Windows 8.1 64-bit - T200TA-C1-BL at TigerDirect.com,,,New,,,,,,,DDR3L,,,2-in-One,11.6 '',,,,,,,64GB,,"Integrated LAN , Integrated Wireless LAN , Integrated Bluetooth",,IPS HD Multi-Touch Screen,SSD,IntelÂ® HD Graphics,1x 64GB,1 - micro,,Yes,"RJ-45 Ethernet Connector , IEEE 802.11 a/b/g/n , Bluetooth 4.0",Standard Size,1 - RJ-45,,1366 x 768,,,Integrated Touchpad,Windows 8.1 64-Bit,None,,Intel,Atom,Z3795,1.59GHZ,Quad-Core,"IEEE 802.11a/b/g/n , Bluetooth","[ 1 ] To provide the most accurate specifications , the specifications listed are based upon the manufacturer 's exact model specification as published on the manufacturer 's website , and the manufacturer 's product documentation .",,4GB,Yes,,,,,Integrated Audio,,,,,,,,"1x USB 3.0 , 1x USB 2.0",1 - Combo Headphone/Microphone Jack,,Yes,,,,,,,,,,,,,,,,,,,,,,,,,,,,,,,,,,,,,,,,,,,,,,,,,,,,,Built-in Stereo Speakers,,,,,,,,,,,,,,,,,,,,,,,,
"Lenovo C260 All-In-One PC - Intel Celeron J1800 2.41GHz, 4GB DDR3 Memory, 500GB HDD, DVDRW, 19.5 Display, Windows 8.1 64-bit - 57327436 at TigerDirect.com",,,New,,,,,,,DDR3,,,PC,19.5 '',,,,,High Definition Audio,,500GB,,,1.9 '',HD+ Display,,Intel HD Graphics,,1,13.5 '',,,Included,1,,1600 x 900,,,Included,Windows 8.1 64-Bit,,,Intel,Celeron,J1800,2.41GHz,,,"[ 1 ] To provide the most accurate specifications , the specifications listed are based upon the manufacturer 's exact model specification as published on the manufacturer 's website , and the manufacturer 's product documentation .",6-in-1,4GB,No,,,19.1 '',,Integrated Audio,,,,All-In-One,,,,"1 - USB 3.0 , 3 - USB 2.0",1 - Headphone/Microphone Jack Combo,Integrated Graphics,,,Black,,,All-In-One,HDD,1,,Integrated,10/100/1000Mbps,Gigabit Ethernet,RJ-45,,,DVD±RW,Vertical,,FCBGA1170,,,"7,200RPM",,,,,,,,,"Wireless LAN 802.11 b/g/n , Bluetooth 4.0",,,,,,,,,,Yes,Yes,,Media Reader,Built-In,720p,,,,,,,,,,,,,,,,,,,,,,,,,,,,,,,,
ASUS G751JY Intel Core i7 24GB Memory 1TB HDD + 256GB SSD NVIDIA GTX 980M 4GB GDDR5 17.3 Gaming Laptop Windows 8.1 64-bit - G751JY-DH71 at TigerDirect.com,,,New,,,,,,,DDR3L,,,Laptop,17.3 '',,,,8.4 lbs,,8-Cell Lithium-ion,1256GB,,"Integrated LAN , Integrated Wireless LAN , Integrated Bluetooth",12.5 '',Full HD Display,HDD + SSD,NVIDIA GTX 980M,"1x 1TB HDD , 1x 256GB SSD",1,0.9 '',Yes,"RJ-45 Ethernet Connector , IEEE 802.11 ac , Bluetooth",,1 - RJ-45,,1920 x 1080,SD/MMC,,,Windows 8.1 64-Bit,Blu-Ray Burner,,Intel,Core i7,4710HQ,2.5GHz,Quad-Core,"IEEE 802.11ac , Bluetooth v4.0","[ 1 ] To provide the most accurate specifications , the specifications listed are based upon the manufacturer 's exact model specification as published on the manufacturer 's website , and the manufacturer 's product documentation .",,24GB,,,1,16.4 '',,,,,,Gaming,,,,4 - USB 3.0,1 - Headphone/line-out,,,,,,,,,,,,,,,,,,,,,,,,,7200 RPM,,4GB GDDR5,,,,,,,,,,,,,,1 - Microphone input port,,,,,,,,,,,,,,,,,,,,,,,,,,,,,,,,,,,,,,
"Lenovo ThinkServer TS440 70AQ000NUX Tower Server - 5U, 1-way, Intel Xeon E3-1225 v3 3.20GHz, 4GB Memory, No HDD, No OS at TigerDirect.com",,,New,,,,,,,DDR3,,,,,,,,,,,,,,23.4 '',,,Intel HD Graphics P4600,,,16.9 '',,,,1,32GB,,,,,No OS,,,Intel,Xeon,E3-1225 v3,3.20GHz,,,"[ 9 ] To provide the most accurate specifications , the specifications listed are based upon the exact model specification as published by CNET .",,4GB,,,1,7.7 '',10 1 6 - USB 3.0,,,,,,,4.0,,2 - USB 2.0,,Integrated,,,,,,5U Rackmounted,,,,Intel I217,10/100/1000Mbps,Gigabit Ethernet,RJ-45,1 x 4GB,,,,450 Watt,LGA1150,,1.0,,,,,,,DVD-ROM,1.0,1.0,,,,,,,,,,,,,AC 120/230 V ( 50/60 Hz ),,,,,,1600MHz PC3-12800,1600MHz,,,,,,,0,4 Hot-Swap,2.0,SATA 6Gb/s,,3.0,,,8MB,Hard Drive Not Included,Tower,,,,Intel,,Single,2.0,1.0,ThinkServer RAID 500,1.0,
MSI GP70 Leopard-010 Intel Core i5-4200M 2.5GHz 8GB Memory 1TB HDD NVIDIA Geforce GT 840M (2GB GDDR3) 17.3 Gaming Notebook Windows 8.1 64-bit at TigerDirect.com,,,New,,,,,,,DDR3L,,,,17.3 '',,,,5.95 lbs,,6-Cell Lithium-ion,1TB,Black,Integrated Wireless LAN,10.60 '',Full HD Display,HDD,NVIDIA Geforce GT840M,1x 1TB,1,1.53 '',Yes,Killer Gaming Network,Steel Series Gaming Backlit 102 keys,,,1920 x 1080,SD ( XC/HC ),,Integrated Touchpad,Windows 8.1 64-Bit,DVDRW,,Intel,Core i5,4200M,2.5GHz,,Bluetooth,"[ 1 ] To provide the most accurate specifications , the specifications listed are based upon the manufacturer 's exact model specification as published on the manufacturer 's website , and the manufacturer 's product documentation .",,8GB,,,1,16.45 '',Intel 1x1 Wireless-AC 3160 a/c Integrated Bluetooth 802.11ac 2 - USB 3.0,,,,,Gaming,,,,2 - USB 2.0,1 - Combo Headphone/Microphone Jack,,,,,,,,,,,,,,,,,,,,,,,,,,,2G GDDR3,,,,,,,,,,,,,,,,,,,,,,,,,,,,,,,,,,,,,,,,,,,,,,,,,,,,
"Microsoft Surface Pro 3 Intel Core i5 256GB Storage 12 Tablet, WiFi, Windows 8.1 Pro 64-bit - PS2-00001 at TigerDirect.com",Yes,2 - Front & Rear,New,Intel Core i5-4300U 1.6GHz,7.93 in x 11.5 in x 0.36 in,2160 x 1440,Yes,5MP,1,LPDDR3,Yes,Windows 8.1 Pro,Windows,12 '',256GB,Yes,1.0,1.76 lbs,,,,,,,,,,,,,,,,,,,,,,,,,,,,,,,,,,,,,,,,,,,,,,,,,,,,,,,,,,,,,,,,,,,,,,,,,,,,,,,,,,,,,,,,,,,,,,,,,,,,,,,,,,,,,,,,,,,,,,,,,,,,,,,
"Microsoft Surface 2 Tablet - 10.6 Screen 1920x1080, Multi-Touch, Windows RT 8.1, 32GB, 2GB RAM Memory, USB 3.0, Micro SD card Reader, front and Rear Cameras(Refurbished) - P6W-00001 at TigerDirect.com",Yes,2 - Front & Rear,Refurbished,NVIDIA Tegra 4 Quad-Core,10.81 '' x 6.77 '' x 0.37 '',,,3.5MP,Yes,RAM,Yes,Windows 8.1,Windows,10.6 '',32GB,,1.0,1.49 lbs,,,,,,,,,,,,,,,,,,,,,,,,,,,,,,,,,,,,,,,,,,,,,,,,,,,,,,,,,,,,,,,,,,,,,,,,,,,,,,,,,16 : 9,5.0 MP,Web surfing - up to 10 hours,10.1 '' to 11 '',2 GB,Yes,Multi-touch,1 Micro,,,,,,,,,,,,,,,,,,,,,,,,,,,,,,,,,,,,,,,
ASUS G751JY Intel Core i7 24GB Memory 1TB HDD + 256GB SSD NVIDIA GTX 980M 4GB GDDR5 17.3 Gaming Laptop Windows 8.1 64-bit - G751JY-DH71 at TigerDirect.com,,,New,,,,,,,DDR3L,,,Laptop,17.3 '',,,,8.4 lbs,,8-Cell Lithium-ion,1256GB,,"Integrated LAN , Integrated Wireless LAN , Integrated Bluetooth",12.5 '',Full HD Display,HDD + SSD,NVIDIA GTX 980M,"1x 1TB HDD , 1x 256GB SSD",1,0.9 '',Yes,"RJ-45 Ethernet Connector , IEEE 802.11 ac , Bluetooth",,1 - RJ-45,,1920 x 1080,SD/MMC,,,Windows 8.1 64-Bit,Blu-Ray Burner,,Intel,Core i7,4710HQ,2.5GHz,Quad-Core,"IEEE 802.11ac , Bluetooth v4.0","[ 1 ] To provide the most accurate specifications , the specifications listed are based upon the manufacturer 's exact model specification as published on the manufacturer 's website , and the manufacturer 's product documentation .",,24GB,,,1,16.4 '',,,,,,Gaming,,,,4 - USB 3.0,1 - Headphone/line-out,,,,,,,,,,,,,,,,,,,,,,,,,7200 RPM,,4GB GDDR5,,,,,,,,,,,,,,1 - Microphone input port,,,,,,,,,,,,,,,,,,,,,,,,,,,,,,,,,,,,,,
