author_1,author_2,author_3,author_4,title,venue,year
ada_waichee_fu,king_lum_cheung,,,enhanced nearest neighbour search on the rtree,sigmod record,1998.0
euthimios_panagos,alexandros_biliris,,,eos an extensible object store,sigmod conference,1994.0
fereidoon_sadri,laks_v_s_lakshmanan,iyer_n_subramanian,,schemasql a language for interoperability in relational multidatabase systems,vldb,1996.0
anhai_doan,pedro_domingos,alon_y_halevy,,reconciling schemas of disparate data sources a machinelearning approach,sigmod conference,2001.0
raymond_t_ng,paul_shum,,,optimal clip ordering for multiclip queries,vldb j,1998.0
fabio_casati,mingchien_shan,,,process automation as the foundation for ebusiness,vldb,2000.0
jennifer_widom,,,,research issues in active database systems report from the closing panel at rideads 94,sigmod record,1994.0
richard_t_snodgrass,,,,acm tods in this internet age,sigmod record,2003.0
nikos_mamoulis,dimitris_papadias,vasilis_delis,,algorithms for querying by spatial structure,vldb,1998.0
giuseppe_santucci,tiziana_catarci,,,query by diagram a graphical environment for querying databases,sigmod conference,1994.0
bernhard_mitschang,michael_jaedicke,,,userdefined table operators enhancing extensibility for ordbms,vldb,1999.0
asuman_dogac,,,,guest editors introduction,sigmod record,2002.0
feng_shao,lin_guo,chavdar_botev,jayavel_shanmugasundaram,xrank ranked keyword search over xml documents,sigmod conference,2003.0
richard_t_snodgrass,,,,chairs message,sigmod record,1998.0
rajeev_motwani,serge_abiteboul,svetlozar_nestorov,,infering structure in semistructured data,sigmod record,1997.0
jian_pei,laks_v_s_lakshmanan,yan_zhao,,efficacious data cube exploration by semantic summarization and compression,vldb,2003.0
david_e_culler,joseph_m_hellerstein,david_a_patterson,andrea_c_arpacidusseau,highperformance sorting on networks of workstations,sigmod conference,1997.0
marc_h_scholl,,,,transactional information systems book review,sigmod record,2001.0
atsushi_ohori,peter_buneman,,,polymorphism and type inference in database programming,acm trans database syst,1996.0
m_howard_williams,norman_w_paton,andrew_dinn,maria_l_barja,an effective deductive objectoriented database through language integration,vldb,1994.0
kenneth_a_ross,jun_rao,,,cache conscious indexing for decisionsupport in main memory,vldb,1999.0
reuven_kashi,nathan_s_netanyahu,amihood_amir,,analyzing quantitative databases image is everything,vldb,2001.0
sailesh_krishnamurthy,c_mohan,larry_brown,hamid_pirahesh,dbcache database caching for web application servers,sigmod conference,2002.0
donald_kossmann,konrad_stocker,,,iterative dynamic programming a new class of query optimization algorithms,acm trans database syst,2000.0
douglas_banks,marcel_kornacker,,,highconcurrency locking in rtrees,vldb,1995.0
nabil_r_adam,yelena_yesha,,,electronic commerce tutorial,sigmod conference,1998.0
ahmed_k_elmagarmid,haitao_jiang,,,spatial and temporal contentbased access to hypervideo databases,vldb j,1998.0
claus_hagen,hansjrg_schek,gustavo_alonso,markus_tresch,distributed processing over standalone systems and applications,vldb,1997.0
junghoo_cho,hector_garciamolina,,,synchronizing a database to improve freshness,sigmod conference,2000.0
henry_f_korth,,,,the double life of the transaction abstraction fundamental principle and evolving system concept,vldb,1995.0
christopher_r_palmer,christos_faloutsos,,,density biased sampling an improved method for data mining and clustering,sigmod conference,2000.0
,,,,the tsql2 final language definition announcement,sigmod record,1994.0
pinkwang_eng,kianlee_tan,beng_chin_ooi,,efficient progressive skyline computation,vldb,2001.0
harald_kosch,,,,mpeg7 and multimedia database systems,sigmod record,2002.0
yirong_xu,rakesh_agrawal,amit_somani,,storage and querying of ecommerce data,vldb,2001.0
nick_roussopoulos,yannis_kotidis,,,dynamat a dynamic view management system for data warehouses,sigmod conference,1999.0
martin_strauss,s_muthukrishnan,yannis_kotidis,anna_c_gilbert,how to summarize the universe dynamic maintenance of quantiles,vldb,2002.0
martin_grohe,,,,parameterized complexity for the database theorist,sigmod record,2002.0
michael_j_franklin,,,,editors notes,sigmod record,2000.0
gavin_m_bierman,,,,formal semantics and analysis of object queries,sigmod conference,2003.0
cetin_ozkan,cem_evrendilek,yuksel_saygin,ilker_altintas,metu objectoriented dbms,sigmod conference,1994.0
malcolm_p_atkinson,ronald_morrison,,,orthogonally persistent object systems,vldb j,1995.0
marcin_skubiszewski,patrick_valduriez,,,concurrent garbage collection in o2,vldb,1997.0
ioana_manolescu,stefano_ceri,,,constructing and integrating datacentric web applications method tool and techniques,vldb,2003.0
robert_meersman,amit_p_sheth,,,guest editors introduction,sigmod record,2002.0
gadi_entin,shai_geva,shaul_dar,eran_palmon,dtls dataspot database exploration using plain language,vldb,1998.0
michael_j_franklin,,,,editors notes,sigmod record,1998.0
robert_rees,luisfelipe_cabrera,wayne_hineman,,applying database technology in the adsm mass storage system,vldb,1995.0
kyuyoung_whang,yangsae_moon,ilyeol_song,sang_ho_lee,dynamic buffer allocation in videoondemand systems,sigmod conference,2001.0
wei_wang,haifeng_jiang,hongjun_lu,jeffrey_xu_yu,holistic twig joins on indexed xml documents,vldb,2003.0
alon_y_levy,,,,obtaining complete answers from incomplete databases,vldb,1996.0
martin_staudt,matthias_jarke,,,incremental maintenance of externally materialized views,vldb,1996.0
claudia_bauzer_medeiros,fatima_pires,,,databases for gis,sigmod record,1994.0
dan_suciu,ioana_manolescu,daniela_florescu,alon_y_levy,query optimization in the presence of limited access patterns,sigmod conference,1999.0
mingsyan_chen,philip_s_yu,jong_soo_park,,an effective hash based algorithm for mining association rules,sigmod conference,1995.0
henrique_madeira,marco_vieira,,,a dependability benchmark for oltp application environments,vldb,2003.0
david_b_lomet,,,,high speed online backup when using logical log operations,sigmod conference,2000.0
jiawei_han,,,,towards online analytical mining in large databases,sigmod record,1998.0
kyoji_hirata,yoshinori_hara,wensyan_li,k_seluk_candan,facilitating multimedia database exploration through visual interfaces and perpetual query reformulations,vldb,1997.0
geoffrey_phipps,marcia_a_derr,shinichi_morishita,,the gluenail deductive database system desig implementatio and evaluation,vldb j,1994.0
nick_roussopoulos,mema_roussopoulos,yannis_kotidis,,cubetree organization of and bulk updates on the data cube,sigmod conference,1997.0
marianne_winslett,,,,interview with avi silberschatz,sigmod record,2002.0
chengxiang_zhai,marianne_winslett,yuanyuan_zhou,kevin_chenchuan_chang,database research at the university of illinois at urbanachampaign,sigmod record,2002.0
berthold_reinwald,hamid_pirahesh,,,sql open heterogeneous data access,sigmod conference,1998.0
carole_a_goble,brian_j_read,,,report on the 18th british national conference on databases bncod,sigmod record,2002.0
jeffrey_f_naughton,amit_shukla,prasad_deshpande,,materialized view selection for multidimensional datasets,vldb,1998.0
carlo_combi,giuseppe_pozzi,,,hmap a temporal data model managing intervals with different granularities and indeterminacy from natural language sentences,vldb j,2001.0
bernhard_mitschang,clara_nippl,,,topaz a costbase ruledrive multiphase parallelizer,vldb,1998.0
reza_sadri,amir_m_zarkesh,jafar_adibi,carlo_zaniolo,a sequential pattern query language for supporting instant data mining for eservices,vldb,2001.0
wolfgang_lehner,alexander_hinneburg,dirk_habich,,combioperator database support for data mining applications,vldb,2003.0
vipul_kashyap,stefan_decker,,,the semantic web semantics for data on the web,vldb,2003.0
rafael_alonso,yuhlin_chang,v_s_mani,liviu_iftode,managing video data in a mobile environment,sigmod record,1995.0
yannis_e_ioannidis,minos_n_garofalakis,,,parallel query scheduling and optimization with time and spaceshared resources,vldb,1997.0
michael_freeston,,,,a general solution of the ndimensional btree problem,sigmod conference,1995.0
jim_gray,,,,parallel database systems 101,sigmod conference,1995.0
binto_george,jayant_r_haritsa,,,secure buffering in firm realtime database systems,vldb,1998.0
pinar_koksal,sena_nural_arpinar,asuman_dogac,,workflow history management,sigmod record,1998.0
michael_j_franklin,stanley_b_zdonik,swarup_acharya,rafael_alonso,broadcast disks data management for asymmetric communications environments,sigmod conference,1995.0
mayur_datar,piotr_indyk,s_muthukrishnan,graham_cormode,comparing data streams using hamming norms how to zero in,vldb,2002.0
masatoshi_yoshikawa,shunsuke_uemura,yasushi_sakurai,haruhiko_kojima,the atree an index structure for highdimensional spaces using relative approximation,vldb,2000.0
simonas_saltenis,christian_s_jensen,giedrius_slivinskas,rasa_bliujute,rtree based indexing of nowrelative bitemporal data,vldb,1998.0
richard_t_snodgrass,wei_li,dengfeng_gao,,skew handling techniques in sortmerge join,sigmod conference,2002.0
hanuma_kodavalla,nagavamsi_ponnekanti,,,online index rebuild,sigmod conference,2000.0
alexandros_nanopoulos,yannis_manolopoulos,,,efficient similarity search for market basket data,vldb j,2002.0
divesh_srivastava,ting_yu,h_v_jagadish,laks_v_s_lakshmanan,compressed accessibility map efficient access control for xml,vldb,2002.0
alberto_o_mendelzon,john_keenleyside,denilson_barbosa,kelly_a_lyons,toxgene a templatebased data generator for xml,sigmod conference,2002.0
zachary_g_ives,qiong_luo,,,interviewing during a tight job market,sigmod record,2002.0
jiawei_han,xiaolei_li,benjamin_w_wah,dong_xin,starcubing computing iceberg cubes by topdown and bottomup integration,vldb,2003.0
thomas_zurek,markus_sinnwell,,,datawarehousing has more colours than just black white,vldb,1999.0
marek_rusinkiewicz,dimitrios_georgakopoulos,witold_litwin,,chronological scheduling of transactions with temporal dependencies,vldb j,1994.0
gustav_fahl,tore_risch,,,query processing over object views of relational data,vldb j,1997.0
boris_chidlovskii,uwe_m_borghoff,,,semantic caching of web queries,vldb j,2000.0
curtis_e_dyreson,michael_h_bhlen,christian_s_jensen,,capturing and querying multiple aspects of semistructured data,vldb,1999.0
latha_s_colby,gopal_mulagund,richard_l_cole,craig_j_bunker,aggregate maintenance for data warehousing in informix red brick vista,vldb,2001.0
devashish_worah,souvik_das,ivan_shevchenko,amit_p_sheth,supporting statewide immunisation tracking using multiparadigm workflow technology,vldb,1996.0
daniel_j_abadi,mitch_cherniack,,,visual coko a debugger for query optimizer development,sigmod conference,2002.0
meikel_pss,dmitry_potapov,,,data compression in oracle,vldb,2003.0
munir_cochinwala,john_bradley,,,a multidatabase system for tracking and retrieval of financial data,vldb,1994.0
hector_garciamolina,ramana_yerneni,wilburt_labio,,shrinking the warehouse update window,sigmod conference,1999.0
edward_omiecinski,shamkant_b_navathe,ashok_savasere,,an efficient algorithm for mining association rules in large databases,vldb,1995.0
eric_simon,esther_pacitti,,,update propagation strategies to improve freshness in lazy master replicated databases,vldb j,2000.0
tak_w_yan,hector_garciamolina,,,the sift information dissemination system,acm trans database syst,1999.0
daniel_barbar,,,,special issue on data mining for intrusion detection and threat analysis guest editors introduction,sigmod record,2001.0
prabhakar_raghavan,,,,extracting and exploiting structure in text search,sigmod conference,2003.0
jayant_r_haritsa,vibhuti_s_sengar,,,plastic reducing query optimization overheads through plan recycling,sigmod conference,2003.0
phillip_b_gibbons,minos_n_garofalakis,,,wavelet synopses with error guarantees,sigmod conference,2002.0
chen_li,jeffrey_d_ullman,foto_n_afrati,,generating efficient plans for queries using views,sigmod conference,2001.0
laks_v_s_lakshmanan,jian_pei,yan_zhao,,qctrees an efficient summary structure for semantic olap,sigmod conference,2003.0
norman_w_paton,carole_a_goble,,,information management for genome level bioinformatics,vldb,2001.0
michael_j_franklin,mehmet_altinel,,,efficient filtering of xml documents for selective dissemination of information,vldb,2000.0
arthur_j_bernstein,narayanan_krishnakumar,,,bounded ignorance a technique for increasing concurrency in a replicated system,acm trans database syst,1994.0
arie_segev,,,,editors notes and erratum,sigmod record,1994.0
herb_edelstein,,,,research and products are they relevant to each other panel,sigmod conference,1995.0
leonard_j_seligman,michael_j_carey,,,nsf workshop on industrialacademic cooperation in database systems,sigmod record,1999.0
sorana_rabinovici,john_catozzi,,,operating system extensions for the teradata parallel vldb,vldb,2001.0
liang_huai_yang,mongli_lee,wynne_hsu,,efficient mining of xml query patterns for caching,vldb,2003.0
ravi_krishnamurthy,charles_hoch,nita_goyal,michael_suckow,is gui programming a database research problem,sigmod conference,1996.0
terence_critchlow,,,,report on xewa00 the xml enabled widearea searches for bioinformatics workshop,sigmod record,2001.0
armando_fox,,,,toward recoveryoriented computing,vldb,2002.0
t_v_ashwin,rahul_gupta,sugata_ghosal,,adaptable similarity search using nonrelevant information,vldb,2002.0
james_l_edwards,meridith_a_lane,ebbe_nielsen,,biodiversity informatics the challenge of rapid developmen large database and complex data keynote,vldb,2000.0
anil_kumar,vassilis_j_tsotras,,,temporal database bibliography update,sigmod record,1996.0
mick_j_jordan,susan_spence,laurent_dayns,malcolm_p_atkinson,an orthogonally persistent java,sigmod record,1996.0
yan_zhao,laks_v_s_lakshmanan,jian_pei,,socqet semantic olap with compressed cube and summarization,sigmod conference,2003.0
yahiko_kambayashi,koichi_goto,,,integration of electronic tickets and personal guide system for public transport using mobile terminals,sigmod conference,2003.0
kenneth_a_ross,,,,tail recursion elimination in deductive databases,acm trans database syst,1996.0
maurizio_panti,alberto_giretti,luca_spalazzi,,a casebased approach to information integration,vldb,2000.0
lyman_do,pamela_drew,prabhu_ram,,distributed transactions in practice,sigmod record,1999.0
zhaohui_tang,fei_sha,georges_gardarin,,calibrating the query optimizer cost model of irod an objectoriented federated database system,vldb,1996.0
elisa_bertino,ahmed_k_elmagarmid,mohandsaid_hacid,,quality of service in multimedia digital libraries,sigmod record,2001.0
jeanchristophe_r_pazzaglia,chiara_biancheri,gavino_paddeu,,eiha deploying web and wap services using xml technology,sigmod record,2001.0
swarup_acharya,viswanath_poosala,phillip_b_gibbons,sridhar_ramaswamy,join synopses for approximate query answering,sigmod conference,1999.0
martin_van_den_berg,soumen_chakrabarti,byron_dom,,distributed hypertext resource discovery through examples,vldb,1999.0
george_colliat,,,,data management challenges in crm,sigmod conference,2003.0
andrew_eisenberg,jim_melton,,,sql standardization the next steps,sigmod record,2000.0
miron_livny,raghu_ramakrishnan,donko_donjerkovic,shilpa_lawande,devise integrated querying and visualization of large datasets,sigmod conference,1997.0
jeffrey_f_naughton,amit_shukla,karthikeyan_ramasamy,prasad_deshpande,storage estimation for multidimensional aggregates in the presence of hierarchies,vldb,1996.0
bernhard_seeger,dimitris_papadias,greg_fu,yufei_tao,an optimal and progressive algorithm for skyline queries,sigmod conference,2003.0
steffen_staab,rudi_studer,york_sure,,methodology for development and employment of ontology based knowledge management applications,sigmod record,2002.0
alin_dobra,johannes_gehrke,rajeev_rastogi,minos_n_garofalakis,processing complex aggregate queries over data streams,sigmod conference,2002.0
felipe_cabrera,,,,web services industrial session,vldb,2003.0
chris_clifton,svetlozar_nestorov,rajeev_motwani,shalom_tsur,query flocks a generalization of associationrule mining,sigmod conference,1998.0
maxim_lifantsev,tzicker_chiueh,,,ioconscious data preparation for largescale web search engines,vldb,2002.0
richard_t_snodgrass,,,,reminiscences on influential papers,sigmod record,1999.0
jing_chen,louxin_zhang,limsoon_wong,,a protein patent query system powered by kleisli,sigmod conference,1998.0
abraham_silberschatz,stanley_b_zdonik,,,database systems breaking out of the box,sigmod record,1997.0
andreas_meier,,,,providing database migration tools a practicioners approach,vldb,1995.0
panos_k_chrysanthis,krithi_ramamritham,,,synthesis of extended transaction models using acta,acm trans database syst,1994.0
joseph_m_hellerstein,mehul_a_shah,marcel_kornacker,,amdb an access method debugging tool,sigmod conference,1998.0
juan_loaiza,ashok_joshi,tirthankar_lahiri,william_bridge,checkpointing in oracle,vldb,1998.0
,,,,titl forewor vldb journal to be published electronicall index vol 4,vldb j,1995.0
martin_staudt,yannis_vassiliou,manfred_a_jeusfeld,stella_gatziu,design and management of data warehouses report on the dmdw99 workshop,sigmod record,1999.0
ramakrishnan_srikant,rakesh_agrawal,alexandre_v_evfimievski,,information sharing across private databases,sigmod conference,2003.0
jeffrey_f_naughton,ambuj_shatdal,,,adaptive parallel aggregation algorithms,sigmod conference,1995.0
jayant_sharma,kothuri_venkata_ravi_kanth,jay_banerjee,siva_ravada,indexing mediumdimensionality data in oracle,sigmod conference,1999.0
jennifer_widom,hector_garciamolina,yue_zhuge,joachim_hammer,view maintenance in a warehousing environment,sigmod conference,1995.0
richard_t_snodgrass,,,,chairs message,sigmod record,1999.0
vincent_oria,benjamin_bin_yao,shu_lin,paul_iglinski,disima a distributed and interoperable image database system,sigmod conference,2000.0
laurent_mignet,amlie_marian,gregory_cobena,serge_abiteboul,changecentric management of versions in an xml warehouse,vldb,2001.0
rajeev_rastogi,kyuseok_shim,minos_n_garofalakis,,spirit sequential pattern mining with regular expression constraints,vldb,1999.0
sunita_sarawagi,,,,useradaptive exploration of multidimensional data,vldb,2000.0
sang_hyuk_son,rasikan_david,bhavani_m_thuraisingham,,improving timeliness in realtime secure database systems,sigmod record,1996.0
dan_suciu,hartmut_liefke,,,an extensible compressor for xml data,sigmod record,2000.0
daniel_barbar,hector_garciamolina,,,the demarcation protocol a technique for maintaining constraints in distributed database systems,vldb j,1994.0
mitch_cherniack,stanley_b_zdonik,nesime_tatbul,ugur_etintemel,monitoring streams a new class of data management applications,vldb,2002.0
jignesh_m_patel,jiebing_yu,navin_kabra,david_j_dewitt,clientserver paradise,vldb,1994.0
laurent_vieille,,,,from data independence to knowledge independence an ongoing story,vldb,1998.0
dirk_dllmann,,,,petabyte databases,sigmod conference,1999.0
vasilis_vassalos,yannis_papakonstantinou,,,query rewriting for semistructured data,sigmod conference,1999.0
csar_a_galindolegaria,arnon_rosenthal,,,outerjoin simplification and reordering for query optimization,acm trans database syst,1997.0
richard_t_snodgrass,,,,reminiscences on influential papers,sigmod record,1998.0
hanan_samet,aya_soffer,,,integrating symbolic images into a multimedia database system using classification and abstraction approaches,vldb j,1998.0
bernhard_seeger,jenspeter_dittrich,jochen_van_den_bercken,,javaxxxl a prototype for a library of query processing algorithms,sigmod conference,2000.0
clark_d_french,,,,one size fits all database architectures do not work for dds,sigmod conference,1995.0
marianne_winslett,,,,interview with david maier,sigmod record,2002.0
prasanna_ganesan,sunita_sarawagi,surajit_chaudhuri,,factorizing complex predicates in queries to exploit indexes,sigmod conference,2003.0
krithi_ramamritham,panos_k_chrysanthis,,,a taxonomy of correctness criteria in database applications,vldb j,1996.0
ling_liu,,,,editors notes,sigmod record,2003.0
karl_aberer,,,,book review column,sigmod record,2002.0
jiawei_han,liangyou_chen,jian_pei,ying_lu,dnaminer a system prototype for mining dna sequences,sigmod conference,2001.0
prakash_ramanan,,,,efficient algorithms for minimizing tree pattern queries,sigmod conference,2002.0
john_l_schnase,,,,research directions in biodiversity informatics,vldb,2000.0
patricia_g_selinger,,,,information integration and xml in ibms db2,vldb,2002.0
mayank_bawa,sergio_marti,sepandar_d_kamvar,brian_cooper,peertopeer research at stanford,sigmod record,2003.0
arjan_loeffen,,,,text databases a survey of text models and systems,sigmod record,1994.0
pavan_deolasee,amol_katkar,krithi_ramamritham,ankur_panchbudhe,dissemination of dynamic data,sigmod conference,2001.0
yixin_ruan,kianlee_tan,jason_chionh,lidan_shou,walking through a very large virtual environment in realtime,vldb,2001.0
fabio_casati,daniela_grigori,umeshwar_dayal,mingchien_shan,improving business process quality through exception understandin predictio and prevention,vldb,2001.0
ratko_orlandic,craig_swietlik,jack_lukaszuk,,the design of a retrieval technique for highdimensional data on tertiary storage,sigmod record,2002.0
tam_nguyen,v_srinivasan,,,accessing relational databases from the world wide web,sigmod conference,1996.0
,,,,highperformance and scalability through application tie inmemory data management,vldb,2000.0
eugene_j_shekita,david_e_simmen,timothy_malkemus,,fundamental techniques for order optimization,sigmod conference,1996.0
george_a_mihaila,louiqa_raschid,anthony_tomasic,,locating and accessing data repositories with websemantics,vldb j,2002.0
kyuyoung_whang,gunter_schlageter,amr_el_abbadi,,guest editorial,vldb j,2001.0
s_sudarshan,charu_c_aggarwal,mihalis_yannakakis,alfons_kemper,reminiscences on influential papers,sigmod record,2000.0
luc_segoufin,philippe_rigaux,stphane_grumbach,,the dedale system for complex spatial queries,sigmod conference,1998.0
bjrn_r_jnsson,shaul_dar,divesh_srivastava,michael_tan,semantic data caching and replacement,vldb,1996.0
mitch_cherniack,stanley_b_zdonik,,,inferring function semantics to optimize queries,vldb,1998.0
david_b_lomet,,,,the evolution of effective btree page organization and techniques a personal account,sigmod record,2001.0
d_wildfogel,ramana_yerneni,,,efficient testing of high performance transaction processing systems,vldb,1997.0
peter_a_boncz,martin_l_kersten,stefan_manegold,,generic database cost models for hierarchical memory systems,vldb,2002.0
nectaria_tryfona,thanasis_hadzilacos,,,an extended entityrelationship model for geographic applications,sigmod record,1997.0
shlomo_moran,ronny_lempel,,,optimizing result prefetching in web search engines with segmented indices,vldb,2002.0
michael_lesk,,,,experiments on access to digital libraries how can images and text be used together,vldb,1994.0
james_r_hamilton,limsoon_wong,kenneth_a_ross,laks_v_s_lakshmanan,reminiscences on influential papers,sigmod record,2001.0
sharad_mehrotra,,,,ensuring consistency in multidatabases by preserving twolevel serializability,acm trans database syst,1998.0
michael_j_carey,anil_nori,nelson_mendona_mattos,,objectrelational database systems principle product and challenges tutorial,sigmod conference,1997.0
alexandros_biliris,euthimios_panagos,,,synchronization and recovery in a clientserver storage system,vldb j,1997.0
brad_adelberg,hector_garciamolina,ben_kao,,applying update streams in a soft realtime database system,sigmod conference,1995.0
alexander_brodsky,pavel_a_exarkhopoulo,victor_e_segal,jia_chen,the ccube constraint objectoriented database system,sigmod conference,1999.0
joseph_m_hellerstein,,,,index research forest or trees panel abstract,sigmod conference,2000.0
susanne_englert,,,,nonstop sql scalability and availability for decision support,sigmod conference,1994.0
arunprasad_p_marathe,kenneth_salem,,,query processing techniques for arrays,vldb j,2002.0
asterio_k_tanaka,patrick_valduriez,,,the ecobase project database and web technologies for environmental information systems,sigmod record,2001.0
alfons_kemper,florian_matthes,donald_kossmann,,sap r3 a database application system tutorial,sigmod conference,1998.0
edwin_r_lassettre,,,,olympic records for data at the 1998 nagano games,sigmod conference,1998.0
m_toiati,michele_missikoff,,,mosaico a system for conceptual modeling and rapid prototyping of objectoriented database application,sigmod conference,1994.0
michael_j_franklin,yanlei_diao,,,query processing for highvolume xml message brokering,vldb,2003.0
joachim_hammer,,,,treasurers message,sigmod record,2002.0
m_tamer_zsu,,,,chairs message,sigmod record,2002.0
stephen_blott,henry_f_korth,,,an almostserial protocol for transaction execution in mainmemory database systems,vldb,2002.0
jiawei_han,ke_wang,yu_he,,mining frequent itemsets using support constraints,vldb,2000.0
edward_maros,darrel_j_van_buer,marjorie_templeton,herbert_henley,interviso dealing with the complexity of federated database access,vldb j,1995.0
jos_a_blakeley,,,,open object database management systems,sigmod conference,1994.0
ernest_teniente,elena_baralis,stefano_paraboschi,,materialized views selection in a multidimensional database,vldb,1997.0
donald_kossmann,michael_j_carey,,,on saying enough already in sql,sigmod conference,1997.0
mark_l_mcauliffe,c_k_tan,marvin_h_solomon,nancy_e_hall,shoring up persistent applications,sigmod conference,1994.0
michael_stonebraker,nesime_tatbul,mitch_cherniack,stanley_b_zdonik,load shedding in a data stream manager,vldb,2003.0
tova_milo,mariano_p_consens,,,optimizing queries on files,sigmod conference,1994.0
johannes_gehrke,venkatesh_ganti,raghu_ramakrishnan,,rainforest a framework for fast decision tree construction of large datasets,vldb,1998.0
donko_donjerkovic,raghu_ramakrishnan,,,probabilistic optimization of top n queries,vldb,1999.0
paul_brown,michael_stonebraker,,,bigsur a system for the management of earth science data,vldb,1995.0
