#,Title,Pages
1,"Anyway, I Want to Have Sex With a Trap Elf! / とにかく俺は男の娘エルフとエッチがしたいんだ!!",29
2,"Anyway, I Want To Have Sex With a Shota-Elf! / それでも俺はショタエルフとエッチがしたいんだ!!",29
3,I Still Want to Have More Sex With a Bitch Mesu-Shota Elf! / まだまだ俺はビッチなメスショタエルフとエッチがしたいんだ!!,33
4,I Still Want to Have Sex With a Trap Elf Anytime! / いつでも俺はオトコノコエルフとエッチがしたいんだ!!!,58
5,What if a Trap Elf Came to My House / もしも男の娘エルフが我が家に来たら,36
6,Tatoeba Shota Elf ga Wagaya ni Kitara / たとえばショタエルフが我が家に来たら,36
7,Soshite Bitchna Mesu-Shota Elf ga Wagaya ni Kitara / そしてビッチなメスショタエルフが我が家に来たら,37
