Buy Canon IXUS 155 Digital Camera in Blue from CamBuy in Sydney,,,Yes,,,Yes,,,,,,,,,,,,,95.3 x 56.8 x 23.7 mm,,,,,,+/- 2 EV in 1/3 stop increments. Enhanced i-Contrast for automatic dynamic range correction,,,,,,,,,,,,,,,,,,,,,,,,,,,,,,,,,,,,,,,,,,,Approx. 2 or 10 sec. or Custom,,,,,,,,,"TTL DIGIC 4+ with iSAPS technology 1/2.3 type CCD sRGB SD, SDHC, SDXC TTL",,,Approx. 142 g (including battery/batteries and memory card),,,,,,,,,,,,,,,,,,,,,,,,,,,,"Evaluative (linked to Face Detection AF frame), Centre-weighted average, Spot (centre)",,,"Auto (including Face Detection WB), Daylight, Cloudy, Tungsten, Fluorescent, Fluorescent H, Custom",,,,,,,,,,,,9 elements in 7 groups (1 double-sided aspherical lens),Approx. 0.8 shots/sec.¹ (until memory card becomes full)²,,,,,,,,4.3 – 43.0 mm (35 mm equivalent: 24 – 240 mm),,,,,,,,,,,,,"6.8 cm (2.7"") LCD (TFT), Approx. 230,000 dots",,,,,,,,,,,,1 – 1/2000 sec. (factory default) 15 – 1/2000 sec. (total range – varies by shooting mode),,,,,,,,,Yes,,"Single, Continuous (Auto mode only), Servo AF/AE, Tracking AF¹",,,Rechargeable Li-ion Battery NB-11LH (battery and charger supplied),,,Approx. 230 shots Eco Mode: Approx. 310 shots Approx. 300min. playback,,,ImageBrowser EX,,,,Canon SELPHY Compact Photo Printers and Canon Inkjet Printers supporting PictBridge,,,Primary Colour,,"Hi-Speed USB (MTP, PTP) dedicated connector (Mini-B compatible)",Approx. 100%,,,,,,,,"Single, Continuous, Self-Timer",Approx. 20.0M,,,,,,,Canon High Power Flash HF-DC2,,"Face Detection FE, Smart Flash Exposure",Yes,,,,,,Yes,,,,"4:3 - (L) 5152 x 3864, (M1) 3648 x 2736, (M2) 2048 x 1536, (S) 640 x 480, (W) 5152 x 2896 Resize in playback (M2, S)",,,,,,,,,"English, German, French, Dutch, Danish, Finnish, Italian, Norwegian, Swedish, Spanish, Simplified Chinese, Chinese (traditional), Japanese, Russian, Portuguese, Korean, Greek, Polish, Czech, Hungarian, Turkish, Thai, Arabic, Ukrainian, Romanian, Farsi, Malaysian, Hindi, Indonesian, Vietnamese, Hebrew",,,,"Auto, Manual Flash On / Off, Slow Synchro Smart Auto (32 scenes detected), P, Portrait, Live View Control, FaceSelf-Timer, Low Light (5.0 MP), Fish-eye Effect, Miniature Effect, Toy Camera Effect, Monochrome, Super Vivid, Poster Effect, Snow, Fireworks, Long Shutter",(HD) Up to 4 GB or 29 min. 59 sec.¹ (L) up to 4 GB or 1 hour²,,,"0 – 40 °C, 10 – 90% humidity","Camera Window PhotoStitch A/V output, dedicated connector (PAL/NTSC) Canon AV Cable AVC-DC400",Yes,,Approx. 2x – 10x,,AC Adapter Kit ACK-DC90,,,Yes,,,,,,,"JPEG compression, (Exif 2.3 [Exif Print] compliant) / Design rule for Camera File system, Digital Print Order Format [DPOF] Version 1.1 compliant",,,,,,,,,"AiAF (Face Detection / 9-point), 1-point AF (fixed to centre)","AUTO, 100, 200, 400, 800, 1600","Windows 8, 8.1 / 7 SP1 / Vista SP2 / XP SP3 Mac OS X 10.7, 10.8, 10.9",,,,,,,,,,,,,,,,,,,,,,,,,,,,,,,,,,,,,,,,,,,,,,,,,,,,,,"Optional, AC Adapter Kit ACK-DC90",Adjustable to one of five levels. Quick-bright LCD,50cm – 4.0 m (W) / 1.0 – 2.0 m (T),Soft Case DCC-1370 Soft Case DCC-1320,1 cm (W) from front of lens in macro,Fine,,,"Yes (lens shift-type), approx. 2.5-stop¹. Intelligent IS plus Enhanced Dynamic IS",,f/3.0 – f/6.9,"Smart Auto (21 scenes detected), P, Portrait, Miniature Effect, Monochrome, Super Vivid, Poster Effect, Snow, Fireworks","(HD) 1280 x 720, 25 fps, (L) 640 x 480, 30 fps Miniature Effect (HD) 5fps, 2.5fps, 1.25 fps Miniature Effect (L) 6fps, 3fps, 1.5 fps MOV [H.264 + Linear PCM (monaural) ]",,"Yes, during shooting and playback",Yes. Fastest speed 1/2000 sec.,Optical 10x ZoomPlus 20x Digital Approx. 4x Combined Approx. 40x¹,Canon High Power Flash HF-DC2,,,,,,,,,,,,,,,,,,,,,,,,,,,,,,,,,,,,,,,,,,,,,,,,,,,,,,,,,,,,,,,,,,,,,,,,,,,,,,,,,,,,,,,,,,,,,,,,,,,,,,,,,,,,,,,,,,,,,,,,,,,,,,,,,,,,,,,,,,,,,,,,,,,,,,,,,,,,,,,,,,,,,,,,,,,,,,,,,,,,,,,,,,,,,,,,,,,,,,,,,,,,,,,,,,,,,,,,,,,,,,,,,,,,,,,,,,,,,,,,,,,,,,,,,,,,,,,,,,,,,,,,,,,,,,,,,,,,,,,,,,,,,,,,,,,,,,,,,,,,,,,,,,,,,,,,,
Buy Ricoh WG-4 Digital Camera in Silver from CamBuy in Sydney,,,,,,,,,,,,,,,,,,"approx. 7.2x
Intelligent zoom: approx. 6x at 7M and 28.8 x at 640 (including optical zoom)",,,,,,,,,,,,,,,,,,,,,,,,,,,,,,,,,,,,,,,,,,,,,,,,,,,,,,,,,,Total 16.79 MP,"3.0’’ wide-TFT color LCD, Wide viewing 170°, AR Coating (LCD Cover only), with protection acrylic cover LCD frame rate: approx. 60 Integrated auto flash control TTL contrast detection auto focus system 1/2.3"" CMOS",,,209g (unloaded) 229g (with battery & SD card),"Auto, Daylight, Shade, Tungsten light, Fluorescent light (D:Daylight Color, N:Daylight White, W:White Light), Manual",,,,,,,,,,,,,,,,,,,,,,,,,,,,,,,,,,,,,,,Aperture: F2.0(W) - F4.9(T) Smallest aperture: F11.3(W)-F18.5(T),,,"RICOH lens, 9 elements in 7 groups (4 aspherical elements)",,,,,,,,,"4.5 - 18mm, approx. 25 - 100mm in 35mm",,,,,,,,"Video output (NTSC/PAL) USB 2.0 (Hi-Speed), USB/AV terminal, HDMI terminal (Type D) (Micro) port",,,,,,,"Full HD 1920 (1920x1080) : approx. 30fps, HD 1280 (1280x720), approx. 60/30fps, Quality: level Fixed Shake reduction: Movie SR mode",,,,,,,,,,1/4000 - 1/4sec (Mechanical and electronic shutter) 1/2000- 4sec (Night Scene mode setting),,,,,,,,,,,,,,,,,,,,,,,,,,,,,,,,,,,,,,,Approx. 16.0 megapixels,,,,,,,,,,,,,,,,,,,,,,,,,,,,,,,"Multi-segment metering, Centre-weighted metering, Spot AE metering",,"Flash-on and Flash-off modes ""Red-eye"" compensation function with pre-discharge Drives modes:
One shot, Self-timer (10 sec, 2 sec, Remote Control (immediately, 3 sec)), Continuous Shooting, Burst Shooting, Remote Control, Auto Bracketing Image Tone: Bright, Natural, Monochrome, Remote control compatible, receivers located in the front and back of the camera",,,,,,,,,,,,,,,,,,,,,,,,,,,,,,,,,,,,,,,,,,,,,,,,,,,,,,"Photo format : JPEG (Exif 2.3), DCF 2.0, DPOF, PRINT Image Matching III Video format : MPEG-4 AVC/H.264 Audio : Movie/Underwater, Movie/Time-Lapse, Movie/1cm- Macro Movie, 32KHz, 16bit Stereo High Speed Movie: 8 KHz, 16 bit, stereo",,,,,,,,,,,,,,,,,,,,"Slideshow, Image Rotation, Small Face Filter, Ink Rubbing Filter, Collage, Digital Filter (B&W/Sepia, Toy Camera, Retro, Color, Extract Color, Color Emphasis, High Contrast, Starburst, Soft, Fish-eye, Brightness, Miniature), HDR Filter, Original Frame, Movie Edit, Red-eye Edit, Resize, Cropping, Image Copy, Protect, DPOF, Start-up Screen",,,,,,,,,,,,,,,,,,,,,,,,,,,,,,,,,,,,4x,,,,,,,,,,,,"Waterproof, dust, sand, crash, cold, pressure proof digital compact",,,,,,,,,,,,,,,,,,,,,,,,,,,,,,,,,,,,,,,,,,,,,,,,,,,,,,,,,,,,,,,,,,,,,,,,,,,,,,,,,,,,,,,,,,,,,,,,,,,,,,,,,,,,,,,,,,,,,,,,,,,,,,,,,,,,,,,,,,,,,,,,,,,,,,,,,,,,,,,,,,,,,,,,,,,,,,,,,,,,,,,,,,,,,"Exposure Modes:
Auto Picture, Program, Shutter Priority, USER, HDR, Handheld Night Snap, Movie, Digital Microscope, Landscape, Flower, Portrait, Interval Shot, Underwater, Underwater Movie, Interval Movie, High Speed movie, Time-Lapse movie, 1cm-Macro Movie, Digital SR, Surf & Snow, Kids, Pet, Sport, Night Scene, Night Scene Portrait, Fireworks, Food, Report, Green Auto picture Scene Modes:
Landscape, Portrait, Night Scene, Night Scene Portrait, Standard, Flower, Sport, Candlelight, Blue Sky, Sunset, Text, Group Photo, Pet, Portrait & Blue Sky, Portrait & Sunset, Portrait & Backlight",,,,,,,,,,,,,,,,,,,,,,,,"Auto, Manual (ISO 125 - 6400) Auto ISO range: ISO 125-200, ISO 125-400, ISO 125-800, ISO 125-1600, ISO 125-3200, ISO 125-6400
Fixed at ISO 125-1600 in Green mode.
Fixed at ISO 125-200, 125-400, 125-400, 125-1600 in Handheld Night Snap mode.
Fixed at ISO 125-6400 in Report mode.",,,,,,,,,,,,,,,,,,,,,,,,,,,,,,,,,,,,,,,,,,,,,,,,,,,,,,,,,,,,,,,,,,,,,,,,,,,,,,,,
Buy Canon PowerShot SX60 HS Digital Camera from CamBuy in Sydney,,,"Yes, via customisable buttons",,,"Yes, via customisable buttons",,,,,,,,,,,,,,,,,,,+/- 3 EV in 1/3 stop increments Manual and automatic dynamic range correction Automatic shadow correction,,,,,,,,,,,,,,,,,,,,,,,,,,,,,,,,,,,,,,,,,,,"Approx. 2 or 10 sec., Custom",,,,,,,,,"sRGB TTL 1/2.3 type back-illuminated CMOS TTL DIGIC 6 with iSAPS technology SD, SDHC, SDXC (UHS Speed Class 1 compatible)",,,Approx. 650 g (including battery and memory card),,,,,,,,,,,,,,,,,,,,,,,,,,,,"Evaluative (linked to Face Detection AF frame), Centre-weighted average, Spot (centre or linked to Face Detection AF or FlexiZone AF frame)",,,"Auto (including Face Detection WB), Daylight, Shade, Cloudy, Tungsten, Fluorescent, Fluorescent H, Flash, Custom 1, Custom 2 Multi-area WB correction available in Smart Auto White Balance Compensation",,,,,,,,,,,,15 elements in 11 groups (1 double sided aspherical lens and 3 UD lenses),Approx. 6.4 shots/sec until memory card becomes full¹ with AF: Approx. 3.8 shots/sec²³ with Live View: Approx. 4.6 shots/sec²³,,,,,,,,3.8 – 247.0 mm (35 mm equivalent: 21 – 1365 mm),,,,,,,,,,,,,"Vari-angle 7.5 cm (3.0”) PureColor II VA (TFT), Approx. 922,000 dots",,,,,,,,,,,,1 – 1/2000 sec. (factory default) 15 – 1/2000 sec. (total range – varies by shooting mode),,,,,,,,1/3 – 2 EV in 1/3 stop increments,Yes,,"Single, Continuous, Servo AF/AE¹, Tracking AF","Manual selection using FlexiZone AF/AE, Size (Normal, Small)",,Rechargeable Li-ion Battery NB-10L (battery and charger supplied),,,Approx. 340 shots Eco mode approx. 450 shots Approx. 360 min. playback,,,ImageBrowser EX,,,,Canon SELPHY Compact Photo Printers and Canon Inkjet Printers supporting PictBridge,,,Primary Colour,,"Hi-Speed USB (MTP, PTP) DIGITAL connector",Approx. 100%,,,,127.6 x 92.6 x 114.3 mm,Yes,,,"Single, Auto Drive, Continuous, Continuous with AF, Self-Timer",Approx. 16.1M¹,,,,,,,"Canon Speedlite (including 270EX, 270EX II, 320EX, 430EX II, 580EX II, 600EX, 600EX-RT¹) Speedlite Transmitter ST-E2, Speedlite bracket SB-E2, Off-Camera Shoe Cord OC-E3",,"+/- 2 EV in 1/3 stop increments. Face Detection FE, Safety FE, Smart Flash Exposure","Yes, via customisable buttons",,,,,,"Yes, live histogram",,,,"4:3 - (RAW, L) 4608 x 3456, (M1) 3264 x 2448, (M2) 2048 x 1536, (S) 640 x 480 16:9 - (RAW, L) 4608 x 2592, (M1) 3264 x 1832, (M2) 1920 x 1080, (S) 640 x 360 3:2 - (RAW, L) 4608 x 3072, (M1) 3264 x 2176, (M2) 2048 x 1368, (S) 640 x 424 1:1 - (RAW, L) 3456 x 3456, (M1) 2448 x 2448, (M2) 1536 x 1536, (S) 480 x 480 4:5 - (RAW, L) 2768 x 3456, (M1) 1952 x 2448, (M2) 1232 x 1536, (S) 384 x 480 Resize in playback (M2, S)",Yes,,,,"Lens Hood LH-DC90 Filter Adapter FA-DC67A (Compatible with Canon 67mm Filters: Circular Polarizing PL-C B, Protect Filter)",,"Yes, plus MF Peaking",,"English, German, French, Dutch, Danish, Finnish, Italian, Greek, Norwegian, Portuguese, Russian, Swedish, Spanish, Ukrainian, Polish, Czech, Hungarian, Turkish, Simplified Chinese, Chinese (traditional), Japanese, Korean, Thai, Arabic, Romanian, Farsi, Hindi, Malay, Indonesian, Vietnamese, Hebrew",,,,"Auto, Manual Flash On / Off, Slow Synchro Smart Auto (58 scenes detected), Program AE, Shutter priority AE, Aperture priority AE, Manual, Custom 1, Custom 2, Hybrid Auto, Creative Shot, Sports, SCN (Portrait, Smart Shutter (Smile, Wink Self-Timer, FaceSelf-Timer), Handheld Night Scene, Low Light (4.0MP), Snow, Fireworks), Creative Filters (High Dynamic Range, Fish-eye Effect, Miniature Effect, Toy Camera Effect, Soft Focus, Monochrome, Super Vivid, Poster Effect), Movie",(Full HD & HD) Up to 4 GB or 29 min. 59 sec.¹ (L and M) Up to 4 GB or 1 hour² (Super Slow Motion Movie) Approx. 30 sec.,,,"0 – 40 °C, 10 – 90% humidity",HDMI Mini Connector A/V output (PAL/NTSC) External microphone (3.5 mm Stereo mini jack) Interface cable IFC-400PCU Canon AV cable AVC-DC400ST Canon HDMI Cable HTC-100 CameraWindow PhotoStitch Map Utility,Yes (via USB or Wireless LAN),,Approx. 2x – 10x,,"AC Adapter Kit ACK-DC80, Battery Charger CB-2LCE",,,Yes,,Yes,,,,,"JPEG compression (Exif 2.3 [Exif Print] compliant) / Design rule for Camera File system and DPOF ver. 1.1 compliant), RAW, RAW+JPEG",,"EVF (0.17 type), 4:3 aspect ratio, approx. 922,000 dots",,,,,,,,"100, 125, 160, 200, 250, 320, 400, 500, 640, 800, 1000, 1250, 1600, 2000, 2500, 3200 AUTO ISO: 100 - 3200 (possible to set Max. ISO speed and rate of change)",Windows 8 / 8.1 / 7 SP1 Mac OS X 10.8 / 10.9 For Wi-Fi connection to a PC: Windows 8 / 8.1 / 7 SP1 Mac OS X 10.8.2 or later / 10.9,,,,,,,,,,,,,,,,,,,,,,,,,,,,,,,,,,,,,,,,,,,,,,,,,,,,,,"Optional, AC Adapter Kit ACK-DC80",Adjustable to one of five levels. Quick-bright LCD,50 cm – 5.5 m (W) / 1.8 m – 3.0 m (T),Soft Case DCC-850 PowerShot Neck Strap NS-100 PowerShot Accessory Organizer,0 cm (W) from front of lens in Macro,"RAW, Superfine, Fine","Wireless LAN (IEEE802.11b/g/n), (2.4 GHz only), with NFC support¹",GPS via mobile (linked to a compatible smartphone),"Yes (lens shift-type), approx. 3.5-stop¹. Intelligent IS with 5-axis Enhanced Dynamic IS","3 levels with internal flash (up to 19 levels with external EX Speedlite 270EX II, 320EX and 430EX II. 22 levels with 580EX II, 600EX and 600EX-RT¹)",f/3.4-f/6.5,"Smart Auto (21 scenes detected), Standard, Program AE, Manual, Portrait, Miniature Effect, Monochrome, Super Vivid, Poster Effect, Snow, Fireworks, iFrame Movie, Super Slow Motion Movie","(Full HD) 1920 x 1080, 60 fps / 30 fps (HD) 1280 x 720, 30 fps (L) 640 x 480, 30 fps Super Slow Motion Movie (L) 640 x 480, 120 fps, (M) 320 x 240, 240 fps Miniature Effect (HD, L) 6 fps, 3 fps, 1.5 fps Hybrid Auto (HD) 30 fps iFrame Movie (Full HD) 30 fps MP4 [Video: MPEG-4 AVC / H.264, Audio: MPEG-4 AAC-LC (stereo) recording level can be manually adjusted by user] iFrame","My Colors (My Colors Off, Vivid, Neutral, Sepia, Black & White, Positive Film, Lighter Skin Tone, Darker Skin Tone, Vivid Blue, Vivid Green, Vivid Red, Custom Color)","Yes, during shooting and playback",Yes. Fastest speed: 1/2000 sec. (built-in flash) 1/250 sec. (external flash) 1/2000 sec. (external flash using high-speed synchro),Optical 65x ZoomPlus 130x Digital Approx. 4x (with Digital Tele-Converter approx. 1.6x or 2.0x¹). Combined approx. 260x,E-TTL with EX Speedlite range¹,,,,,,,,,,,,,,,,,,,,,,,,,,,,,,,,,,,,,,,,,,,,,,,,,,,,,,,,,,,,,,,,,,,,,,,,,,,,,,,,,,,,,,,,,,,,,,,,,,,,,,,,,,,,,,,,,,,,,,,,,,,,,,,,,,,,,,,,,,,,,,,,,,,,,,,,,,,,,,,,,,,,,,,,,,,,,,,,,,,,,,,,,,,,,,,,,,,,,,,,,,,,,,,,,,,,,,,,,,,,,,,,,,,,,,,,,,Yes,Digital Photo Professional for RAW development,My Menu customisation available,Image tagging feature,,,,,,,,,,,,,,,,,,,,,,,,,,,,,,,,,,,,,,,,,,,,,,,,,,,,,,,,,,,,,,,,,,,,,,,,,,,,
Buy Ricoh WG-4 Digital Camera in Lime Yellow from CamBuy in Sydney,,,,,,,,,,,,,,,,,,"approx. 7.2x
Intelligent zoom: approx. 6x at 7M and 28.8 x at 640 (including optical zoom)",,,,,,,,,,,,,,,,,,,,,,,,,,,,,,,,,,,,,,,,,,,,,,,,,,,,,,,,,,Total 16.79 MP,"3.0’’ wide-TFT color LCD, Wide viewing 170°, AR Coating (LCD Cover only), with protection acrylic cover LCD frame rate: approx. 60 Integrated auto flash control 1/2.3"" CMOS TTL contrast detection auto focus system",,,209g (unloaded) 229g (with battery & SD card),"Auto, Daylight, Shade, Tungsten light, Fluorescent light (D:Daylight Color, N:Daylight White, W:White Light), Manual",,,,,,,,,,,,,,,,,,,,,,,,,,,,,,,,,,,,,,,Aperture: F2.0(W) - F4.9(T) Smallest aperture: F11.3(W)-F18.5(T),,,"RICOH lens, 9 elements in 7 groups (4 aspherical elements)",,,,,,,,,"4.5 - 18mm, approx. 25 - 100mm in 35mm",,,,,,,,"Video output (NTSC/PAL) USB 2.0 (Hi-Speed), USB/AV terminal, HDMI terminal (Type D) (Micro) port",,,,,,,"Full HD 1920 (1920x1080) : approx. 30fps, HD 1280 (1280x720), approx. 60/30fps, Quality: level Fixed Shake reduction: Movie SR mode",,,,,,,,,,1/4000 - 1/4sec (Mechanical and electronic shutter) 1/2000- 4sec (Night Scene mode setting),,,,,,,,,,,,,,,,,,,,,,,,,,,,,,,,,,,,,,,Approx. 16.0 megapixels,,,,,,,,,,,,,,,,,,,,,,,,,,,,,,,"Multi-segment metering, Centre-weighted metering, Spot AE metering",,"Drives modes:
One shot, Self-timer (10 sec, 2 sec, Remote Control (immediately, 3 sec)), Continuous Shooting, Burst Shooting, Remote Control, Auto Bracketing Image Tone: Bright, Natural, Monochrome, Remote control compatible, receivers located in the front and back of the camera Flash-on and Flash-off modes ""Red-eye"" compensation function with pre-discharge",,,,,,,,,,,,,,,,,,,,,,,,,,,,,,,,,,,,,,,,,,,,,,,,,,,,,,"Photo format : JPEG (Exif 2.3), DCF 2.0, DPOF, PRINT Image Matching III Video format : MPEG-4 AVC/H.264 Audio : Movie/Underwater, Movie/Time-Lapse, Movie/1cm- Macro Movie, 32KHz, 16bit Stereo High Speed Movie: 8 KHz, 16 bit, stereo",,,,,,,,,,,,,,,,,,,,"Slideshow, Image Rotation, Small Face Filter, Ink Rubbing Filter, Collage, Digital Filter (B&W/Sepia, Toy Camera, Retro, Color, Extract Color, Color Emphasis, High Contrast, Starburst, Soft, Fish-eye, Brightness, Miniature), HDR Filter, Original Frame, Movie Edit, Red-eye Edit, Resize, Cropping, Image Copy, Protect, DPOF, Start-up Screen",,,,,,,,,,,,,,,,,,,,,,,,,,,,,,,,,,,,4x,,,,,,,,,,,,"Waterproof, dust, sand, crash, cold, pressure proof digital compact",,,,,,,,,,,,,,,,,,,,,,,,,,,,,,,,,,,,,,,,,,,,,,,,,,,,,,,,,,,,,,,,,,,,,,,,,,,,,,,,,,,,,,,,,,,,,,,,,,,,,,,,,,,,,,,,,,,,,,,,,,,,,,,,,,,,,,,,,,,,,,,,,,,,,,,,,,,,,,,,,,,,,,,,,,,,,,,,,,,,,,,,,,,,,"Exposure Modes:
Auto Picture, Program, Shutter Priority, USER, HDR, Handheld Night Snap, Movie, Digital Microscope, Landscape, Flower, Portrait, Interval Shot, Underwater, Underwater Movie, Interval Movie, High Speed movie, Time-Lapse movie, 1cm-Macro Movie, Digital SR, Surf & Snow, Kids, Pet, Sport, Night Scene, Night Scene Portrait, Fireworks, Food, Report, Green Auto picture Scene Modes:
Landscape, Portrait, Night Scene, Night Scene Portrait, Standard, Flower, Sport, Candlelight, Blue Sky, Sunset, Text, Group Photo, Pet, Portrait & Blue Sky, Portrait & Sunset, Portrait & Backlight",,,,,,,,,,,,,,,,,,,,,,,,"Auto, Manual (ISO 125 - 6400) Auto ISO range: ISO 125-200, ISO 125-400, ISO 125-800, ISO 125-1600, ISO 125-3200, ISO 125-6400
Fixed at ISO 125-1600 in Green mode.
Fixed at ISO 125-200, 125-400, 125-400, 125-1600 in Handheld Night Snap mode.
Fixed at ISO 125-6400 in Report mode.",,,,,,,,,,,,,,,,,,,,,,,,,,,,,,,,,,,,,,,,,,,,,,,,,,,,,,,,,,,,,,,,,,,,,,,,,,,,,,,,
Buy Olympus Stylus 1 Digital Camera from CamBuy Camera Store in Sydney,,,,,,,,,,,Approx. 340 shots,,,,,,,4x (42.8x maximum combined zoom),116.2 x 87 x 56.5mm,,,,,,,,,,,,,,,,,,,,,,,,"1/1.7""",,,,,,,,,,,,,,,,,,,,,,,,,12/2 seconds,,,,,,,,,,,,Approx. 346g [CIPA with BLS-5 Battery and Memory card],,,,,,,,,,,,,,,,,,,,,,,,,,,,"Digital ESP metering , Center weighted average metering, Spot metering, Spot metering with highlight control, Spot metering with shadow controlmetering",,,,,,,,,,,,,,,,,,,,,,,,,,,,,,,,,,,,,,,,,,,,,,,,,,,,,,,,,,,,,,,,,,,,,,,,,,,,,,,,,,,,,,,,,,,,,,,,,,,,,,,,,,,,,,,,,,,,,,,,,,,,,,,,,,,,,,,,,,,,,,,,,,,,,,,,,,,,,,,,,,,,,,,,,,,,,,,,,,,,,,,,,,,,,,,,,,,,,,,,,,,,,,,,,,,,,Via OI Share App for IOS & Android,Lens Shift Image Stabiliser,,,,,,,,,,,,,,,,,,,,,,BSI CMOS Sensor,Imager AF,HDMI (CB-HD1 Type D); AV cable (CB-AVC3),BCS-5,,BLS-5,Stereo/Mono,Compact,USB 2.0 High Speed,Art Filters (Photo & Movie),,12 MP,,,,28 - 300mm,Built-in,,Single AF (S-AF) / SuperMacro Mode / Continuous AF (C-AF) / AF tracking (C-AF + TR) / Manual Focus (MF),TruePic VI,100 - 12800,6.0 - 64.2mm,AF Illuminator built-in,"SD Memory Card(SDHC, SDXC, UHS-I compatible), Eye-Fi, FlashAir","Wide: 10cm to infinity, Tele: 80cm to infinity, Super Macro: 5cm",10.7x,Yes (In-camera Mode),"Pop Art, Soft Focus, Pale & Light Colour, Light Tone, Grainy Film, Pin Hole, Diorama, Cross Process, Gentle Sepia, Dramatic Tone, Keyline","RAW, JPEG",29 Minutes,"Portrait, e-Portrait, Landscape, Sport, Night, Night + Portrait, Candle, Sunset, Documents, Panorama, Fireworks, Multiplex exposure, Beach & Snow, Underwater - Wide, Underwater - Macro, HDR",1 040 000 pixels,1.44mp high resolution viewfinder,60sec - 1/2000,Maximum 4GB,"Pop Art, Soft Focus, Pale & Light Colour, Light Tone, Grainy Film, Pin Hole, Diorama, Cross Process, Gentle Sepia, Dramatic Tone, Keyline",MOV(MPEG-4AVC/H.264),Yes,"3""",LCD Tilting,f/2.8 Constant,Via OI Share App for IOS & Android,Yes,,,,,,,,,,,,,,,,,,,,,,,,,,,,,,,,,,,,,,,,,,,,,,,,,,,,,,,,,,,,,,,,,,,,,,,,,,,,,,,,,,,,,,,,,,,,,,,,,,,,,,,,,,,,,,,,,,,,,,,,,,,,,,,,,,,,,,,,,,,,,,,,,,,,,,,,,,,,,,,,,,,,,,,,,,,,,,,,,,,,,,,"Body, Lens cap, BLS-5, BCS-5, USB/Video Multi cable, Shoulder strap,","with optional FL-50R, FL-36R, FL-14, FL-300R, FL-600R",Yes,30 - 90% (operation) / 10 - 90% (storage),0 - +40℃ (operation) / -20 - +60℃ (storage),RAW: 4032(H)x3024(V) (approx. 1/1.5 lossless compressed) Approx. 13.9MB Set1(LF): 4032(H)x3024(V) (1/4 compressed) Approx. 5.9MB Set2(LN): 4032(H)x3024(V) (1/8 compressed) Approx. 2.7MB Set3(MN): 2560(H)x1920(V) (1/8 compressed) Approx. 1.1MB Set4(SN): 10,with optional RM-UC1 Remote Cable & WiFi via OI Share app for IOS & Android,,,,,,,,,,,,,,,,,,,,,,,,,,,,,,,,,,,,,,,,,,,,,,,,,,,,,,,,,,,,,,,,,,,,,
Buy Olympus Stylus Tough TG-3 Digital Camera in Red from CamBuy in Sydney,,,,,,,,,,,Approx. 330 shots,,,,,,,4x,111.5 x 65.9 x 31.2mm,,,,,,,,,,,,,,,,,,,,,,,,"1/2.3""",,,,,,,,,,,,,,,,,,,,,,,,,12/2 seconds/Custom,,,,,,,,,,,,247g,,,,,,,,,,,,,,,,,,,,,,,,,,,,"ESP, Spot",,,,,,,,,,,,,,,,,,,,,,,,,,,,,,,,,,,,,,,,,,,,,,,,,,,,,,,,,,,,,,,,,,,,,,,,,,,,,,,,,,,,,,,,,,,,,,,,,,,,,,,,,,,,,,,,,,,,,,,,,,,,,,,,,,,,,,,,,,,,,,,,,,,,,,,,,,,,,,,,,,,,,,,,,,,,,,,,,,,,,,,,,,,,,,,,,,,,,,,,,,,,,,,,,,,,,Yes,"CMOS Shift, Multi-Motion Movie IS",,,,,,,,,,,,,,,,,,,,,,BSI-CMOS,CMOS Contrast Detection,HDMI (Type D),,In-Camera via USB,Li-ion (LI-92B),Linear PCM,Compact,USB 2.0 High Speed,Magic Filters (Photo & Movie),Yes,16MP,Yes,"15m Waterproof, 2.1m Shockproof, -10º Celsius Freezeproof, Dustproof, 100kgf Crushproof",,25 - 100mm,Built-in (GN 4.6),Wide: 0.2m-7.9m (ISO 1600) Tele: 0.1m-3.1m (ISO1600),"Face Detection, iESP/Spot/tracking",TruePic VII,100 - 6400,4.5 - 18mm,LED AF Illuminator,SD / SDHC / SDXC,Normal 0.1m - ∞ (Wide - Tele) Super Macro 0.01 - 0.1m (Wide - Tele),4x,In Software & In Camera,1.POP ART 2.SOFT FOCUS 3.PALE & LIGHT COLOR 4.GRAINY FILM 5.PIN HOLE 6.DIORAMA 7.DRAMATIC,JPEG,29 Minutes,1.PORTRAIT 2.ePORTRAIT 3.LANDSCAPE 4.INTERVAL 5.HANDHELD STAR LIGHT 6.NIGHT SCENE 7.NIGHT + PORTRAIT 8.SPORT 9.INDOOR 10.SELF PORTRAIT 11.SUNSET 12.FIREWORKS 6.NIGHT SCENE 7.NIGHT + PORTRAIT 8.SPORT 9.INDOOR 10.SELF PORTRAIT 11.SUNSET 12.FIREWORKS 13.CUISINE 14.DOCUMENTS 15.BEACH & SNOW 16.UNDER WATER SNAPSHOT 17.UNDER WATER WIDE1 18.UNDER WATER WIDE2 19.UNDER WATER MACRO 20.SNOW 21.PANORAMA 22.BACKLIGHT HDR,460k,,Auto: 1/4-1/2000 (Night Scene: Longest 4 Sec),Maximum 4GB,1.POP ART 2.SOFT FOCUS 3.PALE & LIGHT COLOR 4.GRAINY FILM 5.PIN HOLE 6.DIORAMA 7.DRAMATIC,MOV / H.264,Yes,"3.0""",LCD,Wide (W) F2.0 - Tele(T) F4.9,Compatible with Olympus Image Share for iOS & Android,Yes,,,,,,,,,,,,,,,,,,,,,,,,,,,,,,,,,,,,,,,,,,,,,,,,,,,,,,,,,,,,,,,,,,,,,,,,,,,,,,,,,,,,,,,,,,,,,,,,,,,,,,,,,,,,,,,,,,,,,,,,,,,,,,,,,,,,,,,,,,,,,,,,,,,,,,,,,,,,,,,,,,,,,,,,,,,,,,,,,,,,,,,"Camera, USB Cable & Charger, Wrist Strap, Lithium-Ion Battery (LI-92B),",,,,,,,,,,,,,,,,,,,,,,,,,,,,,,,,,,,,,,,,,,,,,,,,,,,,,,,,,,,,,,,,,,,,,,,,,,,
