<page title>,actual recordable time motion images,ae bracket,ae lock,af assist lamp,af detective range,af lock,af mode,aspect ratio,audio video output,battery,battery life cipa standard,burst speed,camera effective pixels,color space,color temperature setting,colour filter,continuous recordable time motion images,digital zoom,dimensions w x h x d,diopter adjustment,direct print,direction detection function,dust reduction system,erase,exposure compensation,exposure mode,external microphone input,extra tele conversion,eye point,eye sensor,eye sensor adjustment,field of view,file sizepixels,filed of view,flash mode,flash synchronization,flicker reduction,fn1 fn2 fn3 fn4 fn5 fn6 fn7 fn8 fn9,focus mode,function lever,hdmi,image quality,image sensor size,image stabilization system,iso sensitivity standard output sensitivity,lens mount,level gauge,light metering mode,light metering system,magnification,metering range,microphone,monitor adjustment,monitor size,nfc,number of recordable images,operating humidity,operating temperature,osd language,other functions,others,pixels,playback mode,protection,recording file format,recording media,remote input,self timer,shutter speed,software,speaker,still image,still image and video,synchronization speed,tilting,total pixels,type,usb,video,weight,white balance,white balance adjustment,white balance bracket,wifi,1280 x 720 hd,1920 x 1080 full hd,35mm focal length equivalent,640 x 480 hd,ad resolution power,af points,builtin flash guide number,chassis material,colour filter size,coverage verticalhorizontal,custom functions settings,dioptric adjustment,effective sensor size,ettl ii autoflash,exposure compansation,external interface,imaging sensor effective pixels,integrated cleaning system,iso speed range,large,lcd monitor,live view,medium,metering modes,metering segments,raw,settings,shooting modes,shooting speed,small 1,small 2,small 3,wb bracketing,weight excl battery,wireless remote control shooting,aperture,autofocus af,charging time,construction,continuous shooting,data transfer protocol,digital zoom magnification,exposure control,file formats,file system,flash control,fnumber,focal length,focus range,focusarea selection,frame coverage playback mode,frame coverage shooting mode,humidity,image sensor,image size pixels,interface,io terminal,lens,media,metering mode,monitor,motion blur reduction,movie,movie recording actual battery life for recording 2,number of effective pixels,optional accessories,power sources,product name,range,range approx iso sensitivity auto,selftimer,shutter,speed,still pictures,supplied accessories,supported languages,temperature,tripod socket,vibration reduction,video output,aeb,af assist beam,af microadjustment,af modes,af point selection,af working range,batteries,battery grip,battery indicator,battery life,body materials,brightness adjustment,browsing printing,builtin flash coverage,builtin flash gn iso 100 meters,builtin flash recycle time,canon printers,case,coating,colour filter type,colour space,computer,coverage,custom functions,custom white balance,depth of field preview,dimensions wxhxd,dioptre correction,display formats,display options,drive modes,effective pixels,eos 7d mark ii,external flash compatibility,external flash control,eyepoint,file numbering,firmware update,flash,flash exposure bracketing,flash exposure compensation,flash exposure lock,focusing,focusing screen,folders,frame rate,highlight alert,histogram,hotshoe pc terminal,image eraseprotection,image processing,image size,intelligent orientation sensor,intervalometer,iso sensitivity 8,lcd panel illumination,lenses,lowpass filter,manual focus,menu categories,menu languages,metadata tag,metering,mirror,modes,movie length,movie size,movie type,operating environment,other,pictbridge,picture styles,playback zoom,power saving,power supply battery chargers,predictive af 7,rawjpeg simultaneous recording,redeye reduction,remote controller switch,second curtain synchronisation,selected af point display,sensor cleaning,slide show,sound memo,still image type,supported operating system,viewfinder,viewfinder information,viewing angle horizontallyvertically,water dust resistance,weight body only,wireless file transmitter,xsync,af system points,iso sensitivity,pc macintosh,ac adapter,accessory shoe,accessory terminal,active dlighting,adl bracketing,afarea mode,audio input,audio output,audio recording device,audio recording format,autofocus,battery pack,builtin flash,compatible lenses,depthoffield preview,detection range,double slot,dustreduction system,effective angle of view,exposure bracketing,exposure lock,exposure meter coupling,file format,flash bracketing,flash compensation,flash sync speed,flashready indicator,focus lock,focus point,frame advance rate,frame coverage,frame size pixels and frame rate,guide number,hdmi output,iso sensitivity recommended exposure index,lens aperture,lens servo,metering method,mode,nikon creative lighting system cls,other options,picture control system,playback,range iso 100 f14 lens 20 c68 f,reflex mirror,release mode,remote release modes,sync terminal,video compression,white balance bracketing,exposure metering mode,flash range approx iso sensitivity auto,movie recording actual battery life for recording,ac power supply,brightness,builtin flash range,cases straps,closest focusing distance,compression,computerother,gps,image stabilisation,manual power adjustment,maximum fnumber,modes in movie,movies,photo effects,redeye correction,slow sync speed,zoom,external flash,automatic scene selection,range iso 100 f14 lens 20c68f,shutter flash sync speed,shutter type,bracketing,clear image zoom,lens type,optical zoom,photo creativity,picture effect,scene selection,control,image sensor type,autofocus system type,av interface cable type,battery charger,battery charging,battery type model,built in microphone type,camera type,computer interface cable type,creative filter system,date imprint,effective megapixels,electronic compass,environmental protection,external microphone option,film lens equivalent 35mm,flash type and power,flash working range iso,focus modes,image processing engine,iso range,lens focal length,lowlight af assistance,memory card type,nearest focusing distance,optical zoom range,panorama recording,photo magic filter types,photo recording formats,recording time,scene modes,screen resolution,secondary viewfinder,shutter speed range,video file sizes,video magic filter types,video recording format,video with sound,viewing screen size,viewing screen type,widest aperture,wifi compatibility,wireless flash capability,10m 3648 x 2736 43 mode,18m 4896 x 3672 43 mode,2m 1920 x 1080 169 mode,3d,3d viewing mode,5m 2592 x 1944 43 mode,ac adaptor,anti motion blur,auto focus illuminator,auto macro,automatic image rotation,avc mp4 1440 x 1080 12m,avc mp4 vga 640 x 480 3m,beach,brightness setting,builtin microphone,burst interval minimum,burst speed maximum,date view,download music,dustproof,easy shooting,f number,face detection,face detection face selection,face detection max no of detectable faces,face detection mode,fireworks,flash range,focal length 35mm conversion movie 169,focal length 35mm conversion movie 43,focal length 35mm conversion still image 169,focal length 35mm conversion still image 43,focal length f,focus mode centerweighted af,focus mode flexible spot af face tracking focus,focus mode flexible spot af tracking focus,focus mode flexiblespot af,focus mode multipoint af,focus mode spot af,focus range iauto,focus range program auto,gourmet,grid line,gross pixels,handheld twilight,hdr painting,high sensitivity,hispeed usb,illustration,image stabilizer system,imaging processor,incamera guide,intelligent auto,internal memory data copy to recording media,iso sensitivity setting,landscape,light metering centerweighted,light metering multi pattern,light metering spot,memory stick micro,memory stick micro mark2,micro hdmi,micro sd memory card,micro sdhc memory card,micro sdxc memory card,micro usb,miniature,movie mode,multiuse terminal,name,night portrait,night scene,number of dots,optical zoom during movie recording,panorama,partial colour,pet,pop colour,precision digital zoom still image,program auto,retouch trimming,retouch unsharp masking,richtone monochrome,screen size,shockproof,shooting interval,shooting time lag,shutter release time lag,size,slide show effects,slide show movie,slide show video out,slide show music no of tunes,slideshow with music,smile shutter,snow,soft highkey,soft skin,soft snap,stamina battery life,startup time,still image recording during movie,superior auto,supplied battery,sweep panorama 360 11520 x 1080,sweep panorama hr 10480 x 4096,sweep panorama standard 4912 x 1080 3424 x 1920,sweep panorama wide 7152 x 1080 4912 x 1920,toy camera,tripod receptacle,usb charge,usb connection auto multiconfiguration,usb connection mass storage,usb connection mtp,usb power supply,vga 640 x 480 43 mode,water colour,waterproof,weight with battery memory stick,wind noise reduction,exposure metering,exposure metering method,exposure range iso 100 f14 lens 20 c68 f,focus lens servo,interface accessory terminal,interface hdmi output,interface usb,live view afarea mode,live view autofocus,live view lens servo,note,operating environment humidity,operating environment temperature,power source ac adapter,power source battery,release selftimer,type of camera,12m 4608 x 2592 169 mode,16m 4608 x 3456 43 mode,3d still image 12m 4608 x 2592 169 mode,3d still image 16m 4608 x 3456 43 mode,memory stick duo still image movies,memory stick pro duo high speed,memory stick pro duo still image movies,memory stick pro hg duo,mp4 3m vga 640 x 480 30fps,mp4 6m standard 1280 x 720 30fps,mp4 9m fine 1280 x 720 30fps,sd memory card,sdhc memory card,sdxc memory card,usb connection ptpmtp,exposure modes,flash modes,access protocols,battery life 1 still pictures,data rates actual measured values,security,wifi wireless lan communications protocols,wifi wireless lan operating frequency,wifi wireless lan range line of sight,wifi wireless lan standards,communications protocols,data rate,geodesics,operating frequency,range line of sight,receiving frequency,standards,wireless setup,battery life 1 still pictures,image size photo size,movies actual battery life for recording 2,operating environment temperature,storage media,take a series of pictures,sensitivity,focus bracketing,image manipulation,my camera my menu,my category,box content,compatible external flash units,flash hotshoe for external flash,operating humidity range,operating temperature range,photo file sizes,remote,builtin flash range approx iso sensitivity auto,wireless lan standards,wifi wireless lan standards,continuous recordable time motion images2,fn1 fn2 fn3 fn4 fn5 f6 f7,motion image progressive ntsc area,motion image progressive pal area,standard accessories,assisted shooting mode,compatible ap accessories,incamera editing options,interchangeable lens types,internal memory,is modes,max burst shooting speed,photo art filter types,sensorself cleaning system,still picture aspect ratios,video art filter types video,wb options,control for hdmi,histogram indicator,portrait,posterization,retro photo,soft focus,actual recordable time motion pictures,af metering,audio,auto ae bracketing,battery life approx,built in memory,calendar display dual image playback,continuous recordable time motion pictures,conversion lens compatibility,copy title edit text stamp,cut animation,display,dpof print setting set protection,edit,exposure parameters,extra optical zoom ez,file,finder,focus,high speed video,intelligent zoom,light metering,metrics,motion picture recording 2,mp4,pictbridge support,picture quality,power,recording modes,resize cropping aspect conv leveling,sensor,set favorites rotate image,setup,show highlights,show histogram,standard package,std video,still picture recording,thumbnails zoomed playback,video divide,zoom in motion picture,waterproof weatherproof case,focus mode manual focus
Buy Panasonic LUMIX DMC-GX7 with Leica 25mm Lens from CamBuy,AVCHD : Approx. 70 min with H-FS1442A / AVCHD : Approx. 65 min with H-H020A,"3,5,7 frame, in 1/3 or 2/3 or 1EV Step, Max.±3 EV",Set the Fn button in custom menu to AE lock,YES,EV -4 - 18 (ISO100 equivalent),Set the Fn button in custom menu to AF lock,Face detection / AF Tracking / 23-area-focusing / 1-area-focusing / Pinpoint,"4:3, 3:2, 16:9, 1:1","Monaural Type, NTSC/PAL, NTSC only for North America / *Check the website of the Panasonic sales company in your country or region for details on the products that are available in your market.","Li-ion Battery Pack (7.2V, 1025mAh) (Included) / Battery Charger",Approx. 320 images with H-H020A / Approx. 350 images with H-FS1442A,"Mechanical Shutter - H: 5.0 frames/sec(with AFS), 4.3 frames/sec(with AFC, In 1-area-focusing AF mode), M: 4.0 frames/sec with Live View, L: 2.0 frames/sec with Live View / Electronic Shutter - SH: 40.0 frames/sec, H: 10.0 frames/sec, M: 4.0 frames/sec with Live View, L: 2.0 frames/sec with Live View",16.00 Megapixels,"sRGB, Adobe RGB",2500-10000K in 100K,Primary color filter,AVCHD : Approx. 140 min with H-FS1442A / AVCHD : Approx. 130 min with H-H020A,"2x, 4x",122.60x 70.7 x 54.6 mm / 4.83 x 2.78 x 2.15 inch,-4.0~+3.0（dpt）,PictBridge compatible,Yes,Supersonic wave filter,Single / Multi / All / Except Favorite,1/3EV Step ±5EV,Program AE/ Aperture-Priority / Sutter-Priority / Manual Exposure,No,"Still image: Max.2x (Aspect ratio sets at 4:3. Not effective with L size recording. Magnification ratio depends on the recording pixels and aspect ratio.) / Motion image: 2.4x (FHD/60p, FHD/60i, FHD/30p, FHD/24p in NTSC area / FHD/50p, FHD/50i, FHD/25p, FHD/24p in PAL area), 3.6x (HD/60p, HD/30p in NTSC area / HD/50p, HD/25p in PAL area), 4.8x (VGA/30p in NTSC area / VGA/25p in PAL area)",Approx.17.5mm from eyepiece lens,Yes,High / Low,Approx. 100%,"Still Image: [4:3] 4592x3448(L) / 3232x2424(M) / 2272ｘ1704(S) / 1824x1368(When attaching 3D lens in Micro Four Third System standard) / [3:2] 4592x3064(L) / 3232ｘ2160(M) / 2272ｘ1520(S) / 1824x1216(When attaching 3D lens in Micro Four Third System standard) / [16:9] 4592x2584(L) / 3232ｘ1824(M) / 1920x1080(S) / 1824x1024(When attaching 3D lens in Micro Four Third System standard) / [1:1] 3424ｘ3424(L) / 2416x2416(M) / 1712ｘ1712(S) / 1712x1712(When attaching 3D lens in Micro Four Third System standard)
Motion Image (MP4: NTSC area): [Full HD]1920×1080, 60fps (sensor output is 60p, 28Mbps) / [Full HD]1920x1080, 30fps (sensor output is 30p, 20Mbps) / [HD]1280x720, 30fps (sensor output is 30p, 10Mbps) / [VGA] 640x480, 30fps (sensor output is 30p, 4Mbps)
Motion Image (MP4: PAL area): [Full HD] 1920×1080, 50fps (sensor output is 50p, 28Mbps) / [Full HD]1920x1080, 25fps (sensor output is 25p, 20Mbps) / [HD] 1280x720, 25fps (sensor output is 25p, 10Mbps) / [VGA] 640x480, 25fps (sensor output is 25p, 4Mbps)
Motion Image (AVCHD Progressive : NTSC area): [Full HD]1920×1080, 60p (sensor output is 60p, 28Mbps)
Motion Image (AVCHD Progressive : PAL area): [Full HD] 1920×1080, 50p (sensor output is 50p, 28Mbps)
Motion Image (AVCHD: NTSC area): [Full HD] 1920x1080, 60i (sensor output is 60p, 17Mbps) / [Full HD] 1920×1080, 60i (sensor output is 30p, 24Mbps) / [Full HD] 1920×1080, 24p (sensor output is 24p, 24Mbps) / [HD] 1280 x 720, 60p (sensor output is 60p, 17Mbps)
Motion Image (AVCHD: PAL area): [Full HD] 1920x1080, 50i (sensor output is 50p, 17Mbps) / [Full HD] 1920x1080, 50i (sensor output is 25p, 24Mbps) / [Full HD] 1920x1080, 24p (sensor output is 24p, 24Mbps) / [HD] 1280 x 720, 50p (sensor output is 50p, 17Mbps)",Approx. 100%,"Auto, Auto/Red-eye Reduction, Forced On, Forced On/Red-eye Reduction, Slow Sync., Slow Sync./Red-eye Reduction, Forced Off","1st. Curtain Sync, 2nd Curtain Sync.",[1/50] / [1/60] / [1/100] / [1/120] / OFF,WiFi / Q.MENU / LVF/Monitor Switch / AF/AE LOCK / AF-ON / One Push AE / Touch AE / Preview / Level Gauge / Focus Area Set / Zoom Control / Photo Style / Aspect Ratio / Picture Size / Quality / Metering Mode / Highligt Shadow / / i.Dynamic / i.Resolution / HDR / Electronic Shutter / Flash Mode / Ex. Tele Conv. / Digital Zoom / Stabilizer / Sensitivity / White Balance / AF Mode / Drive Mode / Restore to Default / Motion Pic. Set / Picture Mode / Silent Mode / AFS/ / AFF/AFC / Peaking / Histogram / Guide Line / Rec Area / Step Zoom / Zoom Speed,AFS (Single) / AFF (Flexible) / AFC (Continuous) / MF,No,miniHDMI TypeC / VIERA Link / Video: Auto / 1080p / 1080i / 720p / 480p (576p in PAL system) / Audio: Stereo,"RAW, RAW+Fine, RAW+Standard, Fine, Standard, MPO+Fine, MPO+Standard (When attaching 3D lens in Micro Four Thirds System standard)",17.3 x 13.0 mm (in 4:3 aspect ratio),Image Sensor Shift Type,Auto / Intelligent ISO / 125(Extended) / 200 / 400 / 800 / 1600 / 3200 / 6400 / 12800 / 25600 (Changeable to 1/3 EV step),Micro Four Thirds mount,Yes,Multiple / Center Weighted / Spot,1728-zone multi-pattern sensing system,Approx. 1.39x / 0.7x (35mm camera equivalent) with 50mm lens at infinity; -1.0 m -1,"EV 0 - 18 (F2.0 lens, ISO100 equivalent)",Stereo,"Brightness, Contrast and Saturation, Red tint, Blue tint",3.0inch (7.5cm)/ 3:2 Aspect / Wide-viewing angle,"ISO／IEC 18092, NFC-F(Passive Mode)","9 images (when there are RAW files with the particular speed) / Unlimited consecutive shooting (when there are no RAW files) / (depending on aspect ratio, memory card size, picture size, and the setting for the quality)",10% RH to 80％ RH,0℃ to 40℃ (32°F to 104°F),"Japanese, English, German, French, Italian, Spanish",Guide Lines (3 patterns) / Real-time Histogram,"Quick AF, Continuous AF (during motion image recording), AF+MF, Eye Sensor AF, Touch AF/AE Function, Touch Pad AF, Touch shutter, MF Assist, Touch MF Assist, One Shot AF,",Approx. 1040K dots,"Normal playback, 30-thumbnail display, 12-thumbnail display, Calendar display, Zoomed playback (16x Max.), Slideshow (duration & effect is selectable), / Playback Mode (Normal/Picture/Video/3D Play/Category/Favorite), Title Edit, Location Logging, Clear Retouch, Text Stamp, Video Divide, Stop Motion Video, / Time Lapse Video, Resize, Cropping, Rotate, Favorite, Print set, Protect, Face Recognition Edit","Single / Multi, Cancel","Still Image: JPEG(DCF, Exif 2.3), RAW, MPO (When attaching 3D lens in Micro Four Thirds standard) / Motion Image: AVCHD (Audio format: Dolby Digital 2ch) / MP4 (Audio format AAC 2ch)","SD memory card, SDHC memory card, SDXC memory card (Compatible with UHS-I standard SDHC/SDXC memory cards)",φ2.5mm for Remote,"10sec, 3 images/ 2sec / 10sec","Still Images: Bulb (Max.2min), 1/8000 ~ 60 / Motion image: 1/16000 ~ 1/25 (NTSC area/PAL area)","PHOTOfunSTUDIO 9.2 PE (Windows XP/Vista/7/8) / SILKYPIX® Developer Studio 3.1 SE (Windows XP/Vista/7/8, Mac OS X v10.4/v10.5/v10.6/v10.7/v10.8) / LoiLoScope 30 day full trial version (Windows XP/Vista/7/8)",Monaural,Clear Portrait / Silky Skin / Backlit Softness / Clear in Backlight / Relaxing Tone / Sweet Child's Face / Distinct Scenery / Bright Blue Sky / Romantic Sunset Glow / Vivid Sunset Glow / Glistening Water / Clear Nightscape / Cool Night Sky / / Warm Glowing Nightscape / Artistic Nightscape / Glittering Illuminations / Clear Night Portrait / Soft Image of a Flower / Appetizing Food / Cute Dessert / Freeze Animal Motion / Clear Sports Shot / Monochrome / Panorama Expressive / Retro / Old Days / High Key / Low Key / Sepia / Monochrome / Dynamic Monochrome / Rough Monochrome / Silky Monochrome / Impressive Art / / High Dynamic / Cross Process / Toy Effect / Toy POP / Bleach Bypass / Miniature Effect / Soft Focus / Fantasy / Star Filter / One Point Color / Sun Shine,Standard / Vivid / Natural / Monochrome / Scenery / Portrait / Custom,Less than 1/320 second (Built-in Flash) / Less than 1/250 second (External Flash),Yes,16.84 Megapixels,"Tilt Static LCD with Touch Monitor TTL Built-in Flash, GN7.0 equivalent (ISO 200 ・m), GN5.0 equivalent (ISO 100 ・m）, Built-in Pop-up Live MOS Sensor Focal-plane shutter Contrast AF system LCD Live View Finder (2,764,800 dots equivalent) Digital Single Lens Mirrorless camera",USB 2.0 High Speed Multi,Clear Portrait / Silky Skin / Backlit Softness / Clear in Backlight / Relaxing Tone / Sweet Child's Face / Distinct Scenery / Bright Blue Sky / Romantic Sunset Glow / Vivid Sunset Glow / Clear Nightscape / Cool Night Sky / / Warm Glowing Nightscape / Artistic Nightscape / Clear Night Portrait / Appetizing Food / Cute Dessert / Freeze Animal Motion / Clear Sports Shot / Monochrome Expressive / Retro / Old Days / High Key / Low Key / Sepia / Monochrome / Dynamic Monochrome / Impressive Art / High Dynamic / Cross Process / Toy Effect / Toy POP / Bleach Bypass / Miniature Effect / Fantasy / One Point Color,"Approx. 402g / 0.89 lb （SD card, Battery, Body) / Approx. 360g / 0.79 lb （Body only) / Approx. 489g / 1.08 lb （SD card, Battery, H-H020A lens included） / Approx. 512g / 1.13 lb (SD card, Battery, H-FS1442A lens included)","Auto / Daylight / Cloudy / Shade / Incandescent / Flash / White Set 1, 2 / Color temperature setting","Blue/amber bias, Magenta/green bias",3 exposures in blue/ amber axis or in magenta/ green axis,"IEEE 802.11b/g/n, 2412MHz - 2462MHz (11ch), Wi-Fi / WPA / WPA2, Infrastructure mode",,,,,,,,,,,,,,,,,,,,,,,,,,,,,,,,,,,,,,,,,,,,,,,,,,,,,,,,,,,,,,,,,,,,,,,,,,,,,,,,,,,,,,,,,,,,,,,,,,,,,,,,,,,,,,,,,,,,,,,,,,,,,,,,,,,,,,,,,,,,,,,,,,,,,,,,,,,,,,,,,,,,,,,,,,,,,,,,,,,,,,,,,,,,,,,,,,,,,,,,,,,,,,,,,,,,,,,,,,,,,,,,,,,,,,,,,,,,,,,,,,,,,,,,,,,,,,,,,,,,,,,,,,,,,,,,,,,,,,,,,,,,,,,,,,,,,,,,,,,,,,,,,,,,,,,,,,,,,,,,,,,,,,,,,,,,,,,,,,,,,,,,,,,,,,,,,,,,,,,,,,,,,,,,,,,,,,,,,,,,,,,,,,,,,,,,,,,,,,,,,,,,,,,,,,,,,,,,,,,,,,,,,,,,,,,,,,,,,,,,,,,,,,,,,,,,,,,,,,,,,,,,,,,,,,,,,,,,,,,,,,,,,,,,,,,,,,,,,,,,,,,,,,,,,,,,,,,,,,,,,,,,,,,,,,,,,,,,,,,,,,,,,,,,,,,,,,,,,,,,
Buy Canon EOS 70D Premium Kit from CamBuy Camera Store in Sydney,,,,,,,,,,Lithium-ion LP-E6,,,,,,,,,139 x 104.3 x 78.5mm,,,,,,,,,,,,,,,,,,,,,,,,,,,,,,,,,,,,,,,,,,,,,,,,,,"1/8000 sec - 30, bulb, X-sync 1/250 sec",,,,,,,,,,,,,,,,60p/50p (IPB): approx. 205MB/min,30p/25p/24p (IPB): approx. 235MB/min,1.6X,30p/25p (IPB): approx. @ 78MB/min,14-bit,"19 AF points, all cross type",Yes / 12,Aluminium alloy and polycarbonate resin with glass fibre,"Primary Colours, APS-C",98%,23 / 6,-3 to +1m dpt,22.5 x 15.0mm,Yes,"1/3 or 1/2-stop increments
Normal: ±5; Manual; AEB: ±2",Hi-Speed USB / HDMI / Stereo Audio OUT / External Microphone IN / Remote Control Terminal (RS-60E3),CMOS / 22.0 MP,Yes,ISO 100-12800 (expandable to ISO 25600),Approx. 20 megapixels (5472 x 3648),"3.0"" Vari Angle TFT Colour Liquid Crystal (Approx. 1,040,000 dots)","Yes (Live View Shooting, Movie Servo AF, Remote Live View Shooting, Face Detection, AF Mode, Manual, Magnified View, Multi Aspect Ratio, Exposure Simulation display)",Approx. 8.9 megapixels (3648 x 2432) SD/SDHC/SDXC/UHS-I,"Evaluative, Partial, Spot, Centre-weighted avarage",63 zone TTL full aperture,Approx. 20 megapixels (5472 x 3648),9,10 standard modes,7 fps,Approx. 5 megapixels (2736 x 1824),Approx. 2.50 megapixels (1920 x 1280),"Approx. 350,000 pixels (720 x 480)",Yes,755g,Yes (RC-6),,,,,,,,,,,,,,,,,,,,,,,,,,,,,,,,,,,,,,,,,,,,,,,,,,,,,,,,,,,,,,,,,,,,,,,,,,,,,,,,,,,,,,,,,,,,,,,,,,,,,,,,,,,,,,,,,,,,,,,,,,,,,,,,,,,,,,,,,,,,,,,,,,,,,,,,,,,,,,,,,,,,,,,,,,,,,,,,,,,,,,,,,,,,,,,,,,,,,,,,,,,,,,,,,,,,,,,,,,,,,,,,,,,,,,,,,,,,,,,,,,,,,,,,,,,,,,,,,,,,,,,,,,,,,,,,,,,,,,,,,,,,,,,,,,,,,,,,,,,,,,,,,,,,,,,,,,,,,,,,,,,,,,,,,,,,,,,,,,,,,,,,,,,,,,,,,,,,,,,,,,,,,,,,,,,,,,,,,,,,,,,,,,,,,,,,,,,,,,,,,,,,,,,,,,,,,,,,,,,,,,,,,,,,,,,,,,,,,,,,,,,,,,,,,,,,,,,,,,,,,,,,,,,,,,,,,,,,,,,,,,,,,,,,,,,,,,,,,,,,,,,,,,,,,,,,,,,,,,,,,,,,,
