Buy Nikon COOLPIX S3600 Digital Camera in Silver from CamBuy in Sydney,,,,,,,,,,,,,,,,,,,Approx. 97.1 x 57.9 x 19.9 mm (3.9 x 2.3 x 0.8 in.) (excluding projections),,,,,,,,,,,,,,,,,,,,,,,,,,ISO 80-1600 ISO 3200 (available when using Auto mode),,,,,,,,,,,,,,,,,,,,,,,,,,,,,,,,Compact digital camera,,,Approx. 125 g (4.5 oz) (with battery and SD memory card),,,,,,,,,,,,,,,,,,,,,,,,,,,,,,,,"Scene auto selector, Scene (Portrait, Landscape, Sports, Night portrait, Party/indoor, Beach, Snow, Sunset, Dusk/dawn, Night landscape, Close-up, Food, Museum, Fireworks show, Black and white copy, Backlighting, Panorama assist, Pet portrait), Special effects, Smart portrait, Auto",,,,,,,,Electronically-controlled ND filter (-3 AV) selection,Contrast-detect AF,Approx. 2 h 50 min (when using Charging AC Adapter EH-70P and when no charge remains),8 elements in 7 groups,"Single (default setting), Continuous (the frame rate for continuous shooting is about 1.1 fps and the maximum number of continuous shots is about 6), BSS (Best Shot Selector), Multi-shot 16","MTP, PTP",Up to 4x (angle of view equivalent to that of approx. 800 mm lens in 35mm [135] format),Programmed auto exposure and exposure compensation (-2.0 - +2.0 EV in steps of 1/3 EV),Still pictures: JPEG Sound files (Voice Memo): WAV Movies: AVI (Motion-JPEG compliant),"DCF, Exif 2.3, and DPOF compliant",TTL auto flash with monitor preflashes,f/3.7-6.6,4.5-36.0 mm (angle of view equivalent to that of 25-200 mm lens in 35mm [135] format),"[W]: Approx. 50 cm (1 ft 8 in.) to infinity, [T]: Approx. 1.5 m (5 ft) to infinity Macro mode: Approx. 2 cm (0.8 in.) to infinity (wide-angle position) (All distances measured from center of front surface of lens)","Face priority, center, manual with 99 focus areas, subject tracking, target finding AF",Approx. 99% horizontal and 99% vertical (compared to actual image),Approx. 97% horizontal and 97% vertical (compared to actual image),85% or less (no condensation),1/2.3-in. type CCD; total pixels: approx. 20.48 million,20M (High) [5152 x 3864(fine)] 20M [5152 x 3864] 10M [3648 x 2736] 4M [2272 x 1704] 2M [1600 x 1200] VGA [640 x 480] 16:9 (14M) [5120 x 2880] 1:1 [3864 x 3864],Hi-Speed USB,Audio/video (A/V) output; digital I/O (USB),NIKKOR lens with 8x optical zoom,"Internal memory (approx. 25 MB), SD/SDHC/SDXC memory card","Matrix, center-weighted (digital zoom less than 2x), spot (digital zoom 2x or more)","6.7 cm (2.7-in.), approx. 230k-dot, TFT LCD with anti-reflection coating and 5-level brightness adjustment",Motion detection (still pictures),"720/30p: 1280 x 720/16:9, 720/25p: 1280 x 720/16:9, 480/30p: 640 x 480/4:3, 480/25p: 640 x 480/4:3, 240/30p: 320 x 240/4:3, 240/25p: 320 x 240/4:3",,20.1 million,"Battery Charger MH-66, AC Adapter EH-62G, Audio Video Cable EG-CP14",One Rechargeable Li-ion Battery EN-EL19 (included) AC Adapter EH-62G (available separately),COOLPIX S3600,2 steps (f/3.7 and f/10.5 [W]),[W]: 0.5-3.5 m (1 ft 8 in.-11 ft) [T]: 1.5-2.0 m (5 ft-6 ft 6 in.),Can be selected from 10 s and 2 s,Mechanical and CCD electronic shutter,1/1500-1 s 4 s (when scene mode is set to Fireworks show),Approx. 230 shots when using EN-EL19,"Camera Strap, Rechargeable Li-ion Battery EN-EL19, Charging AC Adapter EH-70P, USB Cable UC-E6, ViewNX 2 CD","Arabic, Bengali, Bulgarian, Chinese (Simplified and Traditional), Czech, Danish, Dutch, English, Finnish, French, German, Greek, Hindi, Hungarian, Indonesian, Italian, Japanese, Korean, Marathi, Norwegian, Persian, Polish, Portuguese (European and Brazilian), Romanian, Russian, Serbian, Spanish, Swedish, Tamil, Telugu, Thai, Turkish, Ukrainian, Vietnamese",0°C-40°C (32°F-104°F),1/4 (ISO 1222),Lens shift (still pictures) Lens shift and electronic VR (movies),Can be selected from NTSC and PAL,,,,,,,,,,,,,,,,,,,,,,,,,,,,,,,,,,,,,,,,,,,,,,,,,,,,,,,,,,,,,,,,,,,,,,,,,,,,,,,,,,,,,,,,,,,,,,,,,,,,,,,,,,,,,,,,,,,,,,,,,,,,,,,,,,,,,,,,,,,,,,,,,,,,,Approx. 45 min (720/30p) when using EN-EL19 Approx. 50 min (720/25p) when using EN-EL19,,,,,,,,,,,,,,,,,,,,,,,,,,,,,,,,,,,,,,,,,,,,,,,,,,,,,,,,,,,,,,,,,,,,,,,,,,,,,,,,,,,,,,,,,,,,,,,,,,,,,,,,,,,,,,,,,,,,,,,,,,,,,,,,,,,,,,,,,,,,,,,,,,,,,,,,,,,,,,,,,,,,,,,,,,,,,,,,,,,,,,,,,,,,,,,,,,,,,,,,,,,,,,,,,,,,,,,,,,,,,,,,,,,,,,,,,,,,,,,,,,,,,,,,,,,,,,,,,,,,,,,,,,,,,,,,,,,,,,,,,,,,,,,,,,,,,,,,,,,,,,,,,,,,,,,,,,,,,,,,,,,,,,,,,,,
Buy Discount Canon PowerShot S120 Digital Camera from CamBuy in Sydney,,,Yes,,,On/Off Selectable,,,,,,,,,,,,,100.2 x 59.0 x 29.0mm,,,,,,+/- 3 EV in 1/3 stop increments Manual and automatic dynamic range correction Automatic shadow correction ND Filter (3 stop),,,,,,,,,,,,,,,,,,,,,,,,,,,,,,,,,,,,,,,,,,,"Approx. 2 or 10 sec., Custom",,,,,,,,,"SD, SDHC, SDXC (UHS Speed Class 1 compatible) TTL DIGIC 6 with iSAPS technology sRGB 1/1.7 type back-illuminated CMOS TTL",,,Approx. 217 g (including battery/batteries and memory card),,,,,,,,,,,,,,,,,,,,,,,,,,,,"Evaluative (linked to Face Detection AF frame), Centre-weighted average, Spot (centre or linked to Face Detection AF or Touch AF frame)",,,"Auto (including Face Detection WB), Daylight, Cloudy, Tungsten, Fluorescent, Fluorescent H, Flash, Underwater, Custom 1, Custom 2 Multi-area WB correction available in Smart Auto White Balance Compensation White Balance Compensation in Underwater mode",,,,,,,,,,,,"7 elements in 6 groups (1 double-sided aspherical lens, 1 double-sided aspherical UA lens and 1 single-sided aspherical lens)",Approx. 12.1 shots/sec for up to 5 frames then approx. 9.4 shots/sec for 635 frames with AF: Approx. 5.5 shots/sec with Live View: Approx. 5.6 shots/sec,,,,,,,,5.2 – 26.0 mm (35 mm equivalent: 24 – 120 mm),,,,,,,,,,,,,"7.5 cm (3.0”) PureColor II G Touch screen LCD (TFT). Approx. 922,000 dots. Capacitive type",,,,,,,,,,,,1 – 1/2500 sec. (factory default) 250 – 1/2500 sec. (total range – varies by shooting mode),,,,,,,,1/3 – 2 EV in 1/3 stop increments,Yes,,"Single, Continuous, Servo AF/AE¹, Touch AF","Size (Normal, Small)",,Rechargeable Li-ion Battery NB-6LH (NB-6LH battery and charger supplied),,,"Approx. 230 shots
Eco mode approx. 300 shots
Approx. 240 min. playback",,,ImageBrowser EX,,,,Canon SELPHY Compact Photo Printers and Canon Inkjet Printers supporting PictBridge,,,Primary Colour,,"Hi-Speed USB (MTP, PTP) dedicated connector (Mini-B compatible)",Approx. 100%,,,,,,,,"Single, Auto Drive, Continuous, Continuous with AF, Self-Timer",Approx. 12.1M,,,,,,,Canon High Power Flash HF-DC2,,"+/- 2 EV in 1/3 stop increments. Face Detection FE, Safety FE, Smart Flash Exposure",Yes,,,,,,"Yes, live histogram",,,,"4:3 - (RAW, L) 4000 x 3000, (M1) 2816 x 2112, (M2) 1600 x 1200, (S) 640 x 480 16:9 - (RAW, L) 4000 x 2248, (M1) 2816 x 1584, (M2) 1920 x 1080, (S) 640 x 360 3:2 - (RAW, L) 4000 x 2664, (M1) 2816 x 1880, (M2) 1600 x 1064, (S) 640 x 424 1:1 - (RAW, L) 2992 x 2992, (M1) 2112 x 2112, (M2) 1200 x 1200, (S) 480 x 480 4:5 - (RAW, L) 2400 x 3000, (M1) 1696 x 2112, (M2) 960 x 1200, (S) 384 x 480 Resize in playback (M2, S)",Yes,,,,,,"Yes, plus MF Peaking",,"English, German, French, Dutch, Danish, Finnish, Italian, Greek, Norwegian, Portuguese, Russian, Swedish, Spanish, Ukrainian, Polish, Czech, Hungarian, Turkish, Simplified Chinese, Chinese (traditional), Japanese, Korean, Thai, Arabic, Romanian, Farsi, Hindi, Malay, Indonesian, Vietnamese",,,,"Smart Auto (58 scenes detected), Hybrid Auto, Program AE, Shutter priority AE, Aperture priority AE, Manual, Custom, SCN (Portrait, Smart Shutter (Smile, Wink Self-Timer, FaceSelf-Timer), Star (Star Nightscape, Star Trails, Star Time-Lapse Movie), Handheld Night Scene, Underwater, Snow, Fireworks), Creative Filters (High Dynamic Range, Nostalgic, Fish-eye Effect, Miniature Effect, Toy Camera Effect, Background Defocus, Soft Focus, Monochrome, Super Vivid, Poster Effect), Movie Auto, Manual Flash On / Off, Slow Synchro",(Full HD & HD) Up to 4 GB or 29 min. 59 sec. (L and M) Up to 4 GB or 1 hour (Super Slow Motion Movie) 30 sec. (Star Time-Lapse Movie) 8/6/4 sec,,,"0 – 40 °C, 10 – 90% humidity","HDMI Mini Connector (HDMI-CEC compatible) A/V output (PAL/NTSC) Map Utility Canon HDMI Cable HTC-100, interface cable IFC-400PCU",Yes (via USB or Wireless LAN),,Approx. 2x – 10x,,"AC Adapter Kit ACK-DC40, Battery Charger CB-2LYE",,,Yes,,Yes,,,,,"JPEG compression (Exif 2.3 [Exif Print] compliant) / Design rule for Camera File system and DPOF ver. 1.1 compliant), RAW, RAW+JPEG",,,,,,,,,"AiAF (9-point, Face Detection or Touch AF with Object and Face Select and Track), 1-point AF (any position is available or fixed centre)","AUTO, 80, 100, 125, 160, 200, 250, 320, 400, 500, 640, 800, 1000, 1250, 1600, 2000, 2500, 3200, 4000, 5000, 6400, 8000, 10000, 12800",Windows 8/7 SP1/ Vista SP2/ XP SP3 Mac OS X v10.6 – 10.8 For Wireless LAN connection to a PC: Windows 8/7 SP1 Mac OS X v10.6.8/10.7/10.8.2 or later,,,,,,,,,,,,,,,,,,,,,,,,,,,,,,,,,,,,,,,,,,,,,,,,,,,,,,"Optional, AC Adapter Kit ACK-DC40",Adjustable to one of five levels. Quick-bright LCD,50 cm – 5.0 m (W) / 50 cm – 2.3 m (T),,3 cm (W) from front of lens in macro,"RAW, Superfine, Fine","Wireless LAN (IEEE802.11 b/g/n), (2.4 GHz only)¹",GPS via mobile (linked to compatible smartphone),"Yes (lens shift-type), approx. 3-stop¹. Intelligent IS with 5-axis Enhanced Dynamic IS",3 levels with internal flash,f/1.8-f/5.7,"Smart Auto (21 scenes detected), Standard, Program AE, Portrait, Nostalgic, Miniature Effect, Monochrome, Super Vivid, Poster Effect, Underwater, Snow, Fireworks, Super Slow Motion Movie","MP4 [Video: MPEG4-AVC (H.264), Audio: MPEG2 AAC-LC (stereo)] (Full HD) 1920 x 1080, 60fps/30fps (HD) 1280 x 720, 30fps, (L) 640 x 480, 30fps Star Time-Lapse Movie (Full HD) 15fps Super Slow Motion Movie (L) 640 x 480, 120fps, (M) 320 x 240, 240fps Miniature Effect (HD, L) 6fps, 3fps, 1.5fps Hybrid Auto (HD)","My Colors (My Colors Off, Vivid, Neutral, Sepia, Black & White, Positive Film, Lighter Skin Tone, Darker Skin Tone, Vivid Blue, Vivid Green, Vivid Red, Custom Color)","Yes, during shooting and playback",Yes. Fastest speed 1/2000 sec.,Optical 5x ZoomPlus 10x Digital Approx. 4x (with Digital Tele-Converter Approx. 1.5x or 2.0x and Safety Zoom¹). Combined Approx. 20x,Canon High Power Flash HF-DC2,,,,,,,,,,,,,,,,,,,,,,,,,,,,,,,,,,,,,,,,,,,,,,,,,,,,,,,,,,,,,,,,,,,,,,,,,,,,,,,,,,,,,,,,,,,,,,,,,,,,,,,,,,,,,,,,,,,,,,,,,,,,,,,,,,,,,,,,,,,,,,,,,,,,,,,,,,,,,,,,,,,,,,,,,,,,,,,,,,,,,,,,,,,,,,,,,,,,,,,,,,,,,,,,,,,,,,,,,,,,,,,,,,,,,,,,,,Yes,Digital Photo Professional for RAW development,,Image tagging feature,,,,,,,,,,,,,,,,,,,,,,,,,,,,,,,,,,,,,,,,,,,,,,,,,,,,,,,,,,,,,,,,,,,,,,,,,,,,
Buy Nikon COOLPIX S32 Digital Camera in Blue from CamBuy in Sydney,,,,,,,,,,,,,,,,,,,Approx. 107.6 x 66.1 x 40.4 mm (4.3 x 2.7 x 1.6 in.) (excluding projections),,,,,,,,,,,,,,,,,,,,,,,,,,ISO 125-1600,,,,,,,,,,,,,,,,,,,,,,,,,,,,,,,,Compact digital camera,,,Approx. 175 g (6.2 oz) (including battery and SD memory card),,,,,,,,,,,,,,,,,,,,,,,,,,,,,,,,"Point and Shoot, Choose a Style (Shoot night scenes, Shoot close-ups, Photograph food, Shoot at intervals, Shoot under water, Take a series of pictures, Photograph fireworks, Shoot backlit scenes, Mirror, Add a bubble effect, Add a neon effect, Add a cartoon effect, Take soft pictures, Create a diorama effect)",,,,,,,,Electronically-controlled ND filter (-2 AV) selection,Contrast-detect AF,Approx. 2 h 35 min (when using Charging AC Adapter EH-70P and when no charge remains),6 elements in 5 groups,,"MTP, PTP",Up to 4x (angle of view equivalent to that of approx. 360 mm lens in 35mm [135] format),Programmed auto exposure and exposure compensation (-2.0 - +2.0 EV in steps of 1 EV),"Still pictures: JPEG Voice messages: WAV Movies: MOV (Video: H.264/MPEG-4 AVC, Audio: LPCM stereo)","DCF, Exif 2.3, and DPOF compliant",TTL auto flash with monitor preflashes,f/3.3-5.9,4.1-12.3 mm (angle of view equivalent to that of 30-90 mm lens in 35mm [135] format),"[W]: Approx. 30 cm (1 ft) to infinity, [T]: Approx. 50 cm (1 ft 8 in.) to infinity Shoot close-ups, Photograph food, Shoot under water, Mirror, Add a bubble effect, Add a neon effect, Add a cartoon effect, Take soft pictures, Create a diorama effect, Highlight colors: Approx. 5 cm (2 in.) (wide-angle position) to infinity (All distances measured from center of front surface of the protective glass)","Center, face detection",Approx. 100% horizontal and 100% vertical (compared to actual picture),Approx. 96% horizontal and 96% vertical (compared to actual picture),85% or less (no condensation),1/3.1-in. type CMOS; approx. 14.17 million total pixels,,Hi-Speed USB,Audio/video (A/V) output; digital I/O (USB) HDMI micro connector (Type D) (HDMI output),NIKKOR lens with 3x optical zoom,,,"6.7 cm (2.7-in.), approx. 230k-dot, TFT LCD with anti-reflection coating and 5-level brightness adjustment","Motion detection (still pictures), electronic VR (still pictures)","Large (1080p) (default setting): 1920 x 1080/16:9/approx. 30 fps, Small (640): 640 x 480/4:3/approx. 30 fps, Small (old-fashioned): 640 x 480/4:3/approx. 15 fps",,13.2 million,"Battery Charger MH-66, AC Adapter EH-62G, Audio Video Cable EG-CP14",One Rechargeable Li-ion Battery EN-EL19 (included) AC Adapter EH-62G (available separately),COOLPIX S32,2 steps (f/3.3 and f/6.6 [W]),,,Mechanical and CMOS electronic shutter,1/2000-1 s 4 s (Choose a style is set to Photograph fireworks),,"Camera Strap, Rechargeable Li-ion Battery EN-EL19, Charging AC Adapter EH-70P, USB Cable UC-E16, Brush","Arabic, Bengali, Bulgarian, Chinese (Simplified and Traditional), Czech, Danish, Dutch, English, Finnish, French, German, Greek, Hindi, Hungarian, Indonesian, Italian, Japanese, Korean, Marathi, Norwegian, Persian, Polish, Portuguese (European and Brazilian), Romanian, Russian, Serbian, Spanish, Swedish, Tamil, Telugu, Thai, Turkish, Ukrainian, Vietnamese",,1/4 (ISO 1222),Electronic VR (movies),Can be selected from NTSC and PAL,,,,,,,,,,,,,,,,,,,,,,,,,,,,,,,,,,,,,,,,,,,,,,,,,,,,,,,,,,,,,,,,,,,,,,,,,,,,,,,,,,,,,,,,,,,,,,,,,,,,,,,,,,,,,,,,,,,,,,,,,,,,,,,,,,"Automatically selected from 480p, 720p, and 1080i",,,,,,,,,,,,,,,,,"Matrix, center-weighted (digital zoom less than 2x), spot (digital zoom 2x or more)",[W]: 0.3-3.1 m (1-10 ft) [T]: 0.6-1.7 m (2 ft-5 ft 6 in.),,,,,,,,,,,,,,,,,,,,,,,,,,,,,,,,,,,,,,,,,,,,,,,,,,,,,,,,,,,,,,,,,,,,,,,,,,,,,,,,,,,,,,,,,,,,,,,JIS/IEC protection class 6 (IP6X) equivalent (under our testing conditions),,,,,,,,,,,,,,,,,,,,,,,,,,,,,,,,,,,,,,,,,,,,,,,,,,,,,,,,,,,,,,,,,Cleared our testing conditions *3 compliant with MIL-STD 810F Method 516.5-Shock,,,,,,,,,,,,,,,,,,,,,,,,,,,,,,,,,JIS/IEC protection class 8 (IPX8) equivalent (under our testing conditions) Capacity to shoot pictures underwater up to a depth of 10 m (32 ft) and for 60 minutes,,,,,,,,,,,,,,,,,,,,,,,,,,,,,,,,,,,,,,,,,,,,,,,,,,,,,Approx. 220 shots when using EN-EL19,13 megapixels [4160 x 3120] 4 megapixels [2272 x 1704] 2 megapixels [1600 x 1200],Approx. 1 h 35 min when using EN-EL19,-10°C - +40°C (14°F-104°F) (for land use) 0°C-40°C (32°F-104°F) (for underwater use),"Internal memory (approx. 25 MB), SD/SDHC/SDXC memory card",Up to 11 images continuously at a rate of about 4.7 fps,,,,,,,,,,,,,,,,,,,,,,,,,,,,,,,,,,,,,,,,,,,,,,,,,,,,,,,,,,,,,,,,,,,,,,,,,,,,,,,,,
Buy Panasonic Lumix DMC-FZ1000 Digital Camera from CamBuy Camera Store,,,,Yes (On / Off),,,,,,,,,,,,,,Max. 4x,,,,,,,"1/3 EV step, +/-5 EV (+/-3 EV for motion picture)",,φ3.5mm for External Microphone,,,,,,,,,,,,,,,RAW / RAW+Fine / RAW+Standard / Fine / Standard,,,,,,,,,,,,,"ISO/IEC 18092, NFC-F (Passive Mode)",,,,,,,"Camera Effective Pixels
20.1 Megapixels",,,,,,2 sec / 10 sec / 10 sec (3 images),,,,,,,,,,,,Approx. 780 g without Battery and SD Memory Card (1.72 lb)/Approx. 831 g with Battery and SD Memory Card (1.83 lb),Auto / Daylight / Cloudy / Shade / Incandescent / Flash / White Set1 / White Set2 / White Set3 / White Set4 / Color Temperature/(2-axis Adjustable),,,IEEE 802.11b/g/n/2412 MHz - 2462 MHz (1-11 ch)/WPA / WPA2/Infrastracture Mode / WPS / Wi-Fi Direct/Wi-Fi Button,,,,,,,,,,,,,,,,,,,,,,,,,,,,,,,,,,,,,,,,,,,,,,,,f = 9.12 - 146mm/(27 - 432mm in 35mm equiv. in 4:3)/(25 - 400mm in 35mm equiv. in 3:2)/(26 - 416mm in 35mm equiv. in 16:9)/(32 - 512mm in 35mm equiv. in 1:1)/(26 - 416mm in 35mm equiv. in 16:9 video recording / O.I.S. Off / Level Shot function Off)/(28 - 448mm in 35mm equiv. in 16:9 video recording / O.I.S. On / Level Shot function Off)/(31 - 496mm in 35mm equiv. in 16:9 video recording / O.I.S. On / Level Shot function On)/(37 - 592mm in 35mm equiv. in 4K video recording),,,,,,,,"microHDMI, AV Output (PAL / NTSC), USB (AV/USB Multi) Remote Input
φ2.5mm for Remote",,"LEICA DC VARIO-ELMARIT/15 elements in 11 groups/(5 Aspherical Lenses / 8 Aspherical Surfaces / 4 ED Lenses) Aperture
F2.8 - 4.0 / Multistage Iris Diaphragm (Still Image: F2.8 - 8.0 (W), F4.0 - 8.0 (T), Motion Picture: F2.8 - 11.0 (W), F4.0 - 11.0 (T))","Recording Media
SD Memory Card, SDHC Memory Card, SDXC Memory Card (Compatible with UHS-I standard)",,"LCD Monitor
7.5cm (3.0"") Free-Angle TFT Screen LCD Display (921K dots), AR Coating/Field of View: Approx. 100%, Wide Viewing-angle/Power Monitor mode, AUTO Power Monitor mode",,,,,,,,,,,"Shutter Speed
Still Image:/Approx. 60 - 1/4,000 sec (Mechanical Shutter)/Approx. 1 - 1/16,000 sec (Electronic Shutter)/Bulb (Approx. 120 sec)/Motion Picture:/Approx. 1/25 - 1/16,000 sec/Approx. 1/2 - 1/16,000 sec (Creative Video Mode / MF Mode)",,,,,,,,,,,,,,,,,,,,,,,,,,,,,,,,,,,,,,,,,,,,,,,"Built- in- Flash
Auto*, Auto/Red-eye Reduction*, Forced On, Forced On/Red-eye Reduction, Slow Sync., Slow Sync./Red-eye Reduction, Forced Off * For iA, iA+ mode only./Flash Synchro: 1st / 2nd Slow Sync./Synchronization for flash dimming and exposure compensation/0.3 - 13.5m (Wide / ISO Auto), 1.0 - 9.5m (Tele / ISO Auto)",,,,,,,,,,,,,,,,,,,,,,,,,,,,,,,"Digital Red Eye Correction (Red-Eye Removal)
Yes (On / Off)",,,,,,,,,,,,,,,,,,,,,,,,,Auto / i.ISO / 80* / 100* / 125 / 200 / 400 / 800 / 1600 / 3200/ 6400 / 12800 / 25600* (* Extended ISO)/(Changeable to 1/3 EV step),,,,,,,,,,,,,,,,,,,,,,,,,,,,,,,,,,,,,,,,,,,,,,,,,,,,,,,,,,,,,,-,,,,,,,,,,,,,,,,,,16x,,,,,,,,,,,,,,,,,,,,,,,,,,,,,,,,,,,,,,,,,,,,,,,,,,,,,,,,,,,,,,,,,,,,,,,,,,,,,,,,,,,,,,,,,,,,,,,,,,,,,,,,,,,,,,,,,,,,,,,,,,,,,,,,,,,,,,,,,,,,,,,,,,,,,,,,,,,,,,,,,,,,,,,,,,,,,,,,,,,,,,,,,,,,,,,,,,,,,,,,,,,,,,,,,,,,,,,,,,,,,,,,,,,,,,,,,,,,,,,,,,,,"Battery Charger, Battery Pack, USB Cable, AC Cable, Lens Hood, Lens Cap, Hot Shoe Cover, DVD",,,,,,,,,,,,,,,,,,,"AVCHD
Approx. 65 min (FHD/60p), Approx. 70 min (FHD/60i)",Face/Eye Detection / Tracking / 49-area / Custom Multi / 1-area (flexible / scalable) / Pinpoint,"Microphone / Speaker
Stereo / Mono","3, 5, 7 frames in 1/3, 2/3 or 1 EV Step, Max. +/-3 EV",360 pictures (CIPA Standard)*1,-,Yes / No,"AVCHD
Approx. 130 min (FHD/60p), Approx. 135 min (FHD/60i)",-,No / Yes / Yes,Yes,"Playback Mode
All, Slideshow, Filtering Play (Picture Only, Video Only, Category Selection, Select Date, Favorite), Calendar",Yes / Yes,"RAW Processing
Yes","Exposure
Program AE, Aperture Priority AE, Shutter Priority AE, Manual","22.4x (3:2 / 10M (M)), 32x (3:2 / 5M (S))","File Format
Still Image: JPEG (DCF/Exif2.3) / RAW, DPOF/Motion Picture: AVCHD, MP4","Viewfinder
0.39"" OLED LVF (Live View Finder) (2359K dots), Field of View: Approx. 100%,/Magnification: Approx. 1.88x / 0.7x (35mm equiv.), Eye Sensor","AFS (Single) / AFF (Flexible) / AFC (Continuous) / MF/Normal / AF Macro / Macro Zoom, Quick AF On / Off (on in Intelligent Auto), Low Light AF, AF/AE Lock Button, AF Area Select, AF Tracking, Eye Sensor AF, Focus Peaking, One Shot AF (Set the Fn button in custom menu to AF-ON) Focusing Area
Normal: Wide 30 cm - infinity / Tele 100 cm - infinity/AF Macro / MF / Intelligent Auto / Motion Picture: Wide 3 cm - infinity / Tele 100 cm - infinity","1920 x 1080 pixels, 25p (FHD: MP4) (Sensor Output is 100fps)",32x,Intelligent Multiple / Center Weighted / Spot,"Dimensions (W x H x D)
136.8 x 98.5 x 130.7 mm/(5.39 x 3.88 x 5.15 inch)","4K Video
3840 x 2160 pixels, 25p (4K: 100Mbps / MP4) (Sensor Output is 25fps) (AAC)",Approx. 65 min (FHD) Approx. 130 min (FHD),Single / Multi / All / DPOF / Favorites,"Photo Style
Standard, Vivid, Natural, Monochrome, Scenery, Portrait, Custom, Cinelike D*, Cinelike V* * When Creative Video mode is selected.","Power
Li-ion Battery Pack (7.2V, 1200mAh, 8.7 Wh) (Included)/AC Adaptor (Input: 110 - 240V AC) (Included)","Still Image Scene Mode / Scene Guide
Clear Portrait, Silky Skin, Backlit Softness, Clear in Backlight, Relaxing Tone, Sweet Child's Face, Distinct Scenery, Bright Blue Sky, Romantic Sunset Glow, Vivid Sunset Glow, Glistening Water, Clear Nightscape, Cool Night Sky, Warm Glowing Nightscape,/Artistic Nightscape, Glittering Illuminations, Handheld Night Shot, Clear Night Portrait, Soft Image of a Flower, Appetizing Food, Cute Dessert, Freeze Animal Motion, Clear Sports Shot, Monochrome, Panorama",Yes / Yes / No / No,"Sensor Size / Total Pixels / Filter
1-type High Sensitivity MOS Sensor / Total Pixel Number 20.9 Megapixels / Primary Color Filter",Yes / Yes,"OSD language
Japanese, English, German, French, Italian, Spanish",Yes,Yes,"Included Software
PHOTOfunSTUDIO 9.5PE/SILKYPIX Developer Studio/LoiLoScope (trial version)/Adobe Reader","640 x 480, 25p (VGA: 4Mbps / MP4) (Sensor Output is 25fps) (AAC)",[4:3] 4864x3648 (17.5M) (L) / 3456x2592 (9M) (M) / 2432x1824 (4.5M) (S)/[3:2] 5472x3648 (20M) (L) / 3888x2592 (10M) (M) / 2736x1824 (5M) (S)/[16:9]5472x3080 (17M) (L) / 3840x2160 (8M) (M) / 1920x1080 (2M) (S)/[1:1] 3648x3648 (13.5M) (L) / 2592x2592 (6.5M) (M) / 1824x1824 (3.5M) (S),"12,30-thumbnails / Yes",Yes,Yes,,
Buy Olympus OM-D E-M1 Body Only in Black from CamBuy,,,,,,,,,,,330 shots (CIPA Test Standard),,,,,,,,,,,,,,,,,,,,,,,,,,,,,,,,4/3,,,Micro Four Thirds,,,TTL Image Sensor metering system,,"EV -2 to 20 (Digital ESP metering, Centre weighted average metering, Spot metering)",,,,,,,,,,,,,,,,,12 & 2 seconds (cancel available),,,,,,,,,,,,"497g (CIPA compliant, with BLN-1 battery and SD card)",,,,,,,,,,,,,,,,,,,,,,,,,,,,"Digital ESP metering (324-area multi pattern metering), Center weighted average metering, Spot Metering, Spot metering with highlight control, Spot metering with shadow control",,,,1. iAuto 2. Programme AE (Programme shift can be performed) 3. Aperture Priority 4. Shutter Priority 5. Manual 6. Movie 7. Photo Story 8. Scene Selector 9. Art Filter,,,,,"3 frames in 2, 4, 6 steps selectable in each A-B/G-M axis",,,,,,,,,,,,,,,,,,,,,,,,,,,,,,,,,,,,,,,,,,,,,,,,,,,,,,,,,,,,,,,,,,,,"sRGB, Adobe RGB",,,,,,"130.4 × 93.5 × 63.1 mm (CIPA guideline compliant, excluding protrusions)",,,,,,,,,,,,,,,,,,,,,,,,,,,,,,,,,,,,,,,,,,,,,,,,,,,,,,,,,,,,,,,,,,,,,,,,,,,,,,,,,,,,,,,,,"2, 3 or 5 frames in 0.3/0.7/1.0EV steps selectable, 7 frames in 0.3/0.7EV steps selectable",,,,,,"1/320 with Built-in Flash, 1/250 with External Flash, Super FP: 1/125-1/8000",,,,,,,,,,,,,,,,,,,,,,,,,,,,,,,,,,,Available (by using Smartphone GPS data),5 axis sensor shift,,,,,,,,,,,,,,,,,,,,,,Live MOS,Dual AF - Contrast Detection & Phase Difference High-Speed imager AF,HDMI Type D,BCN-1,,BLN-1 Li-ion battery (included),Stereo,Compact System Camera,USB 2.0 High Speed,Art Filters,,16.3,,,"3.5mm Stereo Socket, Also Compatible with SEMA-1 AP Microphone Attachment",,"GN10 (Fno/m) at ISO200, 7(Fno/m) at ISO100",,Single AF (S-AF) / Continuous AF (C-AF) / Manual Focus (MF) / S-AF + MF / AF tracking (C-AF + TR),TruePic VII,"ISO LOW (100) - 25,600",,Available,"SD Memory Card (SDHC, SDXC, UHS-I compatible, Eye-Fi Card compatible): Class 6 or higher is recommended for Movie shooting.: Not compatible with Endless Memory",,,In Scene select AE mode,,"RAW (12-bit lossless compression), JPEG, RAW+JPEG, MPO (3D still)",29 Minutes,"Portrait, e-Portrait, Landscape, Landscape + Portrait, Sport, Night, Night + Portrait, Children, High Key, Low Key, DIS mode, Macro, Nature Macro, Candle, Sunset, Documents, Panorama, Fireworks, Beach & Snow, Fisheye Conversion, Wide Conversion.","1,037,000 dot",,"60 - 1/8000 sec. Bulb: up to 30 min. (selectable longest time in the menu. Default: 8 min). 1/3, 1/2, or 1EV steps selectable.","MOV Format : Max 4GB, Motion-JPEG Format : Max 2GB",,"MOV (MPEG-4AVC/H.264) , AVI (Motion JPEG)",Yes,3 inch,TFT LCD Electrostatic Capacitive Touch Screen,,Yes,Yes. Using bundled FL-LM2 flash.,,,,,,,,,,,,,,,,,,,,,,,,,,,,,,,,,,,,,,,,,,,,,,,,,,,,,,,,,,,,,,,,,,,,,,,,,,,,,,,,,,,,,,,,,,,,,,,,,,,,,,,,,,,,,,,,,,,,,,,,,,,,,,,,,,,,,,,,,,,,,,,,,,,,,,,,,,,,,,,,,,,,,,,,,,,,,,,,,,,,,,,"Body, Li-ion battery BLN-1, Li-ion battery charger BCN-1, USB cable, Shoulder strap, OLYMPUS Viewer 2 (CD-ROM), Instruction manual, Warranty card","FL-50R, FL-36R, FL-50, FL-36, FL-14, FL-300R, FL-600R",Yes,30 - 90%,-10 to 40℃,RAW: 4608(H)x3456(V) (approx. 1/1.5 lossless compressed) Approx. 17MB Set1(LF): 4608(H)x3456(V) (1/4 compressed) Approx. 7.5MB Set2(LN): 4608(H)x3456(V) (1/8 compressed) Approx. 3.5MB Set3(MN): 2560(H)x1920(V) (1/8 compressed),RM-UC1 (optional) & WiFi via OI Share App,,,,,,,,,Live Guide,"VF-2, VF-3, VF-4, SEMA-1, PP-1, MAL-1, FL-LM1, FL-LM2","RAW development, Gradation auto, Monochrome, Sepia, Red-eye fix, Saturation, Resize (1280x960, 640x480, 320x240), Trimming, Aspect, e-Portrait, Image Ovarlay, Postrecording",Micro Four Thirds + Other lenses via suitable MFT adaptors,None,"S-I.S.AUTO, S-I.S.1, S-I.S.2, S-I.S.3, OFF",10fps (up to 36 shots in RAW UHS-I 80mbps write min SD Memory Card),"Pop Art, Soft Focus, Pale & Color, Light Tone, Grainy Film, Pin Hole, Diorama, Gentle Sepia, Cross Process, Dramatic Tone, Key Line, Watercolour",Supersonic Wave,"4:3, 3:2, 16:9, 1:1, 3:4","Pop Art, Soft Focus, Pale & Color, Light Tone, Grainy Film, Pin Hole, Diorama, Gentle Sepia, Cross Process, Dramatic Tone, Key Line, Watercolour","Auto WB, 7 Preset WBs, 2 Capture WBs, Custom WB (Kelvin setting)",,,,,,,,,,,,,,,,,,,,,,,,,,,,,,,,,,,,,,,,,,,,,,,,,
