"UM.HS5EE.001, 8653P25, Acer, LCD Monitor, Itenergy Ltd",Yes,No,No,16:9,LED,Acer,250 cd/m²,,,Black,16.7 Million Colours,100000000:1,,,,,,ENERGY STAR MPR II,Yes,,Yes,,,178°,3 Year,"Acer, Inc",UM.HS5EE.001,1920 x 1080,1.0,,36 W,S275HL Widescreen LCD MonitorPower CordVGA CableFoot Stand,In-plane Switching (IPS) Technology,,,S275HL,S275HL Widescreen LCD Monitor,LCD Monitor,6 ms,Full HD,"68.6 cm (27"")",,60 Hz,500 mW,,,178°,No,,Yes,,,142.24 mm,449.58 mm,220 V AC 110 V AC,Anti-glare,622.30 mm,,,,,No,500 mW,S,,No,-1°to15°,6.80 kg,38 kWh,A,,,,,,,,,,,,,,,,,,,,
"UM.VS5EE.B01, 8653Q46, Acer, LCD Monitor, Itenergy Ltd",Yes,No,No,16:9,LED,Acer,250 cd/m²,,,Black,16.7 Million Colours,100000000:1,,,,,,MPR II ENERGY STAR,Yes,,Yes,,,170°,3 Year,"Acer, Inc",UM.VS5EE.B01,1920 x 1080,1.0,,26 W,S235HL Widescreen LCD MonitorPower CordVGA CableFoot Stand,In-plane Switching (IPS) Technology,,,S235HL,S235HL Widescreen LCD Monitor,LCD Monitor,6 ms,Full HD,"58.4 cm (23"")",,60 Hz,600 mW,,,160°,No,,Yes,,,142.24 mm,403.86 mm,220 V AC 110 V AC,,548.64 mm,,,,,No,530 mW,S,,No,-5°to15°,4.60 kg,31 kWh,A,,,,,,,,,,,,,,,,,,,,
"E1980SD-B1, 2639935, Iiyama, LCD Monitor, Itenergy Ltd",Yes,,,5:4,LED,iiyama,250 cd/m²,Speaker,C-ULCETÜV-GSVCCI-BCU,Black,16.7 Million Colours,"1,000:1",189.5 mm,,No,Yes,Security Lock,ENERGY STAR TCO Displays 5.0,Yes,Yes,No,,402 mm,170°,3 Year,"iiyama North America, Inc",E1980SD-B1,1280 x 1024,1.0,2.0,16 W,ProLite E1980SDPower CableVGA (D-Sub) CableDVI-D CableAudio CableStandStand-BaseQuick Start GuideSafety Guide,,Mac PC,ProLite,E1980SD,ProLite E1980SD,LCD Monitor,5 ms,SXGA,"48.3 cm (19"")",Yes,75 Hz,1 W,No,,160°,Yes,100 x 100,Yes,3.20 kg,411 mm,,,220 V AC 110 V AC,,,,,,,,,,,,,,,,Wall Mountable,,,,,,,,No,No,No,,,,,,,,,
"XB2776QS-B1, 2707487, Iiyama, LCD Monitor, Itenergy Ltd",Yes,Yes,Yes,16:9,LED,iiyama,350 cd/m²,Speaker,CETUV-GSVCCI-BPSECU,Black,16.77 Million Colors,"1,000:1",249.5 mm,,Yes,Yes,Security Lock,ENERGY STAR TCO Certified Displays 6.0,Yes,Yes,Yes,Yes,565 mm,178°,3 Year,"iiyama North America, Inc",XB2776QS-B1,2560 x 1440,1.0,2.0,43 W,"ProLite XB2776QS 27"" LCD Screen With Ultra-High ResolutionPower CableDVI (Dual-link)Audio CableStand2 x ScrewsQuick Start GuideSafety Guide",Advanced High Performance In-plane Switching (AH-IPS) Technology,Mac PC,ProLite,XB2776QS,"ProLite XB2776QS 27"" LCD Screen with Ultra-high Resolution",LCD Monitor,5 ms,WQHD,"68.6 cm (27"")",Yes,75 Hz,500 mW,,,178°,Yes,100 x 100,Yes,8.80 kg,644 mm,,,110 V AC 220 V AC,,,,,,,,,,,,,,,,,,,,,,,,,,,,,,,,,,,
"9H.L7CLA.4BE, 3150179, BenQ, LCD Monitor, Itenergy Ltd",Yes,Yes,Yes,16:9,LED,BenQ,250 cd/m²,Speaker,,,16.7 Million Colours,"12,000,000:1",,,,Yes,Security Lock Eco Mode Flicker-free Senseye 3,ENERGY STAR 6.0 TCO Certified Displays 5.2,Yes,Yes,Yes,Yes,,170°,,BenQ Corporation,9H.L7CLA.4BE,1920 x 1080,1.0,2.0,,,Twisted Nematic Film (TN Film),PC,,GL2450HT,GL2450HT Widescreen LCD Monitor,LCD Monitor,2 ms,Full HD,"61 cm (24"")",Yes,,,,,160°,Yes,100 x 100,Yes,5.10 kg,,213 mm,502 mm,230 V AC 120 V AC,,579 mm,,,,,110 mm,,GL,,45°,-5°to15°,,,,Wall Mountable,,,,,,,,,,,,,,,,,,,
"9H.LA7LB.QBE, M352254, BenQ, LCD Monitor, Itenergy Ltd",Yes,,,16:9,LED,BenQ,250 cd/m²,Speaker,,Glossy Black,16.7 Million Colours,"1,000:1",194 mm,,,Yes,Security Lock Eco Mode Senseye 3,ENERGY STAR 5.1 TCO Certified Displays 6.0,Yes,Yes,Yes,Yes,434 mm,170°,,BenQ Corporation,9H.LA7LB.QBE,1920 x 1080,1.0,2.0,23 W,,,PC,,GL2460HM,GL2460HM Widescreen Monitor,LCD Monitor,2 ms,Full HD,"61 cm (24"")",Yes,,300 mW,,,160°,Yes,100 x 100,Yes,4.30 kg,565 mm,,,220 V AC 110 V AC,,,,,,,,,GL60,,,,,,,Wall Mountable,,,,,,,,,,,,,,,,,,,
"247E3LSU2/00, Philips, LCD Monitor, Itenergy Ltd",Yes,,,16:9,LED,Philips,250 cd/m²,,BSMICE MarkingFCC Class BGOSTPSBSASOSEMKOTUV ErgoTUV/GSUL/cUL,Blue Accent Glossy Black,16.7 Million Colours,"1,000:1",41 mm,,,Yes,Touch Controls Security Lock SmartImage,ENERGY STAR 5.0 EPEAT Silver WEEE RoHS TCO Certified Displays,Yes,Yes,,,363 mm,170°,3 Year,Philips Electronics,247E3LSU2/00,1920 x 1080,1.0,,17.53 W,,,Mac PC,,247E3LSU2,247E3LSU2 Widescreen LCD Monitor,LCD Monitor,5 ms,Full HD,"59.9 cm (23.6"")",,60 Hz,500 mW,,,160°,,,Yes,3.97 kg,579 mm,238 mm,442 mm,220 V AC 110 V AC,,579 mm,,,,,,500 mW,E,,,,4.50 kg,,,,,65%,,Yes,Plastic,,,,,,,,,,,,,,
"288P6LJEB/00, 3089024, Philips, LCD Monitor, Itenergy Ltd",Yes,Yes,Yes,16:9,LED,Philips,300 cd/m²,USB Hub Speaker,BSMI CE Mark cETLus FCC Class B GOST SASO SEMKO TUV Ergo TUV/GS,Textured Black,1.07 Billion Colors,"50,000,000:1",49 mm,,Yes,Yes,SmartErgoBase Multiview Mobile High-Definition Link (MHL) Picture in Picture Picture by Picture Eco Mode SmartImage Security Lock SmartControl,TCO Certified Displays 6.0 RoHS WEEE ENERGY STAR 6.0 TCO Certified Edge EPEAT Gold,Yes,Yes,Yes,Yes,395 mm,170°,,Philips Electronics,288P6LJEB/00,3840 x 2160,1.0,2.0,50.50 W,,,PC Mac,Brilliance,288P6LJEB,Brilliance 4K Ultra HD LED Backlit Monitor,LCD Monitor,1 ms,Ultra HD,"71.1 cm (28"")",Yes,60 Hz,500 mW,Yes,USB 3.0,160°,Yes,100 x 100,Yes,5.24 kg,659 mm,273 mm,573 mm,110 V AC 220 V AC,,659 mm,,,,,150 mm,,P,,65°,-5°to20°,8.04 kg,,,,,65%,,Yes,,,,,,,,,,,,,,,
"B2780HSU-W2, 3057091, Iiyama, LCD Monitor, Itenergy Ltd",Yes,Yes,Yes,16:9,LED,iiyama,300 cd/m²,USB Hub,CE TUV-Bauart,White Black,16.7 Million Colours,"5,000,000:1",250 mm,,,Yes,CAD/CAM Mode Security Lock i-Style-Color OverDrive,EPEAT Silver TCO Certified Displays 6.0 ENERGY STAR,Yes,Yes,Yes,Yes,,170°,,"iiyama North America, Inc",B2780HSU-W2,1920 x 1080,1.0,2.0,37 W,B2780HSU Widescreen LCD Monitor Power Cable VGA (D-Sub) Cable DVI Cable Audio Cable USB Cable Stand 2 x Screws Quick Start Guide Safety guide,Twisted Nematic Film (TN Film),Mac PC,ProLite,B2780HSU,B2780HSU Widescreen LCD Monitor,LCD Monitor,1 ms,Full HD,"68.6 cm (27"")",Yes,75 Hz,1 W,Yes,,160°,Yes,100 x 100,Yes,8 kg,,,548 mm,220 V AC 110 V AC,,642 mm,,,,,110 mm,1 W,,,340°,4°to22°,,,,Wall Mountable,,,,,,,,,,,,,,,,,,,
"UM.FV6EE.005, 8654E16, Acer, LCD Monitor, Itenergy Ltd",Yes,No,No,16:9,LED,Acer,250 cd/m²,,,Black,16.7 Million Colours,"100,000,000:1",206.8 mm,,,Yes,,EPEAT Gold ENERGY STAR TCO '06,Yes,Yes,,,422.2 mm,170°,3 Year,"Acer, Inc",UM.FV6EE.005,1920 x 1080,1.0,,20.90 W,V246HL Widescreen LCD MonitorPower Cord1 x VGA Cable,Twisted Nematic Film (TN Film),,,V246HL,V246HL Widescreen LCD Monitor,LCD Monitor,5 ms,Full HD,"61 cm (24"")",Yes,60 Hz,450 mW,,,160°,Yes,100 x 100,Yes,3.50 kg,567 mm,,,110 V AC 220 V AC,Anti-glare,,,,,,No,350 mW,V,,No,-5°to25°,3.90 kg,,,,,,,,,,,,,,,,,,,,,,
"9H.LAGLB.QBE, 2997289, BenQ, LCD Monitor, Itenergy Ltd",Yes,,,16:9,LED,BenQ,250 cd/m²,Speaker,,Glossy Black,16.7 Million Colours,"20,000,000:1",191.3 mm,,,,Security Lock Advanced Motion Accelerator (AMA) Senseye 3 Eye-Care Flicker-free Smart Focus Mobile High-Definition Link (MHL) Brightness Sensor,,,Yes,Yes,,421.6 mm,178°,,BenQ Corporation,9H.LAGLB.QBE,1920 x 1080,1.0,,42 W,EW2440L Widescreen LCD Monitor HDMI cable,Vertical Alignment (VA),PC,,EW2440L,EW2440L Widescreen LCD Monitor,LCD Monitor,4 ms,Full HD,"61 cm (24"")",Yes,,500 mW,,,178°,,,Yes,3.74 kg,545.7 mm,,,220 V AC 110 V AC,,,,,,,,,EW40,,,-5°to20°,,,,Wall Mountable,,,,,,,,,,,,,,,,,,,
"210-ACWC, 0912939, Dell, LCD Monitor, Itenergy Ltd",,,,16:9,LED,Dell,300 cd/m²,USB Hub Microphone Speaker,,,16.77 Million Colors,"8,000,000:1",46.2 mm,,Yes,,,EPEAT Gold RoHS ENERGY STAR 6.0 TCO Certified Displays,Yes,,Yes,,418.1 mm,,,"Dell, Inc",210-ACWC,1920 x 1080,1.0,,60 W,,,,UltraSharp,UZ2715H,UltraSharp 27 Multimedia Monitor - UZ2715H,LCD Monitor,8 ms,Full HD,"68.6 cm (27"")",Yes,,,Yes,,,Yes,,Yes,4.69 kg,658.9 mm,196.09 mm,467.61 mm,,,658.88 mm,,,,,,,,Yes,,,6.83 kg,,,,Click to view,25%,,,,,,,,,,,,,,,,,
"60002932, 3967386, NEC Display Solutions, LCD Monitor, Itenergy Ltd",Yes,,,16:9,LED,NEC Display,250 cd/m²,,,Light Grey Silver,16.7 Million Colours,"1,000:1",71.1 mm,,,Yes,,TCO Displays 5.0 EPEAT Silver ENERGY STAR RoHS,Yes,Yes,,,330.2 mm,176°,3 Year,NEC Display Solutions,60002932,1920 x 1080,1.0,,28 W,,,PC,MultiSync,E231W,MultiSync E231W Widescreen LCD Monitor,LCD Monitor,5 ms,,"58.4 cm (23"")",,50 Hz,340 mW,,,176°,Yes,100 x 100,Yes,4.20 kg,551.2 mm,213.40 mm,492.80 mm,220 V AC 110 V AC,,551.20 mm,,,,,,,E,,,,6.20 kg,,,,,,,,,,,,,,,,,,,,,,
"221P3LPYES/00, PHITFT221P3LPYE, Philips, LCD Monitor, Itenergy Ltd",Yes,,,16:9,LED,Philips,250 cd/m²,USB Hub Speaker,BSMICE MarkFCC Class BGOSTSEMKOTUV/GSTUV ErgoUL/cUL,Silver,16.7 Million Colours,"1,000:1",59 mm,,Yes,Yes,,RoHS TCO Certified Displays 5.1 EPEAT Gold ENERGY STAR,Yes,,,Yes,323 mm,176°,,Philips Electronics,221P3LPYES/00,1920 x 1080,1.0,2.0,17.80 W,,,Mac PC,Brilliance,221P3LPYES,Brilliance 221P3LPYES Widescreen LCD Monitor,LCD Monitor,5 ms,Full HD,"54.6 cm (21.5"")",Yes,60 Hz,500 mW,Yes,USB 2.0,170°,Yes,100 x 100,Yes,3.51 kg,507 mm,220 mm,487 mm,110 V AC 220 V AC,,507 mm,,,,,,,P,,,,5.64 kg,,,,,,,,,,,,,,,,,,,,,,
"9H.L6VLA.TPE, M352447, BenQ, LCD Monitor, Itenergy Ltd",,,,,LED,BenQ,250 cd/m²,,,Black,,"12,000,000:1",,,,Yes,,,,Yes,,,,170°,,BenQ Corporation,9H.L6VLA.TPE,1920 x 1080,1.0,,17 W,,,,,GL2250,GL2250 Widescreen LCD Monitor,LCD Monitor,5 ms,Full HD,"55.9 cm (22"")",,,,,,160°,,,Yes,,,,,,,,,,,,,,,,,,,,,,,,,,,,,,,,,,,,,,,,
"UM.WQ6EE.001, PBMAESTRO226DXBD, Acer, LCD Monitor, Itenergy Ltd",Yes,No,No,16:9,LED,Packard Bell,250 cd/m²,,,Black,16.7 Million Colours,"100,000,000:1",37 mm,,,Yes,CrystalBrite,MPR II EPEAT Gold,Yes,Yes,,,299 mm,178°,,"Acer, Inc",UM.WQ6EE.001,1920 x 1080,1.0,,26 W,Maestro226DX Widescreen LCD Monitor1 x VGA CablePower Cord,In-plane Switching (IPS) Technology,,Maestro,Maestro226DX,Maestro226DX Widescreen LCD Monitor,LCD Monitor,5 ms,Full HD,"54.6 cm (21.5"")",,60 Hz,450 mW,,,178°,No,,Yes,2.60 kg,498 mm,173 mm,385 mm,220 V AC 110 V AC,,498 mm,,,,,No,400 mW,,,No,-5°to15°,3.30 kg,,,,,,,,,,,,,,,,,,,,,,
"VA2349S, B921502, ViewSonic, LCD Monitor, Itenergy Ltd",Yes,,,16:9,LED,Viewsonic,250 cd/m²,,CE CB CU serves UkrSEPRO + DoC,,,"2,000:1",49.9 mm,,,Yes,Security Lock Eco Mode,ENERGY STAR RoHS WEEE REACH ErP EPEAT Silver,Yes,,,,339 mm,178°,2 Year,Viewsonic Corporation,VA2349S,1920 x 1080,1.0,,22 W,VA2349s Widescreen LCD Monitor Power cable D-Sub cable Quick start guide CD-ROM,In-plane Switching (IPS) Technology,PC,,VA2349s,VA2349s Widescreen LCD Monitor,LCD Monitor,5 ms,Full HD,"58.4 cm (23"")",,75 Hz,,,,178°,Yes,100 x 100,Yes,3.50 kg,548.4 mm,213.50 mm,395.10 mm,220 V AC 110 V AC,Anti-glare,548.40 mm,,,,82 kHz,,,,,,,3.90 kg,,,Wall Mountable,,,,,,,,,,,,,,,,,,,
"D7R00A4#ABU, HP, LCD Monitor, Itenergy Ltd",Yes,,Yes,16:9,LED,HP,250 cd/m²,USB Hub,WHQL CE CB KC KCC NOM PSB ICE TUV-S CCC SEPA ISC VCCI FCC BSMI,,1.07 Billion Colors,"1,000:1",65.5 mm,,Yes,,Security Lock,WEEE China Energy Label (CEL) REACH EPA TCO Certified Displays,Yes,Yes,Yes,,379.2 mm,178°,3 Year,Hewlett-Packard,D7R00A4#ABU,2560 x 1440,1.0,,,DreamColor Z27x Professional Display(D7R00A4) AC Power Cord DisplayPort Cable USB Cable HDMI Cable DisplayPort Mini Cable DVD Documentation Kit Factory Calibration Report,In-plane Switching (IPS) Technology,PC,Business,Z27x,DreamColor Z27x Professional Display(D7R00A4),LCD Monitor,7 ms,WQHD,"68.6 cm (27"")",,,,Yes,USB 3.0,178°,,,,8.80 kg,641 mm,242.40 mm,420.40 mm,230 V AC 120 V AC,Anti-glare,641 mm,,,,,,,Z,,45°,-5°to20°,,,,,,,,,,,,,,,,,,,,,,,
"UM.WV6EE.A09, 8654G61, Acer, LCD Monitor, Itenergy Ltd",Yes,No,No,16:9,LED,Acer,250 cd/m²,,,Black,16.7 Million Colours,"100,000,000:1",206.8 mm,,,Yes,,ENERGY STAR EPEAT Gold TCO '06,Yes,Yes,,,390.4 mm,178°,3 Year,"Acer, Inc",UM.WV6EE.A09,1920 x 1080,1.0,,19.50 W,V226HQL Widescreen LCD Monitor1 x VGA Cable,Vertical Alignment (VA),,,V226HQL,V226HQL Widescreen LCD Monitor,LCD Monitor,8 ms,Full HD,"54.6 cm (21.5"")",Yes,60 Hz,350 mW,,,178°,Yes,100 x 100,Yes,3.24 kg,508 mm,,,220 V AC 110 V AC,Anti-glare,,,,,,No,250 mW,V,,No,-5°to25°,3.66 kg,,,,,,,,,,,,,,,,,,,,,,
"X2483HSU-B1, IIYX2483HSUB, Iiyama, LCD Monitor, Itenergy Ltd",Yes,,,16:9,LED,iiyama,250 cd/m²,USB Hub Speaker,CE TÜV-GS VCCI-B PSE CU,Black,16.7 Million Colours,"3,000:1",203 mm,,,Yes,OverDrive Security Lock,TCO Certified Displays ENERGY STAR,Yes,Yes,Yes,Yes,412 mm,178°,3 Year,"iiyama North America, Inc",X2483HSU-B1,1920 x 1080,1.0,2.0,27 W,ProLite X2483HSU Widescreen LCD Monitor Power Cable VGA Cable DVI-D Cable Audio Cable USB Cable Stand Quick Start Guide Safety Guide,AMVA+,Mac PC,ProLite,X2483HSU,ProLite X2483HSU Widescreen LCD Monitor,LCD Monitor,4 ms,Full HD,"61 cm (24"")",Yes,75 Hz,500 mW,Yes,USB 2.0,178°,Yes,100 x 100,Yes,3.30 kg,565.5 mm,,,220 V AC 110 V AC,,,,,,,,,,,,,,,,,,,,,,,,,,,,,,,,,,,
"EF240A, EDGMON044, Edge10, LCD Monitor, Itenergy Ltd",Yes,,,16:9,LED,Edge10,300 cd/m²,,cULusFCCCETUV,Black,16.7 Million Colours,"10,000:1",,,,Yes,Security Lock,ENERGY STAR WEEE,Yes,,,,,170°,3 Year,Edge10 Corporation Limited,EF240a,1920 x 1080,1.0,2.0,30 W,,,Mac PC,,EF240a,EF240a Widescreen LCD Monitor,LCD Monitor,2 ms,Full HD,"61 cm (24"")",Yes,75 Hz,1 W,,,160°,Yes,100 x 100,Yes,5 kg,,200 mm,400 mm,220 V AC,,555 mm,,,,,,,,,,,,,,Wall Mountable,,,,,,,,,,,,,,,,,,,
"E4U30AT#ABU, 943ACNZ, HP, LCD Monitor, Itenergy Ltd",Yes,Yes,Yes,5:4,LED,HP,250 cd/m²,USB Hub,"CECP eco label (China Energy Conservation Program) SEPA eco label (China) TGM eco label(Taiwan Green Mark) EuP lot6 Tier2 China MEPS, Korea MEPS (E-standby) ISO 9241-307 CSA 60950-1 UL 60950-1 EN55022 Class B EN60950 -1 CNS 13438 Class B IEC 60950-1 ""GS"" Mark VCCI KC KCC (Korean) CE Marking FCC Part 15 class B CCC IT ECO (EDS) EN55024 Class B CISPR SmartWay Energy logistics",Black,,"3,000,000:1",47 mm,,Yes,Yes,Security Lock,China Energy Label (CEL) IT Eco Declaration ENERGY STAR TCO Certified Displays TÜV EPEAT Gold,Yes,,,,347 mm,178°,3 Year,Hewlett-Packard,E4U30AT#ABU,1280 x 1024,1.0,,28 W,EliteDisplay E190i 18.89-inch 5:4 LED Backlit IPS Monitor VGA cable DVI cable DisplayPort cable USB cable AC Power cable Warranty card and CD Monitor driver (ICM/INF) Auto adjustment pattern utility software Adobe Acrobat Reader software HP Display Assistant software,In-plane Switching (IPS) Technology,,Elite,E190i,EliteDisplay E190i 18.89-inch 5:4 LED Backlit IPS Monitor,LCD Monitor,8 ms,SXGA,"48 cm (18.9"")",,76 Hz,500 mW,Yes,USB 2.0,178°,,,Yes,3 kg,417 mm,192 mm,486 mm,220 V AC 110 V AC,Anti-static Anti-glare,417 mm,,,,,120 mm,,,,180°,-5°to25°,4.90 kg,,,,,,,,,,,,,,,,,,,,,,
"60003334, 3967978, NEC Display Solutions, LCD Monitor, Itenergy Ltd",Yes,Yes,Yes,16:10,LED,NEC Display,250 cd/m²,,CETÜV ErgonomicsTÜV GSGEEA/Energy LabelFCC Class BPCT/GostUL/C-ULCSAISO 9241-307,Black,16.7 Million Colours,"25,000:1",218 mm,Landscape/Portrait,Yes,Yes,Auto Brightness Control (ABC) Cable Management Eco Mode Carbon Footprint Meter Touch Controls Off Timer Security Lock,ENERGY STAR 5.0 ErP TCO Certified Displays 5.2 TCO Certified Displays 6.0 EPEAT Silver MPR III MPR II RoHS,Yes,Yes,,,384 mm,178°,3 Year,NEC Display Solutions,60003334,1680 x 1050,1.0,,25 W,E223W Widescreen LCD MonitorPower CableCD-ROMSales Office ListUser ManualVGA CableDVI Cable,,PC,MultiSync,E223W,E223W Widescreen LCD Monitor,LCD Monitor,5 ms,WSXGA+,"55.9 cm (22"")",,60 Hz,400 mW,,,178°,Yes,100 x 100,Yes,5.60 kg,503.5 mm,,,220 V AC 110 V AC,,,,,,,,,,,,,,,,,,,,,,,,,,,,,,,,,,,
"LS19C45KMWV/EN, 2694921, Samsung, LCD Monitor, Itenergy Ltd",Yes,Yes,Yes,16:10,LED,Samsung,250 cd/m²,Speaker,"UL: UL 60950-1CSA: CSA C22.2 No.60950-1TUV: EN60950-1, K60950-1CCC: GB 4943-2001PSB: IEC60950-1SIQ: IEC60950-1, EN55022PCBC: IEC60590-1, EN55022NOM: NOM-019-SCFI-1993IRAM: IEC60950-1SASO: IEC60950-1EMC:FCC Part 15, Subpart B class ACE EN55022, EN55024KCC: KN22, KN24C-Tick: AS/NZS3548 (CISPR22)CCC: GB 9254-2008, GB 17625.1-2003",Matte Black,16.7 Million Colours,"1,000:1",54.8 mm,,No,Yes,Off Timer MagicAngle Eco Saving MagicTune MagicRotation MultiScreen MagicBright3,EPEAT Gold Eco-label ENERGY STAR TCO Certified Displays,Yes,,No,,289.9 mm,170°,3 Year,Samsung,LS19C45KMWV/EN,1440 x 900,1.0,2.0,19 W,"19"" S19C450MW Series 4 LED Business MonitorD-sub CableAudio CablePower Cable Length 1.5 mE-ManualInstallation CDQuick Installation Guide",,PC,,S19C450MW,"19"" S19C450MW Series 4 LED Business Monitor",LCD Monitor,5 ms,WXGA+,"48.3 cm (19"")",Yes,,100 mW,,,160°,Yes,100 x 100,Yes,2.75 kg,439.4 mm,210 mm,423.20 mm,220 V AC 110 V AC,,439.40 mm,,,,,,,450,,,,4.25 kg,,,Wall Mountable,,,,Yes,Plastic,,,,,,,,,,,,,,
"9H.LA2LB.DPE, 3223116, BenQ, LCD Monitor, Itenergy Ltd",,,,16:9,LED,BenQ,250 cd/m²,,,,16.7 Million Colours,"20,000,000:1",61 mm,,,Yes,,ENERGY STAR TCO Certified Displays 5.2,Yes,,,,320 mm,,,BenQ Corporation,9H.LA2LB.DPE,1920 x 1080,1.0,,21 W,,,,,GW2255,GW2255 Widescreen LCD Monitor,LCD Monitor,6 ms,Full HD,"54.6 cm (21.5"")",,,,,,,Yes,,Yes,3.70 kg,525 mm,174 mm,400 mm,,,525 mm,,,,,,,GW,,,,,,,,Click to view,,,,,,,,,,,,,,,,,,
"UM.VG7EE.005, ACEG237HLBI, Acer, LCD Monitor, Itenergy Ltd",Yes,No,No,16:9,LED,Acer,250 cd/m²,,,Black,16.7 Million Colours,"100,000,000:1",,,,,CrystalBrite,MPR II,Yes,,Yes,,,178°,2 Year,"Acer, Inc",UM.VG7EE.005,1920 x 1080,1.0,,25 W,G237HL Widescreen LCD Monitor1 x VGA CablePower Cord,In-plane Switching (IPS) Technology,,,G237HL,G237HL Widescreen LCD Monitor,LCD Monitor,6 ms,Full HD,"58.4 cm (23"")",,,490 mW,,,178°,,,Yes,,,185 mm,402 mm,220 V AC 110 V AC,,532 mm,,,,,,450 mW,G,,No,-5°to15°,,31 kWh,A,,,,,,,,,,,,,,,,,,,,
"ES220d, EDGMON056, Edge10, LCD Monitor, Itenergy Ltd",Yes,,,16:9,LED,Edge10,300 cd/m²,,CE cULus FCC ISO 9241-307 Class II,Black,16.7 Million Colours,"10,000:1",,,,Yes,Security Lock,ENERGY STAR WEEE,Yes,,,,,170°,3 Year,Edge10 Corporation Limited,ES220d,1920 x 1080,1.0,,21 W,"21.5"" LED Full HD Display with Dual Input (DVI & VGA) Power Cable VGA Cable",,Mac PC,,ES220d,"21.5"" LED Full HD Display with Dual Input (DVI & VGA)",LCD Monitor,5 ms,Full HD,"54.6 cm (21.5"")",No,75 Hz,1 W,,,170°,Yes,100 x 100,Yes,3.33 kg,,160 mm,456 mm,220 V AC 110 V AC,,507 mm,,,,,,1 W,,,,,,,,Wall Mountable,,,,,,,,,,,,,,,,,,,
"60ABAAT1UK, LNVCMG10, Lenovo, LCD Monitor, Itenergy Ltd",Yes,Yes,,16:9,LED,Lenovo,200 cd/m²,,"KC BELLIS CSA SABS CCC CE GOST INSM PSB BSMI SASO ISC STZ IEC-950 CB Report,KUCAS JEITA IRAM-S NOM KVALITET NEMKO",Black,16.7 Million Colours,600:1,53 mm,,,,,China RoHS EPEAT Silver EU RoHS China Energy Label (CEL) Turkey RoHS ENERGY STAR 6.0 Ukraine RoHS,Yes,,,,274.9 mm,,3 Year,Lenovo Group Limited,60ABAAT1UK,1600 x 900,1.0,,17 W,ThinkVision LT2013s 19.5-inch LED Backlit LCD Monitor Power Cord,,,ThinkVision,LT2013s,ThinkVision LT2013s 19.5-inch LED Backlit LCD Monitor (UK Power Cord),LCD Monitor,5 ms,HD+,"49.5 cm (19.5"")",,,,,,50°,Yes,,Yes,2.89 kg,467 mm,,,,,,,,,,,,,,,,,,,,,,,,,,,,,,,,,,,,,,
"UM.WG6EE.H01, 8654N51, Acer, LCD Monitor, Itenergy Ltd",Yes,No,No,16:9,LED,Acer,250 cd/m²,,,Black,16.7 Million Colours,"100,000,000:1",36 mm,,,Yes,,MPR II,Yes,Yes,,,311 mm,178°,2 Year,"Acer, Inc",UM.WG6EE.H01,1920 x 1080,1.0,,20.50 W,G226HQL Widescreen LCD Monitor1 x VGA CablePower Cord,Vertical Alignment (VA),,,G226HQL,G226HQL Widescreen LCD Monitor,LCD Monitor,8 ms,Full HD,"54.6 cm (21.5"")",,60 Hz,340 mW,,,178°,No,,Yes,2.60 kg,511 mm,168 mm,365 mm,220 V AC 110 V AC,Anti-glare,511 mm,,,,,No,300 mW,G,,No,-5°to15°,2.90 kg,,,,,,,,,,,,,,,,,,,,,,
"VX2209, B921663, ViewSonic, LCD Monitor, Itenergy Ltd",Yes,,,16:9,LED,Viewsonic,250 cd/m²,,CE CU EAC,,16.7 Million Colours,"20,000,000:1",33.6 mm,,,Yes,Eco Mode,RoHS WEEE,Yes,,,,297.8 mm,170°,2 Year,Viewsonic Corporation,VX2209,1920 x 1080,1.0,,24 W,"VX2209 22"" Full HD LED Display Power Adaptor VGA Cable User Manual",,Mac PC,,VX2209,"VX2209 22"" Full HD LED Display",LCD Monitor,5 ms,Full HD,"55.9 cm (22"")",,75 Hz,,,,160°,Yes,75 x 75,Yes,2.46 kg,501.1 mm,215 mm,355.80 mm,230 V AC 120 V AC,Anti-glare,501.10 mm,,,,,,,VX,,,-3°to20°,3.07 kg,,,,,,,,,,,,,,,,,,,,,,
"UM.WK3EE.005, PBVISEO223DXBD, Acer, LCD Monitor, Itenergy Ltd",Yes,No,No,16:9,LED,Packard Bell,200 cd/m²,,,Black,16.7 Million Colours,"100,000,000:1",52 mm,,,Yes,,MPR II EPEAT Gold,Yes,Yes,,,304.5 mm,90°,,"Acer, Inc",UM.WK3EE.005,1920 x 1080,1.0,,18.10 W,Viseo223DX Widescreen LCD Monitor1 x VGA CablePower Cord,Twisted Nematic Film (TN Film),,Viseo,Viseo223DX,Viseo223DX Widescreen LCD Monitor,LCD Monitor,5 ms,Full HD,"54.6 cm (21.5"")",,60 Hz,450 mW,,,65°,Yes,100 x 100,Yes,2.70 kg,508 mm,207 mm,390.50 mm,110 V AC 220 V AC,Anti-glare,508 mm,,,,,No,350 mW,,,No,-5°to25°,3.10 kg,,,,,,,,,,,,,,,,,,,,,,
"243V5LSB/00, 2889771, Philips, LCD Monitor, Itenergy Ltd",Yes,,,16:9,LED,Philips,250 cd/m²,,BSMI CE Mark cETLus FCC Class B GOST PSB SASO SEMKO TUV/ISO9241-307,Black,16.7 Million Colours,"1,000:1",52 mm,,,Yes,Security Lock Sync on Green SmartControl,ENERGY STAR 6.0 WEEE TCO Certified Displays EPEAT Silver RoHS,Yes,Yes,,,344 mm,170°,2 Year,Philips Electronics,243V5LSB/00,1920 x 1080,1.0,,16.70 W,,,PC Mac,,243V5LSB,LCD Monitor with SmartControl Lite,LCD Monitor,5 ms,Full HD,"59.9 cm (23.6"")",,60 Hz,500 mW,,,160°,Yes,100 x 100,Yes,3.22 kg,551 mm,220 mm,420 mm,110 V AC 220 V AC,,551 mm,,,,,,500 mW,V,,,,3.66 kg,,,,,,,,,,,,,,,,,,,,,,
"F8C55AT#ABU, 943ASGM, HP, LCD Monitor, Itenergy Ltd",Yes,,,16:9,LED,HP,200 cd/m²,,,Black,,"3,000,000:1",46.9 mm,,,,Security Lock,WEEE REACH,Yes,,,,288.7 mm,90°,1 Year,Hewlett-Packard,F8C55AT#ABU,1600 x 900,1.0,,23 W,"V201a 49,4 cm (19.45'') LED Backlit Monitor (F8C55AT) AC power cord VGA cable Audio cable Printed documentation Display Assistant (software)",,,Business,V201a,"V201a 49,4 cm (19.45'') LED Backlit Monitor (F8C55AT)",LCD Monitor,5 ms,HD+,"49.4 cm (19.5"")",,,500 mW,,,50°,,,Yes,2.80 kg,468 mm,190 mm,355.30 mm,220 V AC 110 V AC,Anti-glare,468 mm,,,,,,,Value,,,-5°to15°,,,,,,,,,,,,,,,,,,,,,,,
"22MP55HQ-P, 2998247, LG Electronics, LCD Monitor, Itenergy Ltd",Yes,,Yes,16:9,,LG,250 cd/m²,,,High Glossy Black,16.7 Million Colours,"5,000,000:1",61 mm,,No,No,Super Energy Saving Flicker-free Reading Mode,,,Yes,Yes,Yes,312.4 mm,178°,,LG Electronics,22MP55HQ-P,1920 x 1080,1.0,,20 W,,In-plane Switching (IPS) Technology,PC,,22MP55HQ-P,22MP55HQ-P Widescreen LCD Monitor,LCD Monitor,5 ms,Full HD,"55.9 cm (22"")",,,,,,178°,Yes,75 x 75,Yes,4.10 kg,508 mm,187.96 mm,416.56 mm,,Anti-glare,508 mm,,,,83 kHz,,300 mW,MP55,,,-3°to20°,,,,Panel-mountable,,,,,,,,,,,,,,,,,,,
"24MP55HQ-P, 2998421, LG Electronics, LCD Monitor, Itenergy Ltd",,,,16:9,LED,LG,250 cd/m²,,,High Glossy Black,16.7 Million Colours,"5,000,000:1",55 mm,,No,No,Flicker-free Super Energy Saving Reading Mode,ENERGY STAR,Yes,,Yes,,332 mm,178°,,LG Electronics,24MP55HQ-P,1920 x 1080,1.0,,22 W,,In-plane Switching (IPS) Technology,PC,,24MP55HQ-P,24MP55HQ-P Widescreen LCD Monitor,LCD Monitor,5 ms,Full HD,"60.5 cm (23.8"")",,60 Hz,300 mW,,,178°,Yes,100 x 100,Yes,3.10 kg,544 mm,188 mm,440 mm,,Anti-glare,544 mm,,,,83 kHz,,300 mW,,,,-3°to20°,,,,Wall Mountable,,,,,,,,,,,,,,,,,,,
"E5Z95AA#ABU, 3040570, HP, LCD Monitor, Itenergy Ltd",Yes,,,16:9,LED,HP,250 cd/m²,Speaker,CB CE TUV-GS ETL S-mark,Black,,"3,000,000:1",46.9 mm,Landscape,,Yes,Security Lock,WEEE TCO '99 EPEAT Silver REACH ENERGY STAR TÜV MPR II,Yes,Yes,,,347.7 mm,170°,1 Year,Hewlett-Packard,E5Z95AA#ABU,1920 x 1080,1.0,,30 W,"V241a 59,94 cm (23.6'') LED Backlit Monitor (ENERGY STAR)(E5Z95AA) VGA Cable Audio Cable AC Power Cord Printed Documentation and CD HP Display Assistant Software",,,Business,V241a,"V241a 59,94 cm (23.6'') LED Backlit Monitor (ENERGY STAR)(E5Z95AA)",LCD Monitor,5 ms,Full HD,"59.9 cm (23.6"")",Yes,,500 mW,,,160°,,,Yes,,563.3 mm,204.10 mm,412.40 mm,230 V AC 120 V AC,Anti-glare,563.30 mm,,,,,,,Value,,360°,-5°to20°,4 kg,,,,,,,,,,,,,,,,,,,,,,
"XB2483HSU-B1, IIYXB2483HSUB, Iiyama, LCD Monitor, Itenergy Ltd",Yes,Yes,Yes,16:9,LED,iiyama,250 cd/m²,Speaker USB Hub,CE TÜV-GS VCCI-B PSE CU,Black,16.7 Million Colours,"3,000:1",,,,Yes,Security Lock,ENERGY STAR TCO Certified Displays 6.0,Yes,Yes,Yes,Yes,,178°,3 Year,"iiyama North America, Inc",XB2483HSU-B1,1920 x 1080,1.0,2.0,27 W,"High-end 24"" AMVA+ Monitor Featuring Height Adjustable Stand Power cable D-Sub signal cable DVI-D cable USB cable Audio cable Stand Stand-base Quick start guide Safety guide",Advanced-Multi-domain Vertical Alignment Plus (A-MVA+),PC,ProLite,XB2483HSU,"High-end 24"" AMVA+ Monitor Featuring Height Adjustable Stand",LCD Monitor,4 ms,Full HD,"61 cm (24"")",Yes,75 Hz,500 mW,Yes,USB 2.0,178°,Yes,100 x 100,Yes,5 kg,,230 mm,516.50 mm,,,565.50 mm,,,,,,,,,,,,,,Wall Mountable,,,,,,,,,,,,,,,,,,,
"LS22C45KBSV/EN, 886H968, Samsung, LCD Monitor, Itenergy Ltd",Yes,Yes,Yes,16:9,LED,Samsung,250 cd/m²,,"Eco Label Certifications:UL 60950-1CSA C22.2 No. 60950-1TUV: EN60950-1NEMKO: EN60950-1KC: K60950-1CCC: GB 4943-2001PSB: IEC60950-1GOST: IEC60950-1, EN55022SIQ: IEC60950-1, EN55022PCBC: IEC60590-1, EN55022NOM: NAME -019-SCFI-1993IRAM IEC60950-1SASO: IEC60950-1EMC:FCC Part 15 Subpart B Class ACE EN55022, EN55024VCCI V-3 (CISPR22)KCC: KN22, KN24C-Tick: AS / NZS3548 ( CISPR22)CCC: GB 9254-2008, GB 17625.1-2003",Matte Black,16.7 Million Colours,"1,000:1",55.5 mm,,No,Yes,Eco Saving MagicTune MagicRotation MagicAngle MagicBright3 MultiScreen Off Timer,ENERGY STAR EPEAT Gold TCO Certified Displays,Yes,,No,,301.9 mm,170°,1 Year,Samsung,LS22C45KBSV/EN,1920 x 1080,1.0,,24 W,"21.5"" S22C450B Series 4 LED Business MonitorD-Sub CableDVI CablePower Cablee-ManualCD-ROMQuick Installation Guide",,PC,Business,S22C450B,"21.5"" S22C450B Series 4 LED Business Monitor",LCD Monitor,5 ms,Full HD,"54.6 cm (21.5"")",No,,100 mW,,,160°,Yes,100 x 100,Yes,3.05 kg,504.3 mm,210 mm,425.35 mm,110 V AC 220 V AC,,504.30 mm,,,,,,,450,,,,4.50 kg,,,,,,,Yes,Plastic,,,,,,,,,,,,,,
