"Buy Peerless Corner Mount for Flat Panel Displays 40-60"", Black Stands & Mounts - AV CM60 today at PC Connection",RoHS,,,,,,This product is subject to our return policy. Please see our complete return policy for details.,5 Years,5 Years,Black,"Flat panel displays 40-60 inches.
Max load capacity: 200 lbs.
Allows display to be mounted directly in to the corner.
CM60(-S) includes additional plate to accommodate compatible flat/tilt wall mounts for flat panel displays from 40"" – 60"" (SF/ST640/650/660, PF/PT640/650/660 & ONE-TP).
Wall units accommodate speakers when used with smaller displays (wall unit maybe visible with some smaller displays).
Optional shelving available for A/V components.","Corner mount, hardware, documentation",Mounting kit,Flat panel display,33.00 lb(s),"9.3""h x 36.6-60""w x 22""d",Limited.,,,,,,,,,,,,,,,,,,,,,,,,,,,,,,,,,
"Buy Atdec Acrobat Articulated Arm Wall Mount, Black Stands & Mounts - AV SD-AT-DW-BK today at PC Connection",,,,,,,This product is subject to our return policy. Please see our complete return policy for details.,5 Years,5 Years,Black,,"Mount, hardware, documentation",Mounting arm,Flat panel display,,,,,,,,,,,,,,,,,,,,,,,,,,,,,,,,,,,,
Buy Ergotron FX30 Wall Mount Stands & Mounts - AV 60-239-007 today at PC Connection,,,,,,,This product is subject to our return policy. Please see our complete return policy for details.,5 Years,5 Years,Black,,"Mount, documentation",Wall mount,Flat panel display Monitor,30.00 lb(s),"4.5""w x 4.5""d",,,,,,,,,,,,,,,,,,,,,,,,,,,,,,,,,,
"Buy Acer C205 WXGA DLP Projectors, 200 Lumens, White Projectors MR.JH911.009 today at PC Connection",,,,,,,,1 Year,1 Year,White,,"projector, power adapter, MHL cable, protection case, documentation",,,10.70 oz,"1.1""h x 5.7""w x 4.3""d",90 days on lamp,,,10.7 oz,,16.7 million colors,HDMI,HDMI,1000:1,Digital Light Processing (DLP),,1280 x 800,"(1) HDMI
(1) Power in","Supply: 110-220VAC
Consumption: 40W (typ.)",,,Dual speakers Speakers Included,Desktop Floor-mounted front projection Tabletop,4:3 16:9,8.3 ft,1.3 ft,854 x 480,DLP projector,Multiscan,2 ft,,200 ANSI lumens,LED,,,,,,
"Buy NDS 20.8"" E3 3MP Monitor with Quadro K600 Graphics Card Monitors - Medical 997-5713-00-1EN today at PC Connection",MIC CE CSA EN 55011 DICOM Part 14 CCC VCCI FCC Class B certified,Tilt Height Pivot (rotation) Swivel,20.8 in,.206 mm,,600 nit(s) 1000 nit(s),"Due to manufacturer restrictions, all sales on this item are final.",5 Years,5 Years,Gray,,"Display, graphics card, documentation",,,14.00 lb(s),"18.7""h x 14.5""w x 4""d",,,,,,3061 grayscales,DVI Power USB Type B USB Type A,Power USB 1.1 DVI,900:1,TFT,Standard,2048 x 1536 1536 x 2048,"(1) Dual-Link DVI
(1) USB Type B
(2) USB Type A
(1) Power in","Voltage: 100-240VAC, 50-60Hz single phase
Consumption: 60W (typ.) 72W (max.)",35 ms,170/170,,,,,,,,,,,,,Digital Visual Interface (DVI),,,,,
"Buy LG 60"" LY340C Full HD LED-LCD Commercial TV, Black Televisions - LED-LCD Commercial 60LY340C today at PC Connection",,,,,Yes,,This product is subject to our return policy. Please see our complete return policy for details.,2 Years,2 Years,,,,,,,,,60 in,2 speakers,,,,,,,,,,,,,,,,,,,,,,,,,,,,,,,
"Buy Elite VMax2 Electric Projection Screen, MaxWhite, 4:3, 100in Projector Screens VMAX100XWV2 today at PC Connection",,,,,,,This product is subject to our return policy. Please see our complete return policy for details.,2 Years,2 Years,,,"Projection screen, remote controls, wall box, documentation",,,0.00 lb(s),"72.5""h x 93""w","Government, Education, Military, and Religious customers receive a 3 year screen warranty",,,,,,,,,,,,,,,,,,,,,,,,,,,,,,,,,
"Buy NDS 21.3"" Dome S3c Color Display, No Video Card Monitors - Medical 997-5803-00-1NN today at PC Connection",CSA FCC CE CCC VCCI WEEE RoHS,Height Swivel Tilt Pivot (rotation),21.3 in,.212 mm,,800 nit(s) 500 nit(s),"Due to manufacturer restrictions, all sales on this item are final.",5 Years,5 Years,Black,,"Display, documentation",,,14.00 lb(s),"18.7""h x 14.3""w x 3.9""d",Includes backlight,,,,,24-bit (16.7M colors) 2041 grayscales,DisplayPort USB Type B DVI-D Power,Power DisplayPort DVI-D USB,750:1,LCD TFT,Standard,1536 x 2048 2048 x 1536,"(1) DVI-D
(1) DisplayPort
(1) USB Type B
(1) Power in","Input: 100-240VAC, 50-60Hz
Consumption: 96W (typ.); 108W (max.)",24 ms,170/170,Pivot Rotating screen,,,,,,,,,,,,Digital Visual Interface (DVI),,,,,
Buy Keyspan RF Remote for Windows Vista Remote Controls - Presentation ER-V2 today at PC Connection,,,,,,,This product is subject to our return policy. Please see our complete return policy for details.,1 Year,1 Year,Silver,,"Remote, USB transciever, documentation",,,,,,,,,,,,,,,,,,,,,,,,,,,,,,,,,,,"PC with an available USB port
Windows Vista Home Premium or Windows Vista Ultimate
TV tuner card with FM radio capabiity required for live TV and radio functionality",,,
"Buy Touchsystems 22"" NEC AS222-WM Touchsystems Resistive USB Monitor Monitors - LCD W12290R-UM2 today at PC Connection",TCO Displays 6.0 RoHS,Tilt Swivel,22 in,0.25 mm,Yes,250 cd/m2,,3 Years,3 Years,,,,,,,,,,,,,,,,,,,,,,,,,,,,,,,,,,,,,,,,,
"Buy Acer 24"" S241HL BMID LED-LCD Monitor, Black Monitors - LED-LCD UM.FS1AA.001 today at PC Connection",MPRII,,24 in,,Yes,250 cd/m2,,3 Years,3 Years,Black,"Vivid:
You'll enjoy tasks and entertainment more with fine details and smooth movement, thanks to high resolutions, fast response times and superior contrast ratios. Games are more exciting and films truly cinematic when visuals are vibrant. Plus, the widescreen aspect ratio frames movies and HDTV content perfectly.
Easy:
Set your display as you see fit with Acer eColor Management. A host of ports, including HDMI, DVI, DisplayPort and VGA, let you connect other devices -- like your notebook or HDTV -- to expand your perspective to a bigger screen. The great sights are complemented by nice sound in models that include internal speakers.
Green:
Safe for you and your world, Everyday Series monitors are RoHS compliant, use mercury-free white LED backlighting and meet ENERGY STAR 5.0 requirements. Acer EcoDisplay technologies deliver up to 68% power savings, further conserving energy and costs. Acer packaging is made of recyclable materials, too.","Monitor, VGA cable, DVI cable, HDMI cable, power cable, documentation",,,7.60 lb(s),"15.8""h x 22.2""w x 6.5""d",,,,,250 nit(s),16.7 million colors,HDMI HDDB15 Power DVI,Power VGA HDMI DVI,"100,000,000:1",LED-backlit LCD,Widescreen,1920 x 1080,"(1) DVI
(1) HDMI
(1) HDDB15 VGA
(1) Power in","Supply: 110-220VAC
Consumption: 19.8W (typ.); 0.5W (standby/off mode)",5 ms,170/160,,,,,,,,,,,,,Digital Visual Interface (DVI),,,,,
"Buy 3M 22"" Widescreen LCD Privacy Filter Glare Filters & Privacy Screens PF322W today at PC Connection",,,,,,,This product is subject to our return policy. Please see our complete return policy for details.,1 Year,1 Year,,"This Lightweight Privacy Filter is designed for widescreen formatted desktop LCD monitors with a 22"" diagonal widescreen viewing area.
Actual filter viewing area dimensions excluding the frame are 19 1/8"" wide x 12 1/8"" high.
This filter is designed for widescreen desktop monitors with screens that appear more rectangular than square.
Lightweight framed filter will not change monitor position.","Framed filter, documentation",Display privacy filter,,0.00 lb(s),,,,,,,,,,,,,,,,,,,,,,,,,,,,,,,,,,,
"Buy Sony 69.5"" FWD70W850B Full HD LED-LCD Display, Black Monitors - Large-Format LED-LCD FWD70W850B today at PC Connection",,,70 in,,Yes,,This product is subject to our return policy. Please see our complete return policy for details.,Call for Warranty,Call for Warranty,Black,,,,,,,,,,,,,,,,,,,,,,,,,,,,,,,,,,,,,,,,
"Buy Peerless SmartMount Universal Cart for 32""-60"" Flat Panel Stands & Mounts - AV SR560G today at PC Connection",,,,,,,This product is subject to our return policy. Please see our complete return policy for details.,5 Years,5 Years,Black,,"Cart components, universal interface bracket, hardware, documentation",Cart,,,,,,,,,,,,,,,,,,,,,,,,,,,,,,,,,,,,,
"Buy Miracle Business 8"" Color LCD TFT Monitor, White Monitors - LCD LT08W today at PC Connection",CCC CUL FCC,,8 in,0.2025 mm,,250 cd/m2,This product is subject to our return policy. Please see our complete return policy for details.,N/A,N/A,White,,,,,,,,,,,,,,,,,,,,,,,,,,,,,,,,,,,,,,,,
Buy Ergotron T-Slot Bracket Kit Stands & Mounts - AV 60-587-207 today at PC Connection,,,,,,,This product is subject to our return policy. Please see our complete return policy for details.,5 Years,5 Years,,"Light-duty brackets: Neo-Flex Mobile WorkSpace, StyleView Carts, and LX Carts
Interface bracket: Neo-Flex Mobile Workspace","Interface brackets, mounting hardware, documentation",Mounting kit,,,,,,,,,,,,,,,,,,,,,,,,,,,,,,,,,,,,,
"Buy HP Smart Buy 19"" P191 LED-LCD Monitor, Black Monitors - LED-LCD C9E54A8#ABA today at PC Connection",Energy Star,Tilt,18.5 in,0.3 mm,Yes,250 cd/m2,This product is subject to our return policy. Please see our complete return policy for details.,3 Years,3 Years,Black,"Essential business features:
Support your business needs wherever you need a solid performing monitor at a competitive price with an 18.5-inch diagonal LED business display.
Compatibility with HP accessories:
Customize your work space with options like the HP Quick Release, HP Speaker Bar and HP USB Graphics Adapter (options sold separately).
Stability now, and peace of mind for the future:
Maintain product consistency across staggered deployments, ease transitions and help reduce support costs with a minimum one-year lifecycle stability commitment from HP.
Smart software for the multi-tasker:
HP Display Assistant consolidates monitor setting controls into one easy-to-use, centralized interface.
Energy efficient, environmentally aware:
Mercury-Free LED backlighting, a BFR/PVC-free design, and arsenic-free display glass are just a few of the environmental features built into this display.
Dimensions with stand: 13.4""h x 17.7""w x 5.6""d","Monitor, documentation",,,7.10 lb(s),"19.9""h x 17.7""w x 1.9""d",includes backlight,,,,250 cd/m2,,Power HDDB15,Power VGA,,LED-backlit LCD,Widescreen,1366 x 768,"(1) HDDB15 VGA
(1) Power in","Supply: 100-240VAC
Consumption: 20W (max); 18W (typ.);",5 ms,170/160,,,,,,,,,,,,,,,,,,
"Buy LG 54.6"" WL30MS-D Full HD LED-LCD Monitor, Black Monitors - Large-Format LED-LCD 55WL30MS-D today at PC Connection",,,55 in,,Yes,,This product is subject to our return policy. Please see our complete return policy for details.,3 Years,3 Years,,,,,,,,,,,,,,,,,,,,,,,,,,,,,,,,,,,,,,,,,
"Buy HP Promo 23"" ProDisplay P231 Full HD LED-LCD Monitor, Black Monitors - LED-LCD E4S07A8#ABA today at PC Connection",EPEAT Gold,Tilt,23 in,0.265 mm,Yes,250 cd/m2,This product is subject to our return policy. Please see our complete return policy for details.,3 Years,3 Years,Black,"Smart business design with DVI and VGA connectivity options and cable management clip.
Work comfortably with up to 30 degrees of tilt.
HP Display Assistant provides color adjustment, theft deterrence and power saving settings.
ENERGY STAR qualified, EPEAT Gold, Low Halogen components.","monitor, documentation",,,8.50 lb(s),"13""h x 21.4""w x 2""d",,,,,250 nit(s),,HDDB15 DVI-D Power,Power DVI-D VGA,1000:1,LED-backlit LCD,Widescreen,1920 x 1080,"(1) HDDB15 VGA
(1) DVI-D
(1) Power in",Consumption: 31W (max),5 ms,170/160,,,,,,,,,,,,,Digital Visual Interface (DVI),,,,,
"Buy 3M Privacy Filter for 27"" Widescreen LCD Display Glare Filters & Privacy Screens PF27.0W today at PC Connection",,,,,,,This product is subject to our return policy. Please see our complete return policy for details.,1 Year,1 Year,,"Fits widescreen desktop monitors with a diagonally measured 27"" viewing screen","Filter, documentation",Display privacy filter,,,"14.3""h x 22.9""w",,,,,,,,,,,,,,,,,,,,,,,,,,,,,,,,,,
"Buy AOC 24"" E2460SD Full HD LED-LCD Monitor, Black Monitors - LED-LCD e2460Sd today at PC Connection",RoHS CCC DDC-2B DDC-2B/CI FCC CQC CTUVus TCO Displays 5.2 EPA 5.1,Tilt,24 in,0.277 mm,Yes,250 cd/m2,This product is subject to our return policy. Please see our complete return policy for details.,Call for Warranty,Call for Warranty,Black,,,,,,,,,,,,,,,,,,,,,,,,,,,,,,,,,,,,,,,,
"Buy ViewSonic PJD6544W DLP WXGA Projector, 3500 Lumens, Black Projectors PJD6544W today at PC Connection",WEEE UL CCC FCC Class B certified RoHS REACH CUL CE C-Tick CB,,,,,3500 ANSI lumens,This product is subject to our return policy. Please see our complete return policy for details.,3 Years,3 Years,Black,,"Projector, power cable, VGA cable, remote with batteries, DVD, documentation",,,4.70 lb(s),"4.5""h x 11.6""w x 8.6""d",1 year on lamp,,,4.7 lb(s),,1.07 billion colors,HDDB15 USB Type B Mini HDMI 3.5mm audio S-Video USB Type A USB Type B RJ-45 RCA Composite Power DB9,RS-232 Power Ethernet S-Video Audio VGA USB Composite video HDMI,15000:1,Digital Light Processing (DLP),,1600 x 1200,"(3) HDDB15 VGA (2 in, 1 out)
(1) HDMI
(1) 4-pin S-video
(1) RCA composite
(3) 3.5mm audio (2 in, 1 out)
(1) DB9 RS-232
(1) RJ-45 LAN
(1) Power in","Supply: 100-240VAC (Auto Switching), 50/60Hz (universal)
Consumption: 305W (typ.);",,,Speaker Included Remote control Keystone correction Single speaker,Tabletop Desktop,16:10,25 ft,2.3 ft,1200 x 800,DLP projector,Multiscan,3.9 ft,,,,,,,,,
"Buy Open Box ELO Touch Solutions 42"" 4201L Optical Multi-Touch LED Monitors - Large-Format LED-LCD E107085 today at PC Connection",,,42 in,,,,This product is subject to our return policy. Please see our complete return policy for details.,90 Days,90 Days,Black,,,,,,,,,,,,,,,,,,,,,,,,,,,,,,,,,,,,Open Box,,,,
Buy NEC Stand Feet for LCD5250 Stands & Mounts - AV ST-5220 today at PC Connection,,,,,,,This product is subject to our return policy. Please see our complete return policy for details.,N/A,N/A,,,"Stand, documentation",Stand,Flat panel display,,,,,,,,,,,,,,,,,,,,,,,,,,,,,,,,,,,,
"Buy LG 29"" 29UB65-P UltraWide LED-LCD Monitor, Black Monitors - LED-LCD 29UB65-P today at PC Connection",Plug and Play EN 60950-1:2006 DDC/CI EN 55024 EN 61000-3-3 EN 55022 Class B EN 61000-3-2:2006 CUL,Tilt Pivot (rotation) Height,29 in,0.264 mm,Yes,300 cd/m2,This product is subject to our return policy. Please see our complete return policy for details.,Call for Warranty,Call for Warranty,Anthracite,,,,,,,,,,,,,,,,,,,,,,,,,,,,,,,,,,,,,,,,
Buy Tripp Lite 4-Port VGA SVGA 350MHz Video Splitter with Signal Video Extenders & Splitters B114-004-R today at PC Connection,,,,,,,This product is subject to our return policy. Please see our complete return policy for details.,1 Year,1 Year,Black,"Features
Simultaneously display video on (4) VGA/SVGA monitors
Ideal for video presentations or sharing information with multiple users
A built-in booster allows a video signal (up to 1920 x 1080 @ 60Hz) to be transmitted up to 210ft from the source
The splitter can be located up to 25ft from the connected computer and up to 185ft from the connected monitors
350Mhz Bandwidth Support
Cascade up to (3) levels of splitters together to increase the number of connected monitors
Rugged, fully shielded metal housing","Splitter, power supply, documentation",Video splitter,,,,,,,,,,,,,,,,"(4) HD15 (F)
(1) HD15 (M)",,,,,,,,,,,,,,,,,,"Computer with an HDDB15 port
VGA or SVGA monitor with HDDB15 Male cable",,,
"Buy Elite Fixed SableFrame Home Projection Screen, CineWhite, 16:9, Projector Screens ER92WH1 today at PC Connection",,,,,,,This product is subject to our return policy. Please see our complete return policy for details.,2 Years,2 Years,,,,,,,,"Government, Education, Military, and Religious customers receive a 3 year screen warranty",,,,,,,,,,,,,,,,,,,,,,,,,,,,,,,,,
"Buy 3M 19"" Widescreen LCD Privacy Filter, Black Glare Filters & Privacy Screens PF319W today at PC Connection",,,,,,,This product is subject to our return policy. Please see our complete return policy for details.,1 Year,1 Year,Black,"For use with 19"" Widescreen LCD Desktop Displays.","Privacy filter, documentation",Display privacy filter,,,,Limited,,,,,,,,,,,,,,,,,,,,,,,,,,,,,,,,,
Buy NEC X46UN Remote Control and Ambient Light Senror Monitor & Display Accessories KT-RC today at PC Connection,,,,,,,This product is subject to our return policy. Please see our complete return policy for details.,3 Years,3 Years,,,"Remote control, ambient light sensor, cable, documentation",Remote control unit,,,,,,,,,,,,,,,,,,,,,,,,,,,,,,,,,,,,,
Buy Elmo Manufacturing Bundle CRV-32 Student Response System with Projector Accessories 1335-32 today at PC Connection,,,,,,,This product is subject to our return policy. Please see our complete return policy for details.,Call for Warranty,Call for Warranty,,,"(32) Student clickers, teacher control clicker, wireless adapter, carrying bag, software, documentation",,,0.00 lb(s),,,,,,,,,,,,,,"Wireless dongle:
(1) USB Type A (M)","Student Clicker:
(2) AAA batteries (3.0V, 60mA
Up to 150 hours of continuous use; up to 1 year total life",,,,,,,,,,,,,,,,,,,,
Buy Ergotron Spacer Kit for Recessed Display Mount Stands & Mounts - AV 97-501 today at PC Connection,,,,,,,This product is subject to our return policy. Please see our complete return policy for details.,5 Years,5 Years,Black,Compatible with monitors using a VESA FDMI MIS-D 75 x 75mm interface.,"Spacer, (4) screws, documentation",Spacer,Flat panel display,,,,,,,,,,,,,,,,,,,,,,,,,,,,,,,,,,,,
"Buy ViewSonic 23"" VX2370Smh-LED Full HD LED-LCD Frameless Monitor Monitors - LED-LCD VX2370SMH today at PC Connection",,,23 in,,,,This product is subject to our return policy. Please see our complete return policy for details.,3 Years,3 Years,Black,"Frameless Bezel Design:
This display features a frameless solid flush mount surface without conventional ridged bezel. The thin profile also blends seamlessly with the panel for an ultra-high tech look to complement any home setting. The sleek seamless touch sensitive controls provide a simple and intuitive operating experience.
Save Cash and Save the Planet:
With its mercury free backlight and low energy consumption, the ENERGY STAR 5.0 certified VX2370Smh-LED is not only environmentally friendly but also friendly on your electricity bill as well. This can add up to thousands of dollars saved for large install bases, such as big corporate buildings or schools, the savings can be as dramatic as $20, 000 in five years.
Mega Dynamic Contrast Ratio:
One of the great features of VX2370Smh-LED is its ability to dim the backlight completely for pure darkness during dark scenes such as a night shot in a movie. Contrast ratios refer to the ratio of the brightest color to the darkest color. With traditional CCFL backlit displays, contrast ratios are limited to the fluorescent lamp’s ability to dim in order to reproduce darkness. However, with the LED backlight, each LED has the ability to completely shut off allowing for a near infinite ratio of black to white contrast. The end result is true blacks that result in greater overall image quality.
Full HD 1080p Resolution:
The VA2451m-LED features a 24""(23.6” viewable) widescreen with 1920x1080 resolution is capable of displaying a native Full HD 1080p image. Today, devices that can display Full HD content output are getting more and more common. However, without a native Full HD display, you will not be able to experience the picture clarity and the details of the 1080p content you view.
Compatibility:
PC compatible (from VGA up to 1920x1080 non-interlaced)
Mac Up to 1920x1080","Monitor, power cable, AC/DC adapter, VGA cable, HDMI cable, CD, documentation",,,8.60 lb(s),"16.1""h x 21""w x 7.1""d",,,,,250 cd/m2,,DVI-D 3.5mm audio Power HDDB15 HDMI,Audio HDMI Power VGA DVI-D,1000:1,LCD LED-backlit,Widescreen,1920 x 1080,"(1) HDDB15 VGA
(1) HDMI
(1) DVI-D
(2) 3.5mm audio (in, out)
(1) Power in","Supply: 100-240VAC, (universal), 50/60Hz
Consumption: 27W (typ.); 23W (optimize); 20W (conserve)",7 ms,178/178,Speakers Included Dual speakers,,,,,,,,,,,,Digital Visual Interface (DVI),,,24-83,50-76,
"Buy Ergotron Dual-Monitor Desk Stand, Vertical Stands & Mounts - AV 33-091-200 today at PC Connection",,,,,,,This product is subject to our return policy. Please see our complete return policy for details.,5 Years,5 Years,Black,"LCD Size: = 24""
Capacity: 23 pounds per pivot; 46 pounds total
Tilt: 180 degrees
Pan: 180 degrees
Rotation: 360 degrees P/L
Mounting Standards: VESA FDMI, MIS-D, 75/100, C","Stand, documentation",Stand,Monitor,0.00 lb(s),,,,,,,,,,,,,,,,,,,,,,,,,,,,,,,,,,,
"Buy 3M 17"" Widescreen LCD Privacy Filter Glare Filters & Privacy Screens PF317W today at PC Connection",,,,,,,This product is subject to our return policy. Please see our complete return policy for details.,1 Year,1 Year,,"This filter is designed for 17"" widescreen desktop monitors with screens that appear more rectangular than square.","Privacy filter, documentation",Display privacy filter,,,"10.4""h x 16.3""w",,,,,,,,,,,,,,,,,,,,,,,,,,,,,,,,,,
"Buy Ergotron DS100 Dual-Monitor Desk Stand, Horizontal Stands & Mounts - AV 33-322-200 today at PC Connection",,,,,,,This product is subject to our return policy. Please see our complete return policy for details.,5 Years,5 Years,Black,"LCD size: Weight capacity: up to 31 pounds per monitor
Mounting Standards: VESA FDMI, MIS-D, 75/100, C (100x100mm and 75x75mm)
Rotation: 360 degrees P/L","Desk stand, documentation",Stand,,0.00 lb(s),,,,,,,,,,,,,,,,,,,,,,,,,,,,,,,,,,,
"Buy Miracle Business 50"" Plasma HDTV MiracleTouch Monitor White Televisions - Plasma Commercial PL50B-IS today at PC Connection",,,,,,,This product is subject to our return policy. Please see our complete return policy for details.,N/A,N/A,,,,,,,,NOTE: Using product in a commercial setting may void original warranty. Contact manufacturer for details.,50 in,,,,,,,,,,,,,,,,,,,,,,,,,,,,,,,,
"Buy Peerless Metal Stud Wall Plate for SP740, Black Stands & Mounts - AV WSP490 today at PC Connection",,,,,,,This product is subject to our return policy. Please see our complete return policy for details.,5 Years,5 Years,Black,,"Wall plate, documentation",Wall plate,Accessory,,,,,,,,,,,,,,,,,,,,,,,,,,,,,,,,,,,,
"Buy Elite Manual Series Projection Screen, Matte White, 4:3, 100in Projector Screens M100NWV1 today at PC Connection",,,,,,,This product is subject to our return policy. Please see our complete return policy for details.,2 Years,2 Years,White,,"Screen with case, hardware, documentation",Projection screen,,,"73""h x 88""w","Government, Education, Military, and Religious customers receive a 3 year screen warranty",,,,,,,,,,,,,,,,,,,,,,,,,,,,,,,,,
"Buy Chief Manufacturing Flat Panel Tilt Wall Mount (10""-32"" Stands & Mounts - AV FTR4100 today at PC Connection",,,,,,,This product is subject to our return policy. Please see our complete return policy for details.,N/A,N/A,Black,,"Wall mount, hardware, documentation",Wall mount,Flat panel display,,"5.4""h x 5.2""w x 1.8""d",,,,,,,,,,,,,,,,,,,,,,,,,,,,,,,,,,
"Buy Elite VMax2 Projection Screen, MaxWhite, 1:1, 136in (Free Mount Projector Screens VMAX136UWS2 today at PC Connection",,,,,,,This product is subject to our return policy. Please see our complete return policy for details.,2 Years,2 Years,,,"Projection screen, radio frequency remote, infrared remote, wall box, documentation",,,,"96""h x 96""w","Government, Education, Military, and Religious customers receive a 3 year screen warranty",,,,,,,,,,,,,,,,,,,,,,,,,,,,,,,,,
"Buy Sony 60"" FWD60W630B Full HD LED-LCD Display, Black Monitors - Large-Format LED-LCD FWD60W630B today at PC Connection",,,60 in,,Yes,,This product is subject to our return policy. Please see our complete return policy for details.,Call for Warranty,Call for Warranty,Black,,,,,,,,,,,,,,,,,,,,,,,,,,,,,,,,,,,,,,,,
"Buy Eizo Nanao 21"" RX340-BK 3MP LED-LCD Monitor Monitors - LED-LCD RX340-BK today at PC Connection",CSA C22.2 No. 601.1 C-Tick EN 60601-1 CCC UL 60601-1 DICOM Part 14 DVI DMPM WEEE VCCI Class B ITE ISO 13485 ICES-003 Class B EMC FDA 510k GOST-R RoHS,Tilt Swivel Pivot (rotation) Height,21.2 in,0.21075 mm,,1000 cd/m2,This product is subject to our return policy. Please see our complete return policy for details.,5 Years,5 Years,Black,,,,,,,,,,23.600 lb(s),1000 cd/m2,,,,,,,,,,,,,,,,,,,,,,,,,,,,,
Buy Kensington Monitor Stand Plus with SmartFit Stands & Mounts - AV 60089 today at PC Connection,,,,,,,This product is subject to our return policy. Please see our complete return policy for details.,2 Years,2 Years,Black,"Holds CRT or flat panel display up to 21"" and 80 pounds.
Adjusts to 3 height levels.","Monitor stand, documentation",Stand,,0.00 lb(s),,,,,,,,,,,,,,,,,,,,,,,,,,,,,,,,,,,
"Buy Eizo Nanao 27"" MNTR2560X1440 LED-LCD Monitor, Black Monitors - LED-LCD MX270W-BK today at PC Connection",RoHS GOST-R C-Tick EMC DVI DMPM CCC ICES-003 Class B ISO 13485 FDA 510k CSA C22.2 No. 601.1 VCCI Class B ITE EN 60601-1 UL 60601-1 DICOM Part 14,Swivel Pivot (rotation) Height Tilt,27 in,0.233 mm,,300 cd/m2,This product is subject to our return policy. Please see our complete return policy for details.,Call for Warranty,Call for Warranty,Black,,,,,,,,,,,300 cd/m2,,,,,,,,,,,,,,,,,,,,,,,,,,,,,
"Buy Ergotron DS100 28"" Pole Stands & Mounts - AV 20-137-200 today at PC Connection",,,,,,,This product is subject to our return policy. Please see our complete return policy for details.,5 Years,5 Years,Black,,"Pole, documentation",Mounting component,Flat panel display,,,,,,,,,,,,,,,,,,,,,,,,,,,,,,,,,,,,
