<page title>,adjustable display angle,adjustable display height,adjustable display pivot,aspect ratio,backlight technology,brand name,brightness,builtin devices,certifications standards,colour,colour support,contrast ratio,depth,display orientation,displayport,dvi,features,green compliance certificateauthority,green compliant,hdcp supported,hdmi,headphone,height,horizontal viewing angle,limited warranty,manufacturer,manufacturer part number,maximum resolution,number of screens,number of speakers,operating power consumption,package contents,panel technology,platform supported,product line,product model,product name,product type,response time,screen mode,screen size,speakers,standard refresh rate,standby power consumption,usb,usb standard,vertical viewing angle,vesa mount compatible,vesa mount standard,vga,weight approximate,width,depth with stand,height with stand,input voltage,screen surface,width with stand,environmentconscious and reliable,flexible viewing and connectivity options,impressive screen clarity,horizontal frequency,maximum adjustable height,offmode power consumption,product series,webcam,swivel angle,tilt angle,weight with stand approximate,energy consumption per year,energy efficiency class,mount type,full product specifications,postconsumerwaste,3d type,recycled,recycled content,network rj45,packaged quantity,thunderbolt,component video,composite video,superb performance,versatile connections,full datasheet accessories features,mfr code,product,product code,stock,additional information,svideo
"60003588, 3968096, NEC Display Solutions, LCD Monitor, Itenergy Ltd",Yes,Yes,Yes,16:9,LED,NEC Display,250 cd/m²,Speaker USB Hub,CE TÜV Ergonomics TÜV GS FCC Class B PCT/Gost UL/C-UL CSA ISO 9241-307,Black,16.77 Million Colors,"1,000:1",218 mm,Landscape/Portrait,Yes,Yes,Security Lock Cable Management Eco Mode Carbon Footprint Meter Ambient Light Sensor Off Timer Intelligent Power Manager (IPM) System,MPR III EPEAT Gold ENERGY STAR 6.0 RoHS TCO Certified Displays 6.0 TCO Certified Edge,Yes,Yes,Yes,Yes,380.4 mm,178°,3 Year,NEC Display Solutions,60003588,1920 x 1080,1.0,2.0,27 W,"LCD 23"" Commercial Display Power Cable Control Sync Cable USB Cable Audio Cable CD-ROM Sales Office List User Manual VGA - VGA Cable DVI-D - DVI-D Cable",In-plane Switching (IPS) Technology,PC,MultiSync,EA234WMi,"LCD 23"" Commercial Display",LCD Monitor,6 ms,Full HD,"58.4 cm (23"")",Yes,60 Hz,500 mW,Yes,USB 2.0,178°,Yes,100 x 100,Yes,6.40 kg,543.8 mm,,,,,,,,,,,,,,,,,,,,,,,,,,,,,,,,,,,,,,
"C9V73AT#ABU, HP, LCD Monitor, Itenergy Ltd",Yes,Yes,Yes,16:9,LED,HP,250 cd/m²,USB Hub,,Black,,"1,000:1",51 mm,,Yes,Yes,Security Lock,EPEAT Gold WEEE ENERGY STAR REACH TCO Certified Displays,Yes,Yes,,,289 mm,170°,3 Year,Hewlett-Packard,C9V73AT#ABU,1600 x 900,1.0,,30 W,Advantage E201 Widescreen LCD MonitorUSB CableVGA CableAC Power CablePrinted DocumentationCD-ROM,,,Advantage,E201,Advantage E201 Widescreen LCD Monitor,LCD Monitor,5 ms,HD+,"50.8 cm (20"")",,,500 mW,Yes,USB 2.0,160°,,,Yes,5.20 kg,472.8 mm,228.90 mm,434.80 mm,220 V AC 110 V AC,Anti-glare,472.80 mm,,,,,,,,,,,,,,,,,,,,,,,,,,,,,,,,,
"859-BBCT, 0912944, Dell, LCD Monitor, Itenergy Ltd",,,,,,,,,,,,,,,,,,,,,,,,,,,,,,,,,,,,,,,,,,,,,,,,,,,,,,,,,,"Built to comply with
the latest environmental and regulatory standards and protected by a
Premium Panel Guarantee and Advanced Exchange Service.","Fully adjustable stand and a comprehensive
set of analog and digital connectivity ports and cables.","Full HD 1920 x 1080 resolution
with an ultra-wide 178°/178° viewing angle.",,,,,,,,,,,,,,,,,,,,,,,,,,,,,,
"B2480HS-W1, 2633820, Iiyama, LCD Monitor, Itenergy Ltd",Yes,Yes,Yes,16:9,LED,iiyama,300 cd/m²,Speaker,CECUTUV-GS,White,16.7 Million Colours,"1,000:1",244.5 mm,,,Yes,Security Lock,TCO Displays 5.0 ENERGY STAR,Yes,Yes,Yes,,557 mm,170°,3 Year,"iiyama North America, Inc",B2480HS-W1,1920 x 1080,1.0,2.0,22 W,ProLite B2480HS-1Power CableVGA Cable (D-Sub)DVI CableAudio CableStand FootCable HolderQuick Start GuideSafety Guide,,Mac PC,ProLite,B2480HS,ProLite B2480HS-1,LCD Monitor,2 ms,Full HD,"61 cm (24"")",Yes,75 Hz,1 W,,,160°,Yes,100 x 100,Yes,6.10 kg,571.5 mm,,,110 V AC 220 V AC,,,,,,,,,,,,,,,,,,,,,,,,,,,,,,,,,,,
"29UB65-P, 2975676, LG Electronics, LCD Monitor, Itenergy Ltd",Yes,Yes,Yes,21:9,LED,LG,300 cd/m²,Speaker,,,16.7 Million Colours,"5,000,000:1",124.5 mm,,Yes,Yes,Mobile High-Definition Link (MHL),,,,Yes,Yes,419.1 mm,178°,,LG Electronics,29UB65-P,2560 x 1080,1.0,2.0,47 W,,In-plane Switching (IPS) Technology,PC,,29UB65-P,29UB65-P Widescreen LCD Monitor,LCD Monitor,5 ms,UW-UXGA,"73.7 cm (29"")",Yes,,,Yes,USB 3.0,178°,Yes,75 x 75,,5.08 kg,703.6 mm,223.52 mm,,,Anti-glare,,,,,90 kHz,110 mm,500 mW,,,,,,,,,,,,,,,,,,,,,,,,,,,
"T28LNWL, S602WH2, Lenovo, LCD Monitor, Itenergy Ltd",Yes,Yes,Yes,16:9,LED,Lenovo,250 cd/m²,Microphone Speaker USB Hub,Microsoft Lync CertifiedTUV Green Mark UL Environment GoldFCC Class B certifiedTUVBSMIGOSTIEC950NEMKOISO 9241-307NOMSABSSASOTUV SCCCICPSBJEITAICEScULusTUV BauartE-StandbyKCKvalitetSONCAPKEBSEMI,Raven Black,16.7 Million Colours,"1,000:1",56.4 mm,,Yes,Yes,Ambient Light Sensor Security Lock,CECP TCO Certified Edge Displays 1.1 EPEAT ENERGY STAR 6.0 RoHS REACH EuP WEEE,Yes,,,,387.2 mm,,3 Year,Lenovo Group Limited,T28LNWL,1920 x 1080,1.0,2.0,,,Enhanced In-plane Switching (E-IPS) Technology,PC,ThinkVision,LT2323z,LT2323z Wide 23inch e-IPS Flat Panel Monitor,LCD Monitor,7 ms,Full HD,"58.4 cm (23"")",Yes,75 Hz,,Yes,USB 3.0,,,,Yes,6.16 kg,545.3 mm,,,,Anti-glare,,,,,,,,Wide,Yes,,,,,,,,,,,,,,,,,,,,,,,,,
"UM.WB6EE.A01, 8654T98, Acer, LCD Monitor, Itenergy Ltd",Yes,Yes,Yes,16:9,LED,Acer,250 cd/m²,,,Dark Grey,16.7 Million Colours,"100,000,000:1",221 mm,,,Yes,,ENERGY STAR TCO '06,Yes,Yes,,,518.2 mm,178°,3 Year,"Acer, Inc",UM.WB6EE.A01,1920 x 1080,1.0,,19.50 W,B226HQL Widescreen LCD Monitor1 x VGA Cable1 x DVI CablePower Cord,Vertical Alignment (VA),,,B226HQL,B226HQL Widescreen LCD Monitor,LCD Monitor,8 ms,Full HD,"54.6 cm (21.5"")",Yes,60 Hz,350 mW,,,178°,Yes,100 x 100,Yes,3.17 kg,508 mm,,,110 V AC 220 V AC,Anti-glare,,,,,,150 mm,250 mW,B,,60°,-5°to35°,5.81 kg,,,,,,,,,,,,,,,,,,,,,,
"UM.WG6EE.F01, 8655F68, Acer, LCD Monitor, Itenergy Ltd",Yes,No,No,16:9,LED,Acer,250 cd/m²,,,Black,16.7 Million Colours,"100,000,000:1",33.9 mm,,,,,MPR II,Yes,,Yes,,364 mm,170°,2 Year,"Acer, Inc",UM.WG6EE.F01,1920 x 1080,1.0,,22 W,G226HQL Widescreen LCD Monitor1 x VGA CablePower Cord,Twisted Nematic Film (TN Film),,,G226HQL,G226HQL Widescreen LCD Monitor,LCD Monitor,2 ms,Full HD,"54.6 cm (21.5"")",No,60 Hz,450 mW,,,160°,No,,Yes,1.90 kg,511 mm,168 mm,365 mm,220 V AC 110 V AC,Anti-glare,511 mm,,,,,No,400 mW,G,,No,-5°to15°,2 kg,32 kWh,B,,,,,,,,,,,,,,,,,,,,
"VX2858SML, B921660, ViewSonic, LCD Monitor, Itenergy Ltd",Yes,,,16:9,LED,Viewsonic,300 cd/m²,Speaker,,,,"3,000:1",50.8 mm,,,,Mobile High-Definition Link (MHL),,,,Yes,Yes,411.5 mm,176°,,Viewsonic Corporation,VX2858SML,1920 x 1080,1.0,2.0,46 W,,,,,VX2858Sml,VX2858Sml Widescreen LCD Monitor,LCD Monitor,6 ms,Full HD,"71.1 cm (28"")",Yes,,,,,176°,Yes,100 x 100,Yes,3.95 kg,660.4 mm,241.30 mm,510.54 mm,,Anti-glare,660.40 mm,,,,,,,,,,5°to20°,4.58 kg,,,,,,,,,,,,,,,,,,,,,,
"PLE2273HDS-B1, II-PLE2273HDS-B1, Iiyama, LCD Monitor, Itenergy Ltd",Yes,,,16:9,LED,iiyama,250 cd/m²,Speaker,CECBFCC-BTUV-BauartVCCI-BPSE,Black,16.7 Million Colours,"1,000:1",178 mm,,,Yes,,ENERGY STAR TCO Certified Displays 5.2,Yes,Yes,Yes,,390 mm,170°,3 Year,"iiyama North America, Inc",PLE2273HDS-B1,1920 x 1080,1.0,2.0,24 W,ProLite E2273HDS Widescreen LCD MonitorPower CableD-Sub CableDVI CableAudio CableStandCable GuideQuick Start GuideSafety Guide,,Mac PC,ProLite,E2273HDS,ProLite E2273HDS Widescreen LCD Monitor,LCD Monitor,2 ms,Full HD,"55.9 cm (22"")",Yes,75 Hz,500 mW,,,160°,Yes,100 x 600,Yes,3.30 kg,560.5 mm,,,220 V AC 110 V AC,,,,,,,,,,,,,,,,,,,,,,,,,,,,,,,,,,,
"221B3LPCB/02, 2541424, Philips, LCD Monitor, Itenergy Ltd",Yes,Yes,Yes,16:9,LED,Philips,250 cd/m²,USB Hub Speaker,CEBSMIFCC Class BGOSTSEMKOTUV/GSTUV ErgoUL/cUL,Black,16.7 Million Colours,"1,000:1",59 mm,,,Yes,SmartTouch SmartImage PowerSensor Security Lock,EPEAT Gold TCO Certified Displays 5.1 RoHS ENERGY STAR 5.0,Yes,Yes,,Yes,323 mm,176°,,Philips Electronics,221B3LPCB/02,1920 x 1080,1.0,2.0,17.80 W,,,Mac PC,Brilliance,221B3LPCB,"LCD Monitor, LED Backlight with PowerSensor",LCD Monitor,5 ms,Full HD,"54.6 cm (21.5"")",Yes,60 Hz,100 mW,Yes,USB 2.0,170°,Yes,100 x 100,Yes,3.40 kg,507 mm,227 mm,480 mm,220 V AC 110 V AC,,507 mm,,,,,,,B,,,,5.30 kg,,,,,,,,,,,,,,,,,,,,,,
"HS241HPB, V320109, Hannspree, LCD Monitor, Itenergy Ltd",Yes,,,16:9,LED,Hanns.G,250 cd/m²,Speaker,FCC UL/CUL CE CB 3C GS,Black,16.7 Million Colours,"80,000,000:1",220 mm,,,Yes,Eco Mode Security Lock,TCO Certified Displays 6.0 ENERGY STAR China Energy Label (CEL),Yes,Yes,Yes,,399 mm,178°,3 Year,"Hannspree, Inc",HS241HPB,1920 x 1080,1.0,2.0,,HS241HPB Widescreen LCD Monitor Power Cable (1.5M) VGA Cable (1.5M) Audio Cable (1.5M) User Manual(CD) Quick Start Guide(Paper),In-plane Switching (IPS) Technology,PC,,HS241HPB,HS241HPB Widescreen LCD Monitor,LCD Monitor,5 ms,Full HD,"59.9 cm (23.6"")",Yes,60 Hz,,,,178°,Yes,100 x 100,Yes,4.50 kg,561 mm,,,230 V AC 120 V AC,Anti-glare,,,,,,,,HS,,,-5°to15°,,,,Wall Mountable,,,,,,,,,,,,,,,,,,,
"UM.HV6EE.013, 8654J44, Acer, LCD Monitor, Itenergy Ltd",Yes,No,No,16:9,LED,Acer,300 cd/m²,,,Black,16.7 Million Colours,"100,000,000:1",,,,Yes,,TCO Certified Displays 6.0 EPEAT Gold,Yes,Yes,,,,178°,3 Year,"Acer, Inc",UM.HV6EE.013,1920 x 1080,1.0,,28.50 W,V276HL Widescreen LCD MonitorPower Cord1 x VGA Cable,Vertical Alignment (VA),,,V276HL,V276HL Widescreen LCD Monitor,LCD Monitor,6 ms,Full HD,"68.6 cm (27"")",,60 Hz,450 mW,,,178°,Yes,100 x 100,Yes,,,,,220 V AC 110 V AC,Anti-glare,,,,,,No,350 mW,V,,No,-5°to25°,,,,,,,,,,,,,,,,,,,,,,,
"25UM65-P, 3003553, LG Electronics, LCD Monitor, Itenergy Ltd",,,,21:9,LED,LG,,Speaker,,Black,,,,,Yes,Yes,Mobile High-Definition Link (MHL),,,,Yes,,,,,LG Electronics,25UM65-P,2560 x 1080,1.0,2.0,,,In-plane Switching (IPS) Technology,,,25UM65-P,25UM65-P Widescreen LCD Monitor,LCD Monitor,5 ms,UW-UXGA,"63.5 cm (25"")",Yes,,,Yes,USB 3.0,,,,,,,,,,,,,,,,,,,,,,,,,,,,,,,,,,,,,,,,,,,,
"247E4LHAB/00, 2689199, Philips, LCD Monitor, Itenergy Ltd",Yes,,,16:9,LED,Philips,250 cd/m²,Speaker,BSMICCCCE MarkFCC Class BGOSTPSBSASOSEMKOTUV/ISO9241-307UL/cUL,Glossy Black,16.7 Million Colours,"10,000:1",39 mm,,,,SmartImage Touch Controls Security Lock,EPEAT Silver ENERGY STAR 6.0 TCO Certified Displays 6.0 WEEE RoHS,Yes,,Yes,Yes,348 mm,178°,,Philips Electronics,247E4LHAB/00,1920 x 1080,1.0,2.0,17.20 W,,,Mac PC,E-line,247E4LHAB,LCD Monitor With SmartImage Lite,LCD Monitor,5 ms,Full HD,"59.9 cm (23.6"")",Yes,60 Hz,500 mW,,,170°,,,Yes,3.16 kg,557 mm,193 mm,434 mm,220 V AC 110 V AC,,557 mm,,,,,,300 mW,,,,,3.44 kg,,,,,,,,,,,,,,,,,,,,,,
"210-ABRO, 0912943, Dell, LCD Monitor, Itenergy Ltd",,,,16:9,LED,Dell,300 cd/m²,USB Hub,,Black,16.7 Million Colours,"2,000,000:1",46 mm,,Yes,Yes,,RoHS CECP TCO Certified Displays ENERGY STAR 6.0 EPEAT Gold China Energy Label (CEL),Yes,,,,380 mm,,3 Year,"Dell, Inc",210-ABRO,1920 x 1080,1.0,,43 W,27 Monitor - P2714H VGA Cable DisplayPort Cable DVI-D Cable USB Cable,,,,P2714H,27 Monitor - P2714H,LCD Monitor,8 ms,Full HD,"68.6 cm (27"")",,,,Yes,,,Yes,,Yes,4.56 kg,641.4 mm,203.96 mm,538.99 mm,,,641.35 mm,"Built to comply with the latest environmental and
regulatory standards and protected by a Premium Panel Guarantee and
Advanced Exchange Service.","Fully adjustable stand and a comprehensive set of analog and
digital connectivity ports and cables.","Full HD 1920 x 1080 resolution with an ultra-wide
178°/178° viewing angle.",,,,,,,,,,,,Click to view,25%,,,,,,,,,,,,,,,,,
"UM.CV6EE.013, 2716783, Acer, LCD Monitor, Itenergy Ltd",Yes,No,No,5:4,LED,Acer,250 cd/m²,,,Black,16.7 Million Colours,"100,000,000:1",52 mm,,,Yes,,TCO Certified Displays 6.0 EPEAT Gold,Yes,Yes,,,337 mm,170°,3 Year,"Acer, Inc",UM.CV6EE.013,1280 x 1024,1.0,,15.80 W,V196LWidescreen LCD MonitorPower Cord1 x VGA Cable,Twisted Nematic Film (TN Film),,,V196L,V196L LCD Monitor,LCD Monitor,5 ms,SXGA,"48.3 cm (19"")",,75 Hz,450 mW,,,160°,Yes,100 x 100,Yes,2.70 kg,406.4 mm,207 mm,408 mm,110 V AC 220 V AC,Anti-glare,406.40 mm,,,,,No,350 mW,V,,No,-5°to25°,3.10 kg,,,,,,,,,,,,,,,,,,,,,,
"E2480HS-B1, IIYNOT004, Iiyama, LCD Monitor, Itenergy Ltd",Yes,,,16:9,LED,iiyama,300 cd/m²,Speaker,CETUV-GSCU,Black,16.7 Million Colours,"1,000:1",213.5 mm,,,Yes,Security Lock,ENERGY STAR TCO Displays 5.0,Yes,Yes,Yes,,401 mm,170°,3 Year,"iiyama North America, Inc",E2480HS-B1,1920 x 1080,1.0,2.0,22 W,ProLite E2480HSPower CableVGA Cable (D-Sub)DVI CableAudio CableCable HolderStand FootFootQuick Start GuideSafety Guide,,PC Mac,ProLite,E2480HS,ProLite E2480HS,LCD Monitor,2 ms,Full HD,"61 cm (24"")",Yes,75 Hz,1 W,,,160°,Yes,100 x 100,Yes,4.30 kg,571.5 mm,,,220 V AC 110 V AC,,,,,,,,,,,,,,,,Desk Mountable Wall Mountable,,,,,,,,,,,,,,,,,,,
"P2252HS-B1, 2792861, Iiyama, LCD Monitor, Itenergy Ltd",Yes,,,16:9,LED,iiyama,225 cd/m²,Speaker,,,16.77 Million Colors,"1,000:1",,,,Yes,,ENERGY STAR,Yes,Yes,Yes,Yes,,170°,,"iiyama North America, Inc",P2252HS-B1,1920 x 1080,1.0,2.0,18 W,,,,ProLite,P2252HS-B1,ProLite P2252HS-B1 Widescreen LCD Monitor,LCD Monitor,5 ms,Full HD,"54.6 cm (21.5"")",Yes,75 Hz,500 mW,,,160°,Yes,100 x 100,Yes,,,195 mm,382.50 mm,220 V AC 110 V AC,,516.50 mm,,,,,,,,,,,4.50 kg,,,Wall Mountable,,,,,,,,,,,,,,,,,,,
"LS22C150NS/EN, 886J914, Samsung, LCD Monitor, Itenergy Ltd",Yes,,,16:9,LED,Samsung,200 cd/m²,,,Shiny Black,16.7 Million Colours,700:1,53 mm,,No,No,MagicTune MagicBright3 Off Timer Magic Upscale Eco Saving Eco Mode,ENERGY STAR 6.0,Yes,,,,311 mm,90°,3 Year,Samsung,LS22C150NS/EN,1920 x 1080,1.0,,18 W,S22C150N Widescreen LCD Monitor D-sub cable Quick Setup Guide,,Mac PC,,S22C150N,S22C150N Widescreen LCD Monitor,LCD Monitor,5 ms,Full HD,"54.6 cm (21.5"")",No,,300 mW,No,,65°,,,Yes,2.70 kg,512 mm,197 mm,385 mm,220 V AC 110 V AC,,512 mm,,,,,,300 mW,,,,,3.10 kg,,,,,,No,,,,,,,,,,,,,,,,
"60B0HAT1UK, 2895265, Lenovo, LCD Monitor, Itenergy Ltd",Yes,,,16:9,LED,Lenovo,250 cd/m²,,China Energy standard Tier 1 VOC test TUV Ergo DDC/CI ISO 9241-307,Raven Black,16.7 Million Colours,"1,000:1",167.2 mm,,,Yes,Security Lock,EU RoHS Turkey RoHS China RoHS EPEAT Silver TCO Certified Displays 6.0 ENERGY STAR 6.0 Ukraine RoHS RoHS,Yes,,,,399 mm,90°,3 Year,Lenovo Group Limited,60B0HAT1UK,1920 x 1080,1.0,,21 W,,Twisted Nematic Film (TN Film),PC,ThinkVision,E2323,ThinkVision E2323 Wide 23-Inch FHD WLED Backlit LCD Monitor,LCD Monitor,5 ms,Full HD,"58.4 cm (23"")",,75 Hz,500 mW,,,160°,Yes,100 x 100,Yes,3.55 kg,548.5 mm,,,220 V AC 110 V AC,,,,,,,,500 mW,,,,,,,,Wall Mountable,,,,,,,,,,,,,,,,,,,
"UM.VG6EE.B01, 8653C88, Acer, LCD Monitor, Itenergy Ltd",Yes,No,No,16:9,LED,Acer,,,,,,"100,000,000:1",,,,Yes,,,,,Yes,,,,,"Acer, Inc",UM.VG6EE.B01,1920 x 1080,1.0,,22.01 W,,Twisted Nematic Film (TN Film),,,G236HLBBID,G236HLBBID Widescreen LCD Monitor,LCD Monitor,5 ms,Full HD,"58.4 cm (23"")",,,450 mW,,,,No,,,,,,,,,,,,,,No,400 mW,,,No,-5°to15°,,30 kWh,A,,,,,,,,,,,,,,,,,,,,
"9H.L7CLA.TBU, BENNOT056, BenQ, LCD Monitor, Itenergy Ltd",Yes,No,,16:9,LED,BenQ,250 cd/m²,Speaker,,Glossy Black,16.7 Million Colours,"1,000:1",179.1 mm,,,Yes,Eco Mode Security Lock Senseye 3,ENERGY STAR 5.0 TCO Displays 5.0,Yes,Yes,Yes,,436.5 mm,170°,,BenQ Corporation,9H.L7CLA.TBU,1920 x 1080,1.0,2.0,42 W,,,PC,,GL2450HM,GL2450HM Widescreen LCD Monitor,LCD Monitor,2 ms,Full HD,"61 cm (24"")",Yes,,300 mW,,,160°,Yes,100 x 100,Yes,4.10 kg,579.4 mm,,,220 V AC 110 V AC,,,,,,,,,,,,,,,,Wall Mountable,,,,,,,,,,,,,,,,,,,
"19B4LCB5/00, 2905225, Philips, LCD Monitor, Itenergy Ltd",Yes,Yes,Yes,5:4,LED,Philips,250 cd/m²,Speaker,BSMI CE Mark cETLus FCC Class B GOST SEMKO TUV Ergo TUV/GS,Textured Black,16.7 Million Colours,"1,000:1",61 mm,Landscape/Portrait,,Yes,Security Lock TrueVision Eco Mode Sync on Green Cable Management SmartPower SmartErgoBase SmartControl SmartImage,ENERGY STAR 6.0 RoHS TCO Certified Displays 6.0 EPEAT Gold WEEE,Yes,Yes,,Yes,346 mm,170°,,Philips Electronics,19B4LCB5/00,1280 x 1024,1.0,2.0,14 W,,,PC Mac,Brilliance,19B4LCB5,"Brilliance LCD Monitor, LED Backlight with SmartImage",LCD Monitor,5 ms,SXGA,"48.3 cm (19"")",Yes,60 Hz,100 mW,,,160°,Yes,100 x 100,Yes,2.71 kg,404 mm,227 mm,404 mm,110 V AC 220 V AC,,506 mm,,,,,,100 mW,B,,,,4.61 kg,,,,,,,Yes,25%,,,,,,,,,,,,,,
"861-10383, 0912945, Dell, LCD Monitor, Itenergy Ltd",,,,16:10,LED,Dell,250 cd/m²,USB Hub,,Silver,16.78 Million Colors,"2,000,000:1",59.8 mm,,Yes,Yes,,TCO Certified Displays China Energy Label (CEL) ENERGY STAR EPEAT Gold,Yes,,,,332.7 mm,,3 Year,"Dell, Inc",861-10383,1680 x 1050,1.0,,45 W,"Professional P2213 56cm (22"") Monitor with LED Stand Power cable DVI cable USB cable VGA cable Drivers and documentation media Quick setup guide Safety information",,,Professional,P2213,"Professional P2213 56cm (22"") Monitor with LED",LCD Monitor,5 ms,WSXGA+,"55.9 cm (22"")",,,,Yes,,,Yes,,Yes,3.43 kg,510.4 mm,183.30 mm,497.40 mm,,,510.40 mm,,,,,,,,,,,,,,,Click to view,25%,,,,,,,,,,,,,,,,,
"60A1MAT2UK, 2746619, Lenovo, LCD Monitor, Itenergy Ltd",Yes,Yes,Yes,16:9,LED,Lenovo,250 cd/m²,,,,16.7 Million Colours,"1,000:1",,,,,,,,,,,,,,Lenovo Group Limited,60A1MAT2UK,1920 x 1080,1.0,,,,,,ThinkVision,LT2223p,ThinkVision LT2223p 21.5-Inch FHD LED Backlit LCD Monitor,LCD Monitor,,Full HD,"54.6 cm (21.5"")",,,,,,160°,,,,,,,,,,,,,,,,,,,,,,,,,,,,,,,,,,,,,,,,,,,
"UM.BV6EE.005, ACEV176LBMD, Acer, LCD Monitor, Itenergy Ltd",Yes,No,No,5:4,LED,Acer,250 cd/m²,,,Black,16.7 Million Colours,"100,000,000:1",55 mm,,,Yes,,EPEAT Gold TCO Certified Displays 6.0,Yes,Yes,,,308.7 mm,170°,3 Year,"Acer, Inc",UM.BV6EE.005,1280 x 1024,1.0,,13 W,V176L LCD Monitor1 x VGA CablePower Cord,Twisted Nematic Film (TN Film),,,V176L,V176L LCD Monitor,LCD Monitor,5 ms,SXGA,"43.2 cm (17"")",Yes,75 Hz,450 mW,,,160°,Yes,100 x 100,Yes,2.20 kg,369 mm,191 mm,394.50 mm,220 V AC 110 V AC,Anti-glare,369 mm,,,,,No,350 mW,V,,No,-5°to25°,2.60 kg,,,,,,,,,,,,,,,,,,,,,,
"UM.WW3EE.001, 2975740, Acer, LCD Monitor, Itenergy Ltd",Yes,No,No,16:9,LED,Acer,200 cd/m²,,,Black,16.7 Million Colours,"100,000,000:1",52 mm,,,Yes,,MPR II,Yes,Yes,No,,304.5 mm,90°,2 Year,"Acer, Inc",UM.WW3EE.001,1920 x 1080,1.0,,18.10 W,K222HQL Widescreen LCD Monitor1 x VGA CablePower Cord,Twisted Nematic Film (TN Film),,,K222HQL,K222HQL Widescreen LCD Monitor,LCD Monitor,5 ms,Full HD,"54.6 cm (21.5"")",No,60 Hz,450 mW,,,65°,,,Yes,2.70 kg,508 mm,207 mm,390.50 mm,110 V AC 220 V AC,Anti-glare,508 mm,,,,,,350 mW,K,,No,-5°to25°,3.10 kg,29 kWh,A,,,,,,,,,,,,,,,,,,,,
"246V5LHAB/00, 2716391, Philips, LCD Monitor, Itenergy Ltd",Yes,,,16:9,LED,Philips,250 cd/m²,Speaker,GOSTPSBSASOBSMICE MarkuETLusFCC Class BSEMKOTUV/ISO9241-307,Glossy Black,16.7 Million Colours,"1,000:1",63 mm,,,,Sync on Green SmartContrast Security Lock,TCO Certified Displays WEEE EPEAT Silver ENERGY STAR 6.0 RoHS,Yes,,Yes,Yes,354 mm,170°,3 Year,Philips Electronics,246V5LHAB/00,1920 x 1080,1.0,2.0,21.75 W,,,PC Mac,,246V5LHAB,LCD Monitor with SmartControl Lite,LCD Monitor,5 ms,Full HD,"61 cm (24"")",Yes,60 Hz,300 mW,,,160°,Yes,100 x 100,Yes,4.22 kg,565 mm,238 mm,435 mm,110 V AC 220 V AC,,565 mm,,,,,,500 mW,V,,,,4.65 kg,,,,,,,,,,,,,,,,,,,,,,
"R20MBEU, S601JD7, Lenovo, LCD Monitor, Itenergy Ltd",Yes,Yes,Yes,16:10,LED,Lenovo,300 cd/m²,USB Hub,ISO 9241-307FCC Class BULE GoldCEBSMIGOSTNEMKONOMSABSSASOIEC 60950CCCPSBIRAMJEITAcTUVus,Black,16 Million Colours,"1,000:1",257.3 mm,,Yes,Yes,Security Lock,TCO Certified Displays 5.2 RoHS WEEE MPR II EPEAT Gold TCO Certified Edge Displays 1.1 ENERGY STAR 5.1,Yes,Yes,,,394.8 mm,178°,3 Year,Lenovo Group Limited,R20MBEU,1920 x 1200,1.0,,40 W,,In-plane Switching (IPS) Technology,PC,ThinkVision,LT2452p,ThinkVision LT2452p Widescreen LCD Monitor,LCD Monitor,7 ms,WUXGA,"61 cm (24"")",,75 Hz,500 mW,Yes,USB 2.0,178°,Yes,100 x 100,Yes,6.67 kg,559.6 mm,,,110 V AC 220 V AC,Anti-reflective Anti-glare,,,,,,,,,,,,,,,Wall Mountable Desk Mountable,,,,Yes,Plastic,,,,,,,,,,,,,,
"VG2435SM, B921672, ViewSonic, LCD Monitor, Itenergy Ltd",,,,16:10,LED,Viewsonic,250 cd/m²,Speaker,,,16.7 Million Colours,"50,000,000:1",51.6 mm,,,Yes,,TCO Certified Displays REACH ENERGY STAR,Yes,,,,363 mm,,,Viewsonic Corporation,VG2435SM,1920 x 1200,1.0,,31 W,,,,Graphic,VG2435Sm,"VG2435Sm 24"" 16:10 Ergonomic Multimedia Display",LCD Monitor,5 ms,WUXGA,"61 cm (24"")",Yes,,,,,,Yes,,Yes,4.10 kg,531.4 mm,204.22 mm,393.70 mm,,,556.77 mm,,,,,,,,,,,5.70 kg,,,,Click to view,,,,,,,,,,,,,,,,,,
"E2280HS-B1, IIYNOT019, Iiyama, LCD Monitor, Itenergy Ltd",Yes,,,16:9,LED,iiyama,250 cd/m²,Speaker,CETUV-GSCUVESA DPMS,Black,16.7 Million Colours,"5,000,000:1",189.5 mm,,,Yes,Security Lock,ENERGY STAR,Yes,Yes,Yes,,365.5 mm,160°,,"iiyama North America, Inc",E2280HS-B1,1920 x 1080,1.0,2.0,21 W,ProLite E2280HS Widescreen LCD MonitorPower CableD-Sub CableDVI-D CableAudio CableStandQuick Start GuideSafety Guide,,Mac,ProLite,E2280HS,ProLite E2280HS Widescreen LCD Monitor,LCD Monitor,5 ms,Full HD,"55.9 cm (22"")",Yes,,1 W,,,160°,Yes,100 x 100,Yes,3.30 kg,509.5 mm,,,220 V AC 110 V AC,,,,,,,,,,,,,,,,,,,,,,,,,,,,,,,,,,,
"860-10202, DELU2413, Dell, LCD Monitor, Itenergy Ltd",Yes,Yes,Yes,16:10,LED,Dell,350 cd/m²,Card Reader USB Hub,,Black,1.07 Billion Colors,"1,000:1",67.1 mm,,Yes,Yes,PremierColor Technology Security Lock Cable Management,ENERGY STAR 5.1 EPEAT Gold TCO Certified Displays,Yes,Yes,Yes,,361.6 mm,178°,3 Year,"Dell, Inc",860-10202,1920 x 1200,1.0,,130 W,UltraSharp U2413 Widescreen LCD Monitor Stand Power Cable DVI-D Cable DisplayPort Cable USB 3.0 upstream Cable Cable Tie Drivers and Documentation media Colour Calibrated Factory Report Quick Setup Guide Safety Information,Advanced High Performance In-plane Switching (AH-IPS) Technology,PC,UltraSharp,U2413,UltraSharp U2413 Widescreen LCD Monitor,LCD Monitor,6 ms,WUXGA,"61 cm (24"")",,60 Hz,500 mW,Yes,USB 3.0,178°,Yes,,,5.01 kg,556 mm,200.50 mm,530.90 mm,220 V AC 110 V AC,Anti-glare,556 mm,,,,,,,,,,,7.32 kg,,,,,,,,,,,,,,,,,,,,,,
"UM.FS1EE.001, 8653X34, Acer, LCD Monitor, Itenergy Ltd",Yes,No,No,16:9,LED,Acer,250 cd/m²,,,Black,16.7 Million Colours,"100,000,000:1",42 mm,,,Yes,,ENERGY STAR MPR II,Yes,Yes,Yes,,343 mm,170°,3 Year,"Acer, Inc",UM.FS1EE.001,1920 x 1080,1.0,,19.80 W,S241HL Widescreen LCD Monitor1 x VGA Cable1 x DVI CablePower Cord,Twisted Nematic Film (TN Film),,,S241HL,S241HL Widescreen LCD Monitor,LCD Monitor,5 ms,Full HD,"61 cm (24"")",No,60 Hz,460 mW,,,160°,Yes,100 x 100,Yes,3.50 kg,565 mm,166 mm,401 mm,110 V AC 220 V AC,Anti-glare,565 mm,,,,,No,450 mW,S,,No,-5°to15°,3.80 kg,,,,,,,,,,,,,,,,,,,,,,
"D7Z72AT#ABU, 2846672, HP, LCD Monitor, Itenergy Ltd",Yes,Yes,Yes,16:9,LED,HP,250 cd/m²,USB Hub,CE CB KC KCC NOM PSB ICE TUV-S CCC SEPA ISC VCCI FCC BSMI,Black,16.77 Million Colors,"1,000:1",52.2 mm,,Yes,Yes,Security Lock,EPEAT Gold ENERGY STAR China Energy Label (CEL) TCO Certified Edge WEEE CECP REACH EPA,Yes,Yes,,,387.3 mm,178°,3 Year,Hewlett-Packard,D7Z72AT#ABU,1920 x 1080,1.0,,40 W,"EliteDisplay E271i 68,6 cm (27'') LED Backlit Monitor VGA Cable DisplayPort Cable USB Cable AC power Cable Printed Documentation And CD HP DisplayAssistant Software",In-plane Switching (IPS) Technology,PC,Business,E271i,"EliteDisplay E271i 68,6 cm (27'') LED Backlit Monitor",LCD Monitor,7 ms,Full HD,"68.6 cm (27"")",No,60 Hz,500 mW,Yes,USB 2.0,178°,Yes,,Yes,4.90 kg,642 mm,278.50 mm,532.10 mm,220 V AC 110 V AC,Anti-glare,642 mm,,,,,,,Advantage,No,,,7.70 kg,,,Wall Mountable Arm-mountable,,,,,,No,,,,,,,,,,,,,
"860-10148, 0912950, Dell, LCD Monitor, Itenergy Ltd",,,,16:10,LED,Dell,300 cd/m²,USB Hub,,Silver,16.78 Million Colors,"2,000,000:1",65 mm,,Yes,Yes,,China Energy Label (CEL) TCO Certified Displays 5.2 CECP EPEAT Gold ENERGY STAR 5.1,Yes,,,,361.7 mm,,3 Year,"Dell, Inc",860-10148,1920 x 1200,1.0,,72 W,"UltraSharp U2412M 24"" (61cm) Monitor VGA,DVI-DP (1920x1200) Black Stand Power cable Power adapter DVI cable USB cable VGA Cable Drivers and Documentation media Quick Setup Guide Safety Information",,,UltraSharp,U2412M,"UltraSharp U2412M 24"" (61cm) Monitor VGA,DVI-DP (1920x1200) Black",LCD Monitor,8 ms,WUXGA,"61 cm (24"")",,,,Yes,,,Yes,,Yes,3.97 kg,556 mm,180.34 mm,513.59 mm,,,556.01 mm,,,,,,,,,,,,,,,Click to view,,,,,,,,,,,,,,,,,,
"UM.WV6EE.B04, 8655C12, Acer, LCD Monitor, Itenergy Ltd",Yes,No,No,16:9,LED,Acer,200 cd/m²,,,Black,16.7 Million Colours,"100,000,000:1",206.8 mm,,,Yes,,ENERGY STAR MPR II,Yes,Yes,,,390.4 mm,90°,3 Year,"Acer, Inc",UM.WV6EE.B04,1920 x 1080,1.0,,18.10 W,V226HQL Widescreen LCD Monitor1 x VGA CablePower Cord,Twisted Nematic Film (TN Film),,,V226HQL,V226HQL Widescreen LCD Monitor,LCD Monitor,5 ms,Full HD,"54.6 cm (21.5"")",,60 Hz,450 mW,,,65°,Yes,100 x 100,Yes,3.24 kg,508 mm,,,110 V AC 220 V AC,Anti-glare,,,,,,No,350 mW,V,,No,-5°to25°,3.66 kg,,,,,,,,,,,,,,,,,,,,,,
"ET.VG6HE.B01, 8652S94, Acer, LCD Monitor, Itenergy Ltd",Yes,No,No,16:9,LED,Acer,200 cd/m²,,,Black,,"100,000,000:1",,,,Yes,,,,,,,,,,"Acer, Inc",ET.VG6HE.B01,1920 x 1080,1.0,,26 W,,Twisted Nematic Film (TN Film),PC,,G236HLBbd,G236HLBbd Widescreen LCD Monitor,LCD Monitor,5 ms,Full HD,"58.4 cm (23"")",,60 Hz,450 mW,,,,No,,Yes,,,,,,,,,,,,No,400 mW,G,,No,-5°to15°,,,,,,,,,,,,,,,,,,,,,,,
"22MB65PM-B, 2975559, LG Electronics, LCD Monitor, Itenergy Ltd",,Yes,,16:10,LED,LG,250 cd/m²,,,Black,,"50,000,000:1",,,,Yes,,,,,,,,,,LG Electronics,22MB65PM-B,1680 x 1050,1.0,,,,In-plane Switching (IPS) Technology,,,22MB65PM-B,22MB65PM-B Widescreen LCD Monitor,LCD Monitor,5 ms,WSXGA+,"55.9 cm (22"")",Yes,,,,,,Yes,,Yes,4.80 kg,,,,,,,,,,,,,,,,,,,,,,,,,,,,,,,,,,,,,,,
