Buy Peerless HD Flow Pro Wireless Multimedia Kit Monitor & Display Accessories HDS200 today at PC Connection,FCC RoHS CE,,,,,,This product is subject to our return policy. Please see our complete return policy for details.,1 Year,1 Year,Black,"Full HD 1080p (60Hz) (24/30/60 fps) and passive 3D signal flow, ideal for ultra-fast signal streaming.
Long range, high-quality streaming up to 131ft (40m) with no reduction of picture quality.
Multicast up to four HD Flow Pro Wireless Receivers. (Requires additional receiver units)
Instant real-time transmission of Full HD media.
Transmits through walls and ceilings for multi-room streaming capability.
The HD Flow Pro (802.11n) private network resists interference and network sharing from nearby wireless routers.
Built-in IR does not require line-of-sight placement to control source devices such as DVR/set-top box, satellite box, Blu-ray/DVD player, media server, VCR, game console.
Plug and play setup requires no software or driver installation.","Transmitter, receiver, documentation","Monitor, Projector Accessories",,,,,,,,,,,,,,,,"(2) HDMI
(1) RCA composite
(1) RCAx3 component
(1) 3.5mm audio
(1) RCA L/R audio
(1) RJ-45 LAN",,,,,,,,,,,,,,,,,,,,,
"Buy Tripp Lite Full-Motion Wall Mount with Arms for 17"" to 42"" Flat Stands & Mounts - AV DWM1742MA today at PC Connection",RoHS,,,,,,This product is subject to our return policy. Please see our complete return policy for details.,5 Years,5 Years,Black,"Can be used to increase available desk/table space in office applications.
Fits most flat-panel displays from 17” to 42”.
Convenient one-touch display adjustment for easy view optimization.
Wide range of motion with -15° to +15° tilt, 180° swivel and -3° to +3° screen level adjustment capability.
Supports up to 77 pounds.
VESA Pattern (mm): 75x75; 100x100; 200x100; 200x200","mount, documentation",Wall mount,Flat panel display,7.90 lb(s),,,,,,,,,,,,,,,,,,,,,,,,,,,,,,,,,,,
"Buy Tripp Lite 19"" LCD 1U Rackmount KVM Console, Keyboard, Touchpad Monitors - LCD B021-000-19 today at PC Connection",,,19 in,,,,This product is subject to our return policy. Please see our complete return policy for details.,1 Year,1 Year,Black,"Features
19-inch LCD TFT active-matrix, color panel
Space saving 1U 19-inch, rackmount drawer design
Supports resolutions of up to 1280 x 1024
Included PS/2 to USB adapter allows for connection to a USB computer or KVM
Sleep mode when the monitor cover is closed
Constructed of heavy-duty steel housing","Console, KVM cable kit, PS/2 to USB adapter, power cord, documentation",,,,,Limited,,,,,,HDDB15 (F) PS/2,VGA PS/2 USB,,,,,,,,,Rackmount display,,,,,,,,,,,,,,,,,
"Buy Open Box HP 22"" P221 Full HD LED-LCD Monitor, Black Monitors - LED-LCD C9E49A8#ABA today at PC Connection",Energy Star,Tilt,21.5 in,0.248 mm,Yes,250 cd/m2,This product is subject to our return policy. Please see our complete return policy for details.,90 Days,90 Days,Black,"Essential business features:
Support your business needs at a competitive price with a large 21.5-inch diagonal LED display. Review documents side by side, read e-mails while multitasking in another window, and keep more applications open at the same time.
Compatibility with HP accessories:
Customize your work space with options like the HP Quick Release, HP Speaker Bar and HP USB Graphics Adapter (options sold separately).
Stability now, and peace of mind for the future:
Maintain product consistency across staggered deployments, ease transitions and help reduce support costs with a minimum one-year lifecycle stability commitment from HP.
Smart software for the multi-tasker:
HP Display Assistant consolidates monitor setting controls into one easy-to-use, centralized interface.
Energy efficient, environmentally aware:
Mercury-Free LED backlighting, a BFR/PVC-free design, and arsenic-free display glass are just a few of the environmental features built into this display.
Dimensions with stand: 14.9""h x 20.4""w x 6.3""d","Monitor, documentation",,,8.80 lb(s),"12.4""h x 20.4""w x 1.9""d",,,,,250 cd/m2,,Power HDDB15 DVI,VGA DVI Power,,LCD LED-backlit,Widescreen,1920 x 1080,"(1) HDDB15 VGA
(1) DVI
(1) Power in","Supply: 100-240VAC
Consumption: 28W (max); 22W (typ.);",5 ms,170/160,,,,,,,,,,,,,Digital Visual Interface (DVI),Open Box,Stand not included.,,,
"Buy NDS 30"" Dome S6c Diagnostic Medical LED-LCD Monitor with nVidia Monitors - Medical 997-6806-00-1FN today at PC Connection",FCC FDA 510k RoHS EN 60601-1 WEEE ANSI/AAMI ES60601-1 CAN/CSA C22.2 No. 60601-1 REACH VCCI,Pivot (rotation) Swivel Height Tilt,30 in,0.197 mm,,800 cd/m2,"Due to manufacturer restrictions, all sales on this item are final.",5 Years,5 Years,,,,,,,,,,,22.000 lb(s),,,,,,,,,,,,,,,,,,,,,,,,,,,,,,
"Buy 3M 17"" M1700SS Touch LCD Monitor, Black, USB Monitors - LCD 11-91378-225 today at PC Connection",C-Tick CUL FCC Class B certified CE RoHS CCC UL,,17 in,.264 mm,,270 nit(s),,3 Years,3 Years,Black,,"Monitor, video cable, USB cable, power supply, power cable, documentation",,,0.00 lb(s),"16.3""h x 15.9""w x 9.7""d",,,,,,16.2 million colors,DVI HDDB15 USB,DVI USB VGA,800:1,LCD TFT,Standard,1280 x 1024,"(1) HDDB15 VGA
(1) DVI
(1) USB","Supply: 12VDC
Consumption:",9 ms,160/160,Touch screen,,,,,,,,,,,,Digital Visual Interface (DVI),,,,,
"Buy Peerless SmartMount Universal Flat Wall Mount For 42""-71"" Flat Stands & Mounts - AV SF670 today at PC Connection",,,,,,,This product is subject to our return policy. Please see our complete return policy for details.,5 Years,5 Years,Black,"Compatible with 42""-71"" flat screens with mounting hole patterns up to 19.8""h and 35.75""w.","Wall mount, hardware, documentation",Wall mount,Flat panel display,,,,,,,,,,,,,,,,,,,,,,,,,,,,,,,,,,,,
"Buy NDS 21.3"" Dome S3c LED Diagnostic Medical Monitor with nVidia Monitors - Medical 997-6803-00-1FN today at PC Connection",WEEE KCC EN 60601-1 FCC CCC VCCI cCSAus FDA 510k REACH RoHS EN 60601-1-2 TUV GM,Tilt Swivel Pivot (rotation) Height,21.3 in,0.2115 mm,,800 cd/m2,"Due to manufacturer restrictions, all sales on this item are final.",5 Years,5 Years,,,,,,,,,,,14.100 lb(s),,,,,,,,,,,,,,,,,,,,,,,,,,,,,,
"Buy Touchsystems 19"" W21990R-UM LED-LCD TouchScreen Monitor, Black Monitors - LED-LCD W21990R-UM today at PC Connection",Energy Star EPEAT RoHS,,19 in,0.28 mm,,,,3 Years,3 Years,Black,"100 x 100mm VESA mounting pattern.
Swivel and tilt base.","Monitor, documentation",,,10.10 lb(s),"13.7""h x 17.3""w x 8.3""d",includes backlight,,,,250 cd/m2,,HDDB15 DVI-D Power,VGA DVI-D Power,1000:1,LED-backlit LCD,Widescreen,1440 x 900,"(1) HDDB15 VGA
(1) DVI-D
(1) Power in","Supply: 100-240VAC
Consumption: 14W (typ.); 0.4W (power saving mode)",5 ms,160/170,Touch screen,,,,,,,,,,,,Digital Visual Interface (DVI),,,,,
"Buy Acer 27"" V276HL BMD Full HD LED-LCD Monitor, Black Monitors - LED-LCD UM.HV6AA.001 today at PC Connection",,,27 in,,,300 cd/m2,,3 Years,3 Years,Black,"Brilliant:
Focus more sharply on your tasks with the superior contrast ratios and ultra-quick response of Professional Series monitors. Plentiful built-in display technologies deliver consistent viewing across wide angles, faster response time for reduced eye strain, and more realistic colors.
Ecological:
Professional Series monitors are RoHS compliant and mercury free. In addition, the advanced Acer EcoDisplay design plus white LED backlighting yield significant power savings. More than 10% of the material used in these monitors is post-consumer recycled (PCR) plastic, further reducing environmental impact.","Monitor, VGA cable, DVI cable, documentation",,,,,limited,,,,300 cd/m2,,Power HDDB15 DVI,Power VGA DVI,"100,000,000:1",LCD LED-backlit,Widescreen,1920 x 1080,"(1) DVI
(1) HDDB15 VGA
(1) Power in",,6 ms,178/178,Speakers Included Dual speakers,,,,,,,,,,,,Digital Visual Interface (DVI),,,,,
"Buy HP Smart Buy 22"" E221 Full HD LED-LCD Monitor, Black Monitors - LED-LCD C9V76A8#ABA today at PC Connection",Energy Star,Pivot (rotation) Swivel Tilt Height,21.5 in,0.248 mm,Yes,250 cd/m2,This product is subject to our return policy. Please see our complete return policy for details.,3 Years,3 Years,Black,"Bring your content to life with Full-HD resolution. Get vibrant text and graphics from the LED backlit panel, which also makes the monitor thin, light, and easy to position on a desk.
Find your most comfortable working position so you can power through your day. Customizable tilt, height adjustment, swivel, and pivot settings—the most adjustability available on an HP business display—help you find your sweet spot.
Reduce power consumption and help lower your costs with an intelligent, energy efficient design featuring ENERGY STAR, EPEAT Gold, and TCO certifications.","Monitor, VGA cable, DisplayPort cable, USB cable, power cable, documentation",,,,,,,,,250 nit(s),,Power HDDB15 DisplayPort DVI-D,DisplayPort DVI-D VGA Power,1000:1,LCD LED-backlit,Widescreen,1920 x 1080,"(1) HDDB15 VGA
(1) DVI-D
(1) DisplayPort
(1) Power in",Consumption: 36W (typ.),5 ms,170/160,Height Adjustable,,,,,,,,,,,,Digital Visual Interface (DVI),,,,,
"Buy Planar 22"" Full HD PXL2250MW LED-LCD Monitor, Black Monitors - LED-LCD 997-7019-00 today at PC Connection",FCC Class B certified RoHS CE,Tilt,21.5 in,0.2482 mm,,250 cd/m2,This product is subject to our return policy. Please see our complete return policy for details.,3 Years,3 Years,Black,100 x 100mm VESA mounting pattern.,"Monitor, power cord, VGA cable, DVI cable, audio cable, documentation",,,6.40 lb(s),"12.5""h x 20.1""w x 1.9""d",FREE 2-Day Advance Replacement,,,,250 cd/m2,16.7 million colors,HDMI Power HDDB15 DVI 3.5mm audio,DVI Power VGA HDMI Audio,1000:1,LED-backlit LCD,Widescreen,1920 x 1080,"(1) HDMI
(1) DVI
(1) HDDB15 VGA
(1) 3.5mm audio
(1) Power in","Supply: 100-240VAC
Consumption: 21W (typ.); 0.5W (standby)",5 ms,170/160,Dual speakers Speakers Included,,,,,,,,,,,,Digital Visual Interface (DVI),,,,,
"Buy NDS (2) 21.3"" Dome S3c LED-LCD Display, Black Monitors - Medical 997-6803-00-2NN today at PC Connection",VCCI REACH RoHS WEEE KCC,Tilt Swivel Pivot (rotation) Height,21.3 in,0.2115 mm,,800 cd/m2,"Due to manufacturer restrictions, all sales on this item are final.",5 Years,5 Years,Black,,"(2) monitors, documentation",,,14.10 lb(s),"18.7""h x 14.3""w x 3.9""d",,,,14.100 lb(s),800 cd/m2,,USB Type B DisplayPort DVI-D Power,DVI-D DisplayPort Power USB,1400:1,LCD LED-backlit,Widescreen,2048 x 1536,"(1) DVI-D
(1) DisplayPort
(1) USB Type B
(1) Power in","Supply: 100-240VAC, 50/60Hz
Consumption: 96W (typ.); 108W (max)",20 ms,176/176,,,,,,,,,,,,,Digital Visual Interface (DVI),,,,,
Buy Peerless LCD Adapter Plate for VESA 200mm x 100mm Mounting Stands & Mounts - AV LC-V200 today at PC Connection,,,,,,,This product is subject to our return policy. Please see our complete return policy for details.,N/A,N/A,Black,Compatible with flat panels with VESA 200mm x 100mm mounting pattern.,"Adapter plae, hardware, documentation",Bracket,,,,,,,,,,,,,,,,,,,,,,,,,,,,,,,,,,,,,
"Buy LG 24"" MB35D-B Full HD LED-LCD Monitor, Black Monitors - LED-LCD 24MB35D-B today at PC Connection",TCO Displays 6.0 TUV Ergo Plug and Play DDC/CI TUV GS ISO 9241-307 ISO 13406-2 CUL,Tilt,24 in,0.275 mm,Yes,250 cd/m2,This product is subject to our return policy. Please see our complete return policy for details.,Call for Warranty,Call for Warranty,,,,,,,,,,,,,,,,,,,,,,,,,,,,,,,,,,,,,,,,,
"Buy Tripp Lite VGA with RS232 over Cat5 Cat6 Extender, Transmitter Video Extenders & Splitters B130-101S today at PC Connection",,,,,,,This product is subject to our return policy. Please see our complete return policy for details.,1 Year,1 Year,Black,,"Transmitter, receiver, (2) power supplies, (2) mounting hardware kits, screwdriver, (2) adapter cables, documentation",Extender,,,,,,,,,,,,,,,,"(3) HD15 (F)
(2) 3.5mm serial (F)
(2) RJ-45","Input: 100-240V, 50/60Hz
Output: +5V, 2.0A",,,,,,,,,,,,,,,,,"Computer with VGA video output connector (HDDB15 ) and DB-9 Serial Port
Monitor(s) with VGA input
Remote serial device, such as bar code, Scanner, Touch Screen, etc.",,,
"Buy Acer 21.5"" V226HQL ABD Full HD LED-LCD Monitor, Black Monitors - LED-LCD UM.WV6AA.A01 today at PC Connection",TCO06,Tilt,21.5 in,,,250 cd/m2,,3 Years,3 Years,Black,"Convincing:
Focus more sharply on your tasks with the superior contrast ratios and ultra-quick response of Professional Series monitors. In-Plane Switching (IPS) technology delivers consistent viewing across wide angles, faster response time for reduced eye strain, more realistic colors, and a stable view that prevents tailing when the screen is touched.
Green focus:
Professional Series monitors are RoHS compliant and mercury free. In addition, you'll see power savings of up to 68% thanks to advanced Acer EcoDisplay technologies and white LED backlighting, which cut your costs and conserve the earth's resources. Acer also uses recyclable packaging to further reduce ecological impact.","Monitor, VGA cable, DVI cable, documentation",,,,,limited,,,,250 cd/m2,,HDDB15 Power DVI,DVI Power VGA,"100,000,000:1",LED-backlit LCD,Widescreen,1920 x 1080,"(1) DVI
(1) HDDB15 VGA
(1) Power in",,8 ms,178/178,,,,,,,,,,,,,Digital Visual Interface (DVI),,,,,
"Buy Acer P1383W WUXGA DLP 3D Projector, 3100 Lumens, Black Projectors MR.JH111.00B today at PC Connection",,,,,,,,1 Year,1 Year,Black,,"Projector, power cord, VGA cable, remote with battery, carrying case, CD, documentation",,,5.50 lb(s),"3.7""h x 12.4""w x 8.8""d",90 days on lamp,,,5.5 lb(s),,1.07 billion colors,HDMI USB Type B Mini S-Video Power HDDB15,S-Video HDMI Power USB VGA,17000:1,Digital Light Processing (DLP),,1920 x 1200,"(1) S-video
(1) HDDB15 VGA
(1) HDMI
(1) USB Mini B
(1) Power in",Supply: 110-220VAC,,,Speaker Included Keystone correction Remote control Single speaker,Ceiling-mount front projection Ceiling-mount rear projection,16:10,25 ft,2.3 ft,1280 x 800,Digital Light Processing (DLP),Multiscan,3.3 ft,,3100 ANSI lumens,P-VIP,,,,,,
"Buy HP 15"" L5006tm Touchscreen LCD Monitor, Black Monitors - LCD RB146AA#ABA today at PC Connection",ISO 9241-3 ISO 9241-8 ISO 9241-7 TCO99 GOST Plug and Play TCO03 ISO 13406-2 MPRII FCC,,15 in,0.297 mm,Yes,230 cd/m2,This product is subject to our return policy. Please see our complete return policy for details.,3 Years,3 Years,Black,,"Monitor, VGA cable, AC power cord, CD, documentation",,,10.60 lb(s),"12.2""h x 13.8""w x 6.9""d",90-day 24x7 toll-free technical support,,,,,16.2 million colors,HDDB15 (F),VGA,400:1,Touch screen LCD,Standard,1024 x 768,(1) HDDB15 (F),"Voltage: 100-240VAC:, 50/60Hz
Consumption: 22W (typical), 30W (max.),",17 ms,120/100 degree(s),Tilt Touch screen,,,,,,,,,,,,,,,31.5-60 kHz,56-75 Hz,
"Buy Peerless Dedicated Wall Mount for Flat Panel Displays, Black Stands & Mounts - AV SF16D today at PC Connection",,,,,,,This product is subject to our return policy. Please see our complete return policy for details.,5 Years,5 Years,Black,"Compatible with flat panel displays 22"" and up. Please see manufacturer's website for complete compatiblity listing.
Compatible with Peerless' PLP interface brackets.","Wall plate, interface bracket, hardware, documentation",Wall mount,Flat panel display,5.60 lb(s),"9.8""h x 19.3""w x 1.2""d",,,,,,,,,,,,,,,,,,,,,,,,,,,,,,,,,,
Buy Dell MSA14 Single Monitor Arm Stand Stands & Mounts - AV 469-3992 today at PC Connection,,,,,,,This product is subject to our return policy. Please see our complete return policy for details.,3 Years,3 Years,Black,"Improve viewing comfort for better productivity:
The Dell Single Monitor Arm lets you adjust your monitor any way you want, so you can achieve a more ergonomic and comfortable viewing experience. For business users in a collaborative work environment, adjustability can improve sharing of data. For gamers and other recreational users, the arm can be positioned to help relieve fatigue during extended computing sessions.
Optimized for use with Dell monitors:
The arm easily attaches to standard Dell Quick Release monitor panels without the need for screws or other hardware. Simply snap the monitor into place using the Quick Release slots behind the monitor panel. VESA-compliant monitors without Quick Release functionality can easily be mounted using the VESA adapter plate included in the box. The Dell Single Monitor Arm supports monitors that weigh up to 20.5 pounds.
Enjoy a more spacious and organized workspace:
Replacing your monitor stand with this monitor arm lets you reclaim the space directly in front of your monitor, giving you more work space to write, reference materials and maintain good posture. This ergonomic improvement can improve your comfort, productivity, and overall working experience.
In addition, built-in organization tools help you eliminate clutter for a more comfortable desk environment. Integrated cable management within the arm and a Behind Desk Cable Organizer helps you keep your cables in check and maintain a neat and clean desktop.","monitor arm, VESA plate adapter, (2) allen wrenches, thumbscrew, screws and spacers, documentation",Mounting arm,Monitor,9.20 lb(s),,,,,,,,,,,,,,,,,,,,,,,,,,,,,,,,,,,
Buy Videolarm Aluminum Pole Mount Bracket Stands & Mounts - AV APM3 today at PC Connection,,,,,,,This product is subject to our return policy. Please see our complete return policy for details.,5 Years,5 Years,Black,,"Pole mount assembly, documentation",Bracket,,,,,,,,,,,,,,,,,,,,,,,,,,,,,,,,,,,,,
"Buy Asus 28"" VN289Q Full HD LED-LCD Ultra Wide View Monitor, Black Monitors - LED-LCD VN289Q today at PC Connection",BSMI C-Tick CB TCO Displays 6.0 RoHS VCCI WHQL WEEE PSE Mark MEPS FCC CUL CCC,Tilt,28 in,0.32 mm,Yes,300 cd/m2,This product is subject to our return policy. Please see our complete return policy for details.,3 Years,3 Years,Black,,,,,,,,,,,,,,,,,,,,,,,,,,,,,,,,,,,,,,,,
"Buy Tripp Lite HDMI over Cat5 Cat6 Extender, Transmitter and Video Extenders & Splitters B126-1A1 today at PC Connection",,,,,,,This product is subject to our return policy. Please see our complete return policy for details.,1 Year,1 Year,Black,,"Local Unit, Remote Unit, Screwdriver, (2) Mounting Hardware, (2) Power Supply Units, Documentation",AV Extender,,0.00 lb(s),,,,,,,,,,,,,,"(3) HDMI (F)
(2) RJ-45 (F)",,,,,,,,,,,,,,,,,,,,,
"Buy Acer 23"" S236HL tmjj Widescreen Full HD LED-LCD Monitor, Black Monitors - LED-LCD UM.VS6AA.001 today at PC Connection",MPRII,,23 in,,,250 cd/m2,,3 Years,3 Years,Black,"Kensington lock supported.
Energy Star compliant.
Ultra-Slim design.","Monitor, power cord, VGA cable, HDMI cable, documentation",,,,,,,,,250 nit(s),,HDMI Power HDDB15,HDMI VGA Power,"100,000,000:1",LED-backlit LCD,Widescreen,1920 x 1080,"(1) HDMI
(1) HDDB15 VGA
(1) Power in",,6 ms,178/178,Speakers Included Dual speakers,,,,,,,,,,,,,,,,,
"Buy Acer K132 WXGA DLP Projector, 500 Lumens, White Projectors MR.JGN11.00J today at PC Connection",,,,,,,,1 Year,1 Year,White,"Built-in 2W speakers.
Lamp life of 30000 hours (eco mode) and 20000 hours (normal mode).","projector, AC to DC power adapter, HDMI cable, MHL cable, remote with battery, protection case, CD, documentation",,,14.80 oz,"1.6""h x 5.5""w x 4.6""d",,,,14.8 oz,,1.07 billion colors,Power USB Type B Mini HDMI,Power USB HDMI,10000:1,Digital Light Processing (DLP),,1920 x 1080,"(1) HDMI
(1) USB Mini B
(1) Power in",Supply: 110-220VAC,,,Keystone correction Speaker Included Single speaker Remote control,Ceiling-mount rear projection Ceiling-mount front projection,16:10,8.3 ft,1.4 ft,1280 x 800,DLP projector,Multiscan,2 ft,,500 ANSI lumens,LED,,,,,,
Buy Siig HDMI Over CAT5e Mini-Receiver Video Extenders & Splitters CE-H20211-S1 today at PC Connection,,,,,,,This product is subject to our return policy. Please see our complete return policy for details.,3 Years,3 Years,Black,,"Unit, documentation",Receiver,,,,,,,,,,,,,,,,,Low power consumption - no power adapter required.,,,,,,,,,,,,,,,,,,,,
Buy Axis T91C61 Wall Mount Stainless Steel Stands & Mounts - AV 5504-691 today at PC Connection,,,,,,,This product is subject to our return policy. Please see our complete return policy for details.,Call for Warranty,Call for Warranty,Stainless steel,,"mount, documentation",Wall mount,Network Camera,,,,,,,,,,,,,,,,,,,,,,,,,,,,,,,,,,,,
"Buy Planar 55"" PS5561T Full HD LCD Multi-Touch Display, Black Monitors - Large-Format LCD 997-7656-00 today at PC Connection",,Pivot (rotation),55 in,,,,This product is subject to our return policy. Please see our complete return policy for details.,3 Years,3 Years,Black,"IR 6 point touch
VESA Compatible/Location: 400 mm x 200 mm; 4 holes","display, power cord, VGA cable, IR extender cable, remote control, USB cable, documentation",,,91.00 lb(s),"28.7""h x 49.5""w x 2.8""d",Customer First Warranty featuring FREE 2-Day Advance Replacement,,,,450 cd/m2,16.7 million colors,DVI Power RCA (L/R) HDDB15 DisplayPort 3.5mm audio HDMI,Power DisplayPort HDMI VGA Audio DVI,4000:1,LCD,Widescreen,1920 x 1080,"(1) DisplayPort
(1) HDMI
(1) HDDB15 VGA
(1) DVI
(1) RCA L/R audio
(1) 3.5mm audio
(1) RS-232
(1) Power in","Supply: 100-240VAC, 50/60Hz
Consumption: 165W (max)",6.5 ms,178/178,Touch screen Remote control Speakers Included Dual speakers,,,,,,,,,,,,Digital Visual Interface (DVI),,"OS Compatibility:
Windows 8, 7, Vista, XP, Mac OSX and Linux",,,
"Buy Elite Manual Series Projection Screen with White Case, Matte Projector Screens M99NWS1 today at PC Connection",,,,,,,This product is subject to our return policy. Please see our complete return policy for details.,2 Years,2 Years,White,Wall mount brackets sold separately.,"Screen, hardware, case, documentation",Projection screen,,,"80.8""h x 76""w","Government, Education, Military, and Religious customers receive a 3 year screen warranty",,,,,,,,,,,,,,,,,,,,,,,,,,,,,,,,,
Buy Chief Manufacturing Universal Interface Bracket for Large Flat Stands & Mounts - AV MSBUB today at PC Connection,,,,,,,This product is subject to our return policy. Please see our complete return policy for details.,N/A,N/A,Black,,"Bracket, documentation",Bracket,Flat panel display,,,,,,,,,,,,,,,,,,,,,,,,,,,,,,,,,,,,
"Buy ELO Touch Solutions 22"" 2239L IntelliTouch LCD Monitor, Open Monitors - LCD E654071 today at PC Connection",WEEE C-Tick NOM S Mark PCT BSMI EK RoHS FCC MIC CUL CCC VCCI,,22 in,,,270 cd/m2,This product is subject to our return policy. Please see our complete return policy for details.,3 Years,3 Years,Black,,,,,,,,,,,,,,,,,,,,,,,,,,,,,,,,,,,,,,,,
"Buy Elite Manual Series Matte White Projection Screen, Black Case, Projector Screens M113UWS1 today at PC Connection",,,,,,,This product is subject to our return policy. Please see our complete return policy for details.,2 Years,2 Years,White,Wall mount brackets sold separately.,"Screen, hardware, case, documentation",Projection screen,,24.00 lb(s),"88.5""h x 87""w","Government, Education, Military, and Religious customers receive a 3 year screen warranty",,,,,,,,,,,,,,,,,,,,,,,,,,,,,,,,,
"Buy Da-Lite Cosmopolitan Electrol Projection Screen, Matte White, Projector Screens 40782 today at PC Connection",,,,,,,This product is subject to our return policy. Please see our complete return policy for details.,1 Year,1 Year,White,"Viewing Angle: 60 degrees
Gain: 1.0","Screen, case, wall switch, documentation",Projection screen (motorized),,,"60""h x 80""w",,,,,,,,,,,,,,,,,,,,,,,,,,,,,,,,,,
"Buy 3M 15"" MicroTouch M150 LCD Touchmonitor Capacitive, Serial, Monitors - LCD 11-81375-227 today at PC Connection",RoHS CE C-Tick CUL UL CCC FCC Class B certified,Tilt,15 in,0.297 mm,,225 nit(s),,3 Years,3 Years,Black,,"Monitor, VGA cable, AC/DC power supply, AC power cable, serial cable, software, documentation",,,16.30 lb(s),"15.7""h x 16.1""w x 10.2""d",3 years on touch sensor components,,,,,16.2 million colors,3.5mm audio (F) DB9 (F) HDDB15 (F) Power,Serial (RS-232) Power VGA Audio (Stereo),500:1,Touch screen LCD,Standard,1024 x 768,"(1) HDDB15 female
(3) 3.5mm audio
(1) DB9
(1) Power in","Supply: 12VDC power supply
Consumption:",12 ms,150/150,Touch screen Tilt,,,,,,,,,,,,,,"Windows XP, 2000, 98, Me, NT 4.0",,,
"Buy 3M 12.5"" Widescreen Privacy Filter (16:9) for Laptops Glare Filters & Privacy Screens PF12.5W9 today at PC Connection",,,,,,,This product is subject to our return policy. Please see our complete return policy for details.,1 Year,1 Year,,"Fits widescreen notebooks with a 12.5"" diagonal viewing area and a 16:9 aspect ratio.
Easy-on, easy-off attachment system.","Privacy filter, documentation",Display privacy filter,,,"6.2""h x 10.9""w",,,,,,,,,,,,,,,,,,,,,,,,,,,,,,,,,,
