"60003587, 3968097, NEC Display Solutions, LCD Monitor, Itenergy Ltd",Yes,Yes,Yes,16:4,LED,NEC Display,250 cd/m²,Speaker USB Hub,ISO 9241-307 TAV FCC Class B PCT/Gost TCO Certified Edge Displays 1.2,White,16.77 Million Colors,"1,000:1",218 mm,Landscape/Portrait,Yes,Yes,Ambient Light Sensor Off Timer Security Lock Eco Mode Cable Management,ENERGY STAR MPR III RoHS EPEAT Gold TCO Certified Displays 6.0,Yes,Yes,Yes,Yes,380.4 mm,178°,3 Year,NEC Display Solutions,60003587,1920 x 1080,1.0,2.0,27 W,"LCD 23"" Commercial Display Power Cable Control Sync Cable USB Cable Audio Cable CD-ROM Sales Office List User Manual Signal Cable (VGA-VGA) Signal Cable (DVI-D - DVI-D)",In-plane Switching (IPS) Technology,PC,MultiSync,EA234WMi,"LCD 23"" Commercial Display",LCD Monitor,6 ms,Full HD,"58.4 cm (23"")",Yes,60 Hz,500 mW,Yes,USB 2.0,178°,Yes,100 x 100,Yes,6.40 kg,543.8 mm,,,,,,,,,,,,EA,,,,,,,,,,,,,,,,,,,,,,,,,,
"60003415, 3967961, NEC Display Solutions, LCD Monitor, Itenergy Ltd",Yes,Yes,,,LED,NEC Display,300 cd/m²,,,White,,"1,000:1",,,,Yes,,ENERGY STAR,Yes,,Yes,,,,,NEC Display Solutions,60003415,2560 x 1080,1.0,,,,,,MultiSync,EA294WMi,MultiSync EA294WMi Widescreen LCD Monitor,LCD Monitor,5 ms,,"73.7 cm (29"")",,,,,,,,,,,,,,,,,,,,,,,,,,,,,,,,,,,,,,,,,,,,,,,,,
"E104733, S610635, Elo Touch Solutions, Inc, LCD Monitor, Itenergy Ltd",,,,16:9,LED,Elo,300 cd/m²,,IEC 60320 C14 S-Mark C-Tick CUL IC CCC CE VCCI KCC e-Standby COC BSMI FCC UL CB,Black,16.7 Million Colours,"3,000:1",42.6 mm,Landscape/Portrait,,Yes,,China RoHS WEEE RoHS,Yes,,,,373.4 mm,178°,3 Year,"Elo Touch Solutions, Inc",E104733,1920 x 1080,1.0,,38 W,,,,,2740L,2740L 27-inch Open-Frame LCD Monitor,Open-frame LCD Monitor,12 ms,Full HD,"68.6 cm (27"")",,60 Hz,1.30 W,,,178°,Yes,200 x 100,Yes,7.50 kg,632.2 mm,,,220 V AC 110 V AC 12 V DC,Anti-scratch,,,,,,,400 mW,,,,,,,,,,,,,,,,,,,,,,,,,,,
"D7P53A4#ABB, HP, LCD Monitor, Itenergy Ltd",Yes,Yes,Yes,16:10,LED,HP,300 cd/m²,USB Hub,,Black,,"1,000:1",64.5 mm,,Yes,Yes,Security Lock,WEEE REACH ENERGY STAR EPEAT Gold,Yes,Yes,,,365 mm,178°,3 Year,Hewlett-Packard,D7P53A4#ABB,1920 x 1200,1.0,,55 W,Z Display Z24i 61 cm (24'') IPS LED Backlit Monitor (ENERGY STAR) Power Cord USB Cable DisplayPort Cable Documentation CD-ROM HP Display Assistant software,In-plane Switching (IPS) Technology,,Business,Z24i,Z Display Z24i 61 cm (24'') IPS LED Backlit Monitor (ENERGY STAR),LCD Monitor,8 ms,WUXGA,"61 cm (24"")",No,60 Hz,500 mW,Yes,USB 2.0,178°,Yes,,Yes,,559.4 mm,237.90 mm,525 mm,220 V AC 110 V AC,Anti-glare,559.40 mm,,,,,,,Performance,No,,,6.96 kg,,,Wall Mountable,,,,,,,,,,,,,,,,,,,
"LS22C45KMS/EN, Samsung, LCD Monitor, Itenergy Ltd",Yes,Yes,Yes,16:9,,Samsung,250 cd/m²,Speaker,"UL: UL 60950 1CSA: CSA C22.2 No.. 60950-1TUV: EN60950-1NEMKO: EN60950-1KC: K60950-1CCC: GB 4943-2001PSB: IEC60950-1GOST: IEC60950-1, EN55022SIQ: IEC60950-1, EN55022PCBC: IEC60590-1, EN55022NOM: NOM-019-SCFI-1993IRAM: IEC60950-1SASO: IEC60950-1EMC:FCC Part 15, Subpart B Class ACE EN55022, EN55024VCCI V-3 (CISPR22)KCC: KN22, KN24C-Tick: AS/NZS3548 (CISPR22)CCC: GB 9254-2008, GB 17625.1-2003",Matte Black,16.7 Million Colours,"1,000:1",55.5 mm,,,Yes,MagicTune MagicRotation Off Timer MagicBright3 MagicAngle Eco Saving,ENERGY STAR Eco-label TCO EPEAT Gold,Yes,,,,301.9 mm,170°,2 Year,Samsung,LS22C45KMS/EN,1920 x 1080,1.0,2.0,24 W,,,PC,SyncMaster,S22C450M,SyncMaster S22C450M Widescreen LCD Monitor,LCD Monitor,5 ms,Full HD,"54.6 cm (21.5"")",Yes,60 Hz,100 mW,,,160°,Yes,100 x 100,Yes,3.05 kg,504.3 mm,210 mm,425.35 mm,220 V AC 110 V AC,,504.30 mm,,,,,,,450,,,,4.50 kg,,,Wall Mountable,,,,Yes,Plastic,,,,,,,,,,,,,,
"E2280WSD-B, Iiyama, LCD Monitor, Itenergy Ltd",Yes,,,16:10,LED,iiyama,300 cd/m²,Speaker,CETUV-GSCU,Black,16.7 Million Colours,"1,000:1",,,,Yes,Security Lock,TCO Certified Displays ENERGY STAR,Yes,Yes,,,,178°,,"iiyama North America, Inc",E2280WSD-B,1680 x 1050,1.0,2.0,21 W,ProLite E2280WSDPower CableVGA (D-Sub) CableDVI-D CableAudio CableStandStand-BaseCable HolderQuick Start GuideSafety Guide,,PC Mac,ProLite,E2280WSD,ProLite E2280WSD,LCD Monitor,5 ms,,"55.9 cm (22"")",Yes,75 Hz,500 mW,,,170°,Yes,100 x 100,Yes,3.60 kg,,204.50 mm,395.50 mm,220 V AC 110 V AC,,512.50 mm,,,,,,,,,,,,,,,,,,,,,,,,,,,,,,,,,
"27EA83-D.AEK, 4065780, LG Electronics, LCD Monitor, Itenergy Ltd",Yes,Yes,Yes,16:9,,LG,350 cd/m²,USB Hub,UL(cUL) FCC-B CE,,1.07 Billion Colors,"5,000,000:1",38 mm,,Yes,Yes,Dual Link-up Picture in Picture Picture by Picture Split Screen,TCO Certified Displays 5.1 ENERGY STAR 5.0 TCO Certified Displays 6.0,Yes,Yes,Yes,Yes,381 mm,178°,2 Year,LG Electronics,27EA83-D.AEK,2560 x 1440,1.0,2.0,65 W,27EA83-D Widescreen LCD Monitor Power Cord DVI-D Cable DisplayPort Cable,In-plane Switching (IPS) Technology,PC,,27EA83-D,27EA83-D Widescreen LCD Monitor,LCD Monitor,6 ms,WQHD,"68.6 cm (27"")",,75 Hz,,Yes,,178°,Yes,100 x 100,,5.50 kg,643 mm,459 mm,459 mm,220 V AC 110 V AC,Anti-glare,643 mm,,,,,110 mm,500 mW,EA83,,,-5°to15°,7.30 kg,,,,,,,,,,,,,,,,,,,,,,
"60003294, 3967758, NEC Display Solutions, LCD Monitor, Itenergy Ltd",Yes,Yes,,16:10,LED,NEC Display,250 cd/m²,USB Hub Speaker,CETUV ErgonomicsTUV GSGEEA/ Energy LabelFCC Class BPCT/ GostUL/ C-ULCSAISO 9241-307 (pixel failure class I),Black,16.7 Million Colours,"1,000:1",218 mm,Landscape/Portrait,Yes,Yes,Security Lock Off Timer Ambient Light Sensor,TCO Certified Displays 5.2 ENERGY STAR 5.0 MPR III RoHS EPEAT Gold,Yes,Yes,,Yes,384 mm,170°,3 Year,NEC Display Solutions,60003294,1680 x 1050,1.0,2.0,25 W,MultiSync EA223WM Widescreen LCD MonitorPower CableControl Sync CableUSB CableAudio CableCD-ROMSales Office ListUser ManualVGA - VGA Signal CableDVI-D - DVI-D Signal Cable,,,MultiSync,EA223WM,MultiSync EA223WM Widescreen LCD Monitor,LCD Monitor,5 ms,WSXGA+,"55.9 cm (22"")",Yes,60 Hz,500 mW,Yes,USB 2.0,160°,Yes,100 x 100,Yes,5.60 kg,503.5 mm,,,,,,,,,,,,,,,,,,,,,,,,,,,,,,,,,,,,,,
"B5M13AA#ABU, HP, LCD Monitor, Itenergy Ltd",Yes,,,16:9,LED,HP,200 cd/m²,Speaker,,Black,,600:1,47.8 mm,,,Yes,Security Lock,EPEAT Silver ENERGY STAR REACH China Energy Label (CEL),Yes,,,,299 mm,90°,1 Year,Hewlett-Packard,B5M13AA#ABU,1600 x 900,1.0,,26 W,"W2072a 50,8 cm (20"") LED Backlit LCD Monitor (B5M13AA)VGA CableAudio CableAC Power Cable",,,Value,W2072a,"W2072a 50,8 cm (20"") LED Backlit LCD Monitor",LCD Monitor,5 ms,HD+,"50.8 cm (20"")",Yes,,,,,50°,,,Yes,,477.3 mm,47.80 mm,299 mm,220 V AC 110 V AC,Anti-glare,477.30 mm,,,,,,,,,,,3.50 kg,,,,,,,,,,,,,,,,,,,,,,
"LS24C45KBL/EN, Samsung, LCD Monitor, Itenergy Ltd",Yes,Yes,,16:9,LED,Samsung,250 cd/m²,,,Matte Black,16.7 Million Colours,"1,000:1",55.5 mm,Portrait,No,Yes,MagicRotation MagicTune Off Timer MagicAngle MagicBright3 Eco Saving,TCO ENERGY STAR EPEAT Gold,Yes,,No,,330.5 mm,170°,,Samsung,LS24C45KBL/EN,1920 x 1080,1.0,,30 W,,,PC,,S24C450BL,S24C450BL Widscreen LCD Monitor,LCD Monitor,5 ms,Full HD,"59.9 cm (23.6"")",No,,100 mW,,,160°,Yes,100 x 100,Yes,3.75 kg,554.6 mm,224 mm,482.35 mm,220 V AC 110 V AC,,554.60 mm,,,,,,,SC450,,,,5.40 kg,,,Wall Mountable,,,,,,,,,,,,,,,,,,,
"CD4233, B921364, ViewSonic, LCD Monitor, Itenergy Ltd",,,,16:9,,Viewsonic,700 cd/m²,Speaker,,Black,,"1,100:1",123.1 mm,,,Yes,,,,,Yes,,559.6 mm,178°,,Viewsonic Corporation,CD4233,1920 x 1080,1.0,2.0,280 W,,,,,CD4233,CD4233 Widescreen LCD Monitor,LCD Monitor,9 ms,Full HD,"106.7 cm (42"")",Yes,,,,,178°,Yes,100 x 100,Yes,29.50 kg,967.6 mm,403.90 mm,647.70 mm,,,967.60 mm,,,,,,,,,,,31.70 kg,,,Wall Mountable,,,,,,,,,Yes,Yes,,,,,,,,,Yes
"C9V75AA#ABM, HP, LCD Monitor, Itenergy Ltd",Yes,,,16:9,LED,HP,250 cd/m²,USB Hub,,Black,,"5,000,000:1",50.8 mm,,Yes,Yes,Security Lock,,,Yes,,,328.9 mm,170°,,Hewlett-Packard,C9V75AA#ABM,1920 x 1080,1.0,,36 W,,,PC,Business,E231,EliteDisplay E231 23-inch LED Backlit Monitor--Head Only (ENERGY STAR),LCD Monitor,5 ms,Full HD,"58.4 cm (23"")",,,500 mW,Yes,USB 2.0,160°,,,Yes,3.79 kg,544.1 mm,,,,Anti-glare,,,,,,,,Advantage,,360°,-5°to30°,,,,Desk Mountable,,,,,,,,,,,,,,,,,,,
"B5M13AA#ABB, HP, LCD Monitor, Itenergy Ltd",Yes,,,16:9,LED,HP,200 cd/m²,Speaker,CBCETUV-GSISO9241-307CSAFCCEPAGOSTNOMTUV-SVCCIKC/KCCPSBISCBSMIC-TICKCCCSEPAE-standbyWHQL,Black,,600:1,170 mm,,,Yes,Security Lock,ENERGY STAR CECP EPEAT Silver,Yes,Yes,,,357 mm,90°,1 Year,Hewlett-Packard,B5M13AA#ABB,1600 x 900,1.0,,26 W,,,,,W2072a,W2072a 20-inch Diagonal LED Backlit LCD Monitor,LCD Monitor,5 ms,HD+,"50.8 cm (20"")",Yes,60 Hz,500 mW,,,50°,,,Yes,3.55 kg,477 mm,,,,Anti-glare,,,,,,,,,,,,,,,,,,,,,,,,,,,,,,,,,,
"9H.LC8LA.TBE, 3003899, BenQ, LCD Monitor, Itenergy Ltd",Yes,No,,16:9,LED,BenQ,300 cd/m²,,,Glossy Black,16.7 Million Colours,"12,000,000:1",215 mm,,,Yes,Security Lock Flicker-free Eco Mode Senseye 3,ENERGY STAR,Yes,Yes,Yes,Yes,488 mm,170°,,BenQ Corporation,9H.LC8LA.TBE,1920 x 1080,1.0,,21 W,,Twisted Nematic Film (TN Film),PC,,GL2760H,GL2760H Widescreen LCD Monitor,LCD Monitor,2 ms,Full HD,"68.6 cm (27"")",No,,300 mW,,,160°,Yes,100 x 100,Yes,5.40 kg,641 mm,,,110 V AC 220 V AC,,,,,,,,,,,,-5°to20°,,,,Wall Mountable,,,,,,,,,,,,,,,,,,,
"LS19C45KBWV/EN, Samsung, LCD Monitor, Itenergy Ltd",Yes,Yes,Yes,16:10,LED,Samsung,250 cd/m²,,UL CSA EN60950-1 NEMKO KC K60950-1 CCC GB 4943-2001 PSB GOST SIQ PCBC IEC60590-1 EN55022 NOM IRAM SASO FCC EN55024 VCCI V-3 (CISPR22) KCC KN22 KN24 C-Tick AS/NZS3548(CISPR22) CCC GB 9254-2008 GB 17625.1-2003,Matte Black,16.7 Million Colours,"1,000:1",54.8 mm,,No,Yes,MagicRotation MultiScreen Off Timer MagicBright3 MagicAngle Eco Saving Display Power Management Signaling (DPMS) MagicTune,EPEAT Gold TCO Certified Displays ENERGY STAR TÜV,Yes,,No,,289.9 mm,170°,3 Year,Samsung,LS19C45KBWV/EN,1440 x 900,1.0,,19 W,"19"" LED Monitor S19C450BW D-sub Cable 1.5m Power Cable Length E-manual Install CD Quick Setup Guide",Twisted Nematic Film (TN Film),PC,,S19C450BW,"19"" LED Monitor S19C450BW",LCD Monitor,5 ms,WXGA+,"48.3 cm (19"")",No,,,No,,160°,Yes,100 x 100,Yes,2.75 kg,439.4 mm,210 mm,423.20 mm,230 V AC 120 V AC,,439.40 mm,,,,,100 mm,,450,,45°,-3°to25°,4.25 kg,,,Wall Mountable,,,,,,,,,,,,,,,,,,,
"C9E49AA#ABB, HP, LCD Monitor, Itenergy Ltd",Yes,,,16:9,LED,HP,250 cd/m²,,,Black,,"1,000:1",47.5 mm,,,Yes,Security Lock,REACH TCO Certified Displays ENERGY STAR EPEAT Gold,Yes,Yes,,,315.2 mm,170°,3 Year,Hewlett-Packard,C9E49AA#ABB,1920 x 1080,1.0,,28 W,"ProDisplay P221 54,6 cm (21.5'') LED Backlit Monitor (C9E49AA)VGA cableDVI CableAC Power CordPrinted Documentation and CD",,,Essential,P221,"ProDisplay P221 54,6 cm (21.5'') LED Backlit Monitor",LCD Monitor,5 ms,Full HD,"54.6 cm (21.5"")",,,500 mW,,,160°,Yes,100 x 100,Yes,4 kg,518 mm,160 mm,379 mm,220 V AC 110 V AC,Anti-glare,518 mm,,,,,,,,,,,,,,Arm-mountable,,,,,,,,,,,,,,,,,,,
"UM.IW3EE.001, 2975739, Acer, LCD Monitor, Itenergy Ltd",Yes,No,No,16:9,LED,Acer,200 cd/m²,,,Black,16.7 Million Colours,"100,000,000:1",50 mm,,,,,MPR II,Yes,,,,276.2 mm,90°,2 Year,"Acer, Inc",UM.IW3EE.001,1600 x 900,1.0,,13.50 W,K202HQL Widescreen LCD Monitor1 x VGA CablePower Cord,Twisted Nematic Film (TN Film),,,K202HQL,K202HQL Widescreen LCD Monitor,LCD Monitor,5 ms,HD+,"49.5 cm (19.5"")",No,60 Hz,450 mW,,,65°,,,Yes,2.21 kg,463.4 mm,191 mm,362.30 mm,110 V AC 220 V AC,Anti-glare,463.40 mm,,,,,,350 mW,K,,,,2.70 kg,,,,,,,,,,,,,,,,,,,,,,
"PLC1911S-B3, II-PLC1911S-B3, Iiyama, LCD Monitor, Itenergy Ltd",Yes,,,5:4,LED,iiyama,250 cd/m²,,CETUV/BauartCU,Black,16.7 Million Colours,"1,000:1",200.5 mm,,,,Security Lock,,,,,,431.5 mm,170°,2 Year,"iiyama North America, Inc",PLC1911S-B3,1280 x 1024,1.0,2.0,19 W,ProLite C1911S-3 CCTV LCD MonitorPower CableD-Sub CableBNC-RCA AdapterStandQuick Start Guide,,Mac PC,ProLite,C1911S-3,ProLite C1911S-3 CCTV LCD Monitor,LCD Monitor,5 ms,SXGA,"48.3 cm (19"")",Yes,75 Hz,1 W,,,160°,Yes,100 x 100,Yes,3.90 kg,407 mm,,,220 V AC 110 V AC,,,,,,,,,,,,,,,,Wall Mountable,,,,,,,,,,,,,,,,,,,Yes
"9H.LC3LB.QBE, M352551, BenQ, LCD Monitor, Itenergy Ltd",Yes,Yes,Yes,16:9,LED,BenQ,300 cd/m²,Speaker Card Reader USB Hub,,Glossy Black,1.07 Billion Colors,"20,000,000:1",,,Yes,Yes,Ambient Light Sensor Low Blue Light Animation Mode Dual Monitor Support CAD/CAM Mode Security Lock Advanced Motion Accelerator (AMA) Senseye 3 Flicker-free Eye Protect Sensor,TCO Certified Displays 6.0 ENERGY STAR 6.0,Yes,Yes,Yes,Yes,,178°,3 Year,BenQ Corporation,9H.LC3LB.QBE,2560 x 1440,1.0,2.0,97 W,,Vertical Alignment (VA),PC,,BL3200PT,BL3200PT Widescreen LCD Monitor,LCD Monitor,12 ms,WQHD,"81.3 cm (32"")",Yes,76 Hz,500 mW,Yes,USB 3.0,178°,Yes,100 x 100,Yes,13 kg,,231 mm,638 mm,230 V AC 120 V AC,,739 mm,,,,,150 mm,,,,45°,-5°to20°,,,,Wall Mountable,,,,,,,,,,,,,,,,,,,
"LS20C300BL/EN, Samsung, LCD Monitor, Itenergy Ltd",Yes,,,16:9,LED,Samsung,250 cd/m²,,,Translucent Red Gradation,16.7 Million Colours,"1,000:1",53 mm,,No,Yes,MagicBright3 MagicAngle MultiScreen Magic Upscale Eco Saving MagicTune Off Timer,ENERGY STAR 6.0,Yes,,No,,299.8 mm,170°,2 Year,Samsung,LS20C300BL/EN,1600 x 900,1.0,,14 W,,,Mac PC,,S20C300BL,S20C300BL Widescreen LCD Monitor,LCD Monitor,5 ms,HD+,"49.5 cm (19.5"")",No,,300 mW,No,,160°,,,Yes,2.10 kg,476.2 mm,187 mm,379.40 mm,220 V AC 110 V AC,,476.20 mm,,,,,,300 mW,300,,,,2.40 kg,,,,,,,,,,,,,,,,,,,,,,
"LS22C65UDC/EN, 2773803, Samsung, LCD Monitor, Itenergy Ltd",Yes,Yes,Yes,16:9,LED,Samsung,250 cd/m²,USB Hub,"UL (USA): UL 60950-1 CSA (Canada): CSA C22.2 No. 60950-1 TUV (Germany): EN60950-1 NEMKO (Norway): EN60950-1 KC (Korea): K60950-1 CCC (China): GB 4943-2001 PSB (Singapore): IEC60950-1 GOST (Russia): IEC60950-1, EN55022 SIQ (Slovenia): IEC60950-1, EN55022 PCBC (Poland): IEC60590-1, EN55022 NOM (Mexico): NOM-019-SCFI-1993 IRAM (Argentina): IEC60950-1 SASO (Saudi Arabia): IEC60950-1 EMC
FCC (USA) FCC Part 15, Subpart B class A CE (Europe) EN55022, EN55024 VCCI (Japan) V-3 (CISPR22) KCC (Korea): KN22, KN24 C-Tick (Australia): AS / NZS3548 (CISPR22) CCC (China): GB 9254-2008, GB 17625.1-2003",Matte Black,16.7 Million Colours,"1,000:1",55.5 mm,,Yes,Yes,MagicRotation MultiScreen MagicTune Off Timer MagicBright3 Eco Saving,TCO Certified Displays ENERGY STAR EPEAT Gold,Yes,,No,,301.9 mm,178°,3 Year,Samsung,LS22C65UDC/EN,1920 x 1080,1.0,,,,AD-PLS Technology,PC,,S22C650D,"21.5"" S22C650D Series 6 LED Business Monitor",LCD Monitor,5 ms,Full HD,"54.6 cm (21.5"")",No,,,Yes,USB 2.0,178°,Yes,100 x 100,Yes,3.20 kg,504.3 mm,210 mm,490.35 mm,110 V AC 220 V AC,,504.30 mm,,,,,,,650,,,,4.75 kg,,,Wall Mountable,,,,,,,,,,,,,,,,,,,
"298P4QJEB/00, Philips, LCD Monitor, Itenergy Ltd",Yes,Yes,Yes,22:9,LED,Philips,300 cd/m²,USB Hub,,,,"1,000:1",,,Yes,Yes,SmartImage,EPEAT Gold TCO Certified Edge ENERGY STAR,Yes,,Yes,,,178°,,Philips Electronics,298P4QJEB/00,2560 x 1080,1.0,,,,,Mac PC,,298P4QJEB,298P4QJEB Widescreen LCD Monitor,LCD Monitor,7 ms,,"73.7 cm (29"")",,,,Yes,USB 3.0,178°,Yes,,,,,,,220 V AC 110 V AC,,,,,,,,,,,,,,,,,,,,,,,,,,,,,,,,,,,
"C9E49AA, HP, LCD Monitor, Itenergy Ltd",Yes,,,16:9,LED,HP,250 cd/m²,,,Black,,"1,000:1",47.5 mm,,,Yes,Security Lock,EPEAT Gold ENERGY STAR REACH TCO,Yes,Yes,,,315.2 mm,170°,3 Year,Hewlett-Packard,C9E49AA,1920 x 1080,1.0,,28 W,,,,Essential,P221,"ProDispaly P221 54,6 cm (21.5"") LED Backlit Monitor",LCD Monitor,5 ms,Full HD,"54.6 cm (21.5"")",,,500 mW,,,160°,Yes,100 x 100,Yes,4 kg,518 mm,160 mm,379 mm,220 V AC 110 V AC,Anti-glare,518 mm,,,,,,,,,,,,,,Arm-mountable,,,,,,,,,,,,,,,,,,,
"C9F26AA#ABT, HP, LCD Monitor, Itenergy Ltd",Yes,,,16:9,LED,HP,250 cd/m²,,,Black,16.77 Million Colors,"1,000:1",47.5 mm,,,Yes,Security Lock,TCO Certified Edge REACH EPEAT Gold ENERGY STAR,Yes,Yes,,,294.1 mm,170°,3 Year,Hewlett-Packard,C9F26AA#ABT,1600 x 900,1.0,,22 W,ProDisplay P201 20-inch LED Backlit Monitor VGA Cable DVI Cable Power Cord Printed Documentation And CD,,PC,Business,P201,ProDisplay P201 20-inch LED Backlit Monitor,LCD Monitor,5 ms,HD+,"50.8 cm (20"")",No,60 Hz,500 mW,,,160°,Yes,100 x 100,Yes,3.50 kg,482 mm,151.10 mm,359.20 mm,220 V AC 110 V AC,Anti-glare,482 mm,,,,,,,Essential,No,,,,,,,,,,,,No,,,,,,,,,,,,,
"C9V75AA#AC8, HP, LCD Monitor, Itenergy Ltd",,,,16:9,LED,HP,250 cd/m²,USB Hub,,Black,,"5,000,000:1",51 mm,,Yes,Yes,,ENERGY STAR TCO Certified Edge,Yes,,,,329 mm,,3 Year,Hewlett-Packard,C9V75AA#AC8,1920 x 1080,1.0,,36 W,EliteDisplay E231 23-inch LED Backlit Monitor (ENERGY STAR)VGA CableDisplayPort CableUSB CableAC Power CablePrinted Documentation and CD,,,Elite,E231,EliteDisplay E231 23-inch LED Backlit Monitor (ENERGY STAR),LCD Monitor,5 ms,Full HD,"58.4 cm (23"")",,,,Yes,,,,,Yes,3.90 kg,544 mm,242.40 mm,469.90 mm,,,544 mm,,,,,,,,,,,,,,,Click to view,,,,,,,,,,,,,,,,,,
"9H.L9SLB.RBE, 2998469, BenQ, LCD Monitor, Itenergy Ltd",Yes,Yes,Yes,16:9,LED,BenQ,350 cd/m²,,,Red Black,16.7 Million Colours,"12,000,000:1",222 mm,,No,Yes,Game Mode LightBoost Technology Eco Mode Advanced Motion Accelerator (AMA) Security Lock Senseye 3 Black eQualizer Flicker-free Motion Blur Reduction Technology,ENERGY STAR,Yes,Yes,Yes,Yes,431 mm,170°,,BenQ Corporation,9H.L9SLB.RBE,1920 x 1080,1.0,,36 W,XL2411Z Widescreen LCD Monitor VGA cable DVI DL cable,Twisted Nematic Film (TN Film),PC,,XL2411Z,XL2411Z Widescreen LCD Monitor,LCD Monitor,1 ms,Full HD,"61 cm (24"")",No,144 Hz,500 mW,,,160°,Yes,100 x 100,Yes,6 kg,570 mm,63 mm,347 mm,110 V AC 220 V AC,,570 mm,,,,,130 mm,500 mW,XL,,45°,-5°to20°,,,,Wall Mountable,,,3D Ready,,,,,No,,,,,,,,,,,
"EB220H, EB220H-EDGE10, Edge10, LCD Monitor, Itenergy Ltd",Yes,Yes,Yes,16:9,LED,Edge10,300 cd/m²,Speaker,UL FCC CE,Black,16.7 Million Colours,"20,000:1",46 mm,Landscape/Portrait,,Yes,Security Lock,ENERGY STAR,Yes,,,,310 mm,170°,3 Year,Edge10 Corporation Limited,EB220H,1920 x 1080,1.0,,24 W,EB220h Widescreen LCD Monitor Power Cable VGA Cable,,Mac PC,,EB220h,EB220h Widescreen LCD Monitor,LCD Monitor,5 ms,Full HD,"54.6 cm (21.5"")",No,75 Hz,1 W,,,170°,Yes,100 x 100,Yes,5.70 kg,508 mm,240 mm,573 mm,220 V AC 110 V AC,,508 mm,,,,,110 mm,1 W,,,,-5°to15°,,,,Wall Mountable,,,,,,,,,,,,,,,,,,,
"LH22UDBPLBB/EN, 2514217, Samsung, LCD Monitor, Itenergy Ltd",,,,1:1,Edge LED,Samsung,450 cd/m²,,,,16.7 Million Colours,"4,000:1",79.5 mm,,Yes,Yes,,,,,Yes,,393.3 mm,178°,,Samsung,LH22UDBPLBB/EN,960 x 960,1.0,,67 W,,,PC,SyncMaster,UD22B,SyncMaster UD22B Widescreen LCD Monitor,LCD Monitor,6 ms,,"55.9 cm (22"")",,,1 W,,,178°,Yes,300 x 300,Yes,5.80 kg,393.3 mm,,,,,,,,,,,,,,,,,,,Wall Mountable,,,,,,Yes,,,,,,,,,,,,,
"220B4LPCS/00, Philips, LCD Monitor, Itenergy Ltd",Yes,Yes,Yes,16:10,LED,Philips,250 cd/m²,Speaker USB Hub,BSMICE MarkFCC Class BGOSTSASOSEMKOTUV ErgoTUV/GSUL/cUL,Black Silver,16.7 Million Colours,"1,000:1",59 mm,,,Yes,SmartImage PowerSensor Security Lock SmartErgoBase TrueVision,RoHS ENERGY STAR 5.0 EPEAT Gold TCO Certified Edge TCO Certified Displays 5.2,Yes,Yes,,Yes,349 mm,170°,,Philips Electronics,220B4LPCS/00,1680 x 1050,1.0,2.0,15.80 W,,,PC Mac,Brilliance,220B4LPCS,"Brilliance LCD monitor, LED Backlight With PowerSensor",LCD Monitor,5 ms,WSXGA+,"55.9 cm (22"")",Yes,60 Hz,300 mW,Yes,USB 2.0,160°,Yes,100 x 100,Yes,3.38 kg,504 mm,227 mm,509 mm,220 V AC 110 V AC,,504 mm,,,,,,,B,,,,5.20 kg,,,,,65%,,Yes,Plastic,,,,,,,,,,,,,,
"C9V75AA#AB1, HP, LCD Monitor, Itenergy Ltd",,,,16:9,LED,HP,250 cd/m²,USB Hub,,Black,,"5,000,000:1",51 mm,,Yes,Yes,,TCO Certified Edge ENERGY STAR,Yes,,,,329 mm,,3 Year,Hewlett-Packard,C9V75AA#AB1,1920 x 1080,1.0,,36 W,EliteDisplay E231 23-inch LED Backlit Monitor (ENERGY STAR)VGA CableDisplayPort CableUSB CableAC Power CablePrinted Documentation and CD,,,Elite,E231,EliteDisplay E231 23-inch LED Backlit Monitor (ENERGY STAR),LCD Monitor,5 ms,Full HD,"58.4 cm (23"")",,,,Yes,,,,,Yes,3.90 kg,544 mm,242.40 mm,469.90 mm,,,544 mm,,,,,,,,,,,,,,,Click to view,,,,,,,,,,,,,,,,,,
"F0W81AA#ABB, HP, LCD Monitor, Itenergy Ltd",Yes,Yes,Yes,16:10,LED,HP,250 cd/m²,USB Hub,,Silver,,"5,000,000:1",55 mm,,Yes,Yes,Security Lock,TCO Certified Edge ENERGY STAR TCO Certified Displays EPEAT Gold,Yes,Yes,,,362.6 mm,178°,3 Year,Hewlett-Packard,F0W81AA#ABB,1920 x 1200,1.0,,40 W,"EliteDisplay E241i 61 cm (24'') IPS LED Backlit Monitor (ENERGY STAR) VGA cable DVI cable (only in the Asia-Pacific region) USB cable DisplayPort cable (not in the Asia-Pacific region with the exception of Australia and New Zealand) power cord Printed documentation and CD (with User Manual, warranty, drivers) Display Assistant Software",In-plane Switching (IPS) Technology,,Elite,E241i,EliteDisplay E241i 61 cm (24'') IPS LED Backlit Monitor (ENERGY STAR),LCD Monitor,8 ms,WUXGA,"61 cm (24"")",,,,Yes,USB 2.0,178°,,,Yes,,556 mm,516.56 mm,276.20 mm,220 V AC 110 V AC,Anti-glare,556 mm,,,,,,,,,180°,-5°to30°,6.58 kg,,,,,,,,,,,,,,,,,,,,,,
"278G4DHSD/00, Philips, LCD Monitor, Itenergy Ltd",Yes,,,16:9,,Philips,250 cd/m²,USB Hub,GOSTBSMICEFCC Class BSEMKOTUV/ISO9241-307UL/cUL,Glossy Black Cherry,16.7 Million Colours,"1,000:1",44 mm,,,,Security Lock SmartImage Ambiglow,TCO Certified Displays WEEE ENERGY STAR 5.0 EPEAT Silver RoHS,Yes,,Yes,,376 mm,178°,,Philips Electronics,278G4DHSD/00,1920 x 1080,1.0,,25.94 W,,In-plane Switching (IPS) Technology,Mac PC,Brilliance,278G4DHSD,LCD Monitor with Ambiglow,LCD Monitor,7 ms,Full HD,"68.6 cm (27"")",,60 Hz,500 mW,Yes,USB 3.0,178°,,,Yes,5 kg,623 mm,197 mm,471 mm,220 V AC 110 V AC,,623 mm,,,,,,300 mW,,,,,5.44 kg,,,,,,3D,,,,,,,,,,,,,,,,
"LH46OLBPPGC/EN, Samsung, LCD Monitor, Itenergy Ltd",,,,16:9,LED,Samsung,1500 cd/m²,,EN55022EN55024IEC 60529IP56,,16.7 Million Colours,"4,000:1",618.5 mm,,Yes,Yes,Picture in Picture,,,Yes,Yes,,1730 mm,178°,,Samsung,LH46OLBPPGC/EN,1920 x 1080,1.0,,,,,,SyncMaster,OL46B,SyncMaster OL46B Widescreen LCD Monitor,LCD Monitor,8 ms,Full HD,"116.8 cm (46"")",,,1 W,,,178°,,,Yes,,614.2 mm,,,,,,,,,,,,,,,,,,,,,,,,,Yes,,,,Yes,,,,,,,,,
"UM.RB6EE.001, PBB296CLBMIIDPRZ, Acer, LCD Monitor, Itenergy Ltd",Yes,Yes,Yes,21:9,LED,Acer,300 cd/m²,USB Hub,,Black,16.7 Million Colours,"100,000,000:1",,,Yes,Yes,,EPEAT Gold TCO Certified Displays 6.0,Yes,,Yes,,,178°,3 Year,"Acer, Inc",UM.RB6EE.001,2560 x 1080,1.0,,36.30 W,B296CL LCD Monitor1 x DVI Cable1 x Displayport Cable1 x USB 3.0 CablePower Cord,In-plane Switching (IPS) Technology,,,B296CL,B296CL Widescreen LCD Monitor,LCD Monitor,8 ms,Full HD,"73.7 cm (29"")",Yes,60 Hz,450 mW,Yes,USB 3.0,178°,Yes,100 x 100,,,,,,220 V AC 110 V AC,Anti-glare,,,,,,150 mm,350 mW,B,,60°,-5°to35°,,63 kWh,C,,,,,,,,,,,,,,,,,,,,
"LS27C65UDS/EN, Samsung, LCD Monitor, Itenergy Ltd",Yes,Yes,Yes,16:9,LED,Samsung,300 cd/m²,USB Hub,"Eco Label Certification:
UL (USA): UL 60950-1 CSA (Canada): CSA C22.2 No. 60950-1 TUV (Germany): EN60950-1 NEMKO (Norway): EN60950-1 KC (Korea): K60950-1 PSB (Singapore): IEC60950-1 GOST (Russia): IEC60950-1, EN55022 SIQ (Slovenia): IEC60950-1, EN55022 PCBC (Poland): IEC60590-1, EN55022 NOM (Mexico): NOM-019-SCFI-1993 IRAM (Argentina): IEC60950-1 SASO (Saudi Arabia): IEC60950-1 EMC:
FCC (USA) FCC Part 15, Subpart B class A CE (Europe) EN55022, EN55024 VCCI (Japan) V-3 (CISPR22) KCC (Korea): KN22, KN24 C-Tick (Australia): AS/NZS3548 (CISPR22) CCC(China): GB 9254-2008, GB 17625.1-2003",Matte Black,16.7 Million Colours,"5,000:1",56.7 mm,,Yes,Yes,MagicRotation MultiScreen MagicTune MagicBright3 Eco Saving Off Timer,EPEAT Gold TCO ENERGY STAR,Yes,,No,,378.1 mm,178°,,Samsung,LS27C65UDS/EN,1920 x 1080,1.0,,,,MVA technology,,,S27C650D,"27"" S27C650D Series 6 LED Business Monitor",LCD Monitor,4 ms,Full HD,"68.6 cm (27"")",No,,,Yes,USB 2.0,178°,Yes,100 x 100,Yes,4.50 kg,639 mm,224 mm,402.80 mm,220 V AC 110 V AC,,639 mm,,,,,,,650,,,,6.20 kg,,,Wall Mountable,,,,,,,,,,,,,,,,,,,
"ET.CV3RE.D25, 865W073, Acer, LCD Monitor, Itenergy Ltd",Yes,No,No,4:3,,Acer,250 cd/m²,,,Black,16.7 Million Colours,"50,000:1",180.4 mm,,,,,TCO Displays 5.0 TCO '05,Yes,,,,406.8 mm,178°,3 Year,"Acer, Inc",ET.CV3RE.D25,1280 x 1024,1.0,,18.50 W,V193DOb LCD MonitorPower CableVGA Cable,Twisted Nematic Film (TN Film),,,V193DOb,V193DOb LCD Monitor,LCD Monitor,5 ms,SXGA,"48.3 cm (19"")",,75 Hz,530 mW,,,178°,Yes,100 x 100,Yes,3.91 kg,408 mm,,,,,,,,,,No,530 mW,V3,,No,-5°to15°,,,,Wall Mountable,,,,,,,,,,,,,,,,,,,
"VG2437MC-LED, B921416, ViewSonic, LCD Monitor, Itenergy Ltd",Yes,Yes,Yes,,LED,Viewsonic,300 cd/m²,USB Hub Speaker Microphone Webcam,,,,"1,000:1",61 mm,,Yes,Yes,,,,Yes,,Yes,340.4 mm,170°,,Viewsonic Corporation,VG2437MC-LED,1920 x 1080,1.0,,24.50 W,,,Mac PC,,VG2437mc-LED,VG2437mc-LED Full HD Resolution with DisplayPort Connectivity,LCD Monitor,5 ms,Full HD,"61 cm (24"")",Yes,,,Yes,USB 2.0,160°,Yes,100 x 100,Yes,3.76 kg,556.3 mm,238.76 mm,452.12 mm,,Anti-glare,556.26 mm,,,,,,,,,,,5.22 kg,,,,,,,Yes,,,,,,,,,,,,,,,
"VG2433SMH, B921635, ViewSonic, LCD Monitor, Itenergy Ltd",Yes,Yes,Yes,16:9,LED,Viewsonic,250 cd/m²,Speaker,CU UkrSEPRO DoC SVHC List & DoC,,16.7 Million Colours,"50,000,000:1",51 mm,Landscape/Portrait,,Yes,Super Clear Image Enhancement Technology Eco Mode,ErP REACH TCO,Yes,,Yes,Yes,343.2 mm,178°,3 Year,Viewsonic Corporation,VG2433SMH,1920 x 1080,1.0,2.0,22 W,VG2433Smh Full HD LED HDMI Multimedia Ergonomic SuperClear Display Power Cable VGA Cable DVI Cable Audio Cable Quick Start Guide ViewSonic Wizard CD-ROM,In-plane Switching (IPS) Technology,,,VG2433Smh,VG2433Smh Full HD LED HDMI Multimedia Ergonomic SuperClear Display,LCD Monitor,4 ms,Full HD,"61 cm (24"")",Yes,60 Hz,,,,178°,Yes,100 x 100,Yes,3.95 kg,566 mm,204.30 mm,382.40 mm,220 V AC 110 V AC,Anti-glare,566 mm,,,,,100 mm,,,,340°,-5°to25°,5.53 kg,,,Wall Mountable,,,,,,,,,,,,,,,,,,,
"UM.QG6EE.001, ACEG246HYLBD, Acer, LCD Monitor, Itenergy Ltd",Yes,No,No,16:9,LED,Acer,250 cd/m²,,,Black,16.7 Million Colours,"100,000,000:1",,,,Yes,,MPR II,Yes,Yes,,,,178°,2 Year,"Acer, Inc",UM.QG6EE.001,1920 x 1080,1.0,,31 W,G246HYL Widescreen LCD MonitorPower Cord1 x VGA Cable,In-plane Switching (IPS) Technology,,,G246HYL,G246HYL Widescreen LCD Monitor,LCD Monitor,6 ms,Full HD,"60.5 cm (23.8"")",,60 Hz,490 mW,,,178°,No,,Yes,,,,,220 V AC 110 V AC,Anti-glare,,,,,,No,450 mW,G,,No,-5°to15°,,,,,,,,,,,,,,,,,,,,,,,
