"F3J72AT#ABU, 943ASGK, HP, LCD Monitor, Itenergy Ltd",Yes,No,Yes,16:9,LED,HP,250 cd/m²,Port Replicator USB Hub Microphone,CB CE TUV-S EAC CUL FCC CSA NOM S-mark VCCI PSB ISC CCC BSMI C-Tick E-standby KC,Black,,"5,000,000:1",51 mm,,Yes,,Security Lock,TCO Certified Displays CECP China Energy Label (CEL) ENERGY STAR TCO Certified Edge WEEE REACH,Yes,Yes,,Yes,329 mm,178°,3 Year,Hewlett-Packard,F3J72AT#ABU,1920 x 1080,1.0,,60 W,Business S231d Widescreen LCD Monitor USB Cable DC Power Cable VGA Cable DisplayPort Cable DC Jack Dongle Cable and Rubber Ring Webcam Rubber Cover Printed Documentation and CD HP Display Assistant Software Additional Signal Cables,In-plane Switching (IPS) Technology,,Business,S231d,Business S231d Widescreen LCD Monitor,LCD Monitor,7 ms,Full HD,"58.4 cm (23"")",No,,2.20 W,Yes,USB 3.0,178°,,,Yes,,544 mm,242.40 mm,469.90 mm,220 V AC 110 V AC,Anti-glare,544 mm,,,,,,,,Yes,360°,-5°to30°,6.12 kg,,,,,,,,,Yes,,,,,,,,,,,,,
"858-10254, DELP2012H, Dell, LCD Monitor, Itenergy Ltd",Yes,Yes,Yes,16:9,LED,Dell,250 cd/m²,USB Hub,,Black,16.7 Million Colours,"1,000:1",,Landscape/Portrait,,Yes,Cable Management,TCO Certified Displays EPEAT Gold ENERGY STAR,Yes,Yes,No,,,170°,3 Year,"Dell, Inc",858-10254,1600 x 900,1.0,,45 W,"Professional P2012H 20'' (51cm) LED Monitor VGA,DVI-D (1600x900) Black UK Power Cable DVI Cable USB Cable VGA Cable Drivers and Documentation Media Quick Setup Guide Safety Information",,,Professional,P2012H,"Professional P2012H 20'' (51cm) LED Monitor VGA,DVI-D (1600x900) Black UK",LCD Monitor,5 ms,HD+,"50.8 cm (20"")",,60 Hz,100 mW,Yes,USB 2.0,160°,Yes,,Yes,2.88 kg,,183.34 mm,401.21 mm,110 V AC 220 V AC,Anti-glare,478.40 mm,,,,,,100 mW,P,No,,,,,,Wall Mountable,,,,,,No,1.0,,,,,,,,,,,,
"D7Q14A4#ABB, 9438D3T, HP, LCD Monitor, Itenergy Ltd",Yes,,,16:9,LED,HP,250 cd/m²,USB Hub,,Black,,"1,000:1",51 mm,,Yes,Yes,Security Lock,REACH EPEAT Gold ENERGY STAR TCO Certified Displays,Yes,Yes,,,309 mm,178°,3 Year,Hewlett-Packard,D7Q14A4#ABB,1920 x 1080,1.0,,31 W,Z Display Z22i 54.6 cm (21.5'') IPS LED Backlit MonitorVGA cableDisplayPort CableUSB CablePower CordPrinted documents and CDHP Software DisplayAssistant,In-plane Switching (IPS) Technology,,Business,Z22i,Z Display Z22i 54.6 cm (21.5'') IPS LED Backlit Monitor,LCD Monitor,8 ms,Full HD,"54.6 cm (21.5"")",,,500 mW,Yes,USB 2.0,178°,,,Yes,,509 mm,509 mm,,220 V AC 110 V AC,Anti-glare,237 mm,,,,,,,Performance,,,,5.80 kg,,,Desk Mountable Arm-mountable,,,,,,,,,,,,,,,,,,,
"22MP65HQ-P, 3003551, LG Electronics, LCD Monitor, Itenergy Ltd",,,,16:9,LED,LG,250 cd/m²,,,Black,16.7 Million Colours,"1,000:1",69 mm,,,,Smart Resolution Technology Intelligent Auto Key Lock Dual-screen Display Dual Web Flicker-free Reading Mode Sleep Timer,,,Yes,Yes,Yes,307 mm,178°,,LG Electronics,22MP65HQ-P,1920 x 1080,1.0,,20 W,,Advanced High Performance In-plane Switching (AH-IPS) Technology,,,22MP65HQ-P,22MP65HQ-P Widescreen LCD Monitor,LCD Monitor,5 ms,Full HD,"54.6 cm (21.5"")",,,300 mW,,,178°,Yes,75 x 75,Yes,2.40 kg,500 mm,188 mm,407 mm,220 V AC 110 V AC,,500 mm,,,,,,,,,,,2.70 kg,,,,,,,,,,,,,,,,,,,,,,
"GB2488HSU-B1, 3048478, Iiyama, LCD Monitor, Itenergy Ltd",Yes,Yes,Yes,16:9,LED,iiyama,350 cd/m²,USB Hub Speaker,CE TÜV-Bauart GOST-R VCCI-B PSE,Black,16.7 Million Colours,"5,000,000:1",230 mm,Landscape/Portrait,Yes,Yes,i-Style-Color Security Lock Eco Mode OverDrive Display Power Management Signaling (DPMS),,,Yes,Yes,Yes,518 mm,170°,,"iiyama North America, Inc",GB2488HSU-B1,1920 x 1080,1.0,2.0,38 W,,Twisted Nematic Film (TN Film),PC Mac,ProLite,GB2488HSU-B1,ProLite GB2488HSU-B1 Widescreen LCD Monitor,LCD Monitor,1 ms,Full HD,"61 cm (24"")",Yes,145 Hz,500 mW,Yes,USB 2.0,160°,Yes,100 x 100,Yes,5.50 kg,568 mm,,,220 V AC 110 V AC,,,,,,,130 mm,,,,45°,-5°to22°,,,,Wall Mountable,,,,,,,,,,,,,,,,,,,
"861-BBBG, 0912934, Dell, LCD Monitor, Itenergy Ltd",,,,16:9,LED,Dell,250 cd/m²,USB Hub,,Black,16.7 Million Colours,"2,000,000:1",46.3 mm,,Yes,Yes,,China Energy Label (CEL) CECP RoHS TCO Certified Displays EPEAT Gold ENERGY STAR,Yes,,,,304.4 mm,,3 Year,"Dell, Inc",861-BBBG,1920 x 1080,1.0,,26 W,P2214H Widescreen LCD Monitor Stand Cable management cover Drivers & Utilities Dell Display Manager 1 x DisplayPort cable 1 x USB cable 1 x VGA cable,,,,P2214H,P2214H Widescreen LCD Monitor,LCD Monitor,8 ms,Full HD,"55.9 cm (22"")",,,,Yes,,,Yes,,Yes,3.26 kg,512.7 mm,180 mm,354.20 mm,,,512.70 mm,,,,,,,,,,,,,,,Click to view,25%,,,,,,,,,,,,,,,,,
"HS221HPB, V320108, Hannspree, LCD Monitor, Itenergy Ltd",Yes,,,16:9,LED,Hanns.G,250 cd/m²,Speaker,FCC UL/CUL CE CB 3C GS,Black,16.7 Million Colours,"80,000,000:1",203 mm,,,Yes,Eco Mode Security Lock,ENERGY STAR China Energy Label (CEL) TCO Certified Displays 6.0,Yes,Yes,Yes,,390 mm,178°,3 Year,"Hannspree, Inc",HS221HPB,1920 x 1080,1.0,2.0,30 W,HS221HPB Widescreen LCD Monitor Power Cable (1.5M) VGA Cable (1.5M) Audio Cable (1.5M) User Manual(CD) Quick Start Guide(Paper),In-plane Switching (IPS) Technology,PC,,HS221HPB,HS221HPB Widescreen LCD Monitor,LCD Monitor,5 ms,Full HD,"54.6 cm (21.5"")",Yes,60 Hz,,,,178°,Yes,100 x 100,Yes,4.70 kg,512 mm,,,120 V AC 230 V AC,Anti-glare,,,,,,,,HS,,,-5°to15°,,,,Wall Mountable,,,,,,,,,,,,,,,,,,,
"859-10178, DELS2340L, Dell, LCD Monitor, Itenergy Ltd",Yes,,,16:9,LED,Dell,250 cd/m²,,EMC,Black,16.7 Million Colours,"1,000:1",37.8 mm,,,,Security Lock,EPEAT Silver ENERGY STAR,Yes,,Yes,,297.7 mm,178°,1 Year,"Dell, Inc",859-10178,1920 x 1080,1.0,,24 W,"S2340L 23"" (58cm) LED Monitor Full HD (1920x1080) VGA,HDMI Power Cable and Adapter Adapter Cable VGA Cable Velcro Strap Drivers & Documentation Media Quick Setup Guide Product and Safety Information Guide",In-plane Switching (IPS) Technology,PC,,S2340L,"S2340L 23"" (58cm) LED Monitor Full HD (1920x1080) VGA,HDMI",LCD Monitor,7 ms,Full HD,"58.4 cm (23"")",,60 Hz,,,,178°,,,Yes,2.95 kg,532.1 mm,4.47 m,398.78 mm,220 V AC 110 V AC,,532.13 mm,,,,,,500 mW,,,,,3.91 kg,,,,,,,,,,,,,,,,,,,,,,
"UM.EV6EE.001, 8654M75, Acer, LCD Monitor, Itenergy Ltd",Yes,No,No,16:10,LED,Acer,250 cd/m²,,,Black,16.7 Million Colours,"100,000,000:1",52 mm,,,Yes,,TCO Certified Displays 6.0 EPEAT Gold,Yes,Yes,,,333.1 mm,170°,3 Year,"Acer, Inc",UM.EV6EE.001,1680 x 1050,1.0,,17.20 W,V226WL Widescreen LCD MonitorPower Cord1 x VGA Cable,Twisted Nematic Film (TN Film),,,V226WL,V226WL Widescreen LCD Monitor,LCD Monitor,5 ms,WSXGA+,"55.9 cm (22"")",,60 Hz,450 mW,,,160°,Yes,100 x 100,Yes,3.09 kg,505.8 mm,207 mm,419.10 mm,220 V AC 110 V AC,Anti-glare,505.80 mm,,,,,No,350 mW,V,,No,-5°to25°,3.52 kg,,,,,,,,,,,,,,,,,,,,,,
"VA2232W-LED, B921299, ViewSonic, LCD Monitor, Itenergy Ltd",Yes,,,,LED,Viewsonic,250 cd/m²,,CECBSVHC ListULcULFCC-B / ICES-003BUL-AR / TUV-SNOMNemko ERGOGSGOST-R+HygienicUkrSEPROCCCCEL level 1BSMIPSBC-tickSASO,Black,,"1,000:1",61.2 mm,,,Yes,,TCO ErP REACH RoHS WEEE,Yes,,,,353.1 mm,170°,3 Year,Viewsonic Corporation,VA2232W-LED,1680 x 1050,1.0,,,,,Mac PC,Value,VA2232w-LED,"VA2232w-LED 22"" High Definition LED Display",LCD Monitor,5 ms,WSXGA+,"55.9 cm (22"")",,75 Hz,,,,160°,Yes,100 x 100,Yes,3.54 kg,510.5 mm,195.58 mm,416.56 mm,220 V AC 110 V AC,Anti-glare,510.54 mm,,,,,,,VA,,,,3.91 kg,,,,,,,,,,,,,,,,,,,,,,
"220P4LPYEB/00, 2674289, Philips, LCD Monitor, Itenergy Ltd",Yes,Yes,Yes,16:10,LED,Philips,250 cd/m²,Speaker USB Hub,BSMICE MarkFCC Class BGOSTSASOSEMKOTUV ErgoTUV/GSUL/cUL,Black,16.7 Million Colours,"1,000:1",59 mm,,Yes,Yes,Security Lock SmartErgoBase PowerSensor SmartImage,TCO Certified Displays 5.2 WEEE TCO Certified Edge EPEAT Gold ENERGY STAR 5.0 RoHS,Yes,Yes,,Yes,349 mm,170°,,Philips Electronics,220P4LPYEB/00,1680 x 1050,1.0,2.0,16.80 W,,,PC Mac,Brilliance,220P4LPYEB,"Brilliance LCD Monitor, LED Backlight with PowerSensor",LCD Monitor,5 ms,WSXGA+,"55.9 cm (22"")",Yes,60 Hz,300 mW,Yes,USB 2.0,160°,Yes,100 x 100,Yes,3.38 kg,504 mm,220 mm,517 mm,220 V AC 110 V AC,,504 mm,,,,,,,P,,,,5.50 kg,,,,,65%,,Yes,Plastic,,,,,,,,,,,,,,
"B2480HS-B1, 2538389, Iiyama, LCD Monitor, Itenergy Ltd",Yes,Yes,Yes,16:9,LED,iiyama,300 cd/m²,Speaker,ECCUTUV-GS,Black,16.7 Million Colours,"1,000:1",244.5 mm,Landscape/Portrait,,Yes,Security Lock,TCO ENERGY STAR TCO Displays 5.0,Yes,Yes,Yes,,557 mm,170°,3 Year,"iiyama North America, Inc",B2480HS-B1,1920 x 1080,1.0,2.0,22 W,ProLite B2480HS-1Power CableVGA Cable (D-Sub)DVI CableAudio CableBase Of The FootCable SupportQuick Start GuideSafety Guide,,Mac PC,ProLite,B2480HS,ProLite B2480HS-1,LCD Monitor,2 ms,Full HD,"59.9 cm (23.6"")",Yes,75 Hz,1 W,,,160°,Yes,100 x 100,Yes,6.10 kg,571.5 mm,,,220 V AC 110 V AC,,,,,,,,,,,,,,,,Desk Mountable Wall Mountable,,,,,,No,,,,,,,,,,,,,
"273E3LSB/00, 2240706, Philips, LCD Monitor, Itenergy Ltd",Yes,,,16:9,LED,Philips,300 cd/m²,,BSMICE MarkFCC Class BGOSTSEMKOPSBSASOTUV ErgoStand TUV/GSUL/cUL,Carbon Black,16.7 Million Colours,"1,200:1",64 mm,,,Yes,SmartPower,ENERGY STAR EPEAT Silver RoHS WEEE,Yes,Yes,,,391 mm,178°,,Philips Electronics,273E3LSB/00,1980 x 1080,1.0,,19.60 W,,,Mac PC,,273E3LSB,273E3LSB Widescreen LCD Monitor,LCD Monitor,3.50 ms,Full HD,"68.6 cm (27"")",,60 Hz,500 mW,,,170°,Yes,100 x 100,Yes,6.50 kg,642 mm,227 mm,440 mm,220 V AC 110 V AC,,642 mm,,,,,,500 mW,E,,,,8.20 kg,,,,,,,,,,,,,,,,,,,,,,
"861-BBCD, DELE2214H, Dell, LCD Monitor, Itenergy Ltd",Yes,,,16:9,LED,Dell,250 cd/m²,,,,16.7 Million Colours,"1,000:1",46.3 mm,,,Yes,PowerNap Security Lock Cable Management,China Energy Label (CEL) TCO Certified Displays EPEAT Gold ENERGY STAR,Yes,Yes,,,304.7 mm,170°,,"Dell, Inc",861-BBCD,1920 x 1080,1.0,,30 W,,Twisted Nematic Film (TN Film),,,E2214H,22 Monitor - E2214H,LCD Monitor,5 ms,Full HD,"54.6 cm (21.5"")",,60 Hz,500 mW,,,160°,Yes,100 x 100,Yes,2.70 kg,513.2 mm,165.50 mm,396.70 mm,220 V AC 110 V AC,Anti-glare,513.20 mm,,,,,,500 mW,,,,6°Up to22°,,,,Wall Mountable,,,,,,,,,,,,,,,,,,,
"861-BBBF, 0912949, Dell, LCD Monitor, Itenergy Ltd",,,,16:9,LED,Dell,250 cd/m²,USB Hub,,Black,16.7 Million Colours,"2,000,000:1",46.3 mm,,Yes,Yes,,EPEAT Gold CECP RoHS ENERGY STAR TCO Certified Displays China Energy Label (CEL),Yes,,,,304.4 mm,,3 Year,"Dell, Inc",861-BBBF,1920 x 1080,1.0,,26 W,"22 Monitor P2214H - 54.6 cm (21.5"") Black No Stand Cable management cover Drivers & Utilities Dell Display Manager 1 x DisplayPort cable 1 x USB cable 1 x VGA cable",,,,P2214H,"22 Monitor P2214H - 54.6 cm (21.5"") Black No Stand",LCD Monitor,8 ms,Full HD,"55.9 cm (22"")",,,,Yes,,,Yes,,Yes,3.26 kg,512.7 mm,180 mm,354.20 mm,,,512.70 mm,,,,,,,,,,,,,,,Click to view,25%,,,,,,,,,,,,,,,,,
"860-10213, DELE2414H, Dell, LCD Monitor, Itenergy Ltd",Yes,,,16:9,LED,Dell,250 cd/m²,,,Black,16.7 Million Colours,"1,000:1",46.5 mm,,,Yes,Security Lock,China Energy Label (CEL) EPEAT Gold TCO Certified Displays ENERGY STAR,Yes,Yes,,,337.5 mm,170°,3 Year,"Dell, Inc",860-10213,1920 x 1080,1.0,,30 W,"E-series E2414H 61cm (24"") LED Monitor VGA,DVI-D (1920x1080) Black Stand Power Cable VGA Cable DVI Cable Cable Cover Drivers and Documentation Media Quick Setup Guide Product Information Guide",Twisted Nematic Film (TN Film),,,E2414H,"E-series E2414H 61cm (24"") LED Monitor VGA,DVI-D (1920x1080) Black",LCD Monitor,5 ms,Full HD,"61 cm (24"")",,60 Hz,500 mW,,,160°,Yes,100 x 100,Yes,3 kg,570 mm,164.20 mm,418.30 mm,220 V AC 110 V AC,Anti-glare,570 mm,,,,,,500 mW,E,,,,,,,Arm-mountable Wall Mountable,,,,,,,,,,,,,,,,,,,
"GB2773HS-GB1, IIYGB2773HSGB, Iiyama, LCD Monitor, Itenergy Ltd",Yes,Yes,,16:9,LED,iiyama,300 cd/m²,Speaker,CE TÜV Bauart GOST-R,Black,16.7 Million Colours,"1,000:1",66 mm,Landscape,,Yes,Security Lock Display Power Management Signaling (DPMS) Eco Mode OverDrive,ENERGY STAR,Yes,Yes,Yes,Yes,399.5 mm,170°,,"iiyama North America, Inc",GB2773HS-GB1,1920 x 1080,1.0,2.0,35 W,ProLite GB2773HS Widescreen LCD Monitor Power Cable DVI-D Cable Audio cable Cable Holder Quick Start Guide Safety Guide,Twisted Nematic Film (TN Film),PC Mac,ProLite,GB2773HS,ProLite GB2773HS Widescreen LCD Monitor,LCD Monitor,1 ms,Full HD,"68.6 cm (27"")",Yes,144 Hz,500 mW,,,160°,Yes,100 x 100,Yes,7.40 kg,647 mm,230 mm,522.50 mm,220 V AC 110 V AC,,647 mm,,,,,,,,,,,,,,Wall Mountable,,,No,,,,,,,,,,,,,,,,
"22MB65PY-B, 2975561, LG Electronics, LCD Monitor, Itenergy Ltd",,Yes,,16:10,LED,LG,250 cd/m²,,,Black,,"5,000,000:1",,,Yes,Yes,,,,,,,,,,LG Electronics,22MB65PY-B,1680 x 1050,1.0,,,,,,,22MB65PY-B,22MB65PY-B Widescreen LCD Monitor,LCD Monitor,5 ms,WSXGA+,"55.9 cm (22"")",Yes,,,Yes,,,Yes,,Yes,6.40 kg,,,,,,,,,,,,,,,,,,,,,,,,,,,,,,,,,,,,,,,
"C221k, EDGEC221K, Edge10, LCD Monitor, Itenergy Ltd",Yes,,,16:9,LED,Edge10,250 cd/m²,Speaker,cULus CE FCC,Black,16.7 Million Colours,"1,000:1",41 mm,,,,3D Comb Filter Security Lock,ENERGY STAR WEEE,Yes,,Yes,,321 mm,170°,2 Year,Edge10 Corporation Limited,C221k,1920 x 1080,1.0,2.0,35 W,"21.5"" LED Professional CCTV Monitor with Full HD Power Cable VGA Cable",,Mac PC,,C221k,"21.5"" LED Professional CCTV Monitor with Full HD",LCD Monitor,5 ms,Full HD,"54.6 cm (21.5"")",Yes,75 Hz,1 W,,,160°,Yes,100 x 100,Yes,5.80 kg,530 mm,,,220 V AC 110 V AC,,,,,,,,,,,,,,,,,,,,,,,,,,Yes,,,,,,,,,
"C272P4QPKEW/00, 2974033, Philips, LCD Monitor, Itenergy Ltd",Yes,Yes,Yes,16:9,LED,Philips,300 cd/m²,Webcam Speaker USB Hub,IEC/EN60601-1-2 CE Mark IEC/EN60601-1 GOST JIS Z2801,Textured White,16.7 Million Colours,"1,000:1",64 mm,Landscape/Portrait,Yes,Yes,Security Lock Multiview PowerSensor Zero Power Switch SmartControl Antimicrobial Sync on Green SmartErgoBase SmartImage Clinic,EPEAT Gold WEEE TÜV ENERGY STAR 6.0 RoHS TCO Certified Displays 6.0,Yes,Yes,Yes,Yes,405 mm,178°,1 Year,Philips Electronics,C272P4QPKEW/00,2560 x 1440,1.0,2.0,27.80 W,,PLS (Plane to Line Switching) Technology,PC Mac,Brilliance,C272P4QPKEW,Brilliance LCD Monitor with Clinical D-image,LCD Monitor,12 ms,WQHD,"68.6 cm (27"")",Yes,60 Hz,300 mW,Yes,USB 3.0,178°,Yes,100 x 100,,5.70 kg,639 mm,242 mm,580 mm,110 V AC 220 V AC,,639 mm,,,,,150 mm,0 mW,,Yes,65°,-5°to20°,8.50 kg,,,Wall Mountable,,,,,,,,,,,,,,,,,,,
"E5Z95AT#ABU, 9439TRK, HP, LCD Monitor, Itenergy Ltd",Yes,,,16:9,LED,HP,250 cd/m²,Speaker,EN 55022 Class A,Black,,"1,000:1",46.9 mm,Landscape,,Yes,Security Lock,TCO '99 MPR II REACH WEEE ENERGY STAR,Yes,Yes,,,347.7 mm,170°,1 Year,Hewlett-Packard,E5Z95AT#ABU,1920 x 1080,1.0,,30 W,"V241a 59,94 cm (23.6'') LED Backlit Monitor (ENERGY STAR) (E5Z95AT) VGA Cable Audio Cable AC Power Cord Printed Documentation and CD HP Display Assistant Software",,,Business,V241a,"V241a 59,94 cm (23.6'') LED Backlit Monitor (ENERGY STAR) (E5Z95AT)",LCD Monitor,5 ms,Full HD,"59.9 cm (23.6"")",Yes,,500 mW,,,160°,,,Yes,,563.3 mm,204.10 mm,412.40 mm,110 V AC 220 V AC,Anti-glare,563.30 mm,,,,,,,Value,,360°,-5°to20°,4 kg,,,,,,,,,,,,,,,,,,,,,,
"9H.L7CLB.DB9, 2835281, BenQ, LCD Monitor, Itenergy Ltd",Yes,Yes,Yes,16:9,LED,BenQ,250 cd/m²,Speaker,,Glossy Black,16.7 Million Colours,"1,000:1",,,,Yes,Security Lock Eco Mode Senseye 3,TCO Certified Displays 5.2 ENERGY STAR 6.0,Yes,Yes,Yes,Yes,,170°,,BenQ Corporation,9H.L7CLB.DB9,1920 x 1080,1.0,2.0,23 W,GL2450HT Widescreen LCD Monitor Quick Start Guide CD-ROM Power Cord D-Sub Cable,Twisted Nematic Film (TN Film),PC,,GL2450HT,GL2450HT Widescreen LCD Monitor,LCD Monitor,5 ms,Full HD,"61 cm (24"")",Yes,76 Hz,300 mW,,,160°,Yes,100 x 100,Yes,5.10 kg,,213 mm,502 mm,110 V AC 220 V AC,,579 mm,,,,,,,GL,,,,,,,Wall Mountable,,,,,,,,,,,,,,,,,,,
"E2473HS-GB1, 2579471, Iiyama, LCD Monitor, Itenergy Ltd",Yes,No,,16:9,LED,iiyama,300 cd/m²,Speaker,CETUV-BauartVCCI-BPSECU,Black,16.7 Million Colours,"1,000:1",218.5 mm,,,Yes,X-Res Technology Security Lock,ENERGY STAR,Yes,Yes,Yes,Yes,418 mm,170°,3 Year,"iiyama North America, Inc",E2473HS-GB1,1920 x 1080,1.0,2.0,22 W,ProLite E2473HSPower CableVGA Cable (D-Sub)DVI CableAudio CableStandCable GuideQuick Start GuideSafety Guide,,PC Mac,ProLite,E2473HS,ProLite E2473HS,LCD Monitor,2 ms,Full HD,"61 cm (24"")",Yes,76 Hz,500 mW,,,160°,Yes,100 x 100,Yes,4.30 kg,556 mm,,,220 V AC 110 V AC,,,,,,,,,,,,,,,,Desk Mountable Wall Mountable,,,,,,,,,,,,,,,,,,,
"9H.LATLA.HPE, M352415, BenQ, LCD Monitor, Itenergy Ltd",Yes,Yes,Yes,16:10,LED,BenQ,250 cd/m²,Speaker,,Black,16.7 Million Colours,"1,000:1",,,,Yes,Security Lock Senseye 3,TCO Certified Displays 6.0,Yes,Yes,,Yes,,170°,,BenQ Corporation,9H.LATLA.HPE,1680 x 1050,1.0,2.0,26 W,,Twisted Nematic Film (TN Film),PC,,BL2211TM,BL2211TM Widescreen LCD Monitor,LCD Monitor,5 ms,WSXGA+,"55.9 cm (22"")",Yes,,300 mW,,,160°,Yes,100 x 100,Yes,5.50 kg,,213.93 mm,502.50 mm,110 V AC 220 V AC,,522.15 mm,,,,,,,BL,,,,,,,Wall Mountable,,,,,,,,,,,,,,,,,,,
"861-10395, DELS2240L, Dell, LCD Monitor, Itenergy Ltd",Yes,,,16:9,LED,Dell,250 cd/m²,,EMC,,16.7 Million Colours,"1,000:1",175.8 mm,,,,Security Lock,EPEAT Silver ENERGY STAR,Yes,,Yes,,380.2 mm,178°,1 Year,"Dell, Inc",861-10395,1920 x 1080,1.0,,18 W,"S2240L 21.5"" (54.6cm) LED Monitor Full HD (1920x1080) VGA,HDMI Power Cable Adapter Adapter Cable VGA Cable Velcro Strap Drivers & Documentation Media Quick Setup Guide Product and Safety Information Guide",In-plane Switching (IPS) Technology,,,S2240L,"S2240L 21.5"" (54.6cm) LED Monitor Full HD (1920x1080) VGA,HDMI",LCD Monitor,7 ms,Full HD,"54.6 cm (21.5"")",,60 Hz,500 mW,,,178°,,,Yes,2.60 kg,499.1 mm,,,220 V AC 110 V AC,,,,,,,,,,,,,3.69 kg,,,,,,,,,,,,,,"Images
come alive with colour-boosting Image Enhance, ultra-wide viewing and
Full HD resolution (1920 x 1080 max.) in a 16:9 widescreen
format.","Connect to a laptop or
desktop with VGA connectivity. Explore a world of HD entertainment
options with an HDMI port.",,,,,,,
"60003586, NECEA193MIB, NEC Display Solutions, LCD Monitor, Itenergy Ltd",Yes,Yes,Yes,5:4,LED,NEC Display,250 cd/m²,Speaker,CE TÜV Ergonomics TÜV GS FCC Class B PCT/Gost UL/C-UL CSA ISO 9241-307,Black,16.77 Million Colors,"1,000:1",65 mm,Landscape/Portrait,Yes,Yes,Off Timer Intelligent Power Manager (IPM) System Security Lock Cable Management Carbon Footprint Meter Eco Mode Ambient Light Sensor,EPEAT Silver ErP TCO Certified Displays 6.0 MPR III ENERGY STAR 6.0 RoHS MPR II,Yes,Yes,,Yes,338 mm,178°,,NEC Display Solutions,60003586,1280 x 1024,1.0,2.0,18 W,,In-plane Switching (IPS) Technology,PC,MultiSync,EA193Mi,"LCD 19"" Desktop Display",LCD Monitor,6 ms,SXGA,"48.3 cm (19"")",Yes,60 Hz,350 mW,,,178°,Yes,100 x 100,Yes,4 kg,408 mm,213.90 mm,386.40 mm,110 V AC 220 V AC,,408 mm,,,,,,,,,,,6 kg,,,Desk Mountable,,,,Yes,Plastic,,,,,,,,,,,,,,
"60A4RAT1EU, S604EA3, Lenovo, LCD Monitor, Itenergy Ltd",Yes,Yes,Yes,16:10,LED,Lenovo,300 cd/m²,USB Hub,CTUVusCSACB ReportNEMKONOMSASOTUV-GSCCCGOSTPSBBSMIKCJEIDATUV-SISCKVALITETKUCASINSMSABSSTZBELLISOTANKONCARCSMSONCAPEMIFCC BICCEVCCIKCC-TickSABSBSMICCCERGONOMICVOCCECPe-Standby,Business Black,1.07 Billion Colors,"1,000:1",62 mm,,Yes,Yes,Picture in Picture Digital Daisy Chain Picture by Picture Security Lock Mobile High-Definition Link (MHL),China RoHS CECP REACH TCO Certified Displays 6.0 Taiwan Green Mark China Energy Label (CEL) ULE Gold TCO Certified Edge Turkey RoHS EPA ENERGY STAR 6.0 EPEAT Gold,Yes,,Yes,,,178°,,Lenovo Group Limited,60A4RAT1EU,2560 x 1600,1.0,,130 W,,Advanced High Performance In-plane Switching (AH-IPS) Technology,PC,ThinkVision,LT3053p,ThinkVision LT3053p 30-inch WQXGA IPS LED Backlit LCD Professional Monitor,LCD Monitor,6 ms,WQXGA,"76.2 cm (30"")",,60 Hz,1.20 W,Yes,USB 3.0,178°,Yes,100 x 100,Yes,11.50 kg,690.1 mm,241.81 mm,471.17 mm,220 V AC 110 V AC,,690.12 mm,,,,,,500 mW,,,,,,,,,,,,,,,1.0,,,,,,".sep { font-family: Arial, Helvetica, sans-serif; font-size: 8pt; color: #b0b0b0; background-color: #b0b0b0; margin-bottom: 20pt; }
.spec { font-family: Arial, Helvetica, sans-serif; margin-bottom: 5pt; font-size: 8pt; }
.sect { font-family: Arial, Helvetica, sans-serif; font-size: 8pt; font-weight: bold; }
.para { font-family: Arial, Helvetica, sans-serif; font-weight: bold; font-siez: 10pt; background-color: #b0b0b0; color: black; }
.descr { font-family: Arial, Helvetica, sans-serif; font-size: 10pt; }
Details
General Information
Manufacturer
Lenovo Group Limited
Manufacturer Part Number
60A4RAT1EU
Brand Name
Lenovo
Product Line
ThinkVision
Product Model
LT3053p
Product Name
ThinkVision LT3053p 30-inch WQXGA IPS LED Backlit LCD Professional Monitor
Packaged Quantity
1
Product Type
LCD Monitor
Technical Information
Number of Screens
1
Screen Size
76.2 cm (30"")
Screen Mode
WQXGA
Panel Technology
Advanced High Performance In-plane Switching (AH-IPS) Technology
Response Time
6 ms
Aspect Ratio
16:10
Horizontal Viewing Angle
178°
Vertical Viewing Angle
178°
Adjustable Display Angle
Yes
Adjustable Display Height
Yes
Adjustable Display Pivot
Yes
Backlight Technology
LED
Features
Security Lock
Features
Mobile High-Definition Link (MHL)
Features
Picture by Picture
Features
Picture in Picture
Features
Digital Daisy Chain
Video
Maximum Resolution
2560 x 1600
Standard Refresh Rate
60 Hz
Colour Support
1.07 Billion Colors
Contrast Ratio
1,000:1
Brightness
300 cd/m²
Interfaces/Ports
DVI
Yes
HDMI
Yes
USB
Yes
USB Standard
USB 3.0
VGA
Yes
DisplayPort
Yes
Built-in Devices
Built-in Devices
USB Hub
Power Description
Input Voltage
110 V AC
Input Voltage
220 V AC
Operating Power Consumption
130 W
Standby Power Consumption
1.20 W
Off-Mode Power Consumption
500 mW
Physical Characteristics
VESA Mount Compatible
Yes
VESA Mount Standard
100 x 100
Colour
Business Black
Width
690.1 mm
Depth
62 mm
Height with Stand
471.17 mm
Width with Stand
690.12 mm
Depth with Stand
241.81 mm
Weight (Approximate)
11.50 kg
Miscellaneous
Certifications & Standards
CTUVusCSACB ReportNEMKONOMSASOTUV-GSCCCGOSTPSBBSMIKCJEIDATUV-SISCKVALITETKUCASINSMSABSSTZBELLISOTANKONCARCSMSONCAPEMIFCC BICCEVCCIKCC-TickSABSBSMICCCERGONOMICVOCCECPe-Standby
Platform Supported
PC
Green Compliant
Yes
Green Compliance Certificate/Authority
EPEAT Gold
Green Compliance Certificate/Authority
ENERGY STAR 6.0
Green Compliance Certificate/Authority
TCO Certified Displays 6.0
Green Compliance Certificate/Authority
ULE Gold
Green Compliance Certificate/Authority
China RoHS
Green Compliance Certificate/Authority
China Energy Label (CEL)
Green Compliance Certificate/Authority
CECP
Green Compliance Certificate/Authority
EPA
Green Compliance Certificate/Authority
Taiwan Green Mark
Green Compliance Certificate/Authority
TCO Certified Edge
Green Compliance Certificate/Authority
REACH
Green Compliance Certificate/Authority
Turkey RoHS
No accessories available
Product feature could not be found.",60A4RAT1EU,"Lenovo ThinkVision LT3053p 76.2 cm
(30"") LED LCD Monitor - 16:10 - 6
ms - Adjustable Display Angle -
2560 x 1600 - 1.07 Billion Colors -
300 cd/mï¿½ - 1,000:1 - WQXGA - DVI
- HDMI - VGA - DisplayPort - USB -
130 W - Business Black - EPEAT
Gold, ENERGY STAR",S604EA3,1 - Available,,
"861-10376, DELP2213, Dell, LCD Monitor, Itenergy Ltd",Yes,Yes,Yes,16:10,LED,Dell,250 cd/m²,USB Hub,EMC,Black,16.78 Million Colors,"1,000:1",59.8 mm,,Yes,Yes,Cable Management Security Lock,EPEAT Gold ENERGY STAR China Energy Label (CEL) TCO Certified Displays,Yes,Yes,,,332.7 mm,170°,3 Year,"Dell, Inc",861-10376,1680 x 1050,1.0,,45 W,"Professional P2213 22'' (56cm) LED Monitor VGA,DVI-D,DP (1680x1050) Black VGA Cable Stand Power Cable DVI Cable USB Cable Drivers and Documentation Media Quick Setup Guide Safety Information",,,Professional,P2213,"Professional P2213 22'' (56cm) LED Monitor VGA,DVI-D,DP (1680x1050) Black",LCD Monitor,5 ms,WSXGA+,"55.9 cm (22"")",,60 Hz,300 mW,Yes,USB 2.0,160°,Yes,100 x 100,Yes,3.43 kg,510.4 mm,183.30 mm,497.40 mm,220 V AC 110 V AC,Anti-glare,510.40 mm,,,,,,,,,,,,,,,,25%,,Yes,,,,,,,,,,,,,,,
"27MB65PY-B, 2975567, LG Electronics, LCD Monitor, Itenergy Ltd",Yes,Yes,Yes,16:9,LED,LG,250 cd/m²,,,Black Hairline,16.7 Million Colours,"5,000,000:1",63.5 mm,,Yes,Yes,Reading Mode Intelligent Auto Super Energy Saving,,,,No,Yes,386.1 mm,178°,,LG Electronics,27MB65PY-B,1920 x 1080,1.0,,36 W,,Advanced High Performance In-plane Switching (AH-IPS) Technology,,,27MB65PY-B,27MB65PY-B Widescreen LCD Monitor,LCD Monitor,5 ms,Full HD,"68.6 cm (27"")",,,300 mW,Yes,,178°,Yes,100 x 200,Yes,5.90 kg,645.2 mm,259.08 mm,408.94 mm,,Anti-glare,645.16 mm,,,,83 kHz,,300 mW,,,,,,,,,,,,,,,,,,,,,,,,,,,
"273V5LHSB/00, 2785805, Philips, LCD Monitor, Itenergy Ltd",Yes,,,16:9,LED,Philips,300 cd/m²,,BSMI CE Mark FCC Class B GOST PSB SASO SEMKO TUV/ISO9241-307 cETLus,Black,16.7 Million Colours,"10,000,000:1",57 mm,,,,Sync on Green SmartContrast Security Lock,WEEE RoHS TCO Certified Displays ENERGY STAR 6.0 EPEAT Silver,Yes,Yes,Yes,,398 mm,170°,,Philips Electronics,273V5LHSB/00,1920 x 1080,1.0,,23.14 W,,,Mac PC,,273V5LHSB,LCD Monitor with SmartControl Lite,LCD Monitor,5 ms,Full HD,"68.6 cm (27"")",,60 Hz,500 mW,,,160°,Yes,100 x 100,Yes,4 kg,646 mm,240 mm,471 mm,220 V AC 110 V AC,,646 mm,,,,,,300 mW,V,,,,4.53 kg,,,,,,,,,,,,,,,,,,,,,,
"D7R00AT#ABU, 3125989, HP, LCD Monitor, Itenergy Ltd",Yes,,Yes,16:9,LED,HP,250 cd/m²,USB Hub,WHQL CE CB KC KCC NOM PSB ICE TUV-S CCC SEPA ISC VCCI FCC BSMI,,1.07 Billion Colors,"1,000:1",65.5 mm,,Yes,,Security Lock,REACH WEEE EPA China Energy Label (CEL) TCO Certified Displays,Yes,Yes,Yes,,379.2 mm,178°,3 Year,Hewlett-Packard,D7R00AT#ABU,2560 x 1440,1.0,,,DreamColor Z27x Professional Display(D7R00AT) AC Power Cord DisplayPort Cable USB Cable HDMI Cable DisplayPort Mini Cable DVD Documentation Kit Factory Calibration Report,In-plane Switching (IPS) Technology,PC,Business,Z27x,DreamColor Z27x Professional Display(D7R00AT),LCD Monitor,7 ms,WQHD,"68.6 cm (27"")",,,1.20 W,Yes,USB 3.0,178°,,,,8.80 kg,641 mm,242.40 mm,420.40 mm,230 V AC 120 V AC,Anti-glare,641 mm,,,,,,,Z,,45°,-5°to20°,,,,,,,,,,,,,,,,,,,,,,,
"22M45HQ-B, 2998779, LG Electronics, LCD Monitor, Itenergy Ltd",Yes,,,,LED,LG,,,,Black,,,,,,,,,,,Yes,,,,,LG Electronics,22M45HQ-B,1920 x 1080,1.0,,,,,,,22M45HQ-B,22M45HQ-B Widescreen LCD Monitor,LCD Monitor,2 ms,Full HD,"55.9 cm (22"")",,,,,,,,,Yes,14 kg,,,,,,,,,,,,,,,,,,,,,,,,,,,,,,,,,,,,,,,
