"Buy Open Box Samsung 40"" PE40C Full HD LED-LCD Monitor, Black Monitors - Large-Format LED-LCD PE40C today at PC Connection",,,40 in,,Yes,,This product is subject to our return policy. Please see our complete return policy for details.,90 Days,90 Days,Black,"An integrated solution to provide a new digital signage experience:
The Samsung Smart Signage Platform (SSSP) is embedded within Samsung displays, providing the power of a dual-core CPU and a combination of media player and integrated display solution, MagicInfo Premium S player. The solution eliminates the need for additional PC modules while reducing installation and maintenance issues. Using the included MagicInfo Premium S player, businesses can create, schedule, and deploy content effortlessly. Multiple types of content can be streamed simultaneously and continuously courtesy of the dual-core CPU and 8GB of storage, and a high performance video processor integrated on a single chip. Save more by paying less for a display integrated with a media player and premium management solution.
Adaptable and Economical Business Display:
These durable displays offer lower total cost of ownership (TCO), and are designed for continuous, energy-efficient operation with reduced power consumption and heat emission. The PE Series LFDs incorporate an innovative backlight unit (BLU), saving more electricity than traditional devices and lowering operational expenditure. This LED technology also reduces environmental impact by cutting out potentially harmful substances such as mercury, halogen and lead, as does the spray-free injection molding used to produce flat panel displays.
24/7 Performance with Enhanced Quality:
A diverse range of businesses can optimise the appearance of their content and image with the PE Series, improving key messages and offering a unified brand identity. Its slim bezel and edge-LED technology offer high brightness, with an enhanced luminescence of 700nit. The viewing experience is further improved by an anti-glare, anti-glossy panel. The PE Series represent highly durable displays that are designed for operation 24/7 in a variety of challenging environments.
Easy Installation and Efficient Space Usage:
Improve business display management with the slim, lightweight design of the Samsung PE Series. This attractive LFD ensures easy installation and improved space management, leaving more room available for other purposes. Content can be delivered to heights of up to 15m thanks to the DisplayPort feature. Furthermore, remote control is ensured by RJ45 port utilisation, even when users are combining RJ45 and RS-232 connections.
Slim and Lightweight for Flexible Installation:
The PE Series has an extremely slim depth, which is 73 per cent reduced compared to traditional products, giving a sleeker overall appearance. The lightweight design frees up more space and leads to easier, more efficient installation. A narrow bezel increases viewer focus on content and allows more room for information display. It also enables virtually seamless video walls for a more immersive experience.
200 x 200mm VESA mounting pattern.","Monitor, power cord, VGA cable, remote with batteries, CD, documentation",,,29.80 lb(s),"20.9""h x 36.2""w x 1.4""d",,,,,700 nit(s),16.7 million colors,DVI-D DisplayPort 3.5mm audio Power HDMI HDDB15,Audio HDMI VGA Power DVI-D DisplayPort,4000:1,LCD LED-backlit,Widescreen,1920 x 1080,"(1) HDDB15 VGA
(1) HDMI
(2) DisplayPort (in, out)
(1) 3.5mm audio
(1) DVI-D
(1) Power in","Supply: 100-240VAC (+/-10%), 50/60Hz
Consumption: 165W (max); 114W (typ.);",8 ms,178/178,,,,,,,,,,,,,Digital Visual Interface (DVI),Open Box,,,,
Buy C2G USB to VGA Video Display Adapter Up To 1920 x 1080 Video Extenders & Splitters 30545 today at PC Connection,RoHS,,,,,,This product is subject to our return policy. Please see our complete return policy for details.,1 Year,1 Year,Gray,,"USB to VGA Adapter, USB A to Mini B Cable, CD, documentation",adapter,,0.20 lb(s),,,,,,,,,,,,,,"(1) USB Mini-B
(1) HDDB15 VGA",,,,,,,,,,,,,,,,,,"Windows 2000 SP 4, XP Home or Professional (Including Table edition) SP2 or SP3, Vista SP1 (32-bit or 64-bit) and Windows 7 (32-bit or 64-bit).
With Single Core CPU at 1.2GHz or higher processor clock. Intel Pentium/Celeron family, or AMD K6/Athlon/Duron family, or compatible processor.
512MB memory.
At least one USB2.0 port 30Mb of available disk space.
Additional requirements for DVD playback:
Dual core CPU at 2.0 GHz processor clock.
The adapter screen resolution be set to 800x600 with 16bit color.",,,
"Buy ELO Touch Solutions Stand for 3201L, 4201L Stands & Mounts - AV E455084 today at PC Connection",,,,,,,This product is subject to our return policy. Please see our complete return policy for details.,Call for Warranty,Call for Warranty,Black,"Compatible with 3201L, 4201L displays.","stand, documentation",Display stand,Flat panel display,,,,,,,,,,,,,,,,,,,,,,,,,,,,,,,,,,,,
"Buy ELO Touch Solutions 17"" 1739L LCD Touch Monitor Monitors - LCD E012584 today at PC Connection",SEMKO CUL C-Tick Class B CB RoHS VCCI Class B ITE,,17 in,,,276 cd/m2,This product is subject to our return policy. Please see our complete return policy for details.,3 Years,3 Years,Black Steel,,,,,0.00 lb(s),,,,,8.800 lb(s),,,,,,,,,,,,,,,,,,,,,,,,,,,,,,
"Buy NDS 21.3"" Dome S3c LED Diagnostic Medical Monitor with nVidia Monitors - Medical 997-6803-00-1EN today at PC Connection",CCC RoHS EN 60601-1-2 WEEE VCCI REACH cCSAus EN 60601-1 FCC FDA 510k KCC TUV GM,Pivot (rotation) Tilt Swivel Height,21.3 in,0.2115 mm,,800 cd/m2,"Due to manufacturer restrictions, all sales on this item are final.",5 Years,5 Years,,,,,,,,,,,14.100 lb(s),,,,,,,,,,,,,,,,,,,,,,,,,,,,,,
"Buy Benq 27"" EW2440L LCD Monitor Monitors - LCD EW2740L today at PC Connection",TUV Bauart TCO Displays 6.0,Tilt,27 in,0.311 mm,Yes,300 cd/m2,This product is subject to our return policy. Please see our complete return policy for details.,3 Years,3 Years,Black,,,,,,,,,,,,,,,,,,,,,,,,,,,,,,,,,,,,,,,,
"Buy Samsung 46"" 460UTN-B Narrow-Bezel Smart LCD Display with Monitors - Large-Format LCD 460UTN-B today at PC Connection",,,46 in,.7455 mm,Yes,450 nit(s),This product is subject to our return policy. Please see our complete return policy for details.,N/A,N/A,Black,,"Display, VGA cable, power cord, remote control with batteries, CD, documentation",,,29.40 lb(s),"22.8""h x 40.4""w x 5.1""d",,,,,,,,,4500:1,LCD,Widescreen,1366 x 768,,"Supply: 100-240VAC (+/-10%), 50-60Hz
Consumption: 260W (typ.); 270W (max.);",,,,,,,,,,,,,,,,,,,,
Buy Tripp Lite 2-Port VGA SVGA 350MHz Video Splitter with Signal Video Extenders & Splitters B114-002-R today at PC Connection,,,,,,,This product is subject to our return policy. Please see our complete return policy for details.,1 Year,1 Year,Black,"Features:
Simultaneously display video on (2) VGA/SVGA monitors.
Ideal for video presentations or sharing information with multiple users.
A built-in booster allows a video signal (up to 2048 x 1536 @ 60Hz) to be transmitted up to 210 feet from the source.
The splitter can be located up to 25 feet from the connected computer and up to 185 feet from the connected monitors.
350Mhz Bandwidth Support.
Cascade up to (3) levels of splitters together to increase the number of connected monitors.
Rugged, fully shielded metal housing.","Splitter, power supply, documentation",Video splitter,,0.00 lb(s),,,,,,,,,,,,,,"(2) HD15 (F)
(1) HD15 (M)",,,,,,,,,,,,,,,,,,"Computer with an HDDB15 port
VGA or SVGA monitor with HDDB15 Male cable",,,
"Buy Peerless Flat Panel TV Floor Stand with 1 Clear Glass Shelf, Stands & Mounts - AV SGLB01 today at PC Connection",,,,,,,This product is subject to our return policy. Please see our complete return policy for details.,5 Years,5 Years,Black,"Features:
Holds flat panel screens from 32"" to 65""
Screens provide tilt and vertical adjustment features to achieve the ideal viewing angle
Incremental tilt of -2°, 0° and +5° makes it easy to simply adjust
Internal cable management neatly hides all cords and cables for a clean, clutter-free look
200 lbs. maximum weight capacity (150 lbs. for screen; 50 lbs. for shelf)
Dimensions: 61""H (including screen brackets) x 40.5"" x 25.6""D
Ships ready-to-assemble","Stand, Glass shelf, documentation",Stand,Plasma display,69.00 lb(s),"61""h x 40.5""w x 25.6""d",,,,,,,,,,,,,,,,,,,,,,,,,,,,,,,,,,
"Buy 3M Privacy Filter for 28"" Widescreen LCD Display Glare Filters & Privacy Screens PF28.0W today at PC Connection",,,,,,,This product is subject to our return policy. Please see our complete return policy for details.,1 Year,1 Year,,"Fits widescreen desktop monitors with a diagonally measured 28"" viewing screen","Filter, documentation",Display privacy filter,,,"14.62""h x 23.38""w",,,,,,,,,,,,,,,,,,,,,,,,,,,,,,,,,,
"Buy Planar Extended Arm Wall Mount, Black Stands & Mounts - AV 997-5547-00 today at PC Connection",,,,,,,This product is subject to our return policy. Please see our complete return policy for details.,N/A,N/A,Black,,"Mount, documentation",Wall mount arm,Monitor LCD,,,,,,,,,,,,,,,,,,,,,,,,,,,,,,,,,,,,
"Buy Miracle Business 8"" TFT LCD Monitor, BLACK Monitors - LCD LT08B today at PC Connection",FCC CUL CCC,,8 in,0.2025 mm,,250 cd/m2,This product is subject to our return policy. Please see our complete return policy for details.,N/A,N/A,Black,,,,,,,,,,,,,,,,,,,,,,,,,,,,,,,,,,,,,,,,
Buy Kensington Flat Panel Wall Mount Cubicle Hanger Adapter Stands & Mounts - AV 60064 today at PC Connection,,,,,,,This product is subject to our return policy. Please see our complete return policy for details.,2 Years,2 Years,,"""VESA-compliant"" or ""Zero Footprint"" flat panel monitors with removable bases.","Adapter, documentation",Wall mount,Monitor,,"8.5""h x 6.5""w x 3.75""d",,,,,,,,,,,,,,,,,,,,,,,,,,,,,,,,,,
Buy Chief Manufacturing Small THINSTALL Dual Swing Arm Wall Mount - Stands & Mounts - AV TS118SU today at PC Connection,UL,,,,,,This product is subject to our return policy. Please see our complete return policy for details.,Call for Warranty,Call for Warranty,Black,"Ultra Low Profile Sleek design collapses to 1.5"" (38 mm), providing an ultra-low profile for all types of TVs, including LED, LCD and Plasma.
Extends up to 18"" (457 mm) Full extension maximizes viewing potential.
Centris low-profile tilt Provides up to 12° of effortless fingertip tilt toachieve optimal viewing angles.
Integrated Cable Management Enclosed, tool-free cable covers make it easy to route power and signal cables, and connect to the wall for a seamless installation.
Max weight capacity of 35 pounds.
For 10""-32"" displays.
Mounting Pattern Compatibility (Universal Versions): 75 x 75, 100 x 100, 200 x 100, 200 x 200mm.","mount, documentation",Mounting arm,Flat panel display,,"11.6""h x 13""w x 1.5""d",,,,,,,,,,,,,,,,,,,,,,,,,,,,,,,,,,
"Buy Acer K137 WXGA Portable DLP Projector with Speakers, 700 Lumens, Projectors MR.JGZ11.009 today at PC Connection",,,,,,,,1 Year,1 Year,White,,"projector, power adapter, HDMI cable, HDMI to Micro USB cable, remote with battery, protection case, CDs, documentation",,,1.10 lb(s),"1.6""h x 7.4""w x 4.6""d",,,,1.1 lb(s),,1.07 billion colors,Power HDDB15 3.5mm audio USB Type B Mini HDMI RCA Composite SD Card USB Type A,Audio Composite video HDMI VGA USB Power SD Card,10000:1,Digital Light Processing (DLP),,1920 x 1080,"(1) HDDB15 VGA
(1) RCA composite
(2) 3.5mm audio (in, out)
(1) USB Mini B
(1) USB Type A
(1) HDMI
(1) Power in",Supply: 110-220VAC,,,Remote control Speakers Included Keystone correction Dual speakers,Desktop Ceiling-mount rear projection Ceiling-mount front projection Tabletop,16:10,8.3 ft,1.4 ft,1280 x 800,DLP projector,Multiscan,2 ft,,700 ANSI lumens,LED,,,,,,
Buy Black Box MediaCento IPX Multicast Video Wall HD Video-over-IP Digital Signage Systems & Modules VX-HDMI-IP-VTX today at PC Connection,CE RoHS,,,,,,This product is subject to our return policy. Please see our complete return policy for details.,1 Year,1 Year,,"Transmits HDMI video and audio over an Ethernet network to create up to 8 x 8 video wall arrays.
Uses existing standards-based Ethernet technology and TCP/IP protocols.
Scales source video for output on a video wall matrix—great for digital signage.","Transmitter, power supply, power cord, (4) foot pads, CD, documentation",,,1.10 lb(s),"1""h x 3.8""w x 5.1""d",,,,,,,,,,,,,"(1) HDMI
(1) RJ-45 LAN
(2) RJ-12
(1) Power in","Supply: 100-240VAC, 50/60Hz
Consumption: 13.5W (typ.)",,,,,,,,,,,,,,,,,,,,
"Buy Samsung 6-Point IR Touch Overlay for ED65C, MD65C Digital Signage Systems & Modules CY-TE65 today at PC Connection",,,,,,,This product is subject to our return policy. Please see our complete return policy for details.,Call for Warranty,Call for Warranty,Black Clear,"Upgrade your display:
Use an overlay to prevent damage to displays in busy public areas or to add touch technology so that members of the public can interact with your content. An interactive whiteboard option lets you write on-screen to improve learning and make presentations more engaging. Save energy by using an LFD and overlay instead of a projector and interactive whiteboard.
Cost effective solution:
In today’s unstable economic environment, businesses are constantly looking for ways to “do more with less” and to enhance equipment longevity with as little expenditure as possible. Samsung protection glass can protect your screen while it is displayed in public areas. Scratch resistant and shatter-proof, this screen shields the panel from damage so your images stay clear for years to come.
Compatible with ED65C, MD65C.
6 point Simultaneous Touch.","Overlay, documentation",,,,"34.7""h x 59.1""w x 2.5""d",,,,,,,,,,,,,,,,,,,,,,,,,,,,,,,,,,
Buy HP Adjustable Dual Monitor Stand Stands & Mounts - AV AW664UT#ABA today at PC Connection,,,,,,,This product is subject to our return policy. Please see our complete return policy for details.,1 Year,1 Year,Black,"Use two external displays up to 24 inches in size at once to increase productivity.
Either or both displays can be rotated to landscape or portrait orientation.
Adjust your computer screen to a comfortable eye level - Dual-hinged design allows for greater depth, height and tilt and angle adjustment for maximum comfort.
Keep your desktop clutter-free even when connecting multiple devices with the simple cable management channels on the back of the stand.","stand, documentation",Display stand,Flat panel display,12.30 lb(s),"15.7""h x 19.7""w x 14""d",,,,,,,,,,,,,,,,,,,,,,,,,,,,,,,,,,
"Buy Peerless Universal Speaker Mount Kit, Black, 2-pack Stands & Mounts - AV PM732 today at PC Connection",,,,,,,This product is subject to our return policy. Please see our complete return policy for details.,5 Years,5 Years,Black,,"(2) mounts, 3"" extension, hardware kit, documentation",Mounting kit,Speaker,,,,,,,,,,,,,,,,,,,,,,,,,,,,,,,,,,,,
"Buy ELO Touch Solutions 2401LM 24"" LCD VGA DVI Medical Intellitouch Monitors - Medical E263686 today at PC Connection",CCC EMC EN 60601-1 EN 60950-1 EN 55024 KC C-Tick EN 55022 IEC 60601-1 BSMI IPX1 WEEE GOST VCCI RoHS CUL,,24 in,,,270 cd/m2,This product is subject to our return policy. Please see our complete return policy for details.,3 Years,3 Years,White,,,,,,,,,,,,,,,,,,,,,,,,,,,,,,,,,,,,,,,,
Buy NDS RGX2 LCD Monitor with nVidia NVS 285X16 Card Monitors - LCD 997-3999-00 today at PC Connection,CUL KCC VCCI REACH CCC WEEE RoHS FCC,,20.1 in,0.255 mm,,300 cd/m2,"Due to manufacturer restrictions, all sales on this item are final.",N/A,N/A,,,,,,,,,,,,,,,,,,,,,,,,,,,,,,,,,,,,,,,,,
"Buy Open Box 3M 19-21"" Executive Anti-Glare Computer Filter, Black Glare Filters & Privacy Screens EF200XXLB today at PC Connection",,,,,,,This product is subject to our return policy. Please see our complete return policy for details.,90 Days,90 Days,Black,,"Filter, documentation",Display screen filter,,,"14.3""h x 17.3""w x 0.4""d",,,,,,,,,,,,,,,,,,,,,,,,,,,,,,Open Box,,,,
"Buy Acer 24"" Full HD LED-LCD Monitor with Speakers Monitors - LED-LCD UM.FB6AA.001 today at PC Connection",TCO Displays 6.0,Swivel Pivot (rotation) Tilt Height,24 in,,Yes,250 cd/m2,,3 Years,3 Years,Black,"Convincing:
Focus more sharply on your tasks with the superior contrast ratios and ultra-quick response of Professional Series monitors. In-Plane Switching (IPS) technology delivers consistent viewing across wide angles, faster response time for reduced eye strain, more realistic colors, and a stable view that prevents tailing when the screen is touched.
Prepared:
Collaborating with others is faster and more productive when you have plenty of ports available. Professional Series monitors allow you to connect to a wide variety of useful devices including notebooks, tablets and giant screen TVs, thanks to helpful VGA, DVI, HDMI, USB and even DisplayPort connectivity options.
Green focus:
Professional Series monitors are RoHS compliant and mercury free. In addition, you'll see power savings of up to 68% thanks to advanced Acer EcoDisplay technologies and white LED backlighting, which cut your costs and conserve the earth's resources. Acer also uses recyclable packaging to further reduce ecological impact.","Monitor, DVI cable, power cord, VGA cable, documentation",,,7.60 lb(s),"15.1""h x 22.3""w x 8.7""d",,,,,250 nit(s),16.7 million colors,DVI HDDB15 Power,DVI VGA Power,"100,000,000:1",LED-backlit LCD,Widescreen,1920 x 1080,"(1) DVI
(1) HDDB15 VGA
(1) Power in",Supply: 110-220VAC,5 ms,170/160,Speakers Included Dual speakers,,,,,,,,,,,,Digital Visual Interface (DVI),,,,,
"Buy 3M 14.1"" Notebook Privacy Filter Glare Filters & Privacy Screens PF14.1 today at PC Connection",,,,,,,This product is subject to our return policy. Please see our complete return policy for details.,1 Year,1 Year,,,"Filter, documentation",Display privacy filter,,,,,,,,,,,,,,,,,,,,,,,,,,,,,,,,,,"Notebook with a 14.1"" screen",,,
"Buy Acer 19"" V196HQL AB LED-LCD Monitor, Black Monitors - LED-LCD UM.XV6AA.A01 today at PC Connection",EPEAT Gold MPRII,,18.5 in,,,200 cd/m2,,3 Years,3 Years,Black,"Convincing:
Focus more sharply on your tasks with the superior contrast ratios and ultra-quick response of Professional Series monitors. In-Plane Switching (IPS) technology delivers consistent viewing across wide angles, faster response time for reduced eye strain, more realistic colors, and a stable view that prevents tailing when the screen is touched.
Prepared:
Collaborating with others is faster and more productive when you have plenty of ports available. Professional Series monitors allow you to connect to a wide variety of useful devices including notebooks, tablets and giant screen TVs, thanks to helpful VGA, DVI, HDMI, USB and even DisplayPort connectivity options.
Green focus:
Professional Series monitors are RoHS compliant and mercury free. In addition, you'll see power savings of up to 68% thanks to advanced Acer EcoDisplay technologies and white LED backlighting, which cut your costs and conserve the earth's resources. Acer also uses recyclable packaging to further reduce ecological impact.
Dimensions and weight with stand:
13.9""h x 17.4""w x 7.5""d
5.5 lbs.","Monitor, VGA cable, power cord, documentation",,,4.40 lb(s),"10.5""h x 17.4""w x 2""d",limited,,,,200 nit(s),16.7 million colors,Power HDDB15,Power VGA,"100,000,000:1",LED-backlit LCD,Widescreen,1366 x 768,"(1) HDDB15 VGA
(1) Power in","Supply: 110-220VAC
Consumption: 11.9W (typ.); 0.5W (standby); 0.4W (off mode)",5 ms,90/65,,,,,,,,,,,,,,,,,,
"Buy Asus 29"" MX299Q LED-LCD Ultrawide Frameless Monitor, Black Monitors - Large-Format LED-LCD MX299Q today at PC Connection",C-Tick CUL ErP Ready VCCI FCC WEEE RoHS WHQL CB BSMI J-MOSS CCC,Tilt,29 in,0.2628 mm,Yes,300 cd/m2,,Call for Warranty,Call for Warranty,Silver Black,,,,,,,,,,,,,,,,,,,,,,,,,,,,,,,,,,,,,,,,
"Buy Acer 22"" B226HQL AYMDR Full HD LED-LCD Monitor with Speakers Monitors - LED-LCD UM.WB6AA.A01 today at PC Connection",EPEAT Gold,Tilt Swivel Height Pivot (rotation),22 in,,Yes,250 cd/m2,,3 Years,3 Years,Black,"Convincing:
Focus more sharply on your tasks with the superior contrast ratios and ultra-quick response of Professional Series monitors. In-Plane Switching (IPS) technology delivers consistent viewing across wide angles, faster response time for reduced eye strain, more realistic colors, and a stable view that prevents tailing when the screen is touched.
Green focus:
Professional Series monitors are RoHS compliant and mercury free. In addition, you'll see power savings of up to 68% thanks to advanced Acer EcoDisplay technologies and white LED backlighting, which cut your costs and conserve the earth's resources. Acer also uses recyclable packaging to further reduce ecological impact.","Monitor, VGA cable, DVI cable, audio cable, documentation",,,,,limited,,,,250 cd/m2,,HDDB15 DVI Power,Power VGA DVI,"100,000,000:1",LCD LED-backlit,Widescreen,1920 x 1080,"(1) DVI
(1) HDDB15 VGA
(1) Power in",,8 ms,178/178,Speakers Included Dual speakers,,,,,,,,,,,,Digital Visual Interface (DVI),,,,,
"Buy Lenovo 17"" LT1713P LED-LCD Monitor, Black Monitors - LED-LCD 60B3HAR2US today at PC Connection",CTUVus TCO Displays 6.0 TCO Certified Edge 1.2 RoHS TUV CCC,Tilt Height,17 in,0.264 mm,Yes,250 cd/m2,This product is subject to our return policy. Please see our complete return policy for details.,3 Years,3 Years,Black,"Arsenic Free Glass
The Electronic Product Environmental Assessment Tool (EPEAT) Gold certified","monitor, documentation",,,7.90 lb(s),"16""h x 14.6""w x 6.5""d",,,,,250 cd/m2,16.7 million colors,Power DVI HDDB15,DVI VGA Power,1000:1,LCD LED-backlit,Widescreen,1280 x 1024,"(1) HDDB15 VGA
(1) DVI
(1) Power in",,5 ms,,,,,,,,,,,6.0,,,Digital Visual Interface (DVI),,,,,
Buy Joy Factory Tournez Wall MagConnect for iPad Stands & Mounts - AV MMA105 today at PC Connection,,,,,,,,1 Year,1 Year,Black,"Lightweight Strength:
MagConnect mounts are built of high-quality carbon fiber arms. This advanced material is surprisingly lightweight yet incredibly strong. The powerful combination of carbon fiber with carefully designed joints produces mounts that are both easy to maneuver and sturdy to use.
Spherical Joints:
MagConnect mounts come equipped with spherical joints for ultimate customizability. The included MagConnect iPad holder can be swiveled 360° to easily transition from portrait to landscape mode without removing it from the mount. And the sturdy carbon fiber arms can also be adjusted into infinite configurations providing you with the perfect angle every time.
Magnetic Personality:
The MagConnect locking mechanism is the next step in the evolution of mobile mounts. The technology is advanced, but using it is quite simple. First, the iPad is secured into a hard-shell case equipped with a powerful magnet. When the case is attached to a compatible product, another magnet instantly interlocks your MagConnect shell with a receiver, while a precision screw tightens for a secure fit.
Beautiful On and Off its Pedestal:
When your iPad is not mounted, you can carry it in style. The MagConnect hard-shell case is textured for stunning look and feel and comes complete with a low-profile cap to cover the magnetic connector. The included case is designed to work seamlessly the Apple Smart Cover, or for greater protection pair it with our Folio360 III, the most customizable iPad case anywhere.
Compatible with: the new iPad (3rd Gen.) & iPad2.","Mount, holder, documentation",Wall mount,iPad iPad 3 iPad 2,1.60 lb(s),,,,,,,,,,,,,,,,,,,,,,,,,,,,,,,,,,,
"Buy LG 41.9"" LY560M Full HD LED-LCD Hospitality Display, Black Monitors - Large-Format LED-LCD 42LY560M today at PC Connection",,,42 in,,Yes,,This product is subject to our return policy. Please see our complete return policy for details.,2 Years,2 Years,,,,,,,,,,,,,,,,,,,,,,,,,,,,,,,,,,,,,,,,,
"Buy Elite VMAX 2 Projection Screen, MaxWhite, 16:9, 121in Projector Screens VMAX120XWH2 today at PC Connection",,,,,,,This product is subject to our return policy. Please see our complete return policy for details.,2 Years,2 Years,,,"Projection screen, white case, RF remote, IR remote, wall box, documentation",,,,"72.3""h x 108.6""w","Government, Education, Military, and Religious customers receive a 3 year screen warranty",,,,,,,,,,,,,,,,,,,,,,,,,,,,,,,,,
Buy Belkin FlipBlade Adjust Stand for iPad 2 Stands & Mounts - AV F5L084TT today at PC Connection,,,,,,,"This product is subject to our return policy. Please see our complete return policy for details.NOTE: The manufacturer does not permit returns on custom cables or cables with manufacturer part numbers beginning with ""RFQ"".",1 Year,1 Year,,"Ultra-thin and lightweight on the go
Multiple angles for viewing and typing
Landscape or portrait viewing
Sturdy support for your tablet","Stand, documentation",Stand,iPad,,,,,,,,,,,,,,,,,,,,,,,,,,,,,,,,,,,,
"Buy NDS (2) 21.3"" Dome S3c LED-LCD Display, Black with NVIDIA Quadro Monitors - Medical 997-6803-00-2FN today at PC Connection",KCC REACH RoHS WEEE VCCI,Swivel Height Pivot (rotation) Tilt,21.3 in,0.2115 mm,,800 cd/m2,"Due to manufacturer restrictions, all sales on this item are final.",5 Years,5 Years,Black,,"(2) monitors, graphics card, documentation",,,14.10 lb(s),"18.7""h x 14.3""w x 3.9""d",,,,14.100 lb(s),800 cd/m2,,DVI-D DisplayPort USB Type B Power,Power DisplayPort USB DVI-D,1400:1,LCD LED-backlit,Widescreen,2048 x 1536,"(1) DVI-D
(1) DisplayPort
(1) USB Type B
(1) Power in","Supply: 100-240VAC, 50/60Hz
Consumption: 96W (typ.); 108W (max)",20 ms,176/176,,,,,,,,,,,,,Digital Visual Interface (DVI),,,,,
